gemlite/configs/l4.json
{"GEMV": {}, "GEMV_REVSPLITK": {"(1, 3072, 1024, 64, 8, 104)": {"BLOCK_SIZE_M": 1, "BLOCK_SIZE_N": 128, "BLOCK_SIZE_K": 16, "A_load_order": 0, "dot_prod_mode": 0, "num_warps": 1, "num_ctas": 1, "num_stages": 2}, "(1, 1024, 1024, 64, 8, 104)": {"BLOCK_SIZE_M": 1, "BLOCK_SIZE_N": 128, "BLOCK_SIZE_K": 8, "A_load_order": 0, "dot_prod_mode": 0, "num_warps": 1, "num_ctas": 1, "num_stages": 1}, "(1, 1024, 4096, 64, 8, 104)": {"BLOCK_SIZE_M": 1, "BLOCK_SIZE_N": 128, "BLOCK_SIZE_K": 16, "A_load_order": 0, "dot_prod_mode": 0, "num_warps": 1, "num_ctas": 1, "num_stages": 2}, "(1, 2560, 4096, 64, 8, 104)": {"BLOCK_SIZE_M": 1, "BLOCK_SIZE_N": 128, "BLOCK_SIZE_K": 32, "A_load_order": 0, "dot_prod_mode": 0, "num_warps": 1, "num_ctas": 1, "num_stages": 1}, "(1, 6144, 2560, 64, 8, 104)": {"BLOCK_SIZE_M": 1, "BLOCK_SIZE_N": 512, "BLOCK_SIZE_K": 32, "A_load_order": 0, "dot_prod_mode": 0, "num_warps": 4, "num_ctas": 1, "num_stages": 1}, "(1, 19456, 2560, 64, 8, 104)": {"BLOCK_SIZE_M": 1, "BLOCK_SIZE_N": 128, "BLOCK_SIZE_K": 32, "A_load_order": 0, "dot_prod_mode": 0, "num_warps": 2, "num_ctas": 1, "num_stages": 1}, "(1, 2560, 9728, 64, 8, 104)": {"BLOCK_SIZE_M": 1, "BLOCK_SIZE_N": 256, "BLOCK_SIZE_K": 32, "A_load_order": 0, "dot_prod_mode": 0, "num_warps": 2, "num_ctas": 1, "num_stages": 1}, "(1, 3456, 1152, 64, 8, 104)": {"BLOCK_SIZE_M": 1, "BLOCK_SIZE_N": 128, "BLOCK_SIZE_K": 32, "A_load_order": 0, "dot_prod_mode": 0, "num_warps": 1, "num_ctas": 1, "num_stages": 1}, "(1, 1152, 1152, 64, 8, 104)": {"BLOCK_SIZE_M": 1, "BLOCK_SIZE_N": 64, "BLOCK_SIZE_K": 32, "A_load_order": 0, "dot_prod_mode": 0, "num_warps": 2, "num_ctas": 1, "num_stages": 2}, "(1, 4096, 4096, 64, 8, 104)": {"BLOCK_SIZE_M": 1, "BLOCK_SIZE_N": 512, "BLOCK_SIZE_K": 32, "A_load_order": 0, "dot_prod_mode": 0, "num_warps": 4, "num_ctas": 1, "num_stages": 2}, "(1, 12288, 4096, 64, 8, 104)": {"BLOCK_SIZE_M": 1, "BLOCK_SIZE_N": 128, "BLOCK_SIZE_K": 32, "A_load_order": 0, "dot_prod_mode": 0, "num_warps": 2, "num_ctas": 1, "num_stages": 1}, "(1, 4096, 12288, 64, 8, 104)": {"BLOCK_SIZE_M": 1, "BLOCK_SIZE_N": 256, "BLOCK_SIZE_K": 32, "A_load_order": 0, "dot_prod_mode": 0, "num_warps": 1, "num_ctas": 1, "num_stages": 1}, "(1, 4096, 2560, 64, 8, 104)": {"BLOCK_SIZE_M": 1, "BLOCK_SIZE_N": 512, "BLOCK_SIZE_K": 32, "A_load_order": 0, "dot_prod_mode": 0, "num_warps": 4, "num_ctas": 1, "num_stages": 2}, "(1, 1024, 2560, 64, 8, 104)": {"BLOCK_SIZE_M": 1, "BLOCK_SIZE_N": 64, "BLOCK_SIZE_K": 32, "A_load_order": 0, "dot_prod_mode": 0, "num_warps": 2, "num_ctas": 1, "num_stages": 2}, "(1, 9728, 2560, 64, 8, 104)": {"BLOCK_SIZE_M": 1, "BLOCK_SIZE_N": 512, "BLOCK_SIZE_K": 32, "A_load_order": 0, "dot_prod_mode": 0, "num_warps": 4, "num_ctas": 1, "num_stages": 1}}, "GEMV_SPLITK": {"(1, 3072, 1024, 1024, 1, 108)": {"BLOCK_SIZE_M": 1, "BLOCK_SIZE_N": 2, "BLOCK_SIZE_K": 1024, "GROUP_SIZE_M": 8, "SPLIT_K": 1, "A_load_order": 0, "dot_prod_mode": 0, "num_warps": 4, "num_ctas": 1, "num_stages": 1}, "(1, 1024, 1024, 1024, 1, 108)": {"BLOCK_SIZE_M": 1, "BLOCK_SIZE_N": 2, "BLOCK_SIZE_K": 1024, "GROUP_SIZE_M": 8, "SPLIT_K": 1, "A_load_order": 0, "dot_prod_mode": 0, "num_warps": 4, "num_ctas": 1, "num_stages": 1}, "(1, 1024, 4096, 4096, 1, 108)": {"BLOCK_SIZE_M": 1, "BLOCK_SIZE_N": 1, "BLOCK_SIZE_K": 1024, "GROUP_SIZE_M": 8, "SPLIT_K": 1, "A_load_order": 0, "dot_prod_mode": 0, "num_warps": 4, "num_ctas": 1, "num_stages": 1}, "(1, 2560, 4096, 4096, 1, 108)": {"BLOCK_SIZE_M": 1, "BLOCK_SIZE_N": 1, "BLOCK_SIZE_K": 1024, "GROUP_SIZE_M": 8, "SPLIT_K": 1, "A_load_order": 1, "dot_prod_mode": 0, "num_warps": 8, "num_ctas": 1, "num_stages": 2}, "(1, 6144, 2560, 2560, 1, 108)": {"BLOCK_SIZE_M": 1, "BLOCK_SIZE_N": 4, "BLOCK_SIZE_K": 512, "GROUP_SIZE_M": 8, "SPLIT_K": 1, "A_load_order": 0, "dot_prod_mode": 0, "num_warps": 4, "num_ctas": 1, "num_stages": 2}, "(1, 19456, 2560, 2560, 1, 108)": {"BLOCK_SIZE_M": 1, "BLOCK_SIZE_N": 2, "BLOCK_SIZE_K": 512, "GROUP_SIZE_M": 8, "SPLIT_K": 1, "A_load_order": 0, "dot_prod_mode": 0, "num_warps": 4, "num_ctas": 1, "num_stages": 1}, "(1, 2560, 9728, 9728, 1, 108)": {"BLOCK_SIZE_M": 1, "BLOCK_SIZE_N": 2, "BLOCK_SIZE_K": 512, "GROUP_SIZE_M": 8, "SPLIT_K": 1, "A_load_order": 0, "dot_prod_mode": 0, "num_warps": 4, "num_ctas": 1, "num_stages": 1}, "(1, 3072, 1024, 1024, 1, 308)": {"BLOCK_SIZE_M": 1, "BLOCK_SIZE_N": 1, "BLOCK_SIZE_K": 1024, "GROUP_SIZE_M": 8, "SPLIT_K": 1, "A_load_order": 0, "dot_prod_mode": 0, "num_warps": 4, "num_ctas": 1, "num_stages": 1}, "(1, 1024, 1024, 1024, 1, 308)": {"BLOCK_SIZE_M": 1, "BLOCK_SIZE_N": 2, "BLOCK_SIZE_K": 1024, "GROUP_SIZE_M": 8, "SPLIT_K": 1, "A_load_order": 0, "dot_prod_mode": 0, "num_warps": 4, "num_ctas": 1, "num_stages": 1}, "(1, 1024, 4096, 4096, 1, 308)": {"BLOCK_SIZE_M": 1, "BLOCK_SIZE_N": 1, "BLOCK_SIZE_K": 1024, "GROUP_SIZE_M": 8, "SPLIT_K": 1, "A_load_order": 0, "dot_prod_mode": 0, "num_warps": 4, "num_ctas": 1, "num_stages": 1}, "(1, 2560, 4096, 4096, 1, 308)": {"BLOCK_SIZE_M": 1, "BLOCK_SIZE_N": 2, "BLOCK_SIZE_K": 2048, "GROUP_SIZE_M": 8, "SPLIT_K": 1, "A_load_order": 0, "dot_prod_mode": 0, "num_warps": 4, "num_ctas": 1, "num_stages": 1}, "(1, 6144, 2560, 2560, 1, 308)": {"BLOCK_SIZE_M": 1, "BLOCK_SIZE_N": 4, "BLOCK_SIZE_K": 512, "GROUP_SIZE_M": 8, "SPLIT_K": 1, "A_load_order": 0, "dot_prod_mode": 0, "num_warps": 4, "num_ctas": 1, "num_stages": 2}, "(1, 19456, 2560, 2560, 1, 308)": {"BLOCK_SIZE_M": 1, "BLOCK_SIZE_N": 2, "BLOCK_SIZE_K": 512, "GROUP_SIZE_M": 8, "SPLIT_K": 1, "A_load_order": 0, "dot_prod_mode": 0, "num_warps": 8, "num_ctas": 1, "num_stages": 1}, "(1, 2560, 9728, 9728, 1, 308)": {"BLOCK_SIZE_M": 1, "BLOCK_SIZE_N": 4, "BLOCK_SIZE_K": 512, "GROUP_SIZE_M": 8, "SPLIT_K": 1, "A_load_order": 1, "dot_prod_mode": 0, "num_warps": 4, "num_ctas": 1, "num_stages": 1}, "(1, 3072, 1024, 1024, 1, 408)": {"BLOCK_SIZE_M": 1, "BLOCK_SIZE_N": 16, "BLOCK_SIZE_K": 256, "GROUP_SIZE_M": 8, "SPLIT_K": 1, "A_load_order": 0, "dot_prod_mode": 0, "num_warps": 4, "num_ctas": 1, "num_stages": 2}, "(1, 1024, 1024, 1024, 1, 408)": {"BLOCK_SIZE_M": 1, "BLOCK_SIZE_N": 4, "BLOCK_SIZE_K": 1024, "GROUP_SIZE_M": 8, "SPLIT_K": 1, "A_load_order": 0, "dot_prod_mode": 0, "num_warps": 4, "num_ctas": 1, "num_stages": 2}, "(1, 1024, 4096, 4096, 1, 408)": {"BLOCK_SIZE_M": 1, "BLOCK_SIZE_N": 4, "BLOCK_SIZE_K": 1024, "GROUP_SIZE_M": 8, "SPLIT_K": 1, "A_load_order": 0, "dot_prod_mode": 0, "num_warps": 4, "num_ctas": 1, "num_stages": 2}, "(1, 2560, 4096, 4096, 1, 408)": {"BLOCK_SIZE_M": 1, "BLOCK_SIZE_N": 1, "BLOCK_SIZE_K": 1024, "GROUP_SIZE_M": 8, "SPLIT_K": 1, "A_load_order": 0, "dot_prod_mode": 0, "num_warps": 4, "num_ctas": 1, "num_stages": 1}, "(1, 6144, 2560, 2560, 1, 408)": {"BLOCK_SIZE_M": 1, "BLOCK_SIZE_N": 4, "BLOCK_SIZE_K": 512, "GROUP_SIZE_M": 8, "SPLIT_K": 1, "A_load_order": 0, "dot_prod_mode": 0, "num_warps": 4, "num_ctas": 1, "num_stages": 1}, "(1, 19456, 2560, 2560, 1, 408)": {"BLOCK_SIZE_M": 1, "BLOCK_SIZE_N": 2, "BLOCK_SIZE_K": 512, "GROUP_SIZE_M": 8, "SPLIT_K": 1, "A_load_order": 0, "dot_prod_mode": 0, "num_warps": 8, "num_ctas": 1, "num_stages": 1}, "(1, 2560, 9728, 9728, 1, 408)": {"BLOCK_SIZE_M": 1, "BLOCK_SIZE_N": 2, "BLOCK_SIZE_K": 512, "GROUP_SIZE_M": 8, "SPLIT_K": 1, "A_load_order": 0, "dot_prod_mode": 0, "num_warps": 4, "num_ctas": 1, "num_stages": 1}, "(1, 3456, 1152, 1152, 1, 108)": {"BLOCK_SIZE_M": 1, "BLOCK_SIZE_N": 16, "BLOCK_SIZE_K": 128, "GROUP_SIZE_M": 8, "SPLIT_K": 1, "A_load_order": 0, "dot_prod_mode": 0, "num_warps": 4, "num_ctas": 1, "num_stages": 2}, "(1, 1152, 1152, 1152, 1, 108)": {"BLOCK_SIZE_M": 1, "BLOCK_SIZE_N": 8, "BLOCK_SIZE_K": 128, "GROUP_SIZE_M": 8, "SPLIT_K": 1, "A_load_order": 0, "dot_prod_mode": 0, "num_warps": 4, "num_ctas": 1, "num_stages": 2}, "(1, 3456, 1152, 1152, 1, 308)": {"BLOCK_SIZE_M": 1, "BLOCK_SIZE_N": 8, "BLOCK_SIZE_K": 128, "GROUP_SIZE_M": 8, "SPLIT_K": 1, "A_load_order": 0, "dot_prod_mode": 0, "num_warps": 4, "num_ctas": 1, "num_stages": 2}, "(1, 1152, 1152, 1152, 1, 308)": {"BLOCK_SIZE_M": 1, "BLOCK_SIZE_N": 8, "BLOCK_SIZE_K": 128, "GROUP_SIZE_M": 8, "SPLIT_K": 1, "A_load_order": 0, "dot_prod_mode": 0, "num_warps": 4, "num_ctas": 1, "num_stages": 2}, "(1, 4096, 4096, 4096, 1, 408)": {"BLOCK_SIZE_M": 1, "BLOCK_SIZE_N": 1, "BLOCK_SIZE_K": 2048, "GROUP_SIZE_M": 8, "SPLIT_K": 1, "A_load_order": 0, "dot_prod_mode": 0, "num_warps": 8, "num_ctas": 1, "num_stages": 2}, "(1, 12288, 4096, 4096, 1, 408)": {"BLOCK_SIZE_M": 1, "BLOCK_SIZE_N": 4, "BLOCK_SIZE_K": 4096, "GROUP_SIZE_M": 8, "SPLIT_K": 1, "A_load_order": 0, "dot_prod_mode": 0, "num_warps": 4, "num_ctas": 1, "num_stages": 1}, "(1, 4096, 12288, 12288, 1, 408)": {"BLOCK_SIZE_M": 1, "BLOCK_SIZE_N": 1, "BLOCK_SIZE_K": 2048, "GROUP_SIZE_M": 8, "SPLIT_K": 1, "A_load_order": 0, "dot_prod_mode": 0, "num_warps": 8, "num_ctas": 1, "num_stages": 2}, "(1, 4096, 4096, 4096, 1, 308)": {"BLOCK_SIZE_M": 1, "BLOCK_SIZE_N": 1, "BLOCK_SIZE_K": 1024, "GROUP_SIZE_M": 8, "SPLIT_K": 1, "A_load_order": 1, "dot_prod_mode": 0, "num_warps": 8, "num_ctas": 1, "num_stages": 2}, "(1, 12288, 4096, 4096, 1, 308)": {"BLOCK_SIZE_M": 1, "BLOCK_SIZE_N": 2, "BLOCK_SIZE_K": 4096, "GROUP_SIZE_M": 8, "SPLIT_K": 1, "A_load_order": 0, "dot_prod_mode": 0, "num_warps": 8, "num_ctas": 1, "num_stages": 1}, "(1, 4096, 12288, 12288, 1, 308)": {"BLOCK_SIZE_M": 1, "BLOCK_SIZE_N": 4, "BLOCK_SIZE_K": 1024, "GROUP_SIZE_M": 8, "SPLIT_K": 1, "A_load_order": 0, "dot_prod_mode": 0, "num_warps": 4, "num_ctas": 1, "num_stages": 2}, "(1, 4096, 2560, 2560, 1, 408)": {"BLOCK_SIZE_M": 1, "BLOCK_SIZE_N": 4, "BLOCK_SIZE_K": 512, "GROUP_SIZE_M": 8, "SPLIT_K": 1, "A_load_order": 0, "dot_prod_mode": 0, "num_warps": 4, "num_ctas": 1, "num_stages": 2}, "(1, 1024, 2560, 2560, 1, 408)": {"BLOCK_SIZE_M": 1, "BLOCK_SIZE_N": 2, "BLOCK_SIZE_K": 512, "GROUP_SIZE_M": 8, "SPLIT_K": 1, "A_load_order": 0, "dot_prod_mode": 0, "num_warps": 4, "num_ctas": 1, "num_stages": 1}, "(1, 9728, 2560, 2560, 1, 408)": {"BLOCK_SIZE_M": 1, "BLOCK_SIZE_N": 4, "BLOCK_SIZE_K": 512, "GROUP_SIZE_M": 8, "SPLIT_K": 1, "A_load_order": 1, "dot_prod_mode": 0, "num_warps": 4, "num_ctas": 1, "num_stages": 1}, "(1, 4096, 2560, 2560, 1, 308)": {"BLOCK_SIZE_M": 1, "BLOCK_SIZE_N": 4, "BLOCK_SIZE_K": 512, "GROUP_SIZE_M": 8, "SPLIT_K": 1, "A_load_order": 0, "dot_prod_mode": 0, "num_warps": 4, "num_ctas": 1, "num_stages": 2}, "(1, 1024, 2560, 2560, 1, 308)": {"BLOCK_SIZE_M": 1, "BLOCK_SIZE_N": 2, "BLOCK_SIZE_K": 512, "GROUP_SIZE_M": 8, "SPLIT_K": 1, "A_load_order": 0, "dot_prod_mode": 0, "num_warps": 4, "num_ctas": 1, "num_stages": 1}, "(1, 9728, 2560, 2560, 1, 308)": {"BLOCK_SIZE_M": 1, "BLOCK_SIZE_N": 4, "BLOCK_SIZE_K": 512, "GROUP_SIZE_M": 8, "SPLIT_K": 1, "A_load_order": 1, "dot_prod_mode": 0, "num_warps": 4, "num_ctas": 1, "num_stages": 1}}, "GEMM_SPLITK": {"(2, 3072, 1024, 1024, 1, 108)": {"BLOCK_SIZE_M": 16, "BLOCK_SIZE_N": 64, "BLOCK_SIZE_K": 256, "GROUP_SIZE_M": 8, "SPLIT_K": 1, "A_load_order": 2, "NUM_STAGES": 4, "num_warps": 4, "num_ctas": 1, "num_stages": 4}, "(4, 3072, 1024, 1024, 1, 108)": {"BLOCK_SIZE_M": 16, "BLOCK_SIZE_N": 64, "BLOCK_SIZE_K": 256, "GROUP_SIZE_M": 8, "SPLIT_K": 1, "A_load_order": 2, "NUM_STAGES": 4, "num_warps": 4, "num_ctas": 1, "num_stages": 4}, "(8, 3072, 1024, 1024, 1, 108)": {"BLOCK_SIZE_M": 16, "BLOCK_SIZE_N": 64, "BLOCK_SIZE_K": 256, "GROUP_SIZE_M": 8, "SPLIT_K": 1, "A_load_order": 2, "NUM_STAGES": 4, "num_warps": 4, "num_ctas": 1, "num_stages": 4}, "(16, 3072, 1024, 1024, 1, 108)": {"BLOCK_SIZE_M": 16, "BLOCK_SIZE_N": 64, "BLOCK_SIZE_K": 256, "GROUP_SIZE_M": 8, "SPLIT_K": 1, "A_load_order": 2, "NUM_STAGES": 4, "num_warps": 4, "num_ctas": 1, "num_stages": 4}, "(24, 3072, 1024, 1024, 1, 108)": {"BLOCK_SIZE_M": 16, "BLOCK_SIZE_N": 64, "BLOCK_SIZE_K": 512, "GROUP_SIZE_M": 8, "SPLIT_K": 1, "A_load_order": 0, "NUM_STAGES": 2, "num_warps": 4, "num_ctas": 1, "num_stages": 2}, "(32, 3072, 1024, 1024, 1, 108)": {"BLOCK_SIZE_M": 16, "BLOCK_SIZE_N": 64, "BLOCK_SIZE_K": 512, "GROUP_SIZE_M": 8, "SPLIT_K": 1, "A_load_order": 0, "NUM_STAGES": 2, "num_warps": 4, "num_ctas": 1, "num_stages": 2}, "(48, 3072, 1024, 1024, 1, 108)": {"BLOCK_SIZE_M": 32, "BLOCK_SIZE_N": 128, "BLOCK_SIZE_K": 256, "GROUP_SIZE_M": 8, "SPLIT_K": 1, "A_load_order": 0, "NUM_STAGES": 2, "num_warps": 4, "num_ctas": 1, "num_stages": 2}, "(64, 3072, 1024, 1024, 1, 108)": {"BLOCK_SIZE_M": 32, "BLOCK_SIZE_N": 128, "BLOCK_SIZE_K": 64, "GROUP_SIZE_M": 8, "SPLIT_K": 1, "A_load_order": 2, "NUM_STAGES": 4, "num_warps": 8, "num_ctas": 1, "num_stages": 4}, "(2, 1024, 1024, 1024, 1, 108)": {"BLOCK_SIZE_M": 16, "BLOCK_SIZE_N": 32, "BLOCK_SIZE_K": 256, "GROUP_SIZE_M": 8, "SPLIT_K": 1, "A_load_order": 0, "NUM_STAGES": 5, "num_warps": 4, "num_ctas": 1, "num_stages": 5}, "(4, 1024, 1024, 1024, 1, 108)": {"BLOCK_SIZE_M": 16, "BLOCK_SIZE_N": 32, "BLOCK_SIZE_K": 512, "GROUP_SIZE_M": 8, "SPLIT_K": 1, "A_load_order": 0, "NUM_STAGES": 3, "num_warps": 4, "num_ctas": 1, "num_stages": 3}, "(8, 1024, 1024, 1024, 1, 108)": {"BLOCK_SIZE_M": 16, "BLOCK_SIZE_N": 32, "BLOCK_SIZE_K": 256, "GROUP_SIZE_M": 8, "SPLIT_K": 1, "A_load_order": 0, "NUM_STAGES": 5, "num_warps": 4, "num_ctas": 1, "num_stages": 5}, "(16, 1024, 1024, 1024, 1, 108)": {"BLOCK_SIZE_M": 16, "BLOCK_SIZE_N": 32, "BLOCK_SIZE_K": 512, "GROUP_SIZE_M": 8, "SPLIT_K": 1, "A_load_order": 0, "NUM_STAGES": 3, "num_warps": 4, "num_ctas": 1, "num_stages": 3}, "(24, 1024, 1024, 1024, 1, 108)": {"BLOCK_SIZE_M": 16, "BLOCK_SIZE_N": 64, "BLOCK_SIZE_K": 256, "GROUP_SIZE_M": 8, "SPLIT_K": 1, "A_load_order": 2, "NUM_STAGES": 4, "num_warps": 4, "num_ctas": 1, "num_stages": 4}, "(32, 1024, 1024, 1024, 1, 108)": {"BLOCK_SIZE_M": 16, "BLOCK_SIZE_N": 64, "BLOCK_SIZE_K": 256, "GROUP_SIZE_M": 8, "SPLIT_K": 1, "A_load_order": 2, "NUM_STAGES": 4, "num_warps": 4, "num_ctas": 1, "num_stages": 4}, "(48, 1024, 1024, 1024, 1, 108)": {"BLOCK_SIZE_M": 32, "BLOCK_SIZE_N": 64, "BLOCK_SIZE_K": 256, "GROUP_SIZE_M": 8, "SPLIT_K": 1, "A_load_order": 2, "NUM_STAGES": 3, "num_warps": 4, "num_ctas": 1, "num_stages": 3}, "(64, 1024, 1024, 1024, 1, 108)": {"BLOCK_SIZE_M": 32, "BLOCK_SIZE_N": 64, "BLOCK_SIZE_K": 256, "GROUP_SIZE_M": 8, "SPLIT_K": 1, "A_load_order": 2, "NUM_STAGES": 3, "num_warps": 4, "num_ctas": 1, "num_stages": 3}, "(2, 1024, 4096, 4096, 1, 108)": {"BLOCK_SIZE_M": 16, "BLOCK_SIZE_N": 64, "BLOCK_SIZE_K": 256, "GROUP_SIZE_M": 8, "SPLIT_K": 1, "A_load_order": 2, "NUM_STAGES": 4, "num_warps": 4, "num_ctas": 1, "num_stages": 4}, "(4, 1024, 4096, 4096, 1, 108)": {"BLOCK_SIZE_M": 16, "BLOCK_SIZE_N": 64, "BLOCK_SIZE_K": 256, "GROUP_SIZE_M": 8, "SPLIT_K": 1, "A_load_order": 2, "NUM_STAGES": 4, "num_warps": 4, "num_ctas": 1, "num_stages": 4}, "(8, 1024, 4096, 4096, 1, 108)": {"BLOCK_SIZE_M": 16, "BLOCK_SIZE_N": 32, "BLOCK_SIZE_K": 256, "GROUP_SIZE_M": 8, "SPLIT_K": 1, "A_load_order": 0, "NUM_STAGES": 5, "num_warps": 4, "num_ctas": 1, "num_stages": 5}, "(16, 1024, 4096, 4096, 1, 108)": {"BLOCK_SIZE_M": 16, "BLOCK_SIZE_N": 32, "BLOCK_SIZE_K": 256, "GROUP_SIZE_M": 8, "SPLIT_K": 1, "A_load_order": 0, "NUM_STAGES": 5, "num_warps": 4, "num_ctas": 1, "num_stages": 5}, "(24, 1024, 4096, 4096, 1, 108)": {"BLOCK_SIZE_M": 16, "BLOCK_SIZE_N": 64, "BLOCK_SIZE_K": 256, "GROUP_SIZE_M": 8, "SPLIT_K": 1, "A_load_order": 2, "NUM_STAGES": 4, "num_warps": 4, "num_ctas": 1, "num_stages": 4}, "(32, 1024, 4096, 4096, 1, 108)": {"BLOCK_SIZE_M": 16, "BLOCK_SIZE_N": 64, "BLOCK_SIZE_K": 256, "GROUP_SIZE_M": 8, "SPLIT_K": 1, "A_load_order": 2, "NUM_STAGES": 4, "num_warps": 4, "num_ctas": 1, "num_stages": 4}, "(48, 1024, 4096, 4096, 1, 108)": {"BLOCK_SIZE_M": 32, "BLOCK_SIZE_N": 64, "BLOCK_SIZE_K": 256, "GROUP_SIZE_M": 8, "SPLIT_K": 1, "A_load_order": 2, "NUM_STAGES": 3, "num_warps": 4, "num_ctas": 1, "num_stages": 3}, "(64, 1024, 4096, 4096, 1, 108)": {"BLOCK_SIZE_M": 32, "BLOCK_SIZE_N": 64, "BLOCK_SIZE_K": 256, "GROUP_SIZE_M": 8, "SPLIT_K": 1, "A_load_order": 2, "NUM_STAGES": 3, "num_warps": 4, "num_ctas": 1, "num_stages": 3}, "(2, 2560, 4096, 4096, 1, 108)": {"BLOCK_SIZE_M": 16, "BLOCK_SIZE_N": 64, "BLOCK_SIZE_K": 256, "GROUP_SIZE_M": 8, "SPLIT_K": 1, "A_load_order": 2, "NUM_STAGES": 4, "num_warps": 4, "num_ctas": 1, "num_stages": 4}, "(4, 2560, 4096, 4096, 1, 108)": {"BLOCK_SIZE_M": 16, "BLOCK_SIZE_N": 64, "BLOCK_SIZE_K": 256, "GROUP_SIZE_M": 8, "SPLIT_K": 1, "A_load_order": 2, "NUM_STAGES": 4, "num_warps": 4, "num_ctas": 1, "num_stages": 4}, "(8, 2560, 4096, 4096, 1, 108)": {"BLOCK_SIZE_M": 16, "BLOCK_SIZE_N": 64, "BLOCK_SIZE_K": 256, "GROUP_SIZE_M": 8, "SPLIT_K": 1, "A_load_order": 2, "NUM_STAGES": 4, "num_warps": 4, "num_ctas": 1, "num_stages": 4}, "(16, 2560, 4096, 4096, 1, 108)": {"BLOCK_SIZE_M": 16, "BLOCK_SIZE_N": 64, "BLOCK_SIZE_K": 256, "GROUP_SIZE_M": 8, "SPLIT_K": 1, "A_load_order": 2, "NUM_STAGES": 4, "num_warps": 4, "num_ctas": 1, "num_stages": 4}, "(24, 2560, 4096, 4096, 1, 108)": {"BLOCK_SIZE_M": 16, "BLOCK_SIZE_N": 64, "BLOCK_SIZE_K": 512, "GROUP_SIZE_M": 8, "SPLIT_K": 1, "A_load_order": 0, "NUM_STAGES": 2, "num_warps": 4, "num_ctas": 1, "num_stages": 2}, "(32, 2560, 4096, 4096, 1, 108)": {"BLOCK_SIZE_M": 16, "BLOCK_SIZE_N": 64, "BLOCK_SIZE_K": 512, "GROUP_SIZE_M": 8, "SPLIT_K": 1, "A_load_order": 0, "NUM_STAGES": 2, "num_warps": 4, "num_ctas": 1, "num_stages": 2}, "(48, 2560, 4096, 4096, 1, 108)": {"BLOCK_SIZE_M": 32, "BLOCK_SIZE_N": 128, "BLOCK_SIZE_K": 128, "GROUP_SIZE_M": 8, "SPLIT_K": 1, "A_load_order": 0, "NUM_STAGES": 4, "num_warps": 4, "num_ctas": 1, "num_stages": 4}, "(64, 2560, 4096, 4096, 1, 108)": {"BLOCK_SIZE_M": 32, "BLOCK_SIZE_N": 128, "BLOCK_SIZE_K": 256, "GROUP_SIZE_M": 8, "SPLIT_K": 1, "A_load_order": 0, "NUM_STAGES": 2, "num_warps": 4, "num_ctas": 1, "num_stages": 2}, "(2, 6144, 2560, 2560, 1, 108)": {"BLOCK_SIZE_M": 16, "BLOCK_SIZE_N": 64, "BLOCK_SIZE_K": 256, "GROUP_SIZE_M": 8, "SPLIT_K": 1, "A_load_order": 2, "NUM_STAGES": 4, "num_warps": 4, "num_ctas": 1, "num_stages": 4}, "(4, 6144, 2560, 2560, 1, 108)": {"BLOCK_SIZE_M": 16, "BLOCK_SIZE_N": 64, "BLOCK_SIZE_K": 256, "GROUP_SIZE_M": 8, "SPLIT_K": 1, "A_load_order": 2, "NUM_STAGES": 4, "num_warps": 4, "num_ctas": 1, "num_stages": 4}, "(8, 6144, 2560, 2560, 1, 108)": {"BLOCK_SIZE_M": 16, "BLOCK_SIZE_N": 64, "BLOCK_SIZE_K": 256, "GROUP_SIZE_M": 8, "SPLIT_K": 1, "A_load_order": 2, "NUM_STAGES": 4, "num_warps": 4, "num_ctas": 1, "num_stages": 4}, "(16, 6144, 2560, 2560, 1, 108)": {"BLOCK_SIZE_M": 16, "BLOCK_SIZE_N": 32, "BLOCK_SIZE_K": 512, "GROUP_SIZE_M": 8, "SPLIT_K": 1, "A_load_order": 0, "NUM_STAGES": 3, "num_warps": 4, "num_ctas": 1, "num_stages": 3}, "(24, 6144, 2560, 2560, 1, 108)": {"BLOCK_SIZE_M": 16, "BLOCK_SIZE_N": 128, "BLOCK_SIZE_K": 256, "GROUP_SIZE_M": 8, "SPLIT_K": 1, "A_load_order": 0, "NUM_STAGES": 2, "num_warps": 4, "num_ctas": 1, "num_stages": 2}, "(32, 6144, 2560, 2560, 1, 108)": {"BLOCK_SIZE_M": 16, "BLOCK_SIZE_N": 64, "BLOCK_SIZE_K": 512, "GROUP_SIZE_M": 8, "SPLIT_K": 1, "A_load_order": 0, "NUM_STAGES": 2, "num_warps": 4, "num_ctas": 1, "num_stages": 2}, "(48, 6144, 2560, 2560, 1, 108)": {"BLOCK_SIZE_M": 32, "BLOCK_SIZE_N": 128, "BLOCK_SIZE_K": 256, "GROUP_SIZE_M": 8, "SPLIT_K": 1, "A_load_order": 0, "NUM_STAGES": 2, "num_warps": 4, "num_ctas": 1, "num_stages": 2}, "(64, 6144, 2560, 2560, 1, 108)": {"BLOCK_SIZE_M": 32, "BLOCK_SIZE_N": 128, "BLOCK_SIZE_K": 256, "GROUP_SIZE_M": 8, "SPLIT_K": 1, "A_load_order": 0, "NUM_STAGES": 2, "num_warps": 4, "num_ctas": 1, "num_stages": 2}, "(2, 19456, 2560, 2560, 1, 108)": {"BLOCK_SIZE_M": 16, "BLOCK_SIZE_N": 256, "BLOCK_SIZE_K": 256, "GROUP_SIZE_M": 8, "SPLIT_K": 1, "A_load_order": 0, "NUM_STAGES": 1, "num_warps": 8, "num_ctas": 1, "num_stages": 1}, "(4, 19456, 2560, 2560, 1, 108)": {"BLOCK_SIZE_M": 16, "BLOCK_SIZE_N": 256, "BLOCK_SIZE_K": 256, "GROUP_SIZE_M": 8, "SPLIT_K": 1, "A_load_order": 0, "NUM_STAGES": 1, "num_warps": 8, "num_ctas": 1, "num_stages": 1}, "(8, 19456, 2560, 2560, 1, 108)": {"BLOCK_SIZE_M": 16, "BLOCK_SIZE_N": 256, "BLOCK_SIZE_K": 256, "GROUP_SIZE_M": 8, "SPLIT_K": 1, "A_load_order": 0, "NUM_STAGES": 1, "num_warps": 8, "num_ctas": 1, "num_stages": 1}, "(16, 19456, 2560, 2560, 1, 108)": {"BLOCK_SIZE_M": 16, "BLOCK_SIZE_N": 256, "BLOCK_SIZE_K": 256, "GROUP_SIZE_M": 8, "SPLIT_K": 1, "A_load_order": 0, "NUM_STAGES": 1, "num_warps": 8, "num_ctas": 1, "num_stages": 1}, "(24, 19456, 2560, 2560, 1, 108)": {"BLOCK_SIZE_M": 16, "BLOCK_SIZE_N": 256, "BLOCK_SIZE_K": 256, "GROUP_SIZE_M": 8, "SPLIT_K": 1, "A_load_order": 0, "NUM_STAGES": 1, "num_warps": 8, "num_ctas": 1, "num_stages": 1}, "(32, 19456, 2560, 2560, 1, 108)": {"BLOCK_SIZE_M": 16, "BLOCK_SIZE_N": 256, "BLOCK_SIZE_K": 256, "GROUP_SIZE_M": 8, "SPLIT_K": 1, "A_load_order": 0, "NUM_STAGES": 1, "num_warps": 8, "num_ctas": 1, "num_stages": 1}, "(48, 19456, 2560, 2560, 1, 108)": {"BLOCK_SIZE_M": 32, "BLOCK_SIZE_N": 256, "BLOCK_SIZE_K": 256, "GROUP_SIZE_M": 8, "SPLIT_K": 1, "A_load_order": 0, "NUM_STAGES": 1, "num_warps": 8, "num_ctas": 1, "num_stages": 1}, "(64, 19456, 2560, 2560, 1, 108)": {"BLOCK_SIZE_M": 32, "BLOCK_SIZE_N": 256, "BLOCK_SIZE_K": 256, "GROUP_SIZE_M": 8, "SPLIT_K": 1, "A_load_order": 0, "NUM_STAGES": 1, "num_warps": 8, "num_ctas": 1, "num_stages": 1}, "(2, 2560, 9728, 9728, 1, 108)": {"BLOCK_SIZE_M": 16, "BLOCK_SIZE_N": 32, "BLOCK_SIZE_K": 256, "GROUP_SIZE_M": 8, "SPLIT_K": 1, "A_load_order": 0, "NUM_STAGES": 5, "num_warps": 4, "num_ctas": 1, "num_stages": 5}, "(4, 2560, 9728, 9728, 1, 108)": {"BLOCK_SIZE_M": 16, "BLOCK_SIZE_N": 32, "BLOCK_SIZE_K": 256, "GROUP_SIZE_M": 8, "SPLIT_K": 1, "A_load_order": 0, "NUM_STAGES": 5, "num_warps": 4, "num_ctas": 1, "num_stages": 5}, "(8, 2560, 9728, 9728, 1, 108)": {"BLOCK_SIZE_M": 16, "BLOCK_SIZE_N": 32, "BLOCK_SIZE_K": 512, "GROUP_SIZE_M": 8, "SPLIT_K": 1, "A_load_order": 0, "NUM_STAGES": 3, "num_warps": 4, "num_ctas": 1, "num_stages": 3}, "(16, 2560, 9728, 9728, 1, 108)": {"BLOCK_SIZE_M": 16, "BLOCK_SIZE_N": 32, "BLOCK_SIZE_K": 512, "GROUP_SIZE_M": 8, "SPLIT_K": 1, "A_load_order": 0, "NUM_STAGES": 3, "num_warps": 4, "num_ctas": 1, "num_stages": 3}, "(24, 2560, 9728, 9728, 1, 108)": {"BLOCK_SIZE_M": 16, "BLOCK_SIZE_N": 32, "BLOCK_SIZE_K": 512, "GROUP_SIZE_M": 8, "SPLIT_K": 1, "A_load_order": 0, "NUM_STAGES": 3, "num_warps": 4, "num_ctas": 1, "num_stages": 3}, "(32, 2560, 9728, 9728, 1, 108)": {"BLOCK_SIZE_M": 16, "BLOCK_SIZE_N": 64, "BLOCK_SIZE_K": 256, "GROUP_SIZE_M": 8, "SPLIT_K": 1, "A_load_order": 2, "NUM_STAGES": 4, "num_warps": 4, "num_ctas": 1, "num_stages": 4}, "(48, 2560, 9728, 9728, 1, 108)": {"BLOCK_SIZE_M": 32, "BLOCK_SIZE_N": 32, "BLOCK_SIZE_K": 256, "GROUP_SIZE_M": 8, "SPLIT_K": 1, "A_load_order": 0, "NUM_STAGES": 4, "num_warps": 4, "num_ctas": 1, "num_stages": 4}, "(64, 2560, 9728, 9728, 1, 108)": {"BLOCK_SIZE_M": 32, "BLOCK_SIZE_N": 32, "BLOCK_SIZE_K": 256, "GROUP_SIZE_M": 8, "SPLIT_K": 1, "A_load_order": 0, "NUM_STAGES": 4, "num_warps": 4, "num_ctas": 1, "num_stages": 4}, "(2, 3072, 1024, 1024, 1, 308)": {"BLOCK_SIZE_M": 16, "BLOCK_SIZE_N": 32, "BLOCK_SIZE_K": 256, "GROUP_SIZE_M": 8, "SPLIT_K": 1, "A_load_order": 0, "NUM_STAGES": 5, "num_warps": 4, "num_ctas": 1, "num_stages": 5}, "(4, 3072, 1024, 1024, 1, 308)": {"BLOCK_SIZE_M": 16, "BLOCK_SIZE_N": 64, "BLOCK_SIZE_K": 512, "GROUP_SIZE_M": 8, "SPLIT_K": 1, "A_load_order": 0, "NUM_STAGES": 2, "num_warps": 4, "num_ctas": 1, "num_stages": 2}, "(8, 3072, 1024, 1024, 1, 308)": {"BLOCK_SIZE_M": 16, "BLOCK_SIZE_N": 32, "BLOCK_SIZE_K": 256, "GROUP_SIZE_M": 8, "SPLIT_K": 1, "A_load_order": 0, "NUM_STAGES": 5, "num_warps": 4, "num_ctas": 1, "num_stages": 5}, "(16, 3072, 1024, 1024, 1, 308)": {"BLOCK_SIZE_M": 16, "BLOCK_SIZE_N": 64, "BLOCK_SIZE_K": 512, "GROUP_SIZE_M": 8, "SPLIT_K": 1, "A_load_order": 0, "NUM_STAGES": 2, "num_warps": 4, "num_ctas": 1, "num_stages": 2}, "(24, 3072, 1024, 1024, 1, 308)": {"BLOCK_SIZE_M": 16, "BLOCK_SIZE_N": 64, "BLOCK_SIZE_K": 512, "GROUP_SIZE_M": 8, "SPLIT_K": 1, "A_load_order": 0, "NUM_STAGES": 2, "num_warps": 4, "num_ctas": 1, "num_stages": 2}, "(32, 3072, 1024, 1024, 1, 308)": {"BLOCK_SIZE_M": 16, "BLOCK_SIZE_N": 64, "BLOCK_SIZE_K": 512, "GROUP_SIZE_M": 8, "SPLIT_K": 1, "A_load_order": 0, "NUM_STAGES": 2, "num_warps": 4, "num_ctas": 1, "num_stages": 2}, "(48, 3072, 1024, 1024, 1, 308)": {"BLOCK_SIZE_M": 32, "BLOCK_SIZE_N": 64, "BLOCK_SIZE_K": 512, "GROUP_SIZE_M": 8, "SPLIT_K": 1, "A_load_order": 0, "NUM_STAGES": 2, "num_warps": 4, "num_ctas": 1, "num_stages": 2}, "(64, 3072, 1024, 1024, 1, 308)": {"BLOCK_SIZE_M": 32, "BLOCK_SIZE_N": 64, "BLOCK_SIZE_K": 512, "GROUP_SIZE_M": 8, "SPLIT_K": 1, "A_load_order": 0, "NUM_STAGES": 2, "num_warps": 4, "num_ctas": 1, "num_stages": 2}, "(2, 1024, 1024, 1024, 1, 308)": {"BLOCK_SIZE_M": 16, "BLOCK_SIZE_N": 64, "BLOCK_SIZE_K": 256, "GROUP_SIZE_M": 8, "SPLIT_K": 1, "A_load_order": 2, "NUM_STAGES": 4, "num_warps": 4, "num_ctas": 1, "num_stages": 4}, "(4, 1024, 1024, 1024, 1, 308)": {"BLOCK_SIZE_M": 16, "BLOCK_SIZE_N": 64, "BLOCK_SIZE_K": 256, "GROUP_SIZE_M": 8, "SPLIT_K": 1, "A_load_order": 2, "NUM_STAGES": 4, "num_warps": 4, "num_ctas": 1, "num_stages": 4}, "(8, 1024, 1024, 1024, 1, 308)": {"BLOCK_SIZE_M": 16, "BLOCK_SIZE_N": 32, "BLOCK_SIZE_K": 512, "GROUP_SIZE_M": 8, "SPLIT_K": 1, "A_load_order": 0, "NUM_STAGES": 4, "num_warps": 4, "num_ctas": 1, "num_stages": 4}, "(16, 1024, 1024, 1024, 1, 308)": {"BLOCK_SIZE_M": 16, "BLOCK_SIZE_N": 32, "BLOCK_SIZE_K": 256, "GROUP_SIZE_M": 8, "SPLIT_K": 1, "A_load_order": 0, "NUM_STAGES": 5, "num_warps": 4, "num_ctas": 1, "num_stages": 5}, "(24, 1024, 1024, 1024, 1, 308)": {"BLOCK_SIZE_M": 16, "BLOCK_SIZE_N": 64, "BLOCK_SIZE_K": 256, "GROUP_SIZE_M": 8, "SPLIT_K": 1, "A_load_order": 2, "NUM_STAGES": 4, "num_warps": 4, "num_ctas": 1, "num_stages": 4}, "(32, 1024, 1024, 1024, 1, 308)": {"BLOCK_SIZE_M": 16, "BLOCK_SIZE_N": 64, "BLOCK_SIZE_K": 256, "GROUP_SIZE_M": 8, "SPLIT_K": 1, "A_load_order": 2, "NUM_STAGES": 4, "num_warps": 4, "num_ctas": 1, "num_stages": 4}, "(48, 1024, 1024, 1024, 1, 308)": {"BLOCK_SIZE_M": 32, "BLOCK_SIZE_N": 64, "BLOCK_SIZE_K": 256, "GROUP_SIZE_M": 8, "SPLIT_K": 1, "A_load_order": 2, "NUM_STAGES": 4, "num_warps": 4, "num_ctas": 1, "num_stages": 4}, "(64, 1024, 1024, 1024, 1, 308)": {"BLOCK_SIZE_M": 32, "BLOCK_SIZE_N": 64, "BLOCK_SIZE_K": 256, "GROUP_SIZE_M": 8, "SPLIT_K": 1, "A_load_order": 2, "NUM_STAGES": 4, "num_warps": 4, "num_ctas": 1, "num_stages": 4}, "(2, 1024, 4096, 4096, 1, 308)": {"BLOCK_SIZE_M": 16, "BLOCK_SIZE_N": 64, "BLOCK_SIZE_K": 256, "GROUP_SIZE_M": 8, "SPLIT_K": 1, "A_load_order": 2, "NUM_STAGES": 4, "num_warps": 4, "num_ctas": 1, "num_stages": 4}, "(4, 1024, 4096, 4096, 1, 308)": {"BLOCK_SIZE_M": 16, "BLOCK_SIZE_N": 32, "BLOCK_SIZE_K": 256, "GROUP_SIZE_M": 8, "SPLIT_K": 1, "A_load_order": 0, "NUM_STAGES": 5, "num_warps": 4, "num_ctas": 1, "num_stages": 5}, "(8, 1024, 4096, 4096, 1, 308)": {"BLOCK_SIZE_M": 16, "BLOCK_SIZE_N": 32, "BLOCK_SIZE_K": 256, "GROUP_SIZE_M": 8, "SPLIT_K": 1, "A_load_order": 0, "NUM_STAGES": 5, "num_warps": 4, "num_ctas": 1, "num_stages": 5}, "(16, 1024, 4096, 4096, 1, 308)": {"BLOCK_SIZE_M": 16, "BLOCK_SIZE_N": 64, "BLOCK_SIZE_K": 256, "GROUP_SIZE_M": 8, "SPLIT_K": 1, "A_load_order": 2, "NUM_STAGES": 4, "num_warps": 4, "num_ctas": 1, "num_stages": 4}, "(24, 1024, 4096, 4096, 1, 308)": {"BLOCK_SIZE_M": 16, "BLOCK_SIZE_N": 64, "BLOCK_SIZE_K": 256, "GROUP_SIZE_M": 8, "SPLIT_K": 1, "A_load_order": 2, "NUM_STAGES": 4, "num_warps": 4, "num_ctas": 1, "num_stages": 4}, "(32, 1024, 4096, 4096, 1, 308)": {"BLOCK_SIZE_M": 16, "BLOCK_SIZE_N": 64, "BLOCK_SIZE_K": 256, "GROUP_SIZE_M": 8, "SPLIT_K": 1, "A_load_order": 2, "NUM_STAGES": 4, "num_warps": 4, "num_ctas": 1, "num_stages": 4}, "(48, 1024, 4096, 4096, 1, 308)": {"BLOCK_SIZE_M": 32, "BLOCK_SIZE_N": 64, "BLOCK_SIZE_K": 256, "GROUP_SIZE_M": 8, "SPLIT_K": 1, "A_load_order": 2, "NUM_STAGES": 4, "num_warps": 4, "num_ctas": 1, "num_stages": 4}, "(64, 1024, 4096, 4096, 1, 308)": {"BLOCK_SIZE_M": 32, "BLOCK_SIZE_N": 64, "BLOCK_SIZE_K": 256, "GROUP_SIZE_M": 8, "SPLIT_K": 1, "A_load_order": 2, "NUM_STAGES": 4, "num_warps": 4, "num_ctas": 1, "num_stages": 4}, "(2, 2560, 4096, 4096, 1, 308)": {"BLOCK_SIZE_M": 16, "BLOCK_SIZE_N": 32, "BLOCK_SIZE_K": 256, "GROUP_SIZE_M": 8, "SPLIT_K": 1, "A_load_order": 0, "NUM_STAGES": 5, "num_warps": 4, "num_ctas": 1, "num_stages": 5}, "(4, 2560, 4096, 4096, 1, 308)": {"BLOCK_SIZE_M": 16, "BLOCK_SIZE_N": 32, "BLOCK_SIZE_K": 256, "GROUP_SIZE_M": 8, "SPLIT_K": 1, "A_load_order": 0, "NUM_STAGES": 5, "num_warps": 4, "num_ctas": 1, "num_stages": 5}, "(8, 2560, 4096, 4096, 1, 308)": {"BLOCK_SIZE_M": 16, "BLOCK_SIZE_N": 32, "BLOCK_SIZE_K": 256, "GROUP_SIZE_M": 8, "SPLIT_K": 1, "A_load_order": 0, "NUM_STAGES": 5, "num_warps": 4, "num_ctas": 1, "num_stages": 5}, "(16, 2560, 4096, 4096, 1, 308)": {"BLOCK_SIZE_M": 16, "BLOCK_SIZE_N": 64, "BLOCK_SIZE_K": 256, "GROUP_SIZE_M": 8, "SPLIT_K": 1, "A_load_order": 2, "NUM_STAGES": 4, "num_warps": 4, "num_ctas": 1, "num_stages": 4}, "(24, 2560, 4096, 4096, 1, 308)": {"BLOCK_SIZE_M": 16, "BLOCK_SIZE_N": 64, "BLOCK_SIZE_K": 512, "GROUP_SIZE_M": 8, "SPLIT_K": 1, "A_load_order": 0, "NUM_STAGES": 2, "num_warps": 4, "num_ctas": 1, "num_stages": 2}, "(32, 2560, 4096, 4096, 1, 308)": {"BLOCK_SIZE_M": 16, "BLOCK_SIZE_N": 32, "BLOCK_SIZE_K": 256, "GROUP_SIZE_M": 8, "SPLIT_K": 1, "A_load_order": 0, "NUM_STAGES": 5, "num_warps": 4, "num_ctas": 1, "num_stages": 5}, "(48, 2560, 4096, 4096, 1, 308)": {"BLOCK_SIZE_M": 32, "BLOCK_SIZE_N": 64, "BLOCK_SIZE_K": 512, "GROUP_SIZE_M": 8, "SPLIT_K": 1, "A_load_order": 0, "NUM_STAGES": 2, "num_warps": 4, "num_ctas": 1, "num_stages": 2}, "(64, 2560, 4096, 4096, 1, 308)": {"BLOCK_SIZE_M": 32, "BLOCK_SIZE_N": 64, "BLOCK_SIZE_K": 512, "GROUP_SIZE_M": 8, "SPLIT_K": 1, "A_load_order": 0, "NUM_STAGES": 2, "num_warps": 4, "num_ctas": 1, "num_stages": 2}, "(2, 6144, 2560, 2560, 1, 308)": {"BLOCK_SIZE_M": 16, "BLOCK_SIZE_N": 32, "BLOCK_SIZE_K": 256, "GROUP_SIZE_M": 8, "SPLIT_K": 1, "A_load_order": 0, "NUM_STAGES": 5, "num_warps": 4, "num_ctas": 1, "num_stages": 5}, "(4, 6144, 2560, 2560, 1, 308)": {"BLOCK_SIZE_M": 16, "BLOCK_SIZE_N": 64, "BLOCK_SIZE_K": 512, "GROUP_SIZE_M": 8, "SPLIT_K": 1, "A_load_order": 0, "NUM_STAGES": 2, "num_warps": 4, "num_ctas": 1, "num_stages": 2}, "(8, 6144, 2560, 2560, 1, 308)": {"BLOCK_SIZE_M": 16, "BLOCK_SIZE_N": 32, "BLOCK_SIZE_K": 256, "GROUP_SIZE_M": 8, "SPLIT_K": 1, "A_load_order": 0, "NUM_STAGES": 5, "num_warps": 4, "num_ctas": 1, "num_stages": 5}, "(16, 6144, 2560, 2560, 1, 308)": {"BLOCK_SIZE_M": 16, "BLOCK_SIZE_N": 64, "BLOCK_SIZE_K": 256, "GROUP_SIZE_M": 8, "SPLIT_K": 1, "A_load_order": 2, "NUM_STAGES": 4, "num_warps": 4, "num_ctas": 1, "num_stages": 4}, "(24, 6144, 2560, 2560, 1, 308)": {"BLOCK_SIZE_M": 16, "BLOCK_SIZE_N": 128, "BLOCK_SIZE_K": 256, "GROUP_SIZE_M": 8, "SPLIT_K": 1, "A_load_order": 0, "NUM_STAGES": 2, "num_warps": 4, "num_ctas": 1, "num_stages": 2}, "(32, 6144, 2560, 2560, 1, 308)": {"BLOCK_SIZE_M": 16, "BLOCK_SIZE_N": 128, "BLOCK_SIZE_K": 256, "GROUP_SIZE_M": 8, "SPLIT_K": 1, "A_load_order": 0, "NUM_STAGES": 2, "num_warps": 4, "num_ctas": 1, "num_stages": 2}, "(48, 6144, 2560, 2560, 1, 308)": {"BLOCK_SIZE_M": 32, "BLOCK_SIZE_N": 128, "BLOCK_SIZE_K": 256, "GROUP_SIZE_M": 8, "SPLIT_K": 1, "A_load_order": 0, "NUM_STAGES": 2, "num_warps": 4, "num_ctas": 1, "num_stages": 2}, "(64, 6144, 2560, 2560, 1, 308)": {"BLOCK_SIZE_M": 32, "BLOCK_SIZE_N": 128, "BLOCK_SIZE_K": 256, "GROUP_SIZE_M": 8, "SPLIT_K": 1, "A_load_order": 0, "NUM_STAGES": 2, "num_warps": 4, "num_ctas": 1, "num_stages": 2}, "(2, 19456, 2560, 2560, 1, 308)": {"BLOCK_SIZE_M": 16, "BLOCK_SIZE_N": 256, "BLOCK_SIZE_K": 256, "GROUP_SIZE_M": 8, "SPLIT_K": 1, "A_load_order": 0, "NUM_STAGES": 1, "num_warps": 8, "num_ctas": 1, "num_stages": 1}, "(4, 19456, 2560, 2560, 1, 308)": {"BLOCK_SIZE_M": 16, "BLOCK_SIZE_N": 256, "BLOCK_SIZE_K": 256, "GROUP_SIZE_M": 8, "SPLIT_K": 1, "A_load_order": 0, "NUM_STAGES": 1, "num_warps": 8, "num_ctas": 1, "num_stages": 1}, "(8, 19456, 2560, 2560, 1, 308)": {"BLOCK_SIZE_M": 16, "BLOCK_SIZE_N": 256, "BLOCK_SIZE_K": 256, "GROUP_SIZE_M": 8, "SPLIT_K": 1, "A_load_order": 0, "NUM_STAGES": 1, "num_warps": 8, "num_ctas": 1, "num_stages": 1}, "(16, 19456, 2560, 2560, 1, 308)": {"BLOCK_SIZE_M": 16, "BLOCK_SIZE_N": 256, "BLOCK_SIZE_K": 256, "GROUP_SIZE_M": 8, "SPLIT_K": 1, "A_load_order": 0, "NUM_STAGES": 1, "num_warps": 8, "num_ctas": 1, "num_stages": 1}, "(24, 19456, 2560, 2560, 1, 308)": {"BLOCK_SIZE_M": 16, "BLOCK_SIZE_N": 256, "BLOCK_SIZE_K": 256, "GROUP_SIZE_M": 8, "SPLIT_K": 1, "A_load_order": 0, "NUM_STAGES": 1, "num_warps": 8, "num_ctas": 1, "num_stages": 1}, "(32, 19456, 2560, 2560, 1, 308)": {"BLOCK_SIZE_M": 16, "BLOCK_SIZE_N": 256, "BLOCK_SIZE_K": 256, "GROUP_SIZE_M": 8, "SPLIT_K": 1, "A_load_order": 0, "NUM_STAGES": 1, "num_warps": 8, "num_ctas": 1, "num_stages": 1}, "(48, 19456, 2560, 2560, 1, 308)": {"BLOCK_SIZE_M": 32, "BLOCK_SIZE_N": 256, "BLOCK_SIZE_K": 256, "GROUP_SIZE_M": 8, "SPLIT_K": 1, "A_load_order": 0, "NUM_STAGES": 1, "num_warps": 8, "num_ctas": 1, "num_stages": 1}, "(64, 19456, 2560, 2560, 1, 308)": {"BLOCK_SIZE_M": 32, "BLOCK_SIZE_N": 256, "BLOCK_SIZE_K": 256, "GROUP_SIZE_M": 8, "SPLIT_K": 1, "A_load_order": 0, "NUM_STAGES": 1, "num_warps": 8, "num_ctas": 1, "num_stages": 1}, "(2, 2560, 9728, 9728, 1, 308)": {"BLOCK_SIZE_M": 16, "BLOCK_SIZE_N": 32, "BLOCK_SIZE_K": 512, "GROUP_SIZE_M": 8, "SPLIT_K": 1, "A_load_order": 0, "NUM_STAGES": 4, "num_warps": 4, "num_ctas": 1, "num_stages": 4}, "(4, 2560, 9728, 9728, 1, 308)": {"BLOCK_SIZE_M": 16, "BLOCK_SIZE_N": 64, "BLOCK_SIZE_K": 256, "GROUP_SIZE_M": 8, "SPLIT_K": 1, "A_load_order": 2, "NUM_STAGES": 4, "num_warps": 4, "num_ctas": 1, "num_stages": 4}, "(8, 2560, 9728, 9728, 1, 308)": {"BLOCK_SIZE_M": 16, "BLOCK_SIZE_N": 32, "BLOCK_SIZE_K": 512, "GROUP_SIZE_M": 8, "SPLIT_K": 1, "A_load_order": 0, "NUM_STAGES": 4, "num_warps": 4, "num_ctas": 1, "num_stages": 4}, "(16, 2560, 9728, 9728, 1, 308)": {"BLOCK_SIZE_M": 16, "BLOCK_SIZE_N": 64, "BLOCK_SIZE_K": 256, "GROUP_SIZE_M": 8, "SPLIT_K": 1, "A_load_order": 2, "NUM_STAGES": 4, "num_warps": 4, "num_ctas": 1, "num_stages": 4}, "(24, 2560, 9728, 9728, 1, 308)": {"BLOCK_SIZE_M": 16, "BLOCK_SIZE_N": 32, "BLOCK_SIZE_K": 512, "GROUP_SIZE_M": 8, "SPLIT_K": 1, "A_load_order": 0, "NUM_STAGES": 4, "num_warps": 4, "num_ctas": 1, "num_stages": 4}, "(32, 2560, 9728, 9728, 1, 308)": {"BLOCK_SIZE_M": 16, "BLOCK_SIZE_N": 32, "BLOCK_SIZE_K": 512, "GROUP_SIZE_M": 8, "SPLIT_K": 1, "A_load_order": 0, "NUM_STAGES": 4, "num_warps": 4, "num_ctas": 1, "num_stages": 4}, "(48, 2560, 9728, 9728, 1, 308)": {"BLOCK_SIZE_M": 32, "BLOCK_SIZE_N": 32, "BLOCK_SIZE_K": 512, "GROUP_SIZE_M": 8, "SPLIT_K": 1, "A_load_order": 0, "NUM_STAGES": 3, "num_warps": 4, "num_ctas": 1, "num_stages": 3}, "(64, 2560, 9728, 9728, 1, 308)": {"BLOCK_SIZE_M": 32, "BLOCK_SIZE_N": 64, "BLOCK_SIZE_K": 512, "GROUP_SIZE_M": 8, "SPLIT_K": 1, "A_load_order": 0, "NUM_STAGES": 2, "num_warps": 4, "num_ctas": 1, "num_stages": 2}, "(2, 3072, 1024, 1024, 1, 408)": {"BLOCK_SIZE_M": 16, "BLOCK_SIZE_N": 64, "BLOCK_SIZE_K": 256, "GROUP_SIZE_M": 8, "SPLIT_K": 1, "A_load_order": 2, "NUM_STAGES": 4, "num_warps": 4, "num_ctas": 1, "num_stages": 4}, "(4, 3072, 1024, 1024, 1, 408)": {"BLOCK_SIZE_M": 16, "BLOCK_SIZE_N": 32, "BLOCK_SIZE_K": 256, "GROUP_SIZE_M": 8, "SPLIT_K": 1, "A_load_order": 0, "NUM_STAGES": 5, "num_warps": 4, "num_ctas": 1, "num_stages": 5}, "(8, 3072, 1024, 1024, 1, 408)": {"BLOCK_SIZE_M": 16, "BLOCK_SIZE_N": 32, "BLOCK_SIZE_K": 256, "GROUP_SIZE_M": 8, "SPLIT_K": 1, "A_load_order": 0, "NUM_STAGES": 5, "num_warps": 4, "num_ctas": 1, "num_stages": 5}, "(16, 3072, 1024, 1024, 1, 408)": {"BLOCK_SIZE_M": 16, "BLOCK_SIZE_N": 32, "BLOCK_SIZE_K": 256, "GROUP_SIZE_M": 8, "SPLIT_K": 1, "A_load_order": 0, "NUM_STAGES": 5, "num_warps": 4, "num_ctas": 1, "num_stages": 5}, "(24, 3072, 1024, 1024, 1, 408)": {"BLOCK_SIZE_M": 16, "BLOCK_SIZE_N": 64, "BLOCK_SIZE_K": 512, "GROUP_SIZE_M": 8, "SPLIT_K": 1, "A_load_order": 0, "NUM_STAGES": 2, "num_warps": 4, "num_ctas": 1, "num_stages": 2}, "(32, 3072, 1024, 1024, 1, 408)": {"BLOCK_SIZE_M": 16, "BLOCK_SIZE_N": 64, "BLOCK_SIZE_K": 512, "GROUP_SIZE_M": 8, "SPLIT_K": 1, "A_load_order": 0, "NUM_STAGES": 2, "num_warps": 4, "num_ctas": 1, "num_stages": 2}, "(48, 3072, 1024, 1024, 1, 408)": {"BLOCK_SIZE_M": 32, "BLOCK_SIZE_N": 64, "BLOCK_SIZE_K": 512, "GROUP_SIZE_M": 8, "SPLIT_K": 1, "A_load_order": 0, "NUM_STAGES": 2, "num_warps": 4, "num_ctas": 1, "num_stages": 2}, "(64, 3072, 1024, 1024, 1, 408)": {"BLOCK_SIZE_M": 32, "BLOCK_SIZE_N": 128, "BLOCK_SIZE_K": 256, "GROUP_SIZE_M": 8, "SPLIT_K": 1, "A_load_order": 0, "NUM_STAGES": 2, "num_warps": 4, "num_ctas": 1, "num_stages": 2}, "(2, 1024, 1024, 1024, 1, 408)": {"BLOCK_SIZE_M": 16, "BLOCK_SIZE_N": 32, "BLOCK_SIZE_K": 512, "GROUP_SIZE_M": 8, "SPLIT_K": 1, "A_load_order": 0, "NUM_STAGES": 4, "num_warps": 4, "num_ctas": 1, "num_stages": 4}, "(4, 1024, 1024, 1024, 1, 408)": {"BLOCK_SIZE_M": 16, "BLOCK_SIZE_N": 64, "BLOCK_SIZE_K": 256, "GROUP_SIZE_M": 8, "SPLIT_K": 1, "A_load_order": 2, "NUM_STAGES": 4, "num_warps": 4, "num_ctas": 1, "num_stages": 4}, "(8, 1024, 1024, 1024, 1, 408)": {"BLOCK_SIZE_M": 16, "BLOCK_SIZE_N": 64, "BLOCK_SIZE_K": 256, "GROUP_SIZE_M": 8, "SPLIT_K": 1, "A_load_order": 2, "NUM_STAGES": 4, "num_warps": 4, "num_ctas": 1, "num_stages": 4}, "(16, 1024, 1024, 1024, 1, 408)": {"BLOCK_SIZE_M": 16, "BLOCK_SIZE_N": 64, "BLOCK_SIZE_K": 256, "GROUP_SIZE_M": 8, "SPLIT_K": 1, "A_load_order": 2, "NUM_STAGES": 4, "num_warps": 4, "num_ctas": 1, "num_stages": 4}, "(24, 1024, 1024, 1024, 1, 408)": {"BLOCK_SIZE_M": 16, "BLOCK_SIZE_N": 64, "BLOCK_SIZE_K": 256, "GROUP_SIZE_M": 8, "SPLIT_K": 1, "A_load_order": 2, "NUM_STAGES": 4, "num_warps": 4, "num_ctas": 1, "num_stages": 4}, "(32, 1024, 1024, 1024, 1, 408)": {"BLOCK_SIZE_M": 16, "BLOCK_SIZE_N": 128, "BLOCK_SIZE_K": 128, "GROUP_SIZE_M": 8, "SPLIT_K": 1, "A_load_order": 0, "NUM_STAGES": 5, "num_warps": 4, "num_ctas": 1, "num_stages": 5}, "(48, 1024, 1024, 1024, 1, 408)": {"BLOCK_SIZE_M": 32, "BLOCK_SIZE_N": 64, "BLOCK_SIZE_K": 256, "GROUP_SIZE_M": 8, "SPLIT_K": 1, "A_load_order": 2, "NUM_STAGES": 4, "num_warps": 4, "num_ctas": 1, "num_stages": 4}, "(64, 1024, 1024, 1024, 1, 408)": {"BLOCK_SIZE_M": 32, "BLOCK_SIZE_N": 64, "BLOCK_SIZE_K": 256, "GROUP_SIZE_M": 8, "SPLIT_K": 1, "A_load_order": 2, "NUM_STAGES": 4, "num_warps": 4, "num_ctas": 1, "num_stages": 4}, "(2, 1024, 4096, 4096, 1, 408)": {"BLOCK_SIZE_M": 16, "BLOCK_SIZE_N": 32, "BLOCK_SIZE_K": 512, "GROUP_SIZE_M": 8, "SPLIT_K": 1, "A_load_order": 0, "NUM_STAGES": 4, "num_warps": 4, "num_ctas": 1, "num_stages": 4}, "(4, 1024, 4096, 4096, 1, 408)": {"BLOCK_SIZE_M": 16, "BLOCK_SIZE_N": 64, "BLOCK_SIZE_K": 256, "GROUP_SIZE_M": 8, "SPLIT_K": 1, "A_load_order": 2, "NUM_STAGES": 4, "num_warps": 4, "num_ctas": 1, "num_stages": 4}, "(8, 1024, 4096, 4096, 1, 408)": {"BLOCK_SIZE_M": 16, "BLOCK_SIZE_N": 32, "BLOCK_SIZE_K": 256, "GROUP_SIZE_M": 8, "SPLIT_K": 1, "A_load_order": 0, "NUM_STAGES": 5, "num_warps": 4, "num_ctas": 1, "num_stages": 5}, "(16, 1024, 4096, 4096, 1, 408)": {"BLOCK_SIZE_M": 16, "BLOCK_SIZE_N": 32, "BLOCK_SIZE_K": 512, "GROUP_SIZE_M": 8, "SPLIT_K": 1, "A_load_order": 0, "NUM_STAGES": 4, "num_warps": 4, "num_ctas": 1, "num_stages": 4}, "(24, 1024, 4096, 4096, 1, 408)": {"BLOCK_SIZE_M": 16, "BLOCK_SIZE_N": 32, "BLOCK_SIZE_K": 256, "GROUP_SIZE_M": 8, "SPLIT_K": 1, "A_load_order": 0, "NUM_STAGES": 5, "num_warps": 4, "num_ctas": 1, "num_stages": 5}, "(32, 1024, 4096, 4096, 1, 408)": {"BLOCK_SIZE_M": 16, "BLOCK_SIZE_N": 64, "BLOCK_SIZE_K": 256, "GROUP_SIZE_M": 8, "SPLIT_K": 1, "A_load_order": 2, "NUM_STAGES": 4, "num_warps": 4, "num_ctas": 1, "num_stages": 4}, "(48, 1024, 4096, 4096, 1, 408)": {"BLOCK_SIZE_M": 32, "BLOCK_SIZE_N": 64, "BLOCK_SIZE_K": 256, "GROUP_SIZE_M": 8, "SPLIT_K": 1, "A_load_order": 2, "NUM_STAGES": 4, "num_warps": 4, "num_ctas": 1, "num_stages": 4}, "(64, 1024, 4096, 4096, 1, 408)": {"BLOCK_SIZE_M": 32, "BLOCK_SIZE_N": 64, "BLOCK_SIZE_K": 256, "GROUP_SIZE_M": 8, "SPLIT_K": 1, "A_load_order": 2, "NUM_STAGES": 4, "num_warps": 4, "num_ctas": 1, "num_stages": 4}, "(2, 2560, 4096, 4096, 1, 408)": {"BLOCK_SIZE_M": 16, "BLOCK_SIZE_N": 32, "BLOCK_SIZE_K": 256, "GROUP_SIZE_M": 8, "SPLIT_K": 1, "A_load_order": 0, "NUM_STAGES": 5, "num_warps": 4, "num_ctas": 1, "num_stages": 5}, "(4, 2560, 4096, 4096, 1, 408)": {"BLOCK_SIZE_M": 16, "BLOCK_SIZE_N": 64, "BLOCK_SIZE_K": 256, "GROUP_SIZE_M": 8, "SPLIT_K": 1, "A_load_order": 2, "NUM_STAGES": 4, "num_warps": 4, "num_ctas": 1, "num_stages": 4}, "(8, 2560, 4096, 4096, 1, 408)": {"BLOCK_SIZE_M": 16, "BLOCK_SIZE_N": 64, "BLOCK_SIZE_K": 256, "GROUP_SIZE_M": 8, "SPLIT_K": 1, "A_load_order": 2, "NUM_STAGES": 4, "num_warps": 4, "num_ctas": 1, "num_stages": 4}, "(16, 2560, 4096, 4096, 1, 408)": {"BLOCK_SIZE_M": 16, "BLOCK_SIZE_N": 64, "BLOCK_SIZE_K": 256, "GROUP_SIZE_M": 8, "SPLIT_K": 1, "A_load_order": 2, "NUM_STAGES": 4, "num_warps": 4, "num_ctas": 1, "num_stages": 4}, "(24, 2560, 4096, 4096, 1, 408)": {"BLOCK_SIZE_M": 16, "BLOCK_SIZE_N": 64, "BLOCK_SIZE_K": 512, "GROUP_SIZE_M": 8, "SPLIT_K": 1, "A_load_order": 0, "NUM_STAGES": 2, "num_warps": 4, "num_ctas": 1, "num_stages": 2}, "(32, 2560, 4096, 4096, 1, 408)": {"BLOCK_SIZE_M": 16, "BLOCK_SIZE_N": 32, "BLOCK_SIZE_K": 256, "GROUP_SIZE_M": 8, "SPLIT_K": 1, "A_load_order": 0, "NUM_STAGES": 5, "num_warps": 4, "num_ctas": 1, "num_stages": 5}, "(48, 2560, 4096, 4096, 1, 408)": {"BLOCK_SIZE_M": 32, "BLOCK_SIZE_N": 64, "BLOCK_SIZE_K": 512, "GROUP_SIZE_M": 8, "SPLIT_K": 1, "A_load_order": 0, "NUM_STAGES": 2, "num_warps": 4, "num_ctas": 1, "num_stages": 2}, "(64, 2560, 4096, 4096, 1, 408)": {"BLOCK_SIZE_M": 32, "BLOCK_SIZE_N": 64, "BLOCK_SIZE_K": 512, "GROUP_SIZE_M": 8, "SPLIT_K": 1, "A_load_order": 0, "NUM_STAGES": 2, "num_warps": 4, "num_ctas": 1, "num_stages": 2}, "(2, 6144, 2560, 2560, 1, 408)": {"BLOCK_SIZE_M": 16, "BLOCK_SIZE_N": 32, "BLOCK_SIZE_K": 256, "GROUP_SIZE_M": 8, "SPLIT_K": 1, "A_load_order": 0, "NUM_STAGES": 5, "num_warps": 4, "num_ctas": 1, "num_stages": 5}, "(4, 6144, 2560, 2560, 1, 408)": {"BLOCK_SIZE_M": 16, "BLOCK_SIZE_N": 32, "BLOCK_SIZE_K": 256, "GROUP_SIZE_M": 8, "SPLIT_K": 1, "A_load_order": 0, "NUM_STAGES": 5, "num_warps": 4, "num_ctas": 1, "num_stages": 5}, "(8, 6144, 2560, 2560, 1, 408)": {"BLOCK_SIZE_M": 16, "BLOCK_SIZE_N": 32, "BLOCK_SIZE_K": 256, "GROUP_SIZE_M": 8, "SPLIT_K": 1, "A_load_order": 0, "NUM_STAGES": 5, "num_warps": 4, "num_ctas": 1, "num_stages": 5}, "(16, 6144, 2560, 2560, 1, 408)": {"BLOCK_SIZE_M": 16, "BLOCK_SIZE_N": 64, "BLOCK_SIZE_K": 256, "GROUP_SIZE_M": 8, "SPLIT_K": 1, "A_load_order": 2, "NUM_STAGES": 4, "num_warps": 4, "num_ctas": 1, "num_stages": 4}, "(24, 6144, 2560, 2560, 1, 408)": {"BLOCK_SIZE_M": 16, "BLOCK_SIZE_N": 128, "BLOCK_SIZE_K": 256, "GROUP_SIZE_M": 8, "SPLIT_K": 1, "A_load_order": 0, "NUM_STAGES": 2, "num_warps": 4, "num_ctas": 1, "num_stages": 2}, "(32, 6144, 2560, 2560, 1, 408)": {"BLOCK_SIZE_M": 16, "BLOCK_SIZE_N": 128, "BLOCK_SIZE_K": 256, "GROUP_SIZE_M": 8, "SPLIT_K": 1, "A_load_order": 0, "NUM_STAGES": 2, "num_warps": 4, "num_ctas": 1, "num_stages": 2}, "(48, 6144, 2560, 2560, 1, 408)": {"BLOCK_SIZE_M": 32, "BLOCK_SIZE_N": 128, "BLOCK_SIZE_K": 256, "GROUP_SIZE_M": 8, "SPLIT_K": 1, "A_load_order": 0, "NUM_STAGES": 2, "num_warps": 4, "num_ctas": 1, "num_stages": 2}, "(64, 6144, 2560, 2560, 1, 408)": {"BLOCK_SIZE_M": 32, "BLOCK_SIZE_N": 128, "BLOCK_SIZE_K": 256, "GROUP_SIZE_M": 8, "SPLIT_K": 1, "A_load_order": 0, "NUM_STAGES": 2, "num_warps": 4, "num_ctas": 1, "num_stages": 2}, "(2, 19456, 2560, 2560, 1, 408)": {"BLOCK_SIZE_M": 16, "BLOCK_SIZE_N": 256, "BLOCK_SIZE_K": 256, "GROUP_SIZE_M": 8, "SPLIT_K": 1, "A_load_order": 0, "NUM_STAGES": 1, "num_warps": 8, "num_ctas": 1, "num_stages": 1}, "(4, 19456, 2560, 2560, 1, 408)": {"BLOCK_SIZE_M": 16, "BLOCK_SIZE_N": 256, "BLOCK_SIZE_K": 256, "GROUP_SIZE_M": 8, "SPLIT_K": 1, "A_load_order": 0, "NUM_STAGES": 1, "num_warps": 8, "num_ctas": 1, "num_stages": 1}, "(8, 19456, 2560, 2560, 1, 408)": {"BLOCK_SIZE_M": 16, "BLOCK_SIZE_N": 256, "BLOCK_SIZE_K": 256, "GROUP_SIZE_M": 8, "SPLIT_K": 1, "A_load_order": 0, "NUM_STAGES": 1, "num_warps": 8, "num_ctas": 1, "num_stages": 1}, "(16, 19456, 2560, 2560, 1, 408)": {"BLOCK_SIZE_M": 16, "BLOCK_SIZE_N": 256, "BLOCK_SIZE_K": 256, "GROUP_SIZE_M": 8, "SPLIT_K": 1, "A_load_order": 0, "NUM_STAGES": 1, "num_warps": 8, "num_ctas": 1, "num_stages": 1}, "(24, 19456, 2560, 2560, 1, 408)": {"BLOCK_SIZE_M": 16, "BLOCK_SIZE_N": 256, "BLOCK_SIZE_K": 256, "GROUP_SIZE_M": 8, "SPLIT_K": 1, "A_load_order": 0, "NUM_STAGES": 1, "num_warps": 8, "num_ctas": 1, "num_stages": 1}, "(32, 19456, 2560, 2560, 1, 408)": {"BLOCK_SIZE_M": 16, "BLOCK_SIZE_N": 256, "BLOCK_SIZE_K": 256, "GROUP_SIZE_M": 8, "SPLIT_K": 1, "A_load_order": 0, "NUM_STAGES": 1, "num_warps": 8, "num_ctas": 1, "num_stages": 1}, "(48, 19456, 2560, 2560, 1, 408)": {"BLOCK_SIZE_M": 32, "BLOCK_SIZE_N": 256, "BLOCK_SIZE_K": 256, "GROUP_SIZE_M": 8, "SPLIT_K": 1, "A_load_order": 0, "NUM_STAGES": 1, "num_warps": 8, "num_ctas": 1, "num_stages": 1}, "(64, 19456, 2560, 2560, 1, 408)": {"BLOCK_SIZE_M": 32, "BLOCK_SIZE_N": 256, "BLOCK_SIZE_K": 256, "GROUP_SIZE_M": 8, "SPLIT_K": 1, "A_load_order": 0, "NUM_STAGES": 1, "num_warps": 8, "num_ctas": 1, "num_stages": 1}, "(2, 2560, 9728, 9728, 1, 408)": {"BLOCK_SIZE_M": 16, "BLOCK_SIZE_N": 32, "BLOCK_SIZE_K": 512, "GROUP_SIZE_M": 8, "SPLIT_K": 1, "A_load_order": 0, "NUM_STAGES": 4, "num_warps": 4, "num_ctas": 1, "num_stages": 4}, "(4, 2560, 9728, 9728, 1, 408)": {"BLOCK_SIZE_M": 16, "BLOCK_SIZE_N": 32, "BLOCK_SIZE_K": 512, "GROUP_SIZE_M": 8, "SPLIT_K": 1, "A_load_order": 0, "NUM_STAGES": 4, "num_warps": 4, "num_ctas": 1, "num_stages": 4}, "(8, 2560, 9728, 9728, 1, 408)": {"BLOCK_SIZE_M": 16, "BLOCK_SIZE_N": 32, "BLOCK_SIZE_K": 512, "GROUP_SIZE_M": 8, "SPLIT_K": 1, "A_load_order": 0, "NUM_STAGES": 4, "num_warps": 4, "num_ctas": 1, "num_stages": 4}, "(16, 2560, 9728, 9728, 1, 408)": {"BLOCK_SIZE_M": 16, "BLOCK_SIZE_N": 32, "BLOCK_SIZE_K": 512, "GROUP_SIZE_M": 8, "SPLIT_K": 1, "A_load_order": 0, "NUM_STAGES": 4, "num_warps": 4, "num_ctas": 1, "num_stages": 4}, "(24, 2560, 9728, 9728, 1, 408)": {"BLOCK_SIZE_M": 16, "BLOCK_SIZE_N": 32, "BLOCK_SIZE_K": 512, "GROUP_SIZE_M": 8, "SPLIT_K": 1, "A_load_order": 0, "NUM_STAGES": 4, "num_warps": 4, "num_ctas": 1, "num_stages": 4}, "(32, 2560, 9728, 9728, 1, 408)": {"BLOCK_SIZE_M": 16, "BLOCK_SIZE_N": 32, "BLOCK_SIZE_K": 512, "GROUP_SIZE_M": 8, "SPLIT_K": 1, "A_load_order": 0, "NUM_STAGES": 4, "num_warps": 4, "num_ctas": 1, "num_stages": 4}, "(48, 2560, 9728, 9728, 1, 408)": {"BLOCK_SIZE_M": 32, "BLOCK_SIZE_N": 32, "BLOCK_SIZE_K": 256, "GROUP_SIZE_M": 8, "SPLIT_K": 1, "A_load_order": 0, "NUM_STAGES": 5, "num_warps": 4, "num_ctas": 1, "num_stages": 5}, "(64, 2560, 9728, 9728, 1, 408)": {"BLOCK_SIZE_M": 32, "BLOCK_SIZE_N": 64, "BLOCK_SIZE_K": 256, "GROUP_SIZE_M": 8, "SPLIT_K": 1, "A_load_order": 2, "NUM_STAGES": 4, "num_warps": 4, "num_ctas": 1, "num_stages": 4}, "(2, 3072, 1024, 64, 8, 104)": {"BLOCK_SIZE_M": 16, "BLOCK_SIZE_N": 128, "BLOCK_SIZE_K": 32, "GROUP_SIZE_M": 8, "SPLIT_K": 4, "A_load_order": 0, "NUM_STAGES": 3, "num_warps": 8, "num_ctas": 1, "num_stages": 3}, "(4, 3072, 1024, 64, 8, 104)": {"BLOCK_SIZE_M": 16, "BLOCK_SIZE_N": 32, "BLOCK_SIZE_K": 64, "GROUP_SIZE_M": 8, "SPLIT_K": 1, "A_load_order": 0, "NUM_STAGES": 4, "num_warps": 4, "num_ctas": 1, "num_stages": 4}, "(8, 3072, 1024, 64, 8, 104)": {"BLOCK_SIZE_M": 16, "BLOCK_SIZE_N": 32, "BLOCK_SIZE_K": 64, "GROUP_SIZE_M": 8, "SPLIT_K": 1, "A_load_order": 0, "NUM_STAGES": 4, "num_warps": 4, "num_ctas": 1, "num_stages": 4}, "(16, 3072, 1024, 64, 8, 104)": {"BLOCK_SIZE_M": 16, "BLOCK_SIZE_N": 32, "BLOCK_SIZE_K": 64, "GROUP_SIZE_M": 8, "SPLIT_K": 1, "A_load_order": 0, "NUM_STAGES": 4, "num_warps": 4, "num_ctas": 1, "num_stages": 4}, "(24, 3072, 1024, 64, 8, 104)": {"BLOCK_SIZE_M": 16, "BLOCK_SIZE_N": 128, "BLOCK_SIZE_K": 64, "GROUP_SIZE_M": 8, "SPLIT_K": 4, "A_load_order": 0, "NUM_STAGES": 1, "num_warps": 4, "num_ctas": 1, "num_stages": 1}, "(32, 3072, 1024, 64, 8, 104)": {"BLOCK_SIZE_M": 16, "BLOCK_SIZE_N": 128, "BLOCK_SIZE_K": 64, "GROUP_SIZE_M": 8, "SPLIT_K": 4, "A_load_order": 0, "NUM_STAGES": 1, "num_warps": 4, "num_ctas": 1, "num_stages": 1}, "(48, 3072, 1024, 64, 8, 104)": {"BLOCK_SIZE_M": 32, "BLOCK_SIZE_N": 128, "BLOCK_SIZE_K": 64, "GROUP_SIZE_M": 8, "SPLIT_K": 4, "A_load_order": 0, "NUM_STAGES": 1, "num_warps": 4, "num_ctas": 1, "num_stages": 1}, "(64, 3072, 1024, 64, 8, 104)": {"BLOCK_SIZE_M": 32, "BLOCK_SIZE_N": 128, "BLOCK_SIZE_K": 64, "GROUP_SIZE_M": 8, "SPLIT_K": 4, "A_load_order": 0, "NUM_STAGES": 1, "num_warps": 4, "num_ctas": 1, "num_stages": 1}, "(2, 1024, 1024, 64, 8, 104)": {"BLOCK_SIZE_M": 16, "BLOCK_SIZE_N": 64, "BLOCK_SIZE_K": 32, "GROUP_SIZE_M": 8, "SPLIT_K": 8, "A_load_order": 2, "NUM_STAGES": 4, "num_warps": 8, "num_ctas": 1, "num_stages": 4}, "(4, 1024, 1024, 64, 8, 104)": {"BLOCK_SIZE_M": 16, "BLOCK_SIZE_N": 64, "BLOCK_SIZE_K": 32, "GROUP_SIZE_M": 8, "SPLIT_K": 8, "A_load_order": 2, "NUM_STAGES": 4, "num_warps": 8, "num_ctas": 1, "num_stages": 4}, "(8, 1024, 1024, 64, 8, 104)": {"BLOCK_SIZE_M": 16, "BLOCK_SIZE_N": 64, "BLOCK_SIZE_K": 32, "GROUP_SIZE_M": 8, "SPLIT_K": 8, "A_load_order": 2, "NUM_STAGES": 4, "num_warps": 8, "num_ctas": 1, "num_stages": 4}, "(16, 1024, 1024, 64, 8, 104)": {"BLOCK_SIZE_M": 16, "BLOCK_SIZE_N": 64, "BLOCK_SIZE_K": 32, "GROUP_SIZE_M": 8, "SPLIT_K": 8, "A_load_order": 2, "NUM_STAGES": 4, "num_warps": 8, "num_ctas": 1, "num_stages": 4}, "(24, 1024, 1024, 64, 8, 104)": {"BLOCK_SIZE_M": 16, "BLOCK_SIZE_N": 64, "BLOCK_SIZE_K": 32, "GROUP_SIZE_M": 8, "SPLIT_K": 8, "A_load_order": 2, "NUM_STAGES": 4, "num_warps": 8, "num_ctas": 1, "num_stages": 4}, "(32, 1024, 1024, 64, 8, 104)": {"BLOCK_SIZE_M": 16, "BLOCK_SIZE_N": 64, "BLOCK_SIZE_K": 32, "GROUP_SIZE_M": 8, "SPLIT_K": 8, "A_load_order": 2, "NUM_STAGES": 4, "num_warps": 8, "num_ctas": 1, "num_stages": 4}, "(48, 1024, 1024, 64, 8, 104)": {"BLOCK_SIZE_M": 32, "BLOCK_SIZE_N": 32, "BLOCK_SIZE_K": 64, "GROUP_SIZE_M": 8, "SPLIT_K": 1, "A_load_order": 0, "NUM_STAGES": 4, "num_warps": 4, "num_ctas": 1, "num_stages": 4}, "(64, 1024, 1024, 64, 8, 104)": {"BLOCK_SIZE_M": 32, "BLOCK_SIZE_N": 32, "BLOCK_SIZE_K": 64, "GROUP_SIZE_M": 8, "SPLIT_K": 1, "A_load_order": 0, "NUM_STAGES": 4, "num_warps": 4, "num_ctas": 1, "num_stages": 4}, "(2, 1024, 4096, 64, 8, 104)": {"BLOCK_SIZE_M": 16, "BLOCK_SIZE_N": 64, "BLOCK_SIZE_K": 32, "GROUP_SIZE_M": 8, "SPLIT_K": 8, "A_load_order": 2, "NUM_STAGES": 4, "num_warps": 8, "num_ctas": 1, "num_stages": 4}, "(4, 1024, 4096, 64, 8, 104)": {"BLOCK_SIZE_M": 16, "BLOCK_SIZE_N": 64, "BLOCK_SIZE_K": 32, "GROUP_SIZE_M": 8, "SPLIT_K": 8, "A_load_order": 2, "NUM_STAGES": 4, "num_warps": 8, "num_ctas": 1, "num_stages": 4}, "(8, 1024, 4096, 64, 8, 104)": {"BLOCK_SIZE_M": 16, "BLOCK_SIZE_N": 64, "BLOCK_SIZE_K": 32, "GROUP_SIZE_M": 8, "SPLIT_K": 8, "A_load_order": 2, "NUM_STAGES": 4, "num_warps": 8, "num_ctas": 1, "num_stages": 4}, "(16, 1024, 4096, 64, 8, 104)": {"BLOCK_SIZE_M": 16, "BLOCK_SIZE_N": 64, "BLOCK_SIZE_K": 32, "GROUP_SIZE_M": 8, "SPLIT_K": 8, "A_load_order": 2, "NUM_STAGES": 4, "num_warps": 8, "num_ctas": 1, "num_stages": 4}, "(24, 1024, 4096, 64, 8, 104)": {"BLOCK_SIZE_M": 16, "BLOCK_SIZE_N": 128, "BLOCK_SIZE_K": 64, "GROUP_SIZE_M": 8, "SPLIT_K": 4, "A_load_order": 2, "NUM_STAGES": 1, "num_warps": 8, "num_ctas": 1, "num_stages": 1}, "(32, 1024, 4096, 64, 8, 104)": {"BLOCK_SIZE_M": 16, "BLOCK_SIZE_N": 128, "BLOCK_SIZE_K": 64, "GROUP_SIZE_M": 8, "SPLIT_K": 4, "A_load_order": 2, "NUM_STAGES": 1, "num_warps": 8, "num_ctas": 1, "num_stages": 1}, "(48, 1024, 4096, 64, 8, 104)": {"BLOCK_SIZE_M": 32, "BLOCK_SIZE_N": 128, "BLOCK_SIZE_K": 64, "GROUP_SIZE_M": 8, "SPLIT_K": 4, "A_load_order": 0, "NUM_STAGES": 1, "num_warps": 4, "num_ctas": 1, "num_stages": 1}, "(64, 1024, 4096, 64, 8, 104)": {"BLOCK_SIZE_M": 32, "BLOCK_SIZE_N": 128, "BLOCK_SIZE_K": 64, "GROUP_SIZE_M": 8, "SPLIT_K": 4, "A_load_order": 0, "NUM_STAGES": 1, "num_warps": 4, "num_ctas": 1, "num_stages": 1}, "(2, 2560, 4096, 64, 8, 104)": {"BLOCK_SIZE_M": 16, "BLOCK_SIZE_N": 128, "BLOCK_SIZE_K": 32, "GROUP_SIZE_M": 8, "SPLIT_K": 4, "A_load_order": 0, "NUM_STAGES": 3, "num_warps": 8, "num_ctas": 1, "num_stages": 3}, "(4, 2560, 4096, 64, 8, 104)": {"BLOCK_SIZE_M": 16, "BLOCK_SIZE_N": 128, "BLOCK_SIZE_K": 32, "GROUP_SIZE_M": 8, "SPLIT_K": 4, "A_load_order": 0, "NUM_STAGES": 3, "num_warps": 8, "num_ctas": 1, "num_stages": 3}, "(8, 2560, 4096, 64, 8, 104)": {"BLOCK_SIZE_M": 16, "BLOCK_SIZE_N": 128, "BLOCK_SIZE_K": 32, "GROUP_SIZE_M": 8, "SPLIT_K": 4, "A_load_order": 0, "NUM_STAGES": 3, "num_warps": 8, "num_ctas": 1, "num_stages": 3}, "(16, 2560, 4096, 64, 8, 104)": {"BLOCK_SIZE_M": 16, "BLOCK_SIZE_N": 128, "BLOCK_SIZE_K": 32, "GROUP_SIZE_M": 8, "SPLIT_K": 4, "A_load_order": 0, "NUM_STAGES": 3, "num_warps": 8, "num_ctas": 1, "num_stages": 3}, "(24, 2560, 4096, 64, 8, 104)": {"BLOCK_SIZE_M": 16, "BLOCK_SIZE_N": 128, "BLOCK_SIZE_K": 64, "GROUP_SIZE_M": 8, "SPLIT_K": 4, "A_load_order": 0, "NUM_STAGES": 1, "num_warps": 4, "num_ctas": 1, "num_stages": 1}, "(32, 2560, 4096, 64, 8, 104)": {"BLOCK_SIZE_M": 16, "BLOCK_SIZE_N": 128, "BLOCK_SIZE_K": 64, "GROUP_SIZE_M": 8, "SPLIT_K": 4, "A_load_order": 0, "NUM_STAGES": 1, "num_warps": 4, "num_ctas": 1, "num_stages": 1}, "(48, 2560, 4096, 64, 8, 104)": {"BLOCK_SIZE_M": 32, "BLOCK_SIZE_N": 128, "BLOCK_SIZE_K": 64, "GROUP_SIZE_M": 8, "SPLIT_K": 4, "A_load_order": 0, "NUM_STAGES": 1, "num_warps": 4, "num_ctas": 1, "num_stages": 1}, "(64, 2560, 4096, 64, 8, 104)": {"BLOCK_SIZE_M": 32, "BLOCK_SIZE_N": 128, "BLOCK_SIZE_K": 64, "GROUP_SIZE_M": 8, "SPLIT_K": 4, "A_load_order": 0, "NUM_STAGES": 1, "num_warps": 4, "num_ctas": 1, "num_stages": 1}, "(2, 6144, 2560, 64, 8, 104)": {"BLOCK_SIZE_M": 16, "BLOCK_SIZE_N": 64, "BLOCK_SIZE_K": 64, "GROUP_SIZE_M": 8, "SPLIT_K": 1, "A_load_order": 0, "NUM_STAGES": 3, "num_warps": 4, "num_ctas": 1, "num_stages": 3}, "(4, 6144, 2560, 64, 8, 104)": {"BLOCK_SIZE_M": 16, "BLOCK_SIZE_N": 64, "BLOCK_SIZE_K": 64, "GROUP_SIZE_M": 8, "SPLIT_K": 1, "A_load_order": 2, "NUM_STAGES": 3, "num_warps": 4, "num_ctas": 1, "num_stages": 3}, "(8, 6144, 2560, 64, 8, 104)": {"BLOCK_SIZE_M": 16, "BLOCK_SIZE_N": 64, "BLOCK_SIZE_K": 64, "GROUP_SIZE_M": 8, "SPLIT_K": 1, "A_load_order": 0, "NUM_STAGES": 3, "num_warps": 4, "num_ctas": 1, "num_stages": 3}, "(16, 6144, 2560, 64, 8, 104)": {"BLOCK_SIZE_M": 16, "BLOCK_SIZE_N": 64, "BLOCK_SIZE_K": 64, "GROUP_SIZE_M": 8, "SPLIT_K": 1, "A_load_order": 0, "NUM_STAGES": 3, "num_warps": 4, "num_ctas": 1, "num_stages": 3}, "(24, 6144, 2560, 64, 8, 104)": {"BLOCK_SIZE_M": 16, "BLOCK_SIZE_N": 512, "BLOCK_SIZE_K": 32, "GROUP_SIZE_M": 8, "SPLIT_K": 4, "A_load_order": 2, "NUM_STAGES": 1, "num_warps": 4, "num_ctas": 1, "num_stages": 1}, "(32, 6144, 2560, 64, 8, 104)": {"BLOCK_SIZE_M": 16, "BLOCK_SIZE_N": 512, "BLOCK_SIZE_K": 32, "GROUP_SIZE_M": 8, "SPLIT_K": 4, "A_load_order": 2, "NUM_STAGES": 1, "num_warps": 4, "num_ctas": 1, "num_stages": 1}, "(48, 6144, 2560, 64, 8, 104)": {"BLOCK_SIZE_M": 32, "BLOCK_SIZE_N": 512, "BLOCK_SIZE_K": 32, "GROUP_SIZE_M": 8, "SPLIT_K": 4, "A_load_order": 2, "NUM_STAGES": 1, "num_warps": 4, "num_ctas": 1, "num_stages": 1}, "(64, 6144, 2560, 64, 8, 104)": {"BLOCK_SIZE_M": 32, "BLOCK_SIZE_N": 512, "BLOCK_SIZE_K": 32, "GROUP_SIZE_M": 8, "SPLIT_K": 4, "A_load_order": 2, "NUM_STAGES": 1, "num_warps": 4, "num_ctas": 1, "num_stages": 1}, "(2, 19456, 2560, 64, 8, 104)": {"BLOCK_SIZE_M": 16, "BLOCK_SIZE_N": 256, "BLOCK_SIZE_K": 64, "GROUP_SIZE_M": 8, "SPLIT_K": 1, "A_load_order": 0, "NUM_STAGES": 1, "num_warps": 8, "num_ctas": 1, "num_stages": 1}, "(4, 19456, 2560, 64, 8, 104)": {"BLOCK_SIZE_M": 16, "BLOCK_SIZE_N": 256, "BLOCK_SIZE_K": 64, "GROUP_SIZE_M": 8, "SPLIT_K": 1, "A_load_order": 0, "NUM_STAGES": 1, "num_warps": 8, "num_ctas": 1, "num_stages": 1}, "(8, 19456, 2560, 64, 8, 104)": {"BLOCK_SIZE_M": 16, "BLOCK_SIZE_N": 256, "BLOCK_SIZE_K": 64, "GROUP_SIZE_M": 8, "SPLIT_K": 1, "A_load_order": 0, "NUM_STAGES": 1, "num_warps": 8, "num_ctas": 1, "num_stages": 1}, "(16, 19456, 2560, 64, 8, 104)": {"BLOCK_SIZE_M": 16, "BLOCK_SIZE_N": 256, "BLOCK_SIZE_K": 64, "GROUP_SIZE_M": 8, "SPLIT_K": 1, "A_load_order": 0, "NUM_STAGES": 1, "num_warps": 8, "num_ctas": 1, "num_stages": 1}, "(24, 19456, 2560, 64, 8, 104)": {"BLOCK_SIZE_M": 16, "BLOCK_SIZE_N": 512, "BLOCK_SIZE_K": 32, "GROUP_SIZE_M": 8, "SPLIT_K": 4, "A_load_order": 2, "NUM_STAGES": 1, "num_warps": 4, "num_ctas": 1, "num_stages": 1}, "(32, 19456, 2560, 64, 8, 104)": {"BLOCK_SIZE_M": 16, "BLOCK_SIZE_N": 128, "BLOCK_SIZE_K": 64, "GROUP_SIZE_M": 8, "SPLIT_K": 4, "A_load_order": 0, "NUM_STAGES": 1, "num_warps": 4, "num_ctas": 1, "num_stages": 1}, "(48, 19456, 2560, 64, 8, 104)": {"BLOCK_SIZE_M": 32, "BLOCK_SIZE_N": 128, "BLOCK_SIZE_K": 64, "GROUP_SIZE_M": 8, "SPLIT_K": 4, "A_load_order": 0, "NUM_STAGES": 1, "num_warps": 4, "num_ctas": 1, "num_stages": 1}, "(64, 19456, 2560, 64, 8, 104)": {"BLOCK_SIZE_M": 32, "BLOCK_SIZE_N": 128, "BLOCK_SIZE_K": 64, "GROUP_SIZE_M": 8, "SPLIT_K": 4, "A_load_order": 0, "NUM_STAGES": 1, "num_warps": 4, "num_ctas": 1, "num_stages": 1}, "(2, 2560, 9728, 64, 8, 104)": {"BLOCK_SIZE_M": 16, "BLOCK_SIZE_N": 128, "BLOCK_SIZE_K": 32, "GROUP_SIZE_M": 8, "SPLIT_K": 4, "A_load_order": 0, "NUM_STAGES": 3, "num_warps": 8, "num_ctas": 1, "num_stages": 3}, "(4, 2560, 9728, 64, 8, 104)": {"BLOCK_SIZE_M": 16, "BLOCK_SIZE_N": 128, "BLOCK_SIZE_K": 32, "GROUP_SIZE_M": 8, "SPLIT_K": 4, "A_load_order": 0, "NUM_STAGES": 3, "num_warps": 8, "num_ctas": 1, "num_stages": 3}, "(8, 2560, 9728, 64, 8, 104)": {"BLOCK_SIZE_M": 16, "BLOCK_SIZE_N": 128, "BLOCK_SIZE_K": 32, "GROUP_SIZE_M": 8, "SPLIT_K": 4, "A_load_order": 0, "NUM_STAGES": 3, "num_warps": 8, "num_ctas": 1, "num_stages": 3}, "(16, 2560, 9728, 64, 8, 104)": {"BLOCK_SIZE_M": 16, "BLOCK_SIZE_N": 128, "BLOCK_SIZE_K": 32, "GROUP_SIZE_M": 8, "SPLIT_K": 4, "A_load_order": 0, "NUM_STAGES": 3, "num_warps": 8, "num_ctas": 1, "num_stages": 3}, "(24, 2560, 9728, 64, 8, 104)": {"BLOCK_SIZE_M": 16, "BLOCK_SIZE_N": 128, "BLOCK_SIZE_K": 64, "GROUP_SIZE_M": 8, "SPLIT_K": 4, "A_load_order": 0, "NUM_STAGES": 1, "num_warps": 4, "num_ctas": 1, "num_stages": 1}, "(32, 2560, 9728, 64, 8, 104)": {"BLOCK_SIZE_M": 16, "BLOCK_SIZE_N": 128, "BLOCK_SIZE_K": 64, "GROUP_SIZE_M": 8, "SPLIT_K": 4, "A_load_order": 0, "NUM_STAGES": 1, "num_warps": 4, "num_ctas": 1, "num_stages": 1}, "(48, 2560, 9728, 64, 8, 104)": {"BLOCK_SIZE_M": 32, "BLOCK_SIZE_N": 128, "BLOCK_SIZE_K": 64, "GROUP_SIZE_M": 8, "SPLIT_K": 4, "A_load_order": 0, "NUM_STAGES": 1, "num_warps": 4, "num_ctas": 1, "num_stages": 1}, "(64, 2560, 9728, 64, 8, 104)": {"BLOCK_SIZE_M": 32, "BLOCK_SIZE_N": 128, "BLOCK_SIZE_K": 64, "GROUP_SIZE_M": 8, "SPLIT_K": 4, "A_load_order": 0, "NUM_STAGES": 1, "num_warps": 4, "num_ctas": 1, "num_stages": 1}, "(2, 3456, 1152, 1152, 1, 108)": {"BLOCK_SIZE_M": 16, "BLOCK_SIZE_N": 64, "BLOCK_SIZE_K": 256, "GROUP_SIZE_M": 8, "SPLIT_K": 1, "A_load_order": 2, "NUM_STAGES": 4, "num_warps": 4, "num_ctas": 1, "num_stages": 4}, "(4, 3456, 1152, 1152, 1, 108)": {"BLOCK_SIZE_M": 16, "BLOCK_SIZE_N": 128, "BLOCK_SIZE_K": 128, "GROUP_SIZE_M": 8, "SPLIT_K": 1, "A_load_order": 0, "NUM_STAGES": 4, "num_warps": 4, "num_ctas": 1, "num_stages": 4}, "(8, 3456, 1152, 1152, 1, 108)": {"BLOCK_SIZE_M": 16, "BLOCK_SIZE_N": 128, "BLOCK_SIZE_K": 128, "GROUP_SIZE_M": 8, "SPLIT_K": 1, "A_load_order": 0, "NUM_STAGES": 4, "num_warps": 4, "num_ctas": 1, "num_stages": 4}, "(16, 3456, 1152, 1152, 1, 108)": {"BLOCK_SIZE_M": 16, "BLOCK_SIZE_N": 32, "BLOCK_SIZE_K": 128, "GROUP_SIZE_M": 8, "SPLIT_K": 1, "A_load_order": 2, "NUM_STAGES": 4, "num_warps": 4, "num_ctas": 1, "num_stages": 4}, "(24, 3456, 1152, 1152, 1, 108)": {"BLOCK_SIZE_M": 16, "BLOCK_SIZE_N": 64, "BLOCK_SIZE_K": 128, "GROUP_SIZE_M": 8, "SPLIT_K": 1, "A_load_order": 0, "NUM_STAGES": 4, "num_warps": 4, "num_ctas": 1, "num_stages": 4}, "(32, 3456, 1152, 1152, 1, 108)": {"BLOCK_SIZE_M": 16, "BLOCK_SIZE_N": 32, "BLOCK_SIZE_K": 128, "GROUP_SIZE_M": 8, "SPLIT_K": 1, "A_load_order": 2, "NUM_STAGES": 4, "num_warps": 4, "num_ctas": 1, "num_stages": 4}, "(48, 3456, 1152, 1152, 1, 108)": {"BLOCK_SIZE_M": 32, "BLOCK_SIZE_N": 64, "BLOCK_SIZE_K": 128, "GROUP_SIZE_M": 8, "SPLIT_K": 1, "A_load_order": 0, "NUM_STAGES": 4, "num_warps": 4, "num_ctas": 1, "num_stages": 4}, "(64, 3456, 1152, 1152, 1, 108)": {"BLOCK_SIZE_M": 32, "BLOCK_SIZE_N": 64, "BLOCK_SIZE_K": 128, "GROUP_SIZE_M": 8, "SPLIT_K": 1, "A_load_order": 0, "NUM_STAGES": 4, "num_warps": 4, "num_ctas": 1, "num_stages": 4}, "(2, 1152, 1152, 1152, 1, 108)": {"BLOCK_SIZE_M": 16, "BLOCK_SIZE_N": 32, "BLOCK_SIZE_K": 128, "GROUP_SIZE_M": 8, "SPLIT_K": 1, "A_load_order": 2, "NUM_STAGES": 4, "num_warps": 4, "num_ctas": 1, "num_stages": 4}, "(4, 1152, 1152, 1152, 1, 108)": {"BLOCK_SIZE_M": 16, "BLOCK_SIZE_N": 32, "BLOCK_SIZE_K": 256, "GROUP_SIZE_M": 8, "SPLIT_K": 1, "A_load_order": 0, "NUM_STAGES": 5, "num_warps": 4, "num_ctas": 1, "num_stages": 5}, "(8, 1152, 1152, 1152, 1, 108)": {"BLOCK_SIZE_M": 16, "BLOCK_SIZE_N": 32, "BLOCK_SIZE_K": 128, "GROUP_SIZE_M": 8, "SPLIT_K": 1, "A_load_order": 2, "NUM_STAGES": 4, "num_warps": 4, "num_ctas": 1, "num_stages": 4}, "(16, 1152, 1152, 1152, 1, 108)": {"BLOCK_SIZE_M": 16, "BLOCK_SIZE_N": 32, "BLOCK_SIZE_K": 128, "GROUP_SIZE_M": 8, "SPLIT_K": 1, "A_load_order": 2, "NUM_STAGES": 4, "num_warps": 4, "num_ctas": 1, "num_stages": 4}, "(24, 1152, 1152, 1152, 1, 108)": {"BLOCK_SIZE_M": 16, "BLOCK_SIZE_N": 32, "BLOCK_SIZE_K": 128, "GROUP_SIZE_M": 8, "SPLIT_K": 1, "A_load_order": 2, "NUM_STAGES": 4, "num_warps": 4, "num_ctas": 1, "num_stages": 4}, "(32, 1152, 1152, 1152, 1, 108)": {"BLOCK_SIZE_M": 16, "BLOCK_SIZE_N": 32, "BLOCK_SIZE_K": 128, "GROUP_SIZE_M": 8, "SPLIT_K": 1, "A_load_order": 2, "NUM_STAGES": 4, "num_warps": 4, "num_ctas": 1, "num_stages": 4}, "(48, 1152, 1152, 1152, 1, 108)": {"BLOCK_SIZE_M": 32, "BLOCK_SIZE_N": 32, "BLOCK_SIZE_K": 128, "GROUP_SIZE_M": 8, "SPLIT_K": 1, "A_load_order": 2, "NUM_STAGES": 4, "num_warps": 4, "num_ctas": 1, "num_stages": 4}, "(64, 1152, 1152, 1152, 1, 108)": {"BLOCK_SIZE_M": 32, "BLOCK_SIZE_N": 32, "BLOCK_SIZE_K": 128, "GROUP_SIZE_M": 8, "SPLIT_K": 1, "A_load_order": 2, "NUM_STAGES": 4, "num_warps": 4, "num_ctas": 1, "num_stages": 4}, "(2, 3456, 1152, 1152, 1, 308)": {"BLOCK_SIZE_M": 16, "BLOCK_SIZE_N": 64, "BLOCK_SIZE_K": 256, "GROUP_SIZE_M": 8, "SPLIT_K": 1, "A_load_order": 2, "NUM_STAGES": 4, "num_warps": 4, "num_ctas": 1, "num_stages": 4}, "(4, 3456, 1152, 1152, 1, 308)": {"BLOCK_SIZE_M": 16, "BLOCK_SIZE_N": 128, "BLOCK_SIZE_K": 128, "GROUP_SIZE_M": 8, "SPLIT_K": 1, "A_load_order": 0, "NUM_STAGES": 5, "num_warps": 4, "num_ctas": 1, "num_stages": 5}, "(8, 3456, 1152, 1152, 1, 308)": {"BLOCK_SIZE_M": 16, "BLOCK_SIZE_N": 32, "BLOCK_SIZE_K": 256, "GROUP_SIZE_M": 8, "SPLIT_K": 1, "A_load_order": 0, "NUM_STAGES": 5, "num_warps": 4, "num_ctas": 1, "num_stages": 5}, "(16, 3456, 1152, 1152, 1, 308)": {"BLOCK_SIZE_M": 16, "BLOCK_SIZE_N": 128, "BLOCK_SIZE_K": 128, "GROUP_SIZE_M": 8, "SPLIT_K": 1, "A_load_order": 0, "NUM_STAGES": 5, "num_warps": 4, "num_ctas": 1, "num_stages": 5}, "(24, 3456, 1152, 1152, 1, 308)": {"BLOCK_SIZE_M": 16, "BLOCK_SIZE_N": 32, "BLOCK_SIZE_K": 128, "GROUP_SIZE_M": 8, "SPLIT_K": 1, "A_load_order": 2, "NUM_STAGES": 4, "num_warps": 4, "num_ctas": 1, "num_stages": 4}, "(32, 3456, 1152, 1152, 1, 308)": {"BLOCK_SIZE_M": 16, "BLOCK_SIZE_N": 32, "BLOCK_SIZE_K": 128, "GROUP_SIZE_M": 8, "SPLIT_K": 1, "A_load_order": 2, "NUM_STAGES": 4, "num_warps": 4, "num_ctas": 1, "num_stages": 4}, "(48, 3456, 1152, 1152, 1, 308)": {"BLOCK_SIZE_M": 32, "BLOCK_SIZE_N": 32, "BLOCK_SIZE_K": 128, "GROUP_SIZE_M": 8, "SPLIT_K": 1, "A_load_order": 2, "NUM_STAGES": 4, "num_warps": 4, "num_ctas": 1, "num_stages": 4}, "(64, 3456, 1152, 1152, 1, 308)": {"BLOCK_SIZE_M": 32, "BLOCK_SIZE_N": 32, "BLOCK_SIZE_K": 128, "GROUP_SIZE_M": 8, "SPLIT_K": 1, "A_load_order": 2, "NUM_STAGES": 4, "num_warps": 4, "num_ctas": 1, "num_stages": 4}, "(2, 1152, 1152, 1152, 1, 308)": {"BLOCK_SIZE_M": 16, "BLOCK_SIZE_N": 32, "BLOCK_SIZE_K": 128, "GROUP_SIZE_M": 8, "SPLIT_K": 1, "A_load_order": 2, "NUM_STAGES": 4, "num_warps": 4, "num_ctas": 1, "num_stages": 4}, "(4, 1152, 1152, 1152, 1, 308)": {"BLOCK_SIZE_M": 16, "BLOCK_SIZE_N": 32, "BLOCK_SIZE_K": 256, "GROUP_SIZE_M": 8, "SPLIT_K": 1, "A_load_order": 0, "NUM_STAGES": 5, "num_warps": 4, "num_ctas": 1, "num_stages": 5}, "(8, 1152, 1152, 1152, 1, 308)": {"BLOCK_SIZE_M": 16, "BLOCK_SIZE_N": 32, "BLOCK_SIZE_K": 256, "GROUP_SIZE_M": 8, "SPLIT_K": 1, "A_load_order": 0, "NUM_STAGES": 5, "num_warps": 4, "num_ctas": 1, "num_stages": 5}, "(16, 1152, 1152, 1152, 1, 308)": {"BLOCK_SIZE_M": 16, "BLOCK_SIZE_N": 32, "BLOCK_SIZE_K": 512, "GROUP_SIZE_M": 8, "SPLIT_K": 1, "A_load_order": 0, "NUM_STAGES": 4, "num_warps": 4, "num_ctas": 1, "num_stages": 4}, "(24, 1152, 1152, 1152, 1, 308)": {"BLOCK_SIZE_M": 16, "BLOCK_SIZE_N": 128, "BLOCK_SIZE_K": 128, "GROUP_SIZE_M": 8, "SPLIT_K": 1, "A_load_order": 0, "NUM_STAGES": 4, "num_warps": 4, "num_ctas": 1, "num_stages": 4}, "(32, 1152, 1152, 1152, 1, 308)": {"BLOCK_SIZE_M": 16, "BLOCK_SIZE_N": 64, "BLOCK_SIZE_K": 256, "GROUP_SIZE_M": 8, "SPLIT_K": 1, "A_load_order": 2, "NUM_STAGES": 4, "num_warps": 4, "num_ctas": 1, "num_stages": 4}, "(48, 1152, 1152, 1152, 1, 308)": {"BLOCK_SIZE_M": 32, "BLOCK_SIZE_N": 32, "BLOCK_SIZE_K": 128, "GROUP_SIZE_M": 8, "SPLIT_K": 1, "A_load_order": 2, "NUM_STAGES": 4, "num_warps": 4, "num_ctas": 1, "num_stages": 4}, "(64, 1152, 1152, 1152, 1, 308)": {"BLOCK_SIZE_M": 32, "BLOCK_SIZE_N": 32, "BLOCK_SIZE_K": 128, "GROUP_SIZE_M": 8, "SPLIT_K": 1, "A_load_order": 2, "NUM_STAGES": 4, "num_warps": 4, "num_ctas": 1, "num_stages": 4}, "(1, 3456, 1152, 1152, 1, 308)": {"BLOCK_SIZE_M": 16, "BLOCK_SIZE_N": 64, "BLOCK_SIZE_K": 128, "GROUP_SIZE_M": 8, "SPLIT_K": 1, "A_load_order": 0, "NUM_STAGES": 4, "num_warps": 4, "num_ctas": 1, "num_stages": 4}, "(1, 1152, 1152, 1152, 1, 308)": {"BLOCK_SIZE_M": 16, "BLOCK_SIZE_N": 32, "BLOCK_SIZE_K": 512, "GROUP_SIZE_M": 8, "SPLIT_K": 1, "A_load_order": 0, "NUM_STAGES": 4, "num_warps": 4, "num_ctas": 1, "num_stages": 4}, "(1, 1152, 4304, 4304, 1, 308)": {"BLOCK_SIZE_M": 16, "BLOCK_SIZE_N": 32, "BLOCK_SIZE_K": 512, "GROUP_SIZE_M": 8, "SPLIT_K": 1, "A_load_order": 0, "NUM_STAGES": 4, "num_warps": 4, "num_ctas": 1, "num_stages": 4}, "(2, 1152, 4304, 4304, 1, 308)": {"BLOCK_SIZE_M": 16, "BLOCK_SIZE_N": 32, "BLOCK_SIZE_K": 256, "GROUP_SIZE_M": 8, "SPLIT_K": 1, "A_load_order": 0, "NUM_STAGES": 5, "num_warps": 4, "num_ctas": 1, "num_stages": 5}, "(4, 1152, 4304, 4304, 1, 308)": {"BLOCK_SIZE_M": 16, "BLOCK_SIZE_N": 64, "BLOCK_SIZE_K": 256, "GROUP_SIZE_M": 8, "SPLIT_K": 1, "A_load_order": 2, "NUM_STAGES": 4, "num_warps": 4, "num_ctas": 1, "num_stages": 4}, "(8, 1152, 4304, 4304, 1, 308)": {"BLOCK_SIZE_M": 16, "BLOCK_SIZE_N": 64, "BLOCK_SIZE_K": 256, "GROUP_SIZE_M": 8, "SPLIT_K": 1, "A_load_order": 2, "NUM_STAGES": 4, "num_warps": 4, "num_ctas": 1, "num_stages": 4}, "(16, 1152, 4304, 4304, 1, 308)": {"BLOCK_SIZE_M": 16, "BLOCK_SIZE_N": 64, "BLOCK_SIZE_K": 256, "GROUP_SIZE_M": 8, "SPLIT_K": 1, "A_load_order": 2, "NUM_STAGES": 4, "num_warps": 4, "num_ctas": 1, "num_stages": 4}, "(24, 1152, 4304, 4304, 1, 308)": {"BLOCK_SIZE_M": 16, "BLOCK_SIZE_N": 64, "BLOCK_SIZE_K": 256, "GROUP_SIZE_M": 8, "SPLIT_K": 1, "A_load_order": 2, "NUM_STAGES": 4, "num_warps": 4, "num_ctas": 1, "num_stages": 4}, "(32, 1152, 4304, 4304, 1, 308)": {"BLOCK_SIZE_M": 16, "BLOCK_SIZE_N": 64, "BLOCK_SIZE_K": 256, "GROUP_SIZE_M": 8, "SPLIT_K": 1, "A_load_order": 2, "NUM_STAGES": 4, "num_warps": 4, "num_ctas": 1, "num_stages": 4}, "(48, 1152, 4304, 4304, 1, 308)": {"BLOCK_SIZE_M": 32, "BLOCK_SIZE_N": 64, "BLOCK_SIZE_K": 256, "GROUP_SIZE_M": 8, "SPLIT_K": 1, "A_load_order": 2, "NUM_STAGES": 4, "num_warps": 4, "num_ctas": 1, "num_stages": 4}, "(64, 1152, 4304, 4304, 1, 308)": {"BLOCK_SIZE_M": 32, "BLOCK_SIZE_N": 64, "BLOCK_SIZE_K": 128, "GROUP_SIZE_M": 8, "SPLIT_K": 1, "A_load_order": 0, "NUM_STAGES": 4, "num_warps": 4, "num_ctas": 1, "num_stages": 4}, "(1, 4096, 4608, 4608, 1, 308)": {"BLOCK_SIZE_M": 16, "BLOCK_SIZE_N": 32, "BLOCK_SIZE_K": 256, "GROUP_SIZE_M": 8, "SPLIT_K": 1, "A_load_order": 0, "NUM_STAGES": 5, "num_warps": 4, "num_ctas": 1, "num_stages": 5}, "(2, 4096, 4608, 4608, 1, 308)": {"BLOCK_SIZE_M": 16, "BLOCK_SIZE_N": 32, "BLOCK_SIZE_K": 512, "GROUP_SIZE_M": 8, "SPLIT_K": 1, "A_load_order": 0, "NUM_STAGES": 4, "num_warps": 4, "num_ctas": 1, "num_stages": 4}, "(4, 4096, 4608, 4608, 1, 308)": {"BLOCK_SIZE_M": 16, "BLOCK_SIZE_N": 32, "BLOCK_SIZE_K": 512, "GROUP_SIZE_M": 8, "SPLIT_K": 1, "A_load_order": 0, "NUM_STAGES": 4, "num_warps": 4, "num_ctas": 1, "num_stages": 4}, "(8, 4096, 4608, 4608, 1, 308)": {"BLOCK_SIZE_M": 16, "BLOCK_SIZE_N": 32, "BLOCK_SIZE_K": 512, "GROUP_SIZE_M": 8, "SPLIT_K": 1, "A_load_order": 0, "NUM_STAGES": 4, "num_warps": 4, "num_ctas": 1, "num_stages": 4}, "(16, 4096, 4608, 4608, 1, 308)": {"BLOCK_SIZE_M": 16, "BLOCK_SIZE_N": 32, "BLOCK_SIZE_K": 512, "GROUP_SIZE_M": 8, "SPLIT_K": 1, "A_load_order": 0, "NUM_STAGES": 4, "num_warps": 4, "num_ctas": 1, "num_stages": 4}, "(24, 4096, 4608, 4608, 1, 308)": {"BLOCK_SIZE_M": 16, "BLOCK_SIZE_N": 128, "BLOCK_SIZE_K": 256, "GROUP_SIZE_M": 8, "SPLIT_K": 1, "A_load_order": 0, "NUM_STAGES": 2, "num_warps": 4, "num_ctas": 1, "num_stages": 2}, "(32, 4096, 4608, 4608, 1, 308)": {"BLOCK_SIZE_M": 16, "BLOCK_SIZE_N": 128, "BLOCK_SIZE_K": 256, "GROUP_SIZE_M": 8, "SPLIT_K": 1, "A_load_order": 0, "NUM_STAGES": 2, "num_warps": 4, "num_ctas": 1, "num_stages": 2}, "(48, 4096, 4608, 4608, 1, 308)": {"BLOCK_SIZE_M": 32, "BLOCK_SIZE_N": 128, "BLOCK_SIZE_K": 256, "GROUP_SIZE_M": 8, "SPLIT_K": 1, "A_load_order": 0, "NUM_STAGES": 2, "num_warps": 4, "num_ctas": 1, "num_stages": 2}, "(64, 4096, 4608, 4608, 1, 308)": {"BLOCK_SIZE_M": 32, "BLOCK_SIZE_N": 128, "BLOCK_SIZE_K": 256, "GROUP_SIZE_M": 8, "SPLIT_K": 1, "A_load_order": 0, "NUM_STAGES": 2, "num_warps": 4, "num_ctas": 1, "num_stages": 2}, "(1, 6144, 4096, 4096, 1, 308)": {"BLOCK_SIZE_M": 16, "BLOCK_SIZE_N": 32, "BLOCK_SIZE_K": 512, "GROUP_SIZE_M": 8, "SPLIT_K": 1, "A_load_order": 0, "NUM_STAGES": 4, "num_warps": 4, "num_ctas": 1, "num_stages": 4}, "(2, 6144, 4096, 4096, 1, 308)": {"BLOCK_SIZE_M": 16, "BLOCK_SIZE_N": 32, "BLOCK_SIZE_K": 512, "GROUP_SIZE_M": 8, "SPLIT_K": 1, "A_load_order": 0, "NUM_STAGES": 4, "num_warps": 4, "num_ctas": 1, "num_stages": 4}, "(4, 6144, 4096, 4096, 1, 308)": {"BLOCK_SIZE_M": 16, "BLOCK_SIZE_N": 32, "BLOCK_SIZE_K": 512, "GROUP_SIZE_M": 8, "SPLIT_K": 1, "A_load_order": 0, "NUM_STAGES": 4, "num_warps": 4, "num_ctas": 1, "num_stages": 4}, "(8, 6144, 4096, 4096, 1, 308)": {"BLOCK_SIZE_M": 16, "BLOCK_SIZE_N": 32, "BLOCK_SIZE_K": 512, "GROUP_SIZE_M": 8, "SPLIT_K": 1, "A_load_order": 0, "NUM_STAGES": 4, "num_warps": 4, "num_ctas": 1, "num_stages": 4}, "(16, 6144, 4096, 4096, 1, 308)": {"BLOCK_SIZE_M": 16, "BLOCK_SIZE_N": 32, "BLOCK_SIZE_K": 512, "GROUP_SIZE_M": 8, "SPLIT_K": 1, "A_load_order": 0, "NUM_STAGES": 4, "num_warps": 4, "num_ctas": 1, "num_stages": 4}, "(24, 6144, 4096, 4096, 1, 308)": {"BLOCK_SIZE_M": 16, "BLOCK_SIZE_N": 64, "BLOCK_SIZE_K": 512, "GROUP_SIZE_M": 8, "SPLIT_K": 1, "A_load_order": 0, "NUM_STAGES": 2, "num_warps": 4, "num_ctas": 1, "num_stages": 2}, "(32, 6144, 4096, 4096, 1, 308)": {"BLOCK_SIZE_M": 16, "BLOCK_SIZE_N": 64, "BLOCK_SIZE_K": 512, "GROUP_SIZE_M": 8, "SPLIT_K": 1, "A_load_order": 0, "NUM_STAGES": 2, "num_warps": 4, "num_ctas": 1, "num_stages": 2}, "(48, 6144, 4096, 4096, 1, 308)": {"BLOCK_SIZE_M": 32, "BLOCK_SIZE_N": 64, "BLOCK_SIZE_K": 512, "GROUP_SIZE_M": 8, "SPLIT_K": 1, "A_load_order": 0, "NUM_STAGES": 2, "num_warps": 4, "num_ctas": 1, "num_stages": 2}, "(64, 6144, 4096, 4096, 1, 308)": {"BLOCK_SIZE_M": 32, "BLOCK_SIZE_N": 64, "BLOCK_SIZE_K": 512, "GROUP_SIZE_M": 8, "SPLIT_K": 1, "A_load_order": 0, "NUM_STAGES": 2, "num_warps": 4, "num_ctas": 1, "num_stages": 2}, "(1, 4096, 4096, 4096, 1, 308)": {"BLOCK_SIZE_M": 16, "BLOCK_SIZE_N": 64, "BLOCK_SIZE_K": 512, "GROUP_SIZE_M": 8, "SPLIT_K": 1, "A_load_order": 0, "NUM_STAGES": 2, "num_warps": 4, "num_ctas": 1, "num_stages": 2}, "(2, 4096, 4096, 4096, 1, 308)": {"BLOCK_SIZE_M": 16, "BLOCK_SIZE_N": 32, "BLOCK_SIZE_K": 512, "GROUP_SIZE_M": 8, "SPLIT_K": 1, "A_load_order": 0, "NUM_STAGES": 4, "num_warps": 4, "num_ctas": 1, "num_stages": 4}, "(4, 4096, 4096, 4096, 1, 308)": {"BLOCK_SIZE_M": 16, "BLOCK_SIZE_N": 64, "BLOCK_SIZE_K": 512, "GROUP_SIZE_M": 8, "SPLIT_K": 1, "A_load_order": 0, "NUM_STAGES": 2, "num_warps": 4, "num_ctas": 1, "num_stages": 2}, "(8, 4096, 4096, 4096, 1, 308)": {"BLOCK_SIZE_M": 16, "BLOCK_SIZE_N": 64, "BLOCK_SIZE_K": 512, "GROUP_SIZE_M": 8, "SPLIT_K": 1, "A_load_order": 0, "NUM_STAGES": 2, "num_warps": 4, "num_ctas": 1, "num_stages": 2}, "(16, 4096, 4096, 4096, 1, 308)": {"BLOCK_SIZE_M": 16, "BLOCK_SIZE_N": 64, "BLOCK_SIZE_K": 512, "GROUP_SIZE_M": 8, "SPLIT_K": 1, "A_load_order": 0, "NUM_STAGES": 2, "num_warps": 4, "num_ctas": 1, "num_stages": 2}, "(24, 4096, 4096, 4096, 1, 308)": {"BLOCK_SIZE_M": 16, "BLOCK_SIZE_N": 128, "BLOCK_SIZE_K": 256, "GROUP_SIZE_M": 8, "SPLIT_K": 1, "A_load_order": 0, "NUM_STAGES": 2, "num_warps": 4, "num_ctas": 1, "num_stages": 2}, "(32, 4096, 4096, 4096, 1, 308)": {"BLOCK_SIZE_M": 16, "BLOCK_SIZE_N": 128, "BLOCK_SIZE_K": 256, "GROUP_SIZE_M": 8, "SPLIT_K": 1, "A_load_order": 0, "NUM_STAGES": 2, "num_warps": 4, "num_ctas": 1, "num_stages": 2}, "(48, 4096, 4096, 4096, 1, 308)": {"BLOCK_SIZE_M": 32, "BLOCK_SIZE_N": 128, "BLOCK_SIZE_K": 256, "GROUP_SIZE_M": 8, "SPLIT_K": 1, "A_load_order": 0, "NUM_STAGES": 2, "num_warps": 4, "num_ctas": 1, "num_stages": 2}, "(64, 4096, 4096, 4096, 1, 308)": {"BLOCK_SIZE_M": 32, "BLOCK_SIZE_N": 128, "BLOCK_SIZE_K": 256, "GROUP_SIZE_M": 8, "SPLIT_K": 1, "A_load_order": 0, "NUM_STAGES": 2, "num_warps": 4, "num_ctas": 1, "num_stages": 2}, "(1, 24576, 4096, 4096, 1, 308)": {"BLOCK_SIZE_M": 16, "BLOCK_SIZE_N": 256, "BLOCK_SIZE_K": 256, "GROUP_SIZE_M": 8, "SPLIT_K": 1, "A_load_order": 0, "NUM_STAGES": 1, "num_warps": 8, "num_ctas": 1, "num_stages": 1}, "(2, 24576, 4096, 4096, 1, 308)": {"BLOCK_SIZE_M": 16, "BLOCK_SIZE_N": 256, "BLOCK_SIZE_K": 256, "GROUP_SIZE_M": 8, "SPLIT_K": 1, "A_load_order": 0, "NUM_STAGES": 1, "num_warps": 8, "num_ctas": 1, "num_stages": 1}, "(4, 24576, 4096, 4096, 1, 308)": {"BLOCK_SIZE_M": 16, "BLOCK_SIZE_N": 256, "BLOCK_SIZE_K": 256, "GROUP_SIZE_M": 8, "SPLIT_K": 1, "A_load_order": 0, "NUM_STAGES": 1, "num_warps": 8, "num_ctas": 1, "num_stages": 1}, "(8, 24576, 4096, 4096, 1, 308)": {"BLOCK_SIZE_M": 16, "BLOCK_SIZE_N": 256, "BLOCK_SIZE_K": 256, "GROUP_SIZE_M": 8, "SPLIT_K": 1, "A_load_order": 0, "NUM_STAGES": 1, "num_warps": 8, "num_ctas": 1, "num_stages": 1}, "(16, 24576, 4096, 4096, 1, 308)": {"BLOCK_SIZE_M": 16, "BLOCK_SIZE_N": 256, "BLOCK_SIZE_K": 256, "GROUP_SIZE_M": 8, "SPLIT_K": 1, "A_load_order": 0, "NUM_STAGES": 1, "num_warps": 8, "num_ctas": 1, "num_stages": 1}, "(24, 24576, 4096, 4096, 1, 308)": {"BLOCK_SIZE_M": 16, "BLOCK_SIZE_N": 256, "BLOCK_SIZE_K": 256, "GROUP_SIZE_M": 8, "SPLIT_K": 1, "A_load_order": 0, "NUM_STAGES": 1, "num_warps": 8, "num_ctas": 1, "num_stages": 1}, "(32, 24576, 4096, 4096, 1, 308)": {"BLOCK_SIZE_M": 16, "BLOCK_SIZE_N": 256, "BLOCK_SIZE_K": 256, "GROUP_SIZE_M": 8, "SPLIT_K": 1, "A_load_order": 0, "NUM_STAGES": 1, "num_warps": 8, "num_ctas": 1, "num_stages": 1}, "(48, 24576, 4096, 4096, 1, 308)": {"BLOCK_SIZE_M": 32, "BLOCK_SIZE_N": 256, "BLOCK_SIZE_K": 256, "GROUP_SIZE_M": 8, "SPLIT_K": 1, "A_load_order": 0, "NUM_STAGES": 1, "num_warps": 8, "num_ctas": 1, "num_stages": 1}, "(64, 24576, 4096, 4096, 1, 308)": {"BLOCK_SIZE_M": 32, "BLOCK_SIZE_N": 256, "BLOCK_SIZE_K": 256, "GROUP_SIZE_M": 8, "SPLIT_K": 1, "A_load_order": 0, "NUM_STAGES": 1, "num_warps": 8, "num_ctas": 1, "num_stages": 1}, "(1, 4096, 12288, 12288, 1, 308)": {"BLOCK_SIZE_M": 16, "BLOCK_SIZE_N": 256, "BLOCK_SIZE_K": 256, "GROUP_SIZE_M": 8, "SPLIT_K": 1, "A_load_order": 0, "NUM_STAGES": 1, "num_warps": 8, "num_ctas": 1, "num_stages": 1}, "(2, 4096, 12288, 12288, 1, 308)": {"BLOCK_SIZE_M": 16, "BLOCK_SIZE_N": 256, "BLOCK_SIZE_K": 256, "GROUP_SIZE_M": 8, "SPLIT_K": 1, "A_load_order": 0, "NUM_STAGES": 1, "num_warps": 8, "num_ctas": 1, "num_stages": 1}, "(4, 4096, 12288, 12288, 1, 308)": {"BLOCK_SIZE_M": 16, "BLOCK_SIZE_N": 256, "BLOCK_SIZE_K": 256, "GROUP_SIZE_M": 8, "SPLIT_K": 1, "A_load_order": 0, "NUM_STAGES": 1, "num_warps": 8, "num_ctas": 1, "num_stages": 1}, "(8, 4096, 12288, 12288, 1, 308)": {"BLOCK_SIZE_M": 16, "BLOCK_SIZE_N": 256, "BLOCK_SIZE_K": 256, "GROUP_SIZE_M": 8, "SPLIT_K": 1, "A_load_order": 0, "NUM_STAGES": 1, "num_warps": 8, "num_ctas": 1, "num_stages": 1}, "(16, 4096, 12288, 12288, 1, 308)": {"BLOCK_SIZE_M": 16, "BLOCK_SIZE_N": 256, "BLOCK_SIZE_K": 256, "GROUP_SIZE_M": 8, "SPLIT_K": 1, "A_load_order": 0, "NUM_STAGES": 1, "num_warps": 8, "num_ctas": 1, "num_stages": 1}, "(24, 4096, 12288, 12288, 1, 308)": {"BLOCK_SIZE_M": 16, "BLOCK_SIZE_N": 256, "BLOCK_SIZE_K": 256, "GROUP_SIZE_M": 8, "SPLIT_K": 1, "A_load_order": 0, "NUM_STAGES": 1, "num_warps": 8, "num_ctas": 1, "num_stages": 1}, "(32, 4096, 12288, 12288, 1, 308)": {"BLOCK_SIZE_M": 16, "BLOCK_SIZE_N": 256, "BLOCK_SIZE_K": 256, "GROUP_SIZE_M": 8, "SPLIT_K": 1, "A_load_order": 0, "NUM_STAGES": 1, "num_warps": 8, "num_ctas": 1, "num_stages": 1}, "(48, 4096, 12288, 12288, 1, 308)": {"BLOCK_SIZE_M": 32, "BLOCK_SIZE_N": 256, "BLOCK_SIZE_K": 256, "GROUP_SIZE_M": 8, "SPLIT_K": 1, "A_load_order": 0, "NUM_STAGES": 1, "num_warps": 8, "num_ctas": 1, "num_stages": 1}, "(64, 4096, 12288, 12288, 1, 308)": {"BLOCK_SIZE_M": 32, "BLOCK_SIZE_N": 256, "BLOCK_SIZE_K": 256, "GROUP_SIZE_M": 8, "SPLIT_K": 1, "A_load_order": 0, "NUM_STAGES": 1, "num_warps": 8, "num_ctas": 1, "num_stages": 1}, "(1, 3456, 1152, 1152, 1, 408)": {"BLOCK_SIZE_M": 16, "BLOCK_SIZE_N": 128, "BLOCK_SIZE_K": 128, "GROUP_SIZE_M": 8, "SPLIT_K": 1, "A_load_order": 0, "NUM_STAGES": 4, "num_warps": 4, "num_ctas": 1, "num_stages": 4}, "(2, 3456, 1152, 1152, 1, 408)": {"BLOCK_SIZE_M": 16, "BLOCK_SIZE_N": 32, "BLOCK_SIZE_K": 256, "GROUP_SIZE_M": 8, "SPLIT_K": 1, "A_load_order": 0, "NUM_STAGES": 5, "num_warps": 4, "num_ctas": 1, "num_stages": 5}, "(4, 3456, 1152, 1152, 1, 408)": {"BLOCK_SIZE_M": 16, "BLOCK_SIZE_N": 64, "BLOCK_SIZE_K": 256, "GROUP_SIZE_M": 8, "SPLIT_K": 1, "A_load_order": 2, "NUM_STAGES": 4, "num_warps": 4, "num_ctas": 1, "num_stages": 4}, "(8, 3456, 1152, 1152, 1, 408)": {"BLOCK_SIZE_M": 16, "BLOCK_SIZE_N": 128, "BLOCK_SIZE_K": 128, "GROUP_SIZE_M": 8, "SPLIT_K": 1, "A_load_order": 0, "NUM_STAGES": 5, "num_warps": 4, "num_ctas": 1, "num_stages": 5}, "(16, 3456, 1152, 1152, 1, 408)": {"BLOCK_SIZE_M": 16, "BLOCK_SIZE_N": 32, "BLOCK_SIZE_K": 128, "GROUP_SIZE_M": 8, "SPLIT_K": 1, "A_load_order": 2, "NUM_STAGES": 4, "num_warps": 4, "num_ctas": 1, "num_stages": 4}, "(24, 3456, 1152, 1152, 1, 408)": {"BLOCK_SIZE_M": 16, "BLOCK_SIZE_N": 64, "BLOCK_SIZE_K": 128, "GROUP_SIZE_M": 8, "SPLIT_K": 1, "A_load_order": 0, "NUM_STAGES": 4, "num_warps": 4, "num_ctas": 1, "num_stages": 4}, "(32, 3456, 1152, 1152, 1, 408)": {"BLOCK_SIZE_M": 16, "BLOCK_SIZE_N": 32, "BLOCK_SIZE_K": 128, "GROUP_SIZE_M": 8, "SPLIT_K": 1, "A_load_order": 2, "NUM_STAGES": 4, "num_warps": 4, "num_ctas": 1, "num_stages": 4}, "(48, 3456, 1152, 1152, 1, 408)": {"BLOCK_SIZE_M": 32, "BLOCK_SIZE_N": 64, "BLOCK_SIZE_K": 128, "GROUP_SIZE_M": 8, "SPLIT_K": 1, "A_load_order": 0, "NUM_STAGES": 4, "num_warps": 4, "num_ctas": 1, "num_stages": 4}, "(64, 3456, 1152, 1152, 1, 408)": {"BLOCK_SIZE_M": 32, "BLOCK_SIZE_N": 64, "BLOCK_SIZE_K": 128, "GROUP_SIZE_M": 8, "SPLIT_K": 1, "A_load_order": 0, "NUM_STAGES": 4, "num_warps": 4, "num_ctas": 1, "num_stages": 4}, "(1, 1152, 1152, 1152, 1, 408)": {"BLOCK_SIZE_M": 16, "BLOCK_SIZE_N": 32, "BLOCK_SIZE_K": 128, "GROUP_SIZE_M": 8, "SPLIT_K": 1, "A_load_order": 2, "NUM_STAGES": 4, "num_warps": 4, "num_ctas": 1, "num_stages": 4}, "(2, 1152, 1152, 1152, 1, 408)": {"BLOCK_SIZE_M": 16, "BLOCK_SIZE_N": 32, "BLOCK_SIZE_K": 256, "GROUP_SIZE_M": 8, "SPLIT_K": 1, "A_load_order": 0, "NUM_STAGES": 5, "num_warps": 4, "num_ctas": 1, "num_stages": 5}, "(4, 1152, 1152, 1152, 1, 408)": {"BLOCK_SIZE_M": 16, "BLOCK_SIZE_N": 32, "BLOCK_SIZE_K": 256, "GROUP_SIZE_M": 8, "SPLIT_K": 1, "A_load_order": 0, "NUM_STAGES": 5, "num_warps": 4, "num_ctas": 1, "num_stages": 5}, "(8, 1152, 1152, 1152, 1, 408)": {"BLOCK_SIZE_M": 16, "BLOCK_SIZE_N": 32, "BLOCK_SIZE_K": 512, "GROUP_SIZE_M": 8, "SPLIT_K": 1, "A_load_order": 0, "NUM_STAGES": 4, "num_warps": 4, "num_ctas": 1, "num_stages": 4}, "(16, 1152, 1152, 1152, 1, 408)": {"BLOCK_SIZE_M": 16, "BLOCK_SIZE_N": 128, "BLOCK_SIZE_K": 128, "GROUP_SIZE_M": 8, "SPLIT_K": 1, "A_load_order": 0, "NUM_STAGES": 5, "num_warps": 4, "num_ctas": 1, "num_stages": 5}, "(24, 1152, 1152, 1152, 1, 408)": {"BLOCK_SIZE_M": 16, "BLOCK_SIZE_N": 64, "BLOCK_SIZE_K": 128, "GROUP_SIZE_M": 8, "SPLIT_K": 1, "A_load_order": 0, "NUM_STAGES": 4, "num_warps": 4, "num_ctas": 1, "num_stages": 4}, "(32, 1152, 1152, 1152, 1, 408)": {"BLOCK_SIZE_M": 16, "BLOCK_SIZE_N": 128, "BLOCK_SIZE_K": 128, "GROUP_SIZE_M": 8, "SPLIT_K": 1, "A_load_order": 0, "NUM_STAGES": 4, "num_warps": 4, "num_ctas": 1, "num_stages": 4}, "(48, 1152, 1152, 1152, 1, 408)": {"BLOCK_SIZE_M": 32, "BLOCK_SIZE_N": 32, "BLOCK_SIZE_K": 128, "GROUP_SIZE_M": 8, "SPLIT_K": 1, "A_load_order": 2, "NUM_STAGES": 4, "num_warps": 4, "num_ctas": 1, "num_stages": 4}, "(64, 1152, 1152, 1152, 1, 408)": {"BLOCK_SIZE_M": 32, "BLOCK_SIZE_N": 64, "BLOCK_SIZE_K": 128, "GROUP_SIZE_M": 8, "SPLIT_K": 1, "A_load_order": 0, "NUM_STAGES": 4, "num_warps": 4, "num_ctas": 1, "num_stages": 4}, "(1, 1152, 4304, 4304, 1, 408)": {"BLOCK_SIZE_M": 16, "BLOCK_SIZE_N": 64, "BLOCK_SIZE_K": 256, "GROUP_SIZE_M": 8, "SPLIT_K": 1, "A_load_order": 2, "NUM_STAGES": 4, "num_warps": 4, "num_ctas": 1, "num_stages": 4}, "(2, 1152, 4304, 4304, 1, 408)": {"BLOCK_SIZE_M": 16, "BLOCK_SIZE_N": 32, "BLOCK_SIZE_K": 256, "GROUP_SIZE_M": 8, "SPLIT_K": 1, "A_load_order": 0, "NUM_STAGES": 5, "num_warps": 4, "num_ctas": 1, "num_stages": 5}, "(4, 1152, 4304, 4304, 1, 408)": {"BLOCK_SIZE_M": 16, "BLOCK_SIZE_N": 64, "BLOCK_SIZE_K": 256, "GROUP_SIZE_M": 8, "SPLIT_K": 1, "A_load_order": 2, "NUM_STAGES": 4, "num_warps": 4, "num_ctas": 1, "num_stages": 4}, "(8, 1152, 4304, 4304, 1, 408)": {"BLOCK_SIZE_M": 16, "BLOCK_SIZE_N": 64, "BLOCK_SIZE_K": 256, "GROUP_SIZE_M": 8, "SPLIT_K": 1, "A_load_order": 2, "NUM_STAGES": 4, "num_warps": 4, "num_ctas": 1, "num_stages": 4}, "(16, 1152, 4304, 4304, 1, 408)": {"BLOCK_SIZE_M": 16, "BLOCK_SIZE_N": 64, "BLOCK_SIZE_K": 256, "GROUP_SIZE_M": 8, "SPLIT_K": 1, "A_load_order": 2, "NUM_STAGES": 4, "num_warps": 4, "num_ctas": 1, "num_stages": 4}, "(24, 1152, 4304, 4304, 1, 408)": {"BLOCK_SIZE_M": 16, "BLOCK_SIZE_N": 64, "BLOCK_SIZE_K": 256, "GROUP_SIZE_M": 8, "SPLIT_K": 1, "A_load_order": 2, "NUM_STAGES": 4, "num_warps": 4, "num_ctas": 1, "num_stages": 4}, "(32, 1152, 4304, 4304, 1, 408)": {"BLOCK_SIZE_M": 16, "BLOCK_SIZE_N": 64, "BLOCK_SIZE_K": 256, "GROUP_SIZE_M": 8, "SPLIT_K": 1, "A_load_order": 2, "NUM_STAGES": 4, "num_warps": 4, "num_ctas": 1, "num_stages": 4}, "(48, 1152, 4304, 4304, 1, 408)": {"BLOCK_SIZE_M": 32, "BLOCK_SIZE_N": 64, "BLOCK_SIZE_K": 256, "GROUP_SIZE_M": 8, "SPLIT_K": 1, "A_load_order": 2, "NUM_STAGES": 4, "num_warps": 4, "num_ctas": 1, "num_stages": 4}, "(64, 1152, 4304, 4304, 1, 408)": {"BLOCK_SIZE_M": 32, "BLOCK_SIZE_N": 64, "BLOCK_SIZE_K": 256, "GROUP_SIZE_M": 8, "SPLIT_K": 1, "A_load_order": 2, "NUM_STAGES": 4, "num_warps": 4, "num_ctas": 1, "num_stages": 4}, "(1, 4096, 4608, 4608, 1, 408)": {"BLOCK_SIZE_M": 16, "BLOCK_SIZE_N": 32, "BLOCK_SIZE_K": 256, "GROUP_SIZE_M": 8, "SPLIT_K": 1, "A_load_order": 0, "NUM_STAGES": 5, "num_warps": 4, "num_ctas": 1, "num_stages": 5}, "(2, 4096, 4608, 4608, 1, 408)": {"BLOCK_SIZE_M": 16, "BLOCK_SIZE_N": 64, "BLOCK_SIZE_K": 512, "GROUP_SIZE_M": 8, "SPLIT_K": 1, "A_load_order": 0, "NUM_STAGES": 2, "num_warps": 4, "num_ctas": 1, "num_stages": 2}, "(4, 4096, 4608, 4608, 1, 408)": {"BLOCK_SIZE_M": 16, "BLOCK_SIZE_N": 64, "BLOCK_SIZE_K": 512, "GROUP_SIZE_M": 8, "SPLIT_K": 1, "A_load_order": 0, "NUM_STAGES": 2, "num_warps": 4, "num_ctas": 1, "num_stages": 2}, "(8, 4096, 4608, 4608, 1, 408)": {"BLOCK_SIZE_M": 16, "BLOCK_SIZE_N": 32, "BLOCK_SIZE_K": 512, "GROUP_SIZE_M": 8, "SPLIT_K": 1, "A_load_order": 0, "NUM_STAGES": 4, "num_warps": 4, "num_ctas": 1, "num_stages": 4}, "(16, 4096, 4608, 4608, 1, 408)": {"BLOCK_SIZE_M": 16, "BLOCK_SIZE_N": 64, "BLOCK_SIZE_K": 512, "GROUP_SIZE_M": 8, "SPLIT_K": 1, "A_load_order": 0, "NUM_STAGES": 2, "num_warps": 4, "num_ctas": 1, "num_stages": 2}, "(24, 4096, 4608, 4608, 1, 408)": {"BLOCK_SIZE_M": 16, "BLOCK_SIZE_N": 128, "BLOCK_SIZE_K": 256, "GROUP_SIZE_M": 8, "SPLIT_K": 1, "A_load_order": 0, "NUM_STAGES": 2, "num_warps": 4, "num_ctas": 1, "num_stages": 2}, "(32, 4096, 4608, 4608, 1, 408)": {"BLOCK_SIZE_M": 16, "BLOCK_SIZE_N": 128, "BLOCK_SIZE_K": 256, "GROUP_SIZE_M": 8, "SPLIT_K": 1, "A_load_order": 0, "NUM_STAGES": 2, "num_warps": 4, "num_ctas": 1, "num_stages": 2}, "(48, 4096, 4608, 4608, 1, 408)": {"BLOCK_SIZE_M": 32, "BLOCK_SIZE_N": 128, "BLOCK_SIZE_K": 256, "GROUP_SIZE_M": 8, "SPLIT_K": 1, "A_load_order": 0, "NUM_STAGES": 2, "num_warps": 4, "num_ctas": 1, "num_stages": 2}, "(64, 4096, 4608, 4608, 1, 408)": {"BLOCK_SIZE_M": 32, "BLOCK_SIZE_N": 128, "BLOCK_SIZE_K": 256, "GROUP_SIZE_M": 8, "SPLIT_K": 1, "A_load_order": 0, "NUM_STAGES": 2, "num_warps": 4, "num_ctas": 1, "num_stages": 2}, "(1, 6144, 4096, 4096, 1, 408)": {"BLOCK_SIZE_M": 16, "BLOCK_SIZE_N": 32, "BLOCK_SIZE_K": 512, "GROUP_SIZE_M": 8, "SPLIT_K": 1, "A_load_order": 0, "NUM_STAGES": 4, "num_warps": 4, "num_ctas": 1, "num_stages": 4}, "(2, 6144, 4096, 4096, 1, 408)": {"BLOCK_SIZE_M": 16, "BLOCK_SIZE_N": 32, "BLOCK_SIZE_K": 512, "GROUP_SIZE_M": 8, "SPLIT_K": 1, "A_load_order": 0, "NUM_STAGES": 4, "num_warps": 4, "num_ctas": 1, "num_stages": 4}, "(4, 6144, 4096, 4096, 1, 408)": {"BLOCK_SIZE_M": 16, "BLOCK_SIZE_N": 32, "BLOCK_SIZE_K": 512, "GROUP_SIZE_M": 8, "SPLIT_K": 1, "A_load_order": 0, "NUM_STAGES": 4, "num_warps": 4, "num_ctas": 1, "num_stages": 4}, "(8, 6144, 4096, 4096, 1, 408)": {"BLOCK_SIZE_M": 16, "BLOCK_SIZE_N": 32, "BLOCK_SIZE_K": 512, "GROUP_SIZE_M": 8, "SPLIT_K": 1, "A_load_order": 0, "NUM_STAGES": 4, "num_warps": 4, "num_ctas": 1, "num_stages": 4}, "(16, 6144, 4096, 4096, 1, 408)": {"BLOCK_SIZE_M": 16, "BLOCK_SIZE_N": 32, "BLOCK_SIZE_K": 512, "GROUP_SIZE_M": 8, "SPLIT_K": 1, "A_load_order": 0, "NUM_STAGES": 4, "num_warps": 4, "num_ctas": 1, "num_stages": 4}, "(24, 6144, 4096, 4096, 1, 408)": {"BLOCK_SIZE_M": 16, "BLOCK_SIZE_N": 32, "BLOCK_SIZE_K": 256, "GROUP_SIZE_M": 8, "SPLIT_K": 1, "A_load_order": 0, "NUM_STAGES": 5, "num_warps": 4, "num_ctas": 1, "num_stages": 5}, "(32, 6144, 4096, 4096, 1, 408)": {"BLOCK_SIZE_M": 16, "BLOCK_SIZE_N": 32, "BLOCK_SIZE_K": 256, "GROUP_SIZE_M": 8, "SPLIT_K": 1, "A_load_order": 0, "NUM_STAGES": 5, "num_warps": 4, "num_ctas": 1, "num_stages": 5}, "(48, 6144, 4096, 4096, 1, 408)": {"BLOCK_SIZE_M": 32, "BLOCK_SIZE_N": 64, "BLOCK_SIZE_K": 512, "GROUP_SIZE_M": 8, "SPLIT_K": 1, "A_load_order": 0, "NUM_STAGES": 2, "num_warps": 4, "num_ctas": 1, "num_stages": 2}, "(64, 6144, 4096, 4096, 1, 408)": {"BLOCK_SIZE_M": 32, "BLOCK_SIZE_N": 64, "BLOCK_SIZE_K": 256, "GROUP_SIZE_M": 8, "SPLIT_K": 1, "A_load_order": 2, "NUM_STAGES": 4, "num_warps": 4, "num_ctas": 1, "num_stages": 4}, "(1, 4096, 4096, 4096, 1, 408)": {"BLOCK_SIZE_M": 16, "BLOCK_SIZE_N": 32, "BLOCK_SIZE_K": 512, "GROUP_SIZE_M": 8, "SPLIT_K": 1, "A_load_order": 0, "NUM_STAGES": 4, "num_warps": 4, "num_ctas": 1, "num_stages": 4}, "(2, 4096, 4096, 4096, 1, 408)": {"BLOCK_SIZE_M": 16, "BLOCK_SIZE_N": 64, "BLOCK_SIZE_K": 512, "GROUP_SIZE_M": 8, "SPLIT_K": 1, "A_load_order": 0, "NUM_STAGES": 2, "num_warps": 4, "num_ctas": 1, "num_stages": 2}, "(4, 4096, 4096, 4096, 1, 408)": {"BLOCK_SIZE_M": 16, "BLOCK_SIZE_N": 64, "BLOCK_SIZE_K": 512, "GROUP_SIZE_M": 8, "SPLIT_K": 1, "A_load_order": 0, "NUM_STAGES": 2, "num_warps": 4, "num_ctas": 1, "num_stages": 2}, "(8, 4096, 4096, 4096, 1, 408)": {"BLOCK_SIZE_M": 16, "BLOCK_SIZE_N": 64, "BLOCK_SIZE_K": 512, "GROUP_SIZE_M": 8, "SPLIT_K": 1, "A_load_order": 0, "NUM_STAGES": 2, "num_warps": 4, "num_ctas": 1, "num_stages": 2}, "(16, 4096, 4096, 4096, 1, 408)": {"BLOCK_SIZE_M": 16, "BLOCK_SIZE_N": 64, "BLOCK_SIZE_K": 512, "GROUP_SIZE_M": 8, "SPLIT_K": 1, "A_load_order": 0, "NUM_STAGES": 2, "num_warps": 4, "num_ctas": 1, "num_stages": 2}, "(24, 4096, 4096, 4096, 1, 408)": {"BLOCK_SIZE_M": 16, "BLOCK_SIZE_N": 32, "BLOCK_SIZE_K": 512, "GROUP_SIZE_M": 8, "SPLIT_K": 1, "A_load_order": 0, "NUM_STAGES": 4, "num_warps": 4, "num_ctas": 1, "num_stages": 4}, "(32, 4096, 4096, 4096, 1, 408)": {"BLOCK_SIZE_M": 16, "BLOCK_SIZE_N": 128, "BLOCK_SIZE_K": 256, "GROUP_SIZE_M": 8, "SPLIT_K": 1, "A_load_order": 0, "NUM_STAGES": 2, "num_warps": 4, "num_ctas": 1, "num_stages": 2}, "(48, 4096, 4096, 4096, 1, 408)": {"BLOCK_SIZE_M": 32, "BLOCK_SIZE_N": 128, "BLOCK_SIZE_K": 256, "GROUP_SIZE_M": 8, "SPLIT_K": 1, "A_load_order": 0, "NUM_STAGES": 2, "num_warps": 4, "num_ctas": 1, "num_stages": 2}, "(64, 4096, 4096, 4096, 1, 408)": {"BLOCK_SIZE_M": 32, "BLOCK_SIZE_N": 128, "BLOCK_SIZE_K": 256, "GROUP_SIZE_M": 8, "SPLIT_K": 1, "A_load_order": 0, "NUM_STAGES": 2, "num_warps": 4, "num_ctas": 1, "num_stages": 2}, "(1, 24576, 4096, 4096, 1, 408)": {"BLOCK_SIZE_M": 16, "BLOCK_SIZE_N": 256, "BLOCK_SIZE_K": 256, "GROUP_SIZE_M": 8, "SPLIT_K": 1, "A_load_order": 0, "NUM_STAGES": 1, "num_warps": 8, "num_ctas": 1, "num_stages": 1}, "(2, 24576, 4096, 4096, 1, 408)": {"BLOCK_SIZE_M": 16, "BLOCK_SIZE_N": 256, "BLOCK_SIZE_K": 256, "GROUP_SIZE_M": 8, "SPLIT_K": 1, "A_load_order": 0, "NUM_STAGES": 1, "num_warps": 8, "num_ctas": 1, "num_stages": 1}, "(4, 24576, 4096, 4096, 1, 408)": {"BLOCK_SIZE_M": 16, "BLOCK_SIZE_N": 256, "BLOCK_SIZE_K": 256, "GROUP_SIZE_M": 8, "SPLIT_K": 1, "A_load_order": 0, "NUM_STAGES": 1, "num_warps": 8, "num_ctas": 1, "num_stages": 1}, "(8, 24576, 4096, 4096, 1, 408)": {"BLOCK_SIZE_M": 16, "BLOCK_SIZE_N": 256, "BLOCK_SIZE_K": 256, "GROUP_SIZE_M": 8, "SPLIT_K": 1, "A_load_order": 0, "NUM_STAGES": 1, "num_warps": 8, "num_ctas": 1, "num_stages": 1}, "(16, 24576, 4096, 4096, 1, 408)": {"BLOCK_SIZE_M": 16, "BLOCK_SIZE_N": 256, "BLOCK_SIZE_K": 256, "GROUP_SIZE_M": 8, "SPLIT_K": 1, "A_load_order": 0, "NUM_STAGES": 1, "num_warps": 8, "num_ctas": 1, "num_stages": 1}, "(24, 24576, 4096, 4096, 1, 408)": {"BLOCK_SIZE_M": 16, "BLOCK_SIZE_N": 256, "BLOCK_SIZE_K": 256, "GROUP_SIZE_M": 8, "SPLIT_K": 1, "A_load_order": 0, "NUM_STAGES": 1, "num_warps": 8, "num_ctas": 1, "num_stages": 1}, "(32, 24576, 4096, 4096, 1, 408)": {"BLOCK_SIZE_M": 16, "BLOCK_SIZE_N": 256, "BLOCK_SIZE_K": 256, "GROUP_SIZE_M": 8, "SPLIT_K": 1, "A_load_order": 0, "NUM_STAGES": 1, "num_warps": 8, "num_ctas": 1, "num_stages": 1}, "(48, 24576, 4096, 4096, 1, 408)": {"BLOCK_SIZE_M": 32, "BLOCK_SIZE_N": 256, "BLOCK_SIZE_K": 256, "GROUP_SIZE_M": 8, "SPLIT_K": 1, "A_load_order": 0, "NUM_STAGES": 1, "num_warps": 8, "num_ctas": 1, "num_stages": 1}, "(64, 24576, 4096, 4096, 1, 408)": {"BLOCK_SIZE_M": 32, "BLOCK_SIZE_N": 256, "BLOCK_SIZE_K": 256, "GROUP_SIZE_M": 8, "SPLIT_K": 1, "A_load_order": 0, "NUM_STAGES": 1, "num_warps": 8, "num_ctas": 1, "num_stages": 1}, "(1, 4096, 12288, 12288, 1, 408)": {"BLOCK_SIZE_M": 16, "BLOCK_SIZE_N": 256, "BLOCK_SIZE_K": 256, "GROUP_SIZE_M": 8, "SPLIT_K": 1, "A_load_order": 0, "NUM_STAGES": 1, "num_warps": 8, "num_ctas": 1, "num_stages": 1}, "(2, 4096, 12288, 12288, 1, 408)": {"BLOCK_SIZE_M": 16, "BLOCK_SIZE_N": 256, "BLOCK_SIZE_K": 256, "GROUP_SIZE_M": 8, "SPLIT_K": 1, "A_load_order": 0, "NUM_STAGES": 1, "num_warps": 8, "num_ctas": 1, "num_stages": 1}, "(4, 4096, 12288, 12288, 1, 408)": {"BLOCK_SIZE_M": 16, "BLOCK_SIZE_N": 256, "BLOCK_SIZE_K": 256, "GROUP_SIZE_M": 8, "SPLIT_K": 1, "A_load_order": 0, "NUM_STAGES": 1, "num_warps": 8, "num_ctas": 1, "num_stages": 1}, "(8, 4096, 12288, 12288, 1, 408)": {"BLOCK_SIZE_M": 16, "BLOCK_SIZE_N": 256, "BLOCK_SIZE_K": 256, "GROUP_SIZE_M": 8, "SPLIT_K": 1, "A_load_order": 0, "NUM_STAGES": 1, "num_warps": 8, "num_ctas": 1, "num_stages": 1}, "(16, 4096, 12288, 12288, 1, 408)": {"BLOCK_SIZE_M": 16, "BLOCK_SIZE_N": 256, "BLOCK_SIZE_K": 256, "GROUP_SIZE_M": 8, "SPLIT_K": 1, "A_load_order": 0, "NUM_STAGES": 1, "num_warps": 8, "num_ctas": 1, "num_stages": 1}, "(24, 4096, 12288, 12288, 1, 408)": {"BLOCK_SIZE_M": 16, "BLOCK_SIZE_N": 256, "BLOCK_SIZE_K": 256, "GROUP_SIZE_M": 8, "SPLIT_K": 1, "A_load_order": 0, "NUM_STAGES": 1, "num_warps": 8, "num_ctas": 1, "num_stages": 1}, "(32, 4096, 12288, 12288, 1, 408)": {"BLOCK_SIZE_M": 16, "BLOCK_SIZE_N": 256, "BLOCK_SIZE_K": 256, "GROUP_SIZE_M": 8, "SPLIT_K": 1, "A_load_order": 0, "NUM_STAGES": 1, "num_warps": 8, "num_ctas": 1, "num_stages": 1}, "(48, 4096, 12288, 12288, 1, 408)": {"BLOCK_SIZE_M": 32, "BLOCK_SIZE_N": 256, "BLOCK_SIZE_K": 256, "GROUP_SIZE_M": 8, "SPLIT_K": 1, "A_load_order": 0, "NUM_STAGES": 1, "num_warps": 8, "num_ctas": 1, "num_stages": 1}, "(64, 4096, 12288, 12288, 1, 408)": {"BLOCK_SIZE_M": 32, "BLOCK_SIZE_N": 256, "BLOCK_SIZE_K": 256, "GROUP_SIZE_M": 8, "SPLIT_K": 1, "A_load_order": 0, "NUM_STAGES": 1, "num_warps": 8, "num_ctas": 1, "num_stages": 1}, "(2, 3456, 1152, 64, 8, 104)": {"BLOCK_SIZE_M": 16, "BLOCK_SIZE_N": 32, "BLOCK_SIZE_K": 64, "GROUP_SIZE_M": 8, "SPLIT_K": 1, "A_load_order": 0, "NUM_STAGES": 4, "num_warps": 4, "num_ctas": 1, "num_stages": 4}, "(4, 3456, 1152, 64, 8, 104)": {"BLOCK_SIZE_M": 16, "BLOCK_SIZE_N": 32, "BLOCK_SIZE_K": 64, "GROUP_SIZE_M": 8, "SPLIT_K": 1, "A_load_order": 0, "NUM_STAGES": 4, "num_warps": 4, "num_ctas": 1, "num_stages": 4}, "(8, 3456, 1152, 64, 8, 104)": {"BLOCK_SIZE_M": 16, "BLOCK_SIZE_N": 32, "BLOCK_SIZE_K": 64, "GROUP_SIZE_M": 8, "SPLIT_K": 1, "A_load_order": 0, "NUM_STAGES": 4, "num_warps": 4, "num_ctas": 1, "num_stages": 4}, "(16, 3456, 1152, 64, 8, 104)": {"BLOCK_SIZE_M": 16, "BLOCK_SIZE_N": 32, "BLOCK_SIZE_K": 64, "GROUP_SIZE_M": 8, "SPLIT_K": 1, "A_load_order": 0, "NUM_STAGES": 4, "num_warps": 4, "num_ctas": 1, "num_stages": 4}, "(24, 3456, 1152, 64, 8, 104)": {"BLOCK_SIZE_M": 16, "BLOCK_SIZE_N": 512, "BLOCK_SIZE_K": 32, "GROUP_SIZE_M": 8, "SPLIT_K": 4, "A_load_order": 2, "NUM_STAGES": 1, "num_warps": 4, "num_ctas": 1, "num_stages": 1}, "(32, 3456, 1152, 64, 8, 104)": {"BLOCK_SIZE_M": 16, "BLOCK_SIZE_N": 128, "BLOCK_SIZE_K": 64, "GROUP_SIZE_M": 8, "SPLIT_K": 2, "A_load_order": 0, "NUM_STAGES": 1, "num_warps": 4, "num_ctas": 1, "num_stages": 1}, "(48, 3456, 1152, 64, 8, 104)": {"BLOCK_SIZE_M": 32, "BLOCK_SIZE_N": 64, "BLOCK_SIZE_K": 64, "GROUP_SIZE_M": 8, "SPLIT_K": 1, "A_load_order": 2, "NUM_STAGES": 3, "num_warps": 4, "num_ctas": 1, "num_stages": 3}, "(64, 3456, 1152, 64, 8, 104)": {"BLOCK_SIZE_M": 32, "BLOCK_SIZE_N": 64, "BLOCK_SIZE_K": 64, "GROUP_SIZE_M": 8, "SPLIT_K": 1, "A_load_order": 0, "NUM_STAGES": 3, "num_warps": 4, "num_ctas": 1, "num_stages": 3}, "(2, 1152, 1152, 64, 8, 104)": {"BLOCK_SIZE_M": 16, "BLOCK_SIZE_N": 64, "BLOCK_SIZE_K": 32, "GROUP_SIZE_M": 8, "SPLIT_K": 4, "A_load_order": 2, "NUM_STAGES": 4, "num_warps": 8, "num_ctas": 1, "num_stages": 4}, "(4, 1152, 1152, 64, 8, 104)": {"BLOCK_SIZE_M": 16, "BLOCK_SIZE_N": 64, "BLOCK_SIZE_K": 32, "GROUP_SIZE_M": 8, "SPLIT_K": 4, "A_load_order": 2, "NUM_STAGES": 4, "num_warps": 8, "num_ctas": 1, "num_stages": 4}, "(8, 1152, 1152, 64, 8, 104)": {"BLOCK_SIZE_M": 16, "BLOCK_SIZE_N": 64, "BLOCK_SIZE_K": 32, "GROUP_SIZE_M": 8, "SPLIT_K": 4, "A_load_order": 2, "NUM_STAGES": 4, "num_warps": 8, "num_ctas": 1, "num_stages": 4}, "(16, 1152, 1152, 64, 8, 104)": {"BLOCK_SIZE_M": 16, "BLOCK_SIZE_N": 32, "BLOCK_SIZE_K": 64, "GROUP_SIZE_M": 8, "SPLIT_K": 2, "A_load_order": 0, "NUM_STAGES": 4, "num_warps": 4, "num_ctas": 1, "num_stages": 4}, "(24, 1152, 1152, 64, 8, 104)": {"BLOCK_SIZE_M": 16, "BLOCK_SIZE_N": 64, "BLOCK_SIZE_K": 32, "GROUP_SIZE_M": 8, "SPLIT_K": 4, "A_load_order": 2, "NUM_STAGES": 4, "num_warps": 8, "num_ctas": 1, "num_stages": 4}, "(32, 1152, 1152, 64, 8, 104)": {"BLOCK_SIZE_M": 16, "BLOCK_SIZE_N": 64, "BLOCK_SIZE_K": 32, "GROUP_SIZE_M": 8, "SPLIT_K": 4, "A_load_order": 2, "NUM_STAGES": 4, "num_warps": 8, "num_ctas": 1, "num_stages": 4}, "(48, 1152, 1152, 64, 8, 104)": {"BLOCK_SIZE_M": 32, "BLOCK_SIZE_N": 32, "BLOCK_SIZE_K": 64, "GROUP_SIZE_M": 8, "SPLIT_K": 1, "A_load_order": 0, "NUM_STAGES": 4, "num_warps": 4, "num_ctas": 1, "num_stages": 4}, "(64, 1152, 1152, 64, 8, 104)": {"BLOCK_SIZE_M": 32, "BLOCK_SIZE_N": 32, "BLOCK_SIZE_K": 64, "GROUP_SIZE_M": 8, "SPLIT_K": 1, "A_load_order": 0, "NUM_STAGES": 4, "num_warps": 4, "num_ctas": 1, "num_stages": 4}, "(1, 3072, 1024, 1024, 1, 308)": {"BLOCK_SIZE_M": 16, "BLOCK_SIZE_N": 64, "BLOCK_SIZE_K": 256, "GROUP_SIZE_M": 8, "SPLIT_K": 1, "A_load_order": 2, "NUM_STAGES": 4, "num_warps": 4, "num_ctas": 1, "num_stages": 4}, "(1, 1024, 1024, 1024, 1, 308)": {"BLOCK_SIZE_M": 16, "BLOCK_SIZE_N": 32, "BLOCK_SIZE_K": 512, "GROUP_SIZE_M": 8, "SPLIT_K": 1, "A_load_order": 0, "NUM_STAGES": 4, "num_warps": 4, "num_ctas": 1, "num_stages": 4}, "(1, 1024, 4096, 4096, 1, 308)": {"BLOCK_SIZE_M": 16, "BLOCK_SIZE_N": 64, "BLOCK_SIZE_K": 256, "GROUP_SIZE_M": 8, "SPLIT_K": 1, "A_load_order": 2, "NUM_STAGES": 4, "num_warps": 4, "num_ctas": 1, "num_stages": 4}, "(1, 2560, 4096, 4096, 1, 308)": {"BLOCK_SIZE_M": 16, "BLOCK_SIZE_N": 64, "BLOCK_SIZE_K": 256, "GROUP_SIZE_M": 8, "SPLIT_K": 1, "A_load_order": 2, "NUM_STAGES": 4, "num_warps": 4, "num_ctas": 1, "num_stages": 4}, "(1, 6144, 2560, 2560, 1, 308)": {"BLOCK_SIZE_M": 16, "BLOCK_SIZE_N": 64, "BLOCK_SIZE_K": 512, "GROUP_SIZE_M": 8, "SPLIT_K": 1, "A_load_order": 0, "NUM_STAGES": 2, "num_warps": 4, "num_ctas": 1, "num_stages": 2}, "(1, 19456, 2560, 2560, 1, 308)": {"BLOCK_SIZE_M": 16, "BLOCK_SIZE_N": 256, "BLOCK_SIZE_K": 256, "GROUP_SIZE_M": 8, "SPLIT_K": 1, "A_load_order": 0, "NUM_STAGES": 1, "num_warps": 8, "num_ctas": 1, "num_stages": 1}, "(1, 2560, 9728, 9728, 1, 308)": {"BLOCK_SIZE_M": 16, "BLOCK_SIZE_N": 32, "BLOCK_SIZE_K": 512, "GROUP_SIZE_M": 8, "SPLIT_K": 1, "A_load_order": 0, "NUM_STAGES": 4, "num_warps": 4, "num_ctas": 1, "num_stages": 4}, "(1, 3072, 1024, 1024, 1, 408)": {"BLOCK_SIZE_M": 16, "BLOCK_SIZE_N": 32, "BLOCK_SIZE_K": 256, "GROUP_SIZE_M": 8, "SPLIT_K": 1, "A_load_order": 0, "NUM_STAGES": 5, "num_warps": 4, "num_ctas": 1, "num_stages": 5}, "(1, 1024, 1024, 1024, 1, 408)": {"BLOCK_SIZE_M": 16, "BLOCK_SIZE_N": 64, "BLOCK_SIZE_K": 256, "GROUP_SIZE_M": 8, "SPLIT_K": 1, "A_load_order": 2, "NUM_STAGES": 4, "num_warps": 4, "num_ctas": 1, "num_stages": 4}, "(1, 1024, 4096, 4096, 1, 408)": {"BLOCK_SIZE_M": 16, "BLOCK_SIZE_N": 32, "BLOCK_SIZE_K": 256, "GROUP_SIZE_M": 8, "SPLIT_K": 1, "A_load_order": 0, "NUM_STAGES": 5, "num_warps": 4, "num_ctas": 1, "num_stages": 5}, "(1, 2560, 4096, 4096, 1, 408)": {"BLOCK_SIZE_M": 16, "BLOCK_SIZE_N": 64, "BLOCK_SIZE_K": 256, "GROUP_SIZE_M": 8, "SPLIT_K": 1, "A_load_order": 2, "NUM_STAGES": 4, "num_warps": 4, "num_ctas": 1, "num_stages": 4}, "(1, 6144, 2560, 2560, 1, 408)": {"BLOCK_SIZE_M": 16, "BLOCK_SIZE_N": 32, "BLOCK_SIZE_K": 256, "GROUP_SIZE_M": 8, "SPLIT_K": 1, "A_load_order": 0, "NUM_STAGES": 5, "num_warps": 4, "num_ctas": 1, "num_stages": 5}, "(1, 19456, 2560, 2560, 1, 408)": {"BLOCK_SIZE_M": 16, "BLOCK_SIZE_N": 256, "BLOCK_SIZE_K": 256, "GROUP_SIZE_M": 8, "SPLIT_K": 1, "A_load_order": 0, "NUM_STAGES": 1, "num_warps": 8, "num_ctas": 1, "num_stages": 1}, "(1, 2560, 9728, 9728, 1, 408)": {"BLOCK_SIZE_M": 16, "BLOCK_SIZE_N": 32, "BLOCK_SIZE_K": 512, "GROUP_SIZE_M": 8, "SPLIT_K": 1, "A_load_order": 0, "NUM_STAGES": 4, "num_warps": 4, "num_ctas": 1, "num_stages": 4}, "(2, 12288, 4096, 4096, 1, 408)": {"BLOCK_SIZE_M": 16, "BLOCK_SIZE_N": 256, "BLOCK_SIZE_K": 256, "GROUP_SIZE_M": 8, "SPLIT_K": 1, "A_load_order": 0, "NUM_STAGES": 1, "num_warps": 8, "num_ctas": 1, "num_stages": 1}, "(4, 12288, 4096, 4096, 1, 408)": {"BLOCK_SIZE_M": 16, "BLOCK_SIZE_N": 256, "BLOCK_SIZE_K": 256, "GROUP_SIZE_M": 8, "SPLIT_K": 1, "A_load_order": 0, "NUM_STAGES": 1, "num_warps": 8, "num_ctas": 1, "num_stages": 1}, "(8, 12288, 4096, 4096, 1, 408)": {"BLOCK_SIZE_M": 16, "BLOCK_SIZE_N": 256, "BLOCK_SIZE_K": 256, "GROUP_SIZE_M": 8, "SPLIT_K": 1, "A_load_order": 0, "NUM_STAGES": 1, "num_warps": 8, "num_ctas": 1, "num_stages": 1}, "(16, 12288, 4096, 4096, 1, 408)": {"BLOCK_SIZE_M": 16, "BLOCK_SIZE_N": 256, "BLOCK_SIZE_K": 256, "GROUP_SIZE_M": 8, "SPLIT_K": 1, "A_load_order": 0, "NUM_STAGES": 1, "num_warps": 8, "num_ctas": 1, "num_stages": 1}, "(24, 12288, 4096, 4096, 1, 408)": {"BLOCK_SIZE_M": 16, "BLOCK_SIZE_N": 256, "BLOCK_SIZE_K": 256, "GROUP_SIZE_M": 8, "SPLIT_K": 1, "A_load_order": 0, "NUM_STAGES": 1, "num_warps": 8, "num_ctas": 1, "num_stages": 1}, "(32, 12288, 4096, 4096, 1, 408)": {"BLOCK_SIZE_M": 16, "BLOCK_SIZE_N": 256, "BLOCK_SIZE_K": 256, "GROUP_SIZE_M": 8, "SPLIT_K": 1, "A_load_order": 0, "NUM_STAGES": 1, "num_warps": 8, "num_ctas": 1, "num_stages": 1}, "(48, 12288, 4096, 4096, 1, 408)": {"BLOCK_SIZE_M": 32, "BLOCK_SIZE_N": 256, "BLOCK_SIZE_K": 256, "GROUP_SIZE_M": 8, "SPLIT_K": 1, "A_load_order": 0, "NUM_STAGES": 1, "num_warps": 8, "num_ctas": 1, "num_stages": 1}, "(64, 12288, 4096, 4096, 1, 408)": {"BLOCK_SIZE_M": 32, "BLOCK_SIZE_N": 256, "BLOCK_SIZE_K": 256, "GROUP_SIZE_M": 8, "SPLIT_K": 1, "A_load_order": 0, "NUM_STAGES": 1, "num_warps": 8, "num_ctas": 1, "num_stages": 1}, "(2, 12288, 4096, 4096, 1, 308)": {"BLOCK_SIZE_M": 16, "BLOCK_SIZE_N": 256, "BLOCK_SIZE_K": 256, "GROUP_SIZE_M": 8, "SPLIT_K": 1, "A_load_order": 0, "NUM_STAGES": 1, "num_warps": 8, "num_ctas": 1, "num_stages": 1}, "(4, 12288, 4096, 4096, 1, 308)": {"BLOCK_SIZE_M": 16, "BLOCK_SIZE_N": 256, "BLOCK_SIZE_K": 256, "GROUP_SIZE_M": 8, "SPLIT_K": 1, "A_load_order": 0, "NUM_STAGES": 1, "num_warps": 8, "num_ctas": 1, "num_stages": 1}, "(8, 12288, 4096, 4096, 1, 308)": {"BLOCK_SIZE_M": 16, "BLOCK_SIZE_N": 256, "BLOCK_SIZE_K": 256, "GROUP_SIZE_M": 8, "SPLIT_K": 1, "A_load_order": 0, "NUM_STAGES": 1, "num_warps": 8, "num_ctas": 1, "num_stages": 1}, "(16, 12288, 4096, 4096, 1, 308)": {"BLOCK_SIZE_M": 16, "BLOCK_SIZE_N": 256, "BLOCK_SIZE_K": 256, "GROUP_SIZE_M": 8, "SPLIT_K": 1, "A_load_order": 0, "NUM_STAGES": 1, "num_warps": 8, "num_ctas": 1, "num_stages": 1}, "(24, 12288, 4096, 4096, 1, 308)": {"BLOCK_SIZE_M": 16, "BLOCK_SIZE_N": 256, "BLOCK_SIZE_K": 256, "GROUP_SIZE_M": 8, "SPLIT_K": 1, "A_load_order": 0, "NUM_STAGES": 1, "num_warps": 8, "num_ctas": 1, "num_stages": 1}, "(32, 12288, 4096, 4096, 1, 308)": {"BLOCK_SIZE_M": 16, "BLOCK_SIZE_N": 256, "BLOCK_SIZE_K": 256, "GROUP_SIZE_M": 8, "SPLIT_K": 1, "A_load_order": 0, "NUM_STAGES": 1, "num_warps": 8, "num_ctas": 1, "num_stages": 1}, "(48, 12288, 4096, 4096, 1, 308)": {"BLOCK_SIZE_M": 32, "BLOCK_SIZE_N": 256, "BLOCK_SIZE_K": 256, "GROUP_SIZE_M": 8, "SPLIT_K": 1, "A_load_order": 0, "NUM_STAGES": 1, "num_warps": 8, "num_ctas": 1, "num_stages": 1}, "(64, 12288, 4096, 4096, 1, 308)": {"BLOCK_SIZE_M": 32, "BLOCK_SIZE_N": 256, "BLOCK_SIZE_K": 256, "GROUP_SIZE_M": 8, "SPLIT_K": 1, "A_load_order": 0, "NUM_STAGES": 1, "num_warps": 8, "num_ctas": 1, "num_stages": 1}, "(2, 4096, 4096, 64, 8, 104)": {"BLOCK_SIZE_M": 16, "BLOCK_SIZE_N": 128, "BLOCK_SIZE_K": 64, "GROUP_SIZE_M": 8, "SPLIT_K": 4, "A_load_order": 2, "NUM_STAGES": 1, "num_warps": 8, "num_ctas": 1, "num_stages": 1}, "(2, 12288, 4096, 64, 8, 104)": {"BLOCK_SIZE_M": 16, "BLOCK_SIZE_N": 512, "BLOCK_SIZE_K": 32, "GROUP_SIZE_M": 8, "SPLIT_K": 4, "A_load_order": 2, "NUM_STAGES": 1, "num_warps": 4, "num_ctas": 1, "num_stages": 1}, "(2, 4096, 12288, 64, 8, 104)": {"BLOCK_SIZE_M": 16, "BLOCK_SIZE_N": 128, "BLOCK_SIZE_K": 64, "GROUP_SIZE_M": 8, "SPLIT_K": 4, "A_load_order": 2, "NUM_STAGES": 1, "num_warps": 8, "num_ctas": 1, "num_stages": 1}, "(4, 4096, 4096, 64, 8, 104)": {"BLOCK_SIZE_M": 16, "BLOCK_SIZE_N": 128, "BLOCK_SIZE_K": 64, "GROUP_SIZE_M": 8, "SPLIT_K": 4, "A_load_order": 2, "NUM_STAGES": 1, "num_warps": 8, "num_ctas": 1, "num_stages": 1}, "(4, 12288, 4096, 64, 8, 104)": {"BLOCK_SIZE_M": 16, "BLOCK_SIZE_N": 512, "BLOCK_SIZE_K": 32, "GROUP_SIZE_M": 8, "SPLIT_K": 4, "A_load_order": 2, "NUM_STAGES": 1, "num_warps": 4, "num_ctas": 1, "num_stages": 1}, "(4, 4096, 12288, 64, 8, 104)": {"BLOCK_SIZE_M": 16, "BLOCK_SIZE_N": 128, "BLOCK_SIZE_K": 64, "GROUP_SIZE_M": 8, "SPLIT_K": 4, "A_load_order": 2, "NUM_STAGES": 1, "num_warps": 8, "num_ctas": 1, "num_stages": 1}, "(8, 4096, 4096, 64, 8, 104)": {"BLOCK_SIZE_M": 16, "BLOCK_SIZE_N": 128, "BLOCK_SIZE_K": 64, "GROUP_SIZE_M": 8, "SPLIT_K": 4, "A_load_order": 2, "NUM_STAGES": 1, "num_warps": 8, "num_ctas": 1, "num_stages": 1}, "(8, 12288, 4096, 64, 8, 104)": {"BLOCK_SIZE_M": 16, "BLOCK_SIZE_N": 512, "BLOCK_SIZE_K": 32, "GROUP_SIZE_M": 8, "SPLIT_K": 4, "A_load_order": 2, "NUM_STAGES": 1, "num_warps": 4, "num_ctas": 1, "num_stages": 1}, "(8, 4096, 12288, 64, 8, 104)": {"BLOCK_SIZE_M": 16, "BLOCK_SIZE_N": 128, "BLOCK_SIZE_K": 64, "GROUP_SIZE_M": 8, "SPLIT_K": 4, "A_load_order": 2, "NUM_STAGES": 1, "num_warps": 8, "num_ctas": 1, "num_stages": 1}, "(16, 4096, 4096, 64, 8, 104)": {"BLOCK_SIZE_M": 16, "BLOCK_SIZE_N": 128, "BLOCK_SIZE_K": 64, "GROUP_SIZE_M": 8, "SPLIT_K": 4, "A_load_order": 2, "NUM_STAGES": 1, "num_warps": 8, "num_ctas": 1, "num_stages": 1}, "(16, 12288, 4096, 64, 8, 104)": {"BLOCK_SIZE_M": 16, "BLOCK_SIZE_N": 256, "BLOCK_SIZE_K": 64, "GROUP_SIZE_M": 8, "SPLIT_K": 2, "A_load_order": 2, "NUM_STAGES": 1, "num_warps": 4, "num_ctas": 1, "num_stages": 1}, "(16, 4096, 12288, 64, 8, 104)": {"BLOCK_SIZE_M": 16, "BLOCK_SIZE_N": 128, "BLOCK_SIZE_K": 64, "GROUP_SIZE_M": 8, "SPLIT_K": 4, "A_load_order": 2, "NUM_STAGES": 1, "num_warps": 8, "num_ctas": 1, "num_stages": 1}, "(24, 4096, 4096, 64, 8, 104)": {"BLOCK_SIZE_M": 16, "BLOCK_SIZE_N": 128, "BLOCK_SIZE_K": 64, "GROUP_SIZE_M": 8, "SPLIT_K": 4, "A_load_order": 0, "NUM_STAGES": 1, "num_warps": 4, "num_ctas": 1, "num_stages": 1}, "(24, 12288, 4096, 64, 8, 104)": {"BLOCK_SIZE_M": 16, "BLOCK_SIZE_N": 256, "BLOCK_SIZE_K": 64, "GROUP_SIZE_M": 8, "SPLIT_K": 1, "A_load_order": 0, "NUM_STAGES": 1, "num_warps": 4, "num_ctas": 1, "num_stages": 1}, "(24, 4096, 12288, 64, 8, 104)": {"BLOCK_SIZE_M": 16, "BLOCK_SIZE_N": 128, "BLOCK_SIZE_K": 64, "GROUP_SIZE_M": 8, "SPLIT_K": 4, "A_load_order": 0, "NUM_STAGES": 1, "num_warps": 4, "num_ctas": 1, "num_stages": 1}, "(32, 4096, 4096, 64, 8, 104)": {"BLOCK_SIZE_M": 16, "BLOCK_SIZE_N": 128, "BLOCK_SIZE_K": 64, "GROUP_SIZE_M": 8, "SPLIT_K": 4, "A_load_order": 0, "NUM_STAGES": 1, "num_warps": 4, "num_ctas": 1, "num_stages": 1}, "(32, 12288, 4096, 64, 8, 104)": {"BLOCK_SIZE_M": 16, "BLOCK_SIZE_N": 256, "BLOCK_SIZE_K": 64, "GROUP_SIZE_M": 8, "SPLIT_K": 1, "A_load_order": 0, "NUM_STAGES": 1, "num_warps": 4, "num_ctas": 1, "num_stages": 1}, "(32, 4096, 12288, 64, 8, 104)": {"BLOCK_SIZE_M": 16, "BLOCK_SIZE_N": 128, "BLOCK_SIZE_K": 64, "GROUP_SIZE_M": 8, "SPLIT_K": 4, "A_load_order": 0, "NUM_STAGES": 1, "num_warps": 4, "num_ctas": 1, "num_stages": 1}, "(48, 4096, 4096, 64, 8, 104)": {"BLOCK_SIZE_M": 32, "BLOCK_SIZE_N": 128, "BLOCK_SIZE_K": 64, "GROUP_SIZE_M": 8, "SPLIT_K": 4, "A_load_order": 0, "NUM_STAGES": 1, "num_warps": 4, "num_ctas": 1, "num_stages": 1}, "(48, 12288, 4096, 64, 8, 104)": {"BLOCK_SIZE_M": 32, "BLOCK_SIZE_N": 128, "BLOCK_SIZE_K": 64, "GROUP_SIZE_M": 8, "SPLIT_K": 1, "A_load_order": 0, "NUM_STAGES": 1, "num_warps": 4, "num_ctas": 1, "num_stages": 1}, "(48, 4096, 12288, 64, 8, 104)": {"BLOCK_SIZE_M": 32, "BLOCK_SIZE_N": 128, "BLOCK_SIZE_K": 64, "GROUP_SIZE_M": 8, "SPLIT_K": 4, "A_load_order": 0, "NUM_STAGES": 1, "num_warps": 4, "num_ctas": 1, "num_stages": 1}, "(64, 4096, 4096, 64, 8, 104)": {"BLOCK_SIZE_M": 32, "BLOCK_SIZE_N": 128, "BLOCK_SIZE_K": 64, "GROUP_SIZE_M": 8, "SPLIT_K": 4, "A_load_order": 0, "NUM_STAGES": 1, "num_warps": 4, "num_ctas": 1, "num_stages": 1}, "(64, 12288, 4096, 64, 8, 104)": {"BLOCK_SIZE_M": 32, "BLOCK_SIZE_N": 128, "BLOCK_SIZE_K": 64, "GROUP_SIZE_M": 8, "SPLIT_K": 1, "A_load_order": 0, "NUM_STAGES": 1, "num_warps": 4, "num_ctas": 1, "num_stages": 1}, "(64, 4096, 12288, 64, 8, 104)": {"BLOCK_SIZE_M": 32, "BLOCK_SIZE_N": 128, "BLOCK_SIZE_K": 64, "GROUP_SIZE_M": 8, "SPLIT_K": 4, "A_load_order": 0, "NUM_STAGES": 1, "num_warps": 4, "num_ctas": 1, "num_stages": 1}, "(2, 4096, 2560, 64, 8, 104)": {"BLOCK_SIZE_M": 16, "BLOCK_SIZE_N": 128, "BLOCK_SIZE_K": 64, "GROUP_SIZE_M": 8, "SPLIT_K": 4, "A_load_order": 2, "NUM_STAGES": 1, "num_warps": 8, "num_ctas": 1, "num_stages": 1}, "(2, 1024, 2560, 64, 8, 104)": {"BLOCK_SIZE_M": 16, "BLOCK_SIZE_N": 64, "BLOCK_SIZE_K": 32, "GROUP_SIZE_M": 8, "SPLIT_K": 8, "A_load_order": 2, "NUM_STAGES": 4, "num_warps": 8, "num_ctas": 1, "num_stages": 4}, "(2, 9728, 2560, 64, 8, 104)": {"BLOCK_SIZE_M": 16, "BLOCK_SIZE_N": 512, "BLOCK_SIZE_K": 32, "GROUP_SIZE_M": 8, "SPLIT_K": 4, "A_load_order": 2, "NUM_STAGES": 1, "num_warps": 4, "num_ctas": 1, "num_stages": 1}, "(4, 4096, 2560, 64, 8, 104)": {"BLOCK_SIZE_M": 16, "BLOCK_SIZE_N": 128, "BLOCK_SIZE_K": 64, "GROUP_SIZE_M": 8, "SPLIT_K": 4, "A_load_order": 2, "NUM_STAGES": 1, "num_warps": 8, "num_ctas": 1, "num_stages": 1}, "(4, 1024, 2560, 64, 8, 104)": {"BLOCK_SIZE_M": 16, "BLOCK_SIZE_N": 64, "BLOCK_SIZE_K": 32, "GROUP_SIZE_M": 8, "SPLIT_K": 8, "A_load_order": 2, "NUM_STAGES": 4, "num_warps": 8, "num_ctas": 1, "num_stages": 4}, "(4, 9728, 2560, 64, 8, 104)": {"BLOCK_SIZE_M": 16, "BLOCK_SIZE_N": 512, "BLOCK_SIZE_K": 32, "GROUP_SIZE_M": 8, "SPLIT_K": 4, "A_load_order": 2, "NUM_STAGES": 1, "num_warps": 4, "num_ctas": 1, "num_stages": 1}, "(8, 4096, 2560, 64, 8, 104)": {"BLOCK_SIZE_M": 16, "BLOCK_SIZE_N": 128, "BLOCK_SIZE_K": 64, "GROUP_SIZE_M": 8, "SPLIT_K": 4, "A_load_order": 2, "NUM_STAGES": 1, "num_warps": 8, "num_ctas": 1, "num_stages": 1}, "(8, 1024, 2560, 64, 8, 104)": {"BLOCK_SIZE_M": 16, "BLOCK_SIZE_N": 64, "BLOCK_SIZE_K": 32, "GROUP_SIZE_M": 8, "SPLIT_K": 8, "A_load_order": 2, "NUM_STAGES": 4, "num_warps": 8, "num_ctas": 1, "num_stages": 4}, "(8, 9728, 2560, 64, 8, 104)": {"BLOCK_SIZE_M": 16, "BLOCK_SIZE_N": 512, "BLOCK_SIZE_K": 32, "GROUP_SIZE_M": 8, "SPLIT_K": 4, "A_load_order": 2, "NUM_STAGES": 1, "num_warps": 4, "num_ctas": 1, "num_stages": 1}, "(16, 4096, 2560, 64, 8, 104)": {"BLOCK_SIZE_M": 16, "BLOCK_SIZE_N": 128, "BLOCK_SIZE_K": 64, "GROUP_SIZE_M": 8, "SPLIT_K": 4, "A_load_order": 2, "NUM_STAGES": 1, "num_warps": 8, "num_ctas": 1, "num_stages": 1}, "(16, 1024, 2560, 64, 8, 104)": {"BLOCK_SIZE_M": 16, "BLOCK_SIZE_N": 64, "BLOCK_SIZE_K": 32, "GROUP_SIZE_M": 8, "SPLIT_K": 8, "A_load_order": 2, "NUM_STAGES": 4, "num_warps": 8, "num_ctas": 1, "num_stages": 4}, "(16, 9728, 2560, 64, 8, 104)": {"BLOCK_SIZE_M": 16, "BLOCK_SIZE_N": 256, "BLOCK_SIZE_K": 64, "GROUP_SIZE_M": 8, "SPLIT_K": 2, "A_load_order": 2, "NUM_STAGES": 1, "num_warps": 4, "num_ctas": 1, "num_stages": 1}, "(24, 4096, 2560, 64, 8, 104)": {"BLOCK_SIZE_M": 16, "BLOCK_SIZE_N": 128, "BLOCK_SIZE_K": 64, "GROUP_SIZE_M": 8, "SPLIT_K": 4, "A_load_order": 0, "NUM_STAGES": 1, "num_warps": 4, "num_ctas": 1, "num_stages": 1}, "(24, 1024, 2560, 64, 8, 104)": {"BLOCK_SIZE_M": 16, "BLOCK_SIZE_N": 64, "BLOCK_SIZE_K": 32, "GROUP_SIZE_M": 8, "SPLIT_K": 8, "A_load_order": 2, "NUM_STAGES": 4, "num_warps": 8, "num_ctas": 1, "num_stages": 4}, "(24, 9728, 2560, 64, 8, 104)": {"BLOCK_SIZE_M": 16, "BLOCK_SIZE_N": 128, "BLOCK_SIZE_K": 64, "GROUP_SIZE_M": 8, "SPLIT_K": 4, "A_load_order": 0, "NUM_STAGES": 1, "num_warps": 4, "num_ctas": 1, "num_stages": 1}, "(32, 4096, 2560, 64, 8, 104)": {"BLOCK_SIZE_M": 16, "BLOCK_SIZE_N": 128, "BLOCK_SIZE_K": 64, "GROUP_SIZE_M": 8, "SPLIT_K": 4, "A_load_order": 0, "NUM_STAGES": 1, "num_warps": 4, "num_ctas": 1, "num_stages": 1}, "(32, 1024, 2560, 64, 8, 104)": {"BLOCK_SIZE_M": 16, "BLOCK_SIZE_N": 64, "BLOCK_SIZE_K": 32, "GROUP_SIZE_M": 8, "SPLIT_K": 8, "A_load_order": 2, "NUM_STAGES": 4, "num_warps": 8, "num_ctas": 1, "num_stages": 4}, "(32, 9728, 2560, 64, 8, 104)": {"BLOCK_SIZE_M": 16, "BLOCK_SIZE_N": 128, "BLOCK_SIZE_K": 64, "GROUP_SIZE_M": 8, "SPLIT_K": 1, "A_load_order": 2, "NUM_STAGES": 1, "num_warps": 8, "num_ctas": 1, "num_stages": 1}, "(48, 4096, 2560, 64, 8, 104)": {"BLOCK_SIZE_M": 32, "BLOCK_SIZE_N": 128, "BLOCK_SIZE_K": 64, "GROUP_SIZE_M": 8, "SPLIT_K": 4, "A_load_order": 0, "NUM_STAGES": 1, "num_warps": 4, "num_ctas": 1, "num_stages": 1}, "(48, 1024, 2560, 64, 8, 104)": {"BLOCK_SIZE_M": 32, "BLOCK_SIZE_N": 128, "BLOCK_SIZE_K": 64, "GROUP_SIZE_M": 8, "SPLIT_K": 4, "A_load_order": 0, "NUM_STAGES": 1, "num_warps": 4, "num_ctas": 1, "num_stages": 1}, "(48, 9728, 2560, 64, 8, 104)": {"BLOCK_SIZE_M": 32, "BLOCK_SIZE_N": 128, "BLOCK_SIZE_K": 64, "GROUP_SIZE_M": 8, "SPLIT_K": 1, "A_load_order": 0, "NUM_STAGES": 1, "num_warps": 4, "num_ctas": 1, "num_stages": 1}, "(64, 4096, 2560, 64, 8, 104)": {"BLOCK_SIZE_M": 32, "BLOCK_SIZE_N": 128, "BLOCK_SIZE_K": 64, "GROUP_SIZE_M": 8, "SPLIT_K": 4, "A_load_order": 0, "NUM_STAGES": 1, "num_warps": 4, "num_ctas": 1, "num_stages": 1}, "(64, 1024, 2560, 64, 8, 104)": {"BLOCK_SIZE_M": 32, "BLOCK_SIZE_N": 32, "BLOCK_SIZE_K": 64, "GROUP_SIZE_M": 8, "SPLIT_K": 1, "A_load_order": 0, "NUM_STAGES": 4, "num_warps": 4, "num_ctas": 1, "num_stages": 4}, "(64, 9728, 2560, 64, 8, 104)": {"BLOCK_SIZE_M": 32, "BLOCK_SIZE_N": 128, "BLOCK_SIZE_K": 64, "GROUP_SIZE_M": 8, "SPLIT_K": 1, "A_load_order": 0, "NUM_STAGES": 1, "num_warps": 4, "num_ctas": 1, "num_stages": 1}, "(2, 4096, 2560, 2560, 1, 408)": {"BLOCK_SIZE_M": 16, "BLOCK_SIZE_N": 64, "BLOCK_SIZE_K": 512, "GROUP_SIZE_M": 8, "SPLIT_K": 1, "A_load_order": 0, "NUM_STAGES": 2, "num_warps": 4, "num_ctas": 1, "num_stages": 2}, "(2, 1024, 2560, 2560, 1, 408)": {"BLOCK_SIZE_M": 16, "BLOCK_SIZE_N": 32, "BLOCK_SIZE_K": 256, "GROUP_SIZE_M": 8, "SPLIT_K": 1, "A_load_order": 0, "NUM_STAGES": 5, "num_warps": 4, "num_ctas": 1, "num_stages": 5}, "(2, 9728, 2560, 2560, 1, 408)": {"BLOCK_SIZE_M": 16, "BLOCK_SIZE_N": 64, "BLOCK_SIZE_K": 256, "GROUP_SIZE_M": 8, "SPLIT_K": 1, "A_load_order": 2, "NUM_STAGES": 4, "num_warps": 4, "num_ctas": 1, "num_stages": 4}, "(4, 4096, 2560, 2560, 1, 408)": {"BLOCK_SIZE_M": 16, "BLOCK_SIZE_N": 64, "BLOCK_SIZE_K": 512, "GROUP_SIZE_M": 8, "SPLIT_K": 1, "A_load_order": 0, "NUM_STAGES": 2, "num_warps": 4, "num_ctas": 1, "num_stages": 2}, "(4, 1024, 2560, 2560, 1, 408)": {"BLOCK_SIZE_M": 16, "BLOCK_SIZE_N": 32, "BLOCK_SIZE_K": 256, "GROUP_SIZE_M": 8, "SPLIT_K": 1, "A_load_order": 0, "NUM_STAGES": 5, "num_warps": 4, "num_ctas": 1, "num_stages": 5}, "(4, 9728, 2560, 2560, 1, 408)": {"BLOCK_SIZE_M": 16, "BLOCK_SIZE_N": 32, "BLOCK_SIZE_K": 256, "GROUP_SIZE_M": 8, "SPLIT_K": 1, "A_load_order": 0, "NUM_STAGES": 5, "num_warps": 4, "num_ctas": 1, "num_stages": 5}, "(8, 4096, 2560, 2560, 1, 408)": {"BLOCK_SIZE_M": 16, "BLOCK_SIZE_N": 64, "BLOCK_SIZE_K": 512, "GROUP_SIZE_M": 8, "SPLIT_K": 1, "A_load_order": 0, "NUM_STAGES": 2, "num_warps": 4, "num_ctas": 1, "num_stages": 2}, "(8, 1024, 2560, 2560, 1, 408)": {"BLOCK_SIZE_M": 16, "BLOCK_SIZE_N": 32, "BLOCK_SIZE_K": 256, "GROUP_SIZE_M": 8, "SPLIT_K": 1, "A_load_order": 0, "NUM_STAGES": 5, "num_warps": 4, "num_ctas": 1, "num_stages": 5}, "(8, 9728, 2560, 2560, 1, 408)": {"BLOCK_SIZE_M": 16, "BLOCK_SIZE_N": 32, "BLOCK_SIZE_K": 256, "GROUP_SIZE_M": 8, "SPLIT_K": 1, "A_load_order": 0, "NUM_STAGES": 5, "num_warps": 4, "num_ctas": 1, "num_stages": 5}, "(16, 4096, 2560, 2560, 1, 408)": {"BLOCK_SIZE_M": 16, "BLOCK_SIZE_N": 64, "BLOCK_SIZE_K": 512, "GROUP_SIZE_M": 8, "SPLIT_K": 1, "A_load_order": 0, "NUM_STAGES": 2, "num_warps": 4, "num_ctas": 1, "num_stages": 2}, "(16, 1024, 2560, 2560, 1, 408)": {"BLOCK_SIZE_M": 16, "BLOCK_SIZE_N": 32, "BLOCK_SIZE_K": 256, "GROUP_SIZE_M": 8, "SPLIT_K": 1, "A_load_order": 0, "NUM_STAGES": 5, "num_warps": 4, "num_ctas": 1, "num_stages": 5}, "(16, 9728, 2560, 2560, 1, 408)": {"BLOCK_SIZE_M": 16, "BLOCK_SIZE_N": 32, "BLOCK_SIZE_K": 512, "GROUP_SIZE_M": 8, "SPLIT_K": 1, "A_load_order": 0, "NUM_STAGES": 4, "num_warps": 4, "num_ctas": 1, "num_stages": 4}, "(24, 4096, 2560, 2560, 1, 408)": {"BLOCK_SIZE_M": 16, "BLOCK_SIZE_N": 128, "BLOCK_SIZE_K": 256, "GROUP_SIZE_M": 8, "SPLIT_K": 1, "A_load_order": 0, "NUM_STAGES": 2, "num_warps": 4, "num_ctas": 1, "num_stages": 2}, "(24, 1024, 2560, 2560, 1, 408)": {"BLOCK_SIZE_M": 16, "BLOCK_SIZE_N": 32, "BLOCK_SIZE_K": 256, "GROUP_SIZE_M": 8, "SPLIT_K": 1, "A_load_order": 0, "NUM_STAGES": 5, "num_warps": 4, "num_ctas": 1, "num_stages": 5}, "(24, 9728, 2560, 2560, 1, 408)": {"BLOCK_SIZE_M": 16, "BLOCK_SIZE_N": 64, "BLOCK_SIZE_K": 512, "GROUP_SIZE_M": 8, "SPLIT_K": 1, "A_load_order": 0, "NUM_STAGES": 2, "num_warps": 4, "num_ctas": 1, "num_stages": 2}, "(32, 4096, 2560, 2560, 1, 408)": {"BLOCK_SIZE_M": 16, "BLOCK_SIZE_N": 128, "BLOCK_SIZE_K": 256, "GROUP_SIZE_M": 8, "SPLIT_K": 1, "A_load_order": 0, "NUM_STAGES": 2, "num_warps": 4, "num_ctas": 1, "num_stages": 2}, "(32, 1024, 2560, 2560, 1, 408)": {"BLOCK_SIZE_M": 16, "BLOCK_SIZE_N": 32, "BLOCK_SIZE_K": 256, "GROUP_SIZE_M": 8, "SPLIT_K": 1, "A_load_order": 0, "NUM_STAGES": 5, "num_warps": 4, "num_ctas": 1, "num_stages": 5}, "(32, 9728, 2560, 2560, 1, 408)": {"BLOCK_SIZE_M": 16, "BLOCK_SIZE_N": 64, "BLOCK_SIZE_K": 512, "GROUP_SIZE_M": 8, "SPLIT_K": 1, "A_load_order": 0, "NUM_STAGES": 2, "num_warps": 4, "num_ctas": 1, "num_stages": 2}, "(48, 4096, 2560, 2560, 1, 408)": {"BLOCK_SIZE_M": 32, "BLOCK_SIZE_N": 128, "BLOCK_SIZE_K": 256, "GROUP_SIZE_M": 8, "SPLIT_K": 1, "A_load_order": 0, "NUM_STAGES": 2, "num_warps": 4, "num_ctas": 1, "num_stages": 2}, "(48, 1024, 2560, 2560, 1, 408)": {"BLOCK_SIZE_M": 32, "BLOCK_SIZE_N": 64, "BLOCK_SIZE_K": 256, "GROUP_SIZE_M": 8, "SPLIT_K": 1, "A_load_order": 2, "NUM_STAGES": 4, "num_warps": 4, "num_ctas": 1, "num_stages": 4}, "(48, 9728, 2560, 2560, 1, 408)": {"BLOCK_SIZE_M": 32, "BLOCK_SIZE_N": 64, "BLOCK_SIZE_K": 512, "GROUP_SIZE_M": 8, "SPLIT_K": 1, "A_load_order": 0, "NUM_STAGES": 2, "num_warps": 4, "num_ctas": 1, "num_stages": 2}, "(64, 4096, 2560, 2560, 1, 408)": {"BLOCK_SIZE_M": 32, "BLOCK_SIZE_N": 128, "BLOCK_SIZE_K": 256, "GROUP_SIZE_M": 8, "SPLIT_K": 1, "A_load_order": 0, "NUM_STAGES": 2, "num_warps": 4, "num_ctas": 1, "num_stages": 2}, "(64, 1024, 2560, 2560, 1, 408)": {"BLOCK_SIZE_M": 32, "BLOCK_SIZE_N": 64, "BLOCK_SIZE_K": 256, "GROUP_SIZE_M": 8, "SPLIT_K": 1, "A_load_order": 2, "NUM_STAGES": 4, "num_warps": 4, "num_ctas": 1, "num_stages": 4}, "(64, 9728, 2560, 2560, 1, 408)": {"BLOCK_SIZE_M": 32, "BLOCK_SIZE_N": 128, "BLOCK_SIZE_K": 256, "GROUP_SIZE_M": 8, "SPLIT_K": 1, "A_load_order": 0, "NUM_STAGES": 2, "num_warps": 4, "num_ctas": 1, "num_stages": 2}, "(2, 4096, 2560, 2560, 1, 308)": {"BLOCK_SIZE_M": 16, "BLOCK_SIZE_N": 32, "BLOCK_SIZE_K": 256, "GROUP_SIZE_M": 8, "SPLIT_K": 1, "A_load_order": 0, "NUM_STAGES": 5, "num_warps": 4, "num_ctas": 1, "num_stages": 5}, "(2, 1024, 2560, 2560, 1, 308)": {"BLOCK_SIZE_M": 16, "BLOCK_SIZE_N": 32, "BLOCK_SIZE_K": 256, "GROUP_SIZE_M": 8, "SPLIT_K": 1, "A_load_order": 0, "NUM_STAGES": 5, "num_warps": 4, "num_ctas": 1, "num_stages": 5}, "(2, 9728, 2560, 2560, 1, 308)": {"BLOCK_SIZE_M": 16, "BLOCK_SIZE_N": 32, "BLOCK_SIZE_K": 256, "GROUP_SIZE_M": 8, "SPLIT_K": 1, "A_load_order": 0, "NUM_STAGES": 5, "num_warps": 4, "num_ctas": 1, "num_stages": 5}, "(4, 4096, 2560, 2560, 1, 308)": {"BLOCK_SIZE_M": 16, "BLOCK_SIZE_N": 32, "BLOCK_SIZE_K": 512, "GROUP_SIZE_M": 8, "SPLIT_K": 1, "A_load_order": 0, "NUM_STAGES": 4, "num_warps": 4, "num_ctas": 1, "num_stages": 4}, "(4, 1024, 2560, 2560, 1, 308)": {"BLOCK_SIZE_M": 16, "BLOCK_SIZE_N": 32, "BLOCK_SIZE_K": 512, "GROUP_SIZE_M": 8, "SPLIT_K": 1, "A_load_order": 0, "NUM_STAGES": 4, "num_warps": 4, "num_ctas": 1, "num_stages": 4}, "(4, 9728, 2560, 2560, 1, 308)": {"BLOCK_SIZE_M": 16, "BLOCK_SIZE_N": 32, "BLOCK_SIZE_K": 256, "GROUP_SIZE_M": 8, "SPLIT_K": 1, "A_load_order": 0, "NUM_STAGES": 5, "num_warps": 4, "num_ctas": 1, "num_stages": 5}, "(8, 4096, 2560, 2560, 1, 308)": {"BLOCK_SIZE_M": 16, "BLOCK_SIZE_N": 64, "BLOCK_SIZE_K": 512, "GROUP_SIZE_M": 8, "SPLIT_K": 1, "A_load_order": 0, "NUM_STAGES": 2, "num_warps": 4, "num_ctas": 1, "num_stages": 2}, "(8, 1024, 2560, 2560, 1, 308)": {"BLOCK_SIZE_M": 16, "BLOCK_SIZE_N": 32, "BLOCK_SIZE_K": 256, "GROUP_SIZE_M": 8, "SPLIT_K": 1, "A_load_order": 0, "NUM_STAGES": 5, "num_warps": 4, "num_ctas": 1, "num_stages": 5}, "(8, 9728, 2560, 2560, 1, 308)": {"BLOCK_SIZE_M": 16, "BLOCK_SIZE_N": 64, "BLOCK_SIZE_K": 256, "GROUP_SIZE_M": 8, "SPLIT_K": 1, "A_load_order": 2, "NUM_STAGES": 4, "num_warps": 4, "num_ctas": 1, "num_stages": 4}, "(16, 4096, 2560, 2560, 1, 308)": {"BLOCK_SIZE_M": 16, "BLOCK_SIZE_N": 64, "BLOCK_SIZE_K": 512, "GROUP_SIZE_M": 8, "SPLIT_K": 1, "A_load_order": 0, "NUM_STAGES": 2, "num_warps": 4, "num_ctas": 1, "num_stages": 2}, "(16, 1024, 2560, 2560, 1, 308)": {"BLOCK_SIZE_M": 16, "BLOCK_SIZE_N": 32, "BLOCK_SIZE_K": 256, "GROUP_SIZE_M": 8, "SPLIT_K": 1, "A_load_order": 0, "NUM_STAGES": 5, "num_warps": 4, "num_ctas": 1, "num_stages": 5}, "(16, 9728, 2560, 2560, 1, 308)": {"BLOCK_SIZE_M": 16, "BLOCK_SIZE_N": 32, "BLOCK_SIZE_K": 256, "GROUP_SIZE_M": 8, "SPLIT_K": 1, "A_load_order": 0, "NUM_STAGES": 5, "num_warps": 4, "num_ctas": 1, "num_stages": 5}, "(24, 4096, 2560, 2560, 1, 308)": {"BLOCK_SIZE_M": 16, "BLOCK_SIZE_N": 128, "BLOCK_SIZE_K": 256, "GROUP_SIZE_M": 8, "SPLIT_K": 1, "A_load_order": 0, "NUM_STAGES": 2, "num_warps": 4, "num_ctas": 1, "num_stages": 2}, "(24, 1024, 2560, 2560, 1, 308)": {"BLOCK_SIZE_M": 16, "BLOCK_SIZE_N": 32, "BLOCK_SIZE_K": 256, "GROUP_SIZE_M": 8, "SPLIT_K": 1, "A_load_order": 0, "NUM_STAGES": 5, "num_warps": 4, "num_ctas": 1, "num_stages": 5}, "(24, 9728, 2560, 2560, 1, 308)": {"BLOCK_SIZE_M": 16, "BLOCK_SIZE_N": 64, "BLOCK_SIZE_K": 512, "GROUP_SIZE_M": 8, "SPLIT_K": 1, "A_load_order": 0, "NUM_STAGES": 2, "num_warps": 4, "num_ctas": 1, "num_stages": 2}, "(32, 4096, 2560, 2560, 1, 308)": {"BLOCK_SIZE_M": 16, "BLOCK_SIZE_N": 128, "BLOCK_SIZE_K": 256, "GROUP_SIZE_M": 8, "SPLIT_K": 1, "A_load_order": 0, "NUM_STAGES": 2, "num_warps": 4, "num_ctas": 1, "num_stages": 2}, "(32, 1024, 2560, 2560, 1, 308)": {"BLOCK_SIZE_M": 16, "BLOCK_SIZE_N": 32, "BLOCK_SIZE_K": 256, "GROUP_SIZE_M": 8, "SPLIT_K": 1, "A_load_order": 0, "NUM_STAGES": 5, "num_warps": 4, "num_ctas": 1, "num_stages": 5}, "(32, 9728, 2560, 2560, 1, 308)": {"BLOCK_SIZE_M": 16, "BLOCK_SIZE_N": 64, "BLOCK_SIZE_K": 512, "GROUP_SIZE_M": 8, "SPLIT_K": 1, "A_load_order": 0, "NUM_STAGES": 2, "num_warps": 4, "num_ctas": 1, "num_stages": 2}, "(48, 4096, 2560, 2560, 1, 308)": {"BLOCK_SIZE_M": 32, "BLOCK_SIZE_N": 128, "BLOCK_SIZE_K": 256, "GROUP_SIZE_M": 8, "SPLIT_K": 1, "A_load_order": 0, "NUM_STAGES": 2, "num_warps": 4, "num_ctas": 1, "num_stages": 2}, "(48, 1024, 2560, 2560, 1, 308)": {"BLOCK_SIZE_M": 32, "BLOCK_SIZE_N": 64, "BLOCK_SIZE_K": 256, "GROUP_SIZE_M": 8, "SPLIT_K": 1, "A_load_order": 2, "NUM_STAGES": 4, "num_warps": 4, "num_ctas": 1, "num_stages": 4}, "(48, 9728, 2560, 2560, 1, 308)": {"BLOCK_SIZE_M": 32, "BLOCK_SIZE_N": 64, "BLOCK_SIZE_K": 512, "GROUP_SIZE_M": 8, "SPLIT_K": 1, "A_load_order": 0, "NUM_STAGES": 2, "num_warps": 4, "num_ctas": 1, "num_stages": 2}, "(64, 4096, 2560, 2560, 1, 308)": {"BLOCK_SIZE_M": 32, "BLOCK_SIZE_N": 128, "BLOCK_SIZE_K": 256, "GROUP_SIZE_M": 8, "SPLIT_K": 1, "A_load_order": 0, "NUM_STAGES": 2, "num_warps": 4, "num_ctas": 1, "num_stages": 2}, "(64, 1024, 2560, 2560, 1, 308)": {"BLOCK_SIZE_M": 32, "BLOCK_SIZE_N": 64, "BLOCK_SIZE_K": 256, "GROUP_SIZE_M": 8, "SPLIT_K": 1, "A_load_order": 2, "NUM_STAGES": 4, "num_warps": 4, "num_ctas": 1, "num_stages": 4}, "(64, 9728, 2560, 2560, 1, 308)": {"BLOCK_SIZE_M": 32, "BLOCK_SIZE_N": 128, "BLOCK_SIZE_K": 256, "GROUP_SIZE_M": 8, "SPLIT_K": 1, "A_load_order": 0, "NUM_STAGES": 2, "num_warps": 4, "num_ctas": 1, "num_stages": 2}}, "GEMM": {"(96, 3072, 1024, 1024, 1, 108)": {"BLOCK_SIZE_M": 64, "BLOCK_SIZE_N": 64, "BLOCK_SIZE_K": 256, "GROUP_SIZE_M": 8, "A_load_order": 2, "NUM_STAGES": 2, "num_warps": 8, "num_ctas": 1, "num_stages": 2}, "(128, 3072, 1024, 1024, 1, 108)": {"BLOCK_SIZE_M": 64, "BLOCK_SIZE_N": 64, "BLOCK_SIZE_K": 256, "GROUP_SIZE_M": 8, "A_load_order": 2, "NUM_STAGES": 2, "num_warps": 8, "num_ctas": 1, "num_stages": 2}, "(192, 3072, 1024, 1024, 1, 108)": {"BLOCK_SIZE_M": 64, "BLOCK_SIZE_N": 256, "BLOCK_SIZE_K": 64, "GROUP_SIZE_M": 8, "A_load_order": 2, "NUM_STAGES": 4, "num_warps": 8, "num_ctas": 1, "num_stages": 4}, "(256, 3072, 1024, 1024, 1, 108)": {"BLOCK_SIZE_M": 64, "BLOCK_SIZE_N": 256, "BLOCK_SIZE_K": 64, "GROUP_SIZE_M": 8, "A_load_order": 2, "NUM_STAGES": 4, "num_warps": 8, "num_ctas": 1, "num_stages": 4}, "(384, 3072, 1024, 1024, 1, 108)": {"BLOCK_SIZE_M": 64, "BLOCK_SIZE_N": 64, "BLOCK_SIZE_K": 256, "GROUP_SIZE_M": 8, "A_load_order": 2, "NUM_STAGES": 2, "num_warps": 8, "num_ctas": 1, "num_stages": 2}, "(512, 3072, 1024, 1024, 1, 108)": {"BLOCK_SIZE_M": 64, "BLOCK_SIZE_N": 256, "BLOCK_SIZE_K": 64, "GROUP_SIZE_M": 8, "A_load_order": 2, "NUM_STAGES": 4, "num_warps": 8, "num_ctas": 1, "num_stages": 4}, "(768, 3072, 1024, 1024, 1, 108)": {"BLOCK_SIZE_M": 64, "BLOCK_SIZE_N": 256, "BLOCK_SIZE_K": 64, "GROUP_SIZE_M": 8, "A_load_order": 2, "NUM_STAGES": 4, "num_warps": 8, "num_ctas": 1, "num_stages": 4}, "(1024, 3072, 1024, 1024, 1, 108)": {"BLOCK_SIZE_M": 64, "BLOCK_SIZE_N": 256, "BLOCK_SIZE_K": 64, "GROUP_SIZE_M": 8, "A_load_order": 2, "NUM_STAGES": 4, "num_warps": 8, "num_ctas": 1, "num_stages": 4}, "(1536, 3072, 1024, 1024, 1, 108)": {"BLOCK_SIZE_M": 64, "BLOCK_SIZE_N": 256, "BLOCK_SIZE_K": 64, "GROUP_SIZE_M": 8, "A_load_order": 2, "NUM_STAGES": 4, "num_warps": 8, "num_ctas": 1, "num_stages": 4}, "(2048, 3072, 1024, 1024, 1, 108)": {"BLOCK_SIZE_M": 64, "BLOCK_SIZE_N": 256, "BLOCK_SIZE_K": 64, "GROUP_SIZE_M": 8, "A_load_order": 2, "NUM_STAGES": 4, "num_warps": 8, "num_ctas": 1, "num_stages": 4}, "(3072, 3072, 1024, 1024, 1, 108)": {"BLOCK_SIZE_M": 64, "BLOCK_SIZE_N": 256, "BLOCK_SIZE_K": 64, "GROUP_SIZE_M": 8, "A_load_order": 2, "NUM_STAGES": 4, "num_warps": 8, "num_ctas": 1, "num_stages": 4}, "(4096, 3072, 1024, 1024, 1, 108)": {"BLOCK_SIZE_M": 64, "BLOCK_SIZE_N": 256, "BLOCK_SIZE_K": 64, "GROUP_SIZE_M": 8, "A_load_order": 2, "NUM_STAGES": 4, "num_warps": 8, "num_ctas": 1, "num_stages": 4}, "(96, 1024, 1024, 1024, 1, 108)": {"BLOCK_SIZE_M": 64, "BLOCK_SIZE_N": 64, "BLOCK_SIZE_K": 128, "GROUP_SIZE_M": 8, "A_load_order": 0, "NUM_STAGES": 4, "num_warps": 8, "num_ctas": 1, "num_stages": 4}, "(128, 1024, 1024, 1024, 1, 108)": {"BLOCK_SIZE_M": 64, "BLOCK_SIZE_N": 64, "BLOCK_SIZE_K": 128, "GROUP_SIZE_M": 8, "A_load_order": 0, "NUM_STAGES": 4, "num_warps": 8, "num_ctas": 1, "num_stages": 4}, "(192, 1024, 1024, 1024, 1, 108)": {"BLOCK_SIZE_M": 64, "BLOCK_SIZE_N": 64, "BLOCK_SIZE_K": 128, "GROUP_SIZE_M": 8, "A_load_order": 0, "NUM_STAGES": 4, "num_warps": 8, "num_ctas": 1, "num_stages": 4}, "(256, 1024, 1024, 1024, 1, 108)": {"BLOCK_SIZE_M": 64, "BLOCK_SIZE_N": 64, "BLOCK_SIZE_K": 256, "GROUP_SIZE_M": 8, "A_load_order": 2, "NUM_STAGES": 2, "num_warps": 8, "num_ctas": 1, "num_stages": 2}, "(384, 1024, 1024, 1024, 1, 108)": {"BLOCK_SIZE_M": 64, "BLOCK_SIZE_N": 64, "BLOCK_SIZE_K": 256, "GROUP_SIZE_M": 8, "A_load_order": 2, "NUM_STAGES": 2, "num_warps": 8, "num_ctas": 1, "num_stages": 2}, "(512, 1024, 1024, 1024, 1, 108)": {"BLOCK_SIZE_M": 64, "BLOCK_SIZE_N": 256, "BLOCK_SIZE_K": 64, "GROUP_SIZE_M": 8, "A_load_order": 2, "NUM_STAGES": 4, "num_warps": 8, "num_ctas": 1, "num_stages": 4}, "(768, 1024, 1024, 1024, 1, 108)": {"BLOCK_SIZE_M": 64, "BLOCK_SIZE_N": 256, "BLOCK_SIZE_K": 64, "GROUP_SIZE_M": 8, "A_load_order": 2, "NUM_STAGES": 4, "num_warps": 8, "num_ctas": 1, "num_stages": 4}, "(1024, 1024, 1024, 1024, 1, 108)": {"BLOCK_SIZE_M": 64, "BLOCK_SIZE_N": 128, "BLOCK_SIZE_K": 64, "GROUP_SIZE_M": 8, "A_load_order": 0, "NUM_STAGES": 5, "num_warps": 4, "num_ctas": 1, "num_stages": 5}, "(1536, 1024, 1024, 1024, 1, 108)": {"BLOCK_SIZE_M": 64, "BLOCK_SIZE_N": 256, "BLOCK_SIZE_K": 64, "GROUP_SIZE_M": 8, "A_load_order": 2, "NUM_STAGES": 4, "num_warps": 8, "num_ctas": 1, "num_stages": 4}, "(2048, 1024, 1024, 1024, 1, 108)": {"BLOCK_SIZE_M": 64, "BLOCK_SIZE_N": 128, "BLOCK_SIZE_K": 64, "GROUP_SIZE_M": 8, "A_load_order": 0, "NUM_STAGES": 5, "num_warps": 4, "num_ctas": 1, "num_stages": 5}, "(3072, 1024, 1024, 1024, 1, 108)": {"BLOCK_SIZE_M": 64, "BLOCK_SIZE_N": 256, "BLOCK_SIZE_K": 64, "GROUP_SIZE_M": 8, "A_load_order": 2, "NUM_STAGES": 4, "num_warps": 8, "num_ctas": 1, "num_stages": 4}, "(4096, 1024, 1024, 1024, 1, 108)": {"BLOCK_SIZE_M": 64, "BLOCK_SIZE_N": 256, "BLOCK_SIZE_K": 64, "GROUP_SIZE_M": 8, "A_load_order": 2, "NUM_STAGES": 4, "num_warps": 8, "num_ctas": 1, "num_stages": 4}, "(96, 1024, 4096, 4096, 1, 108)": {"BLOCK_SIZE_M": 64, "BLOCK_SIZE_N": 64, "BLOCK_SIZE_K": 128, "GROUP_SIZE_M": 8, "A_load_order": 0, "NUM_STAGES": 4, "num_warps": 8, "num_ctas": 1, "num_stages": 4}, "(128, 1024, 4096, 4096, 1, 108)": {"BLOCK_SIZE_M": 64, "BLOCK_SIZE_N": 64, "BLOCK_SIZE_K": 128, "GROUP_SIZE_M": 8, "A_load_order": 0, "NUM_STAGES": 4, "num_warps": 8, "num_ctas": 1, "num_stages": 4}, "(192, 1024, 4096, 4096, 1, 108)": {"BLOCK_SIZE_M": 64, "BLOCK_SIZE_N": 64, "BLOCK_SIZE_K": 128, "GROUP_SIZE_M": 8, "A_load_order": 0, "NUM_STAGES": 4, "num_warps": 8, "num_ctas": 1, "num_stages": 4}, "(256, 1024, 4096, 4096, 1, 108)": {"BLOCK_SIZE_M": 64, "BLOCK_SIZE_N": 128, "BLOCK_SIZE_K": 64, "GROUP_SIZE_M": 8, "A_load_order": 0, "NUM_STAGES": 5, "num_warps": 4, "num_ctas": 1, "num_stages": 5}, "(384, 1024, 4096, 4096, 1, 108)": {"BLOCK_SIZE_M": 64, "BLOCK_SIZE_N": 128, "BLOCK_SIZE_K": 64, "GROUP_SIZE_M": 8, "A_load_order": 0, "NUM_STAGES": 5, "num_warps": 4, "num_ctas": 1, "num_stages": 5}, "(512, 1024, 4096, 4096, 1, 108)": {"BLOCK_SIZE_M": 64, "BLOCK_SIZE_N": 256, "BLOCK_SIZE_K": 64, "GROUP_SIZE_M": 8, "A_load_order": 2, "NUM_STAGES": 4, "num_warps": 8, "num_ctas": 1, "num_stages": 4}, "(768, 1024, 4096, 4096, 1, 108)": {"BLOCK_SIZE_M": 64, "BLOCK_SIZE_N": 256, "BLOCK_SIZE_K": 64, "GROUP_SIZE_M": 8, "A_load_order": 2, "NUM_STAGES": 4, "num_warps": 8, "num_ctas": 1, "num_stages": 4}, "(1024, 1024, 4096, 4096, 1, 108)": {"BLOCK_SIZE_M": 64, "BLOCK_SIZE_N": 64, "BLOCK_SIZE_K": 64, "GROUP_SIZE_M": 8, "A_load_order": 0, "NUM_STAGES": 4, "num_warps": 4, "num_ctas": 1, "num_stages": 4}, "(1536, 1024, 4096, 4096, 1, 108)": {"BLOCK_SIZE_M": 64, "BLOCK_SIZE_N": 256, "BLOCK_SIZE_K": 64, "GROUP_SIZE_M": 8, "A_load_order": 2, "NUM_STAGES": 4, "num_warps": 8, "num_ctas": 1, "num_stages": 4}, "(2048, 1024, 4096, 4096, 1, 108)": {"BLOCK_SIZE_M": 64, "BLOCK_SIZE_N": 64, "BLOCK_SIZE_K": 64, "GROUP_SIZE_M": 8, "A_load_order": 0, "NUM_STAGES": 4, "num_warps": 4, "num_ctas": 1, "num_stages": 4}, "(3072, 1024, 4096, 4096, 1, 108)": {"BLOCK_SIZE_M": 64, "BLOCK_SIZE_N": 128, "BLOCK_SIZE_K": 64, "GROUP_SIZE_M": 8, "A_load_order": 0, "NUM_STAGES": 5, "num_warps": 4, "num_ctas": 1, "num_stages": 5}, "(4096, 1024, 4096, 4096, 1, 108)": {"BLOCK_SIZE_M": 64, "BLOCK_SIZE_N": 256, "BLOCK_SIZE_K": 64, "GROUP_SIZE_M": 8, "A_load_order": 2, "NUM_STAGES": 4, "num_warps": 8, "num_ctas": 1, "num_stages": 4}, "(96, 2560, 4096, 4096, 1, 108)": {"BLOCK_SIZE_M": 64, "BLOCK_SIZE_N": 64, "BLOCK_SIZE_K": 256, "GROUP_SIZE_M": 8, "A_load_order": 2, "NUM_STAGES": 2, "num_warps": 8, "num_ctas": 1, "num_stages": 2}, "(128, 2560, 4096, 4096, 1, 108)": {"BLOCK_SIZE_M": 64, "BLOCK_SIZE_N": 64, "BLOCK_SIZE_K": 256, "GROUP_SIZE_M": 8, "A_load_order": 2, "NUM_STAGES": 2, "num_warps": 8, "num_ctas": 1, "num_stages": 2}, "(192, 2560, 4096, 4096, 1, 108)": {"BLOCK_SIZE_M": 64, "BLOCK_SIZE_N": 256, "BLOCK_SIZE_K": 64, "GROUP_SIZE_M": 8, "A_load_order": 2, "NUM_STAGES": 4, "num_warps": 8, "num_ctas": 1, "num_stages": 4}, "(256, 2560, 4096, 4096, 1, 108)": {"BLOCK_SIZE_M": 64, "BLOCK_SIZE_N": 256, "BLOCK_SIZE_K": 64, "GROUP_SIZE_M": 8, "A_load_order": 2, "NUM_STAGES": 4, "num_warps": 8, "num_ctas": 1, "num_stages": 4}, "(384, 2560, 4096, 4096, 1, 108)": {"BLOCK_SIZE_M": 64, "BLOCK_SIZE_N": 64, "BLOCK_SIZE_K": 64, "GROUP_SIZE_M": 8, "A_load_order": 0, "NUM_STAGES": 4, "num_warps": 4, "num_ctas": 1, "num_stages": 4}, "(512, 2560, 4096, 4096, 1, 108)": {"BLOCK_SIZE_M": 64, "BLOCK_SIZE_N": 128, "BLOCK_SIZE_K": 64, "GROUP_SIZE_M": 8, "A_load_order": 0, "NUM_STAGES": 5, "num_warps": 4, "num_ctas": 1, "num_stages": 5}, "(768, 2560, 4096, 4096, 1, 108)": {"BLOCK_SIZE_M": 64, "BLOCK_SIZE_N": 64, "BLOCK_SIZE_K": 64, "GROUP_SIZE_M": 8, "A_load_order": 0, "NUM_STAGES": 4, "num_warps": 4, "num_ctas": 1, "num_stages": 4}, "(1024, 2560, 4096, 4096, 1, 108)": {"BLOCK_SIZE_M": 64, "BLOCK_SIZE_N": 256, "BLOCK_SIZE_K": 64, "GROUP_SIZE_M": 8, "A_load_order": 2, "NUM_STAGES": 4, "num_warps": 8, "num_ctas": 1, "num_stages": 4}, "(1536, 2560, 4096, 4096, 1, 108)": {"BLOCK_SIZE_M": 64, "BLOCK_SIZE_N": 128, "BLOCK_SIZE_K": 64, "GROUP_SIZE_M": 8, "A_load_order": 0, "NUM_STAGES": 5, "num_warps": 4, "num_ctas": 1, "num_stages": 5}, "(2048, 2560, 4096, 4096, 1, 108)": {"BLOCK_SIZE_M": 64, "BLOCK_SIZE_N": 256, "BLOCK_SIZE_K": 64, "GROUP_SIZE_M": 8, "A_load_order": 2, "NUM_STAGES": 4, "num_warps": 8, "num_ctas": 1, "num_stages": 4}, "(3072, 2560, 4096, 4096, 1, 108)": {"BLOCK_SIZE_M": 64, "BLOCK_SIZE_N": 256, "BLOCK_SIZE_K": 64, "GROUP_SIZE_M": 8, "A_load_order": 2, "NUM_STAGES": 4, "num_warps": 8, "num_ctas": 1, "num_stages": 4}, "(4096, 2560, 4096, 4096, 1, 108)": {"BLOCK_SIZE_M": 64, "BLOCK_SIZE_N": 256, "BLOCK_SIZE_K": 64, "GROUP_SIZE_M": 8, "A_load_order": 2, "NUM_STAGES": 4, "num_warps": 8, "num_ctas": 1, "num_stages": 4}, "(96, 6144, 2560, 2560, 1, 108)": {"BLOCK_SIZE_M": 64, "BLOCK_SIZE_N": 64, "BLOCK_SIZE_K": 256, "GROUP_SIZE_M": 8, "A_load_order": 2, "NUM_STAGES": 2, "num_warps": 8, "num_ctas": 1, "num_stages": 2}, "(128, 6144, 2560, 2560, 1, 108)": {"BLOCK_SIZE_M": 64, "BLOCK_SIZE_N": 64, "BLOCK_SIZE_K": 256, "GROUP_SIZE_M": 8, "A_load_order": 2, "NUM_STAGES": 2, "num_warps": 8, "num_ctas": 1, "num_stages": 2}, "(192, 6144, 2560, 2560, 1, 108)": {"BLOCK_SIZE_M": 64, "BLOCK_SIZE_N": 64, "BLOCK_SIZE_K": 128, "GROUP_SIZE_M": 8, "A_load_order": 0, "NUM_STAGES": 4, "num_warps": 8, "num_ctas": 1, "num_stages": 4}, "(256, 6144, 2560, 2560, 1, 108)": {"BLOCK_SIZE_M": 64, "BLOCK_SIZE_N": 256, "BLOCK_SIZE_K": 64, "GROUP_SIZE_M": 8, "A_load_order": 2, "NUM_STAGES": 4, "num_warps": 8, "num_ctas": 1, "num_stages": 4}, "(384, 6144, 2560, 2560, 1, 108)": {"BLOCK_SIZE_M": 64, "BLOCK_SIZE_N": 128, "BLOCK_SIZE_K": 64, "GROUP_SIZE_M": 8, "A_load_order": 0, "NUM_STAGES": 5, "num_warps": 4, "num_ctas": 1, "num_stages": 5}, "(512, 6144, 2560, 2560, 1, 108)": {"BLOCK_SIZE_M": 64, "BLOCK_SIZE_N": 256, "BLOCK_SIZE_K": 64, "GROUP_SIZE_M": 8, "A_load_order": 2, "NUM_STAGES": 4, "num_warps": 8, "num_ctas": 1, "num_stages": 4}, "(768, 6144, 2560, 2560, 1, 108)": {"BLOCK_SIZE_M": 64, "BLOCK_SIZE_N": 256, "BLOCK_SIZE_K": 64, "GROUP_SIZE_M": 8, "A_load_order": 2, "NUM_STAGES": 4, "num_warps": 8, "num_ctas": 1, "num_stages": 4}, "(1024, 6144, 2560, 2560, 1, 108)": {"BLOCK_SIZE_M": 64, "BLOCK_SIZE_N": 256, "BLOCK_SIZE_K": 64, "GROUP_SIZE_M": 8, "A_load_order": 2, "NUM_STAGES": 4, "num_warps": 8, "num_ctas": 1, "num_stages": 4}, "(1536, 6144, 2560, 2560, 1, 108)": {"BLOCK_SIZE_M": 64, "BLOCK_SIZE_N": 256, "BLOCK_SIZE_K": 64, "GROUP_SIZE_M": 8, "A_load_order": 2, "NUM_STAGES": 4, "num_warps": 8, "num_ctas": 1, "num_stages": 4}, "(2048, 6144, 2560, 2560, 1, 108)": {"BLOCK_SIZE_M": 64, "BLOCK_SIZE_N": 256, "BLOCK_SIZE_K": 64, "GROUP_SIZE_M": 8, "A_load_order": 2, "NUM_STAGES": 4, "num_warps": 8, "num_ctas": 1, "num_stages": 4}, "(3072, 6144, 2560, 2560, 1, 108)": {"BLOCK_SIZE_M": 64, "BLOCK_SIZE_N": 256, "BLOCK_SIZE_K": 64, "GROUP_SIZE_M": 8, "A_load_order": 2, "NUM_STAGES": 4, "num_warps": 8, "num_ctas": 1, "num_stages": 4}, "(4096, 6144, 2560, 2560, 1, 108)": {"BLOCK_SIZE_M": 64, "BLOCK_SIZE_N": 256, "BLOCK_SIZE_K": 64, "GROUP_SIZE_M": 8, "A_load_order": 2, "NUM_STAGES": 4, "num_warps": 8, "num_ctas": 1, "num_stages": 4}, "(96, 19456, 2560, 2560, 1, 108)": {"BLOCK_SIZE_M": 64, "BLOCK_SIZE_N": 64, "BLOCK_SIZE_K": 256, "GROUP_SIZE_M": 8, "A_load_order": 2, "NUM_STAGES": 2, "num_warps": 8, "num_ctas": 1, "num_stages": 2}, "(128, 19456, 2560, 2560, 1, 108)": {"BLOCK_SIZE_M": 64, "BLOCK_SIZE_N": 64, "BLOCK_SIZE_K": 256, "GROUP_SIZE_M": 8, "A_load_order": 2, "NUM_STAGES": 2, "num_warps": 8, "num_ctas": 1, "num_stages": 2}, "(192, 19456, 2560, 2560, 1, 108)": {"BLOCK_SIZE_M": 64, "BLOCK_SIZE_N": 128, "BLOCK_SIZE_K": 128, "GROUP_SIZE_M": 8, "A_load_order": 2, "NUM_STAGES": 3, "num_warps": 4, "num_ctas": 1, "num_stages": 3}, "(256, 19456, 2560, 2560, 1, 108)": {"BLOCK_SIZE_M": 64, "BLOCK_SIZE_N": 256, "BLOCK_SIZE_K": 64, "GROUP_SIZE_M": 8, "A_load_order": 2, "NUM_STAGES": 4, "num_warps": 8, "num_ctas": 1, "num_stages": 4}, "(384, 19456, 2560, 2560, 1, 108)": {"BLOCK_SIZE_M": 64, "BLOCK_SIZE_N": 256, "BLOCK_SIZE_K": 64, "GROUP_SIZE_M": 8, "A_load_order": 2, "NUM_STAGES": 4, "num_warps": 8, "num_ctas": 1, "num_stages": 4}, "(512, 19456, 2560, 2560, 1, 108)": {"BLOCK_SIZE_M": 64, "BLOCK_SIZE_N": 256, "BLOCK_SIZE_K": 64, "GROUP_SIZE_M": 8, "A_load_order": 2, "NUM_STAGES": 4, "num_warps": 8, "num_ctas": 1, "num_stages": 4}, "(768, 19456, 2560, 2560, 1, 108)": {"BLOCK_SIZE_M": 64, "BLOCK_SIZE_N": 256, "BLOCK_SIZE_K": 64, "GROUP_SIZE_M": 8, "A_load_order": 2, "NUM_STAGES": 4, "num_warps": 8, "num_ctas": 1, "num_stages": 4}, "(1024, 19456, 2560, 2560, 1, 108)": {"BLOCK_SIZE_M": 64, "BLOCK_SIZE_N": 256, "BLOCK_SIZE_K": 64, "GROUP_SIZE_M": 8, "A_load_order": 2, "NUM_STAGES": 4, "num_warps": 8, "num_ctas": 1, "num_stages": 4}, "(1536, 19456, 2560, 2560, 1, 108)": {"BLOCK_SIZE_M": 64, "BLOCK_SIZE_N": 256, "BLOCK_SIZE_K": 128, "GROUP_SIZE_M": 8, "A_load_order": 0, "NUM_STAGES": 2, "num_warps": 8, "num_ctas": 1, "num_stages": 2}, "(2048, 19456, 2560, 2560, 1, 108)": {"BLOCK_SIZE_M": 64, "BLOCK_SIZE_N": 256, "BLOCK_SIZE_K": 64, "GROUP_SIZE_M": 8, "A_load_order": 2, "NUM_STAGES": 4, "num_warps": 8, "num_ctas": 1, "num_stages": 4}, "(3072, 19456, 2560, 2560, 1, 108)": {"BLOCK_SIZE_M": 64, "BLOCK_SIZE_N": 256, "BLOCK_SIZE_K": 128, "GROUP_SIZE_M": 8, "A_load_order": 0, "NUM_STAGES": 2, "num_warps": 8, "num_ctas": 1, "num_stages": 2}, "(4096, 19456, 2560, 2560, 1, 108)": {"BLOCK_SIZE_M": 64, "BLOCK_SIZE_N": 256, "BLOCK_SIZE_K": 128, "GROUP_SIZE_M": 8, "A_load_order": 0, "NUM_STAGES": 2, "num_warps": 8, "num_ctas": 1, "num_stages": 2}, "(96, 2560, 9728, 9728, 1, 108)": {"BLOCK_SIZE_M": 64, "BLOCK_SIZE_N": 64, "BLOCK_SIZE_K": 256, "GROUP_SIZE_M": 8, "A_load_order": 2, "NUM_STAGES": 2, "num_warps": 8, "num_ctas": 1, "num_stages": 2}, "(128, 2560, 9728, 9728, 1, 108)": {"BLOCK_SIZE_M": 64, "BLOCK_SIZE_N": 64, "BLOCK_SIZE_K": 256, "GROUP_SIZE_M": 8, "A_load_order": 2, "NUM_STAGES": 2, "num_warps": 8, "num_ctas": 1, "num_stages": 2}, "(192, 2560, 9728, 9728, 1, 108)": {"BLOCK_SIZE_M": 64, "BLOCK_SIZE_N": 256, "BLOCK_SIZE_K": 64, "GROUP_SIZE_M": 8, "A_load_order": 2, "NUM_STAGES": 4, "num_warps": 8, "num_ctas": 1, "num_stages": 4}, "(256, 2560, 9728, 9728, 1, 108)": {"BLOCK_SIZE_M": 64, "BLOCK_SIZE_N": 256, "BLOCK_SIZE_K": 64, "GROUP_SIZE_M": 8, "A_load_order": 2, "NUM_STAGES": 4, "num_warps": 8, "num_ctas": 1, "num_stages": 4}, "(384, 2560, 9728, 9728, 1, 108)": {"BLOCK_SIZE_M": 64, "BLOCK_SIZE_N": 64, "BLOCK_SIZE_K": 64, "GROUP_SIZE_M": 8, "A_load_order": 0, "NUM_STAGES": 4, "num_warps": 4, "num_ctas": 1, "num_stages": 4}, "(512, 2560, 9728, 9728, 1, 108)": {"BLOCK_SIZE_M": 64, "BLOCK_SIZE_N": 128, "BLOCK_SIZE_K": 64, "GROUP_SIZE_M": 8, "A_load_order": 0, "NUM_STAGES": 5, "num_warps": 4, "num_ctas": 1, "num_stages": 5}, "(768, 2560, 9728, 9728, 1, 108)": {"BLOCK_SIZE_M": 64, "BLOCK_SIZE_N": 64, "BLOCK_SIZE_K": 64, "GROUP_SIZE_M": 8, "A_load_order": 0, "NUM_STAGES": 4, "num_warps": 4, "num_ctas": 1, "num_stages": 4}, "(1024, 2560, 9728, 9728, 1, 108)": {"BLOCK_SIZE_M": 64, "BLOCK_SIZE_N": 256, "BLOCK_SIZE_K": 64, "GROUP_SIZE_M": 8, "A_load_order": 2, "NUM_STAGES": 4, "num_warps": 8, "num_ctas": 1, "num_stages": 4}, "(1536, 2560, 9728, 9728, 1, 108)": {"BLOCK_SIZE_M": 64, "BLOCK_SIZE_N": 256, "BLOCK_SIZE_K": 64, "GROUP_SIZE_M": 8, "A_load_order": 2, "NUM_STAGES": 4, "num_warps": 8, "num_ctas": 1, "num_stages": 4}, "(2048, 2560, 9728, 9728, 1, 108)": {"BLOCK_SIZE_M": 64, "BLOCK_SIZE_N": 256, "BLOCK_SIZE_K": 64, "GROUP_SIZE_M": 8, "A_load_order": 2, "NUM_STAGES": 4, "num_warps": 8, "num_ctas": 1, "num_stages": 4}, "(3072, 2560, 9728, 9728, 1, 108)": {"BLOCK_SIZE_M": 64, "BLOCK_SIZE_N": 256, "BLOCK_SIZE_K": 64, "GROUP_SIZE_M": 8, "A_load_order": 2, "NUM_STAGES": 4, "num_warps": 8, "num_ctas": 1, "num_stages": 4}, "(4096, 2560, 9728, 9728, 1, 108)": {"BLOCK_SIZE_M": 64, "BLOCK_SIZE_N": 256, "BLOCK_SIZE_K": 128, "GROUP_SIZE_M": 8, "A_load_order": 0, "NUM_STAGES": 2, "num_warps": 8, "num_ctas": 1, "num_stages": 2}, "(96, 3072, 1024, 1024, 1, 308)": {"BLOCK_SIZE_M": 64, "BLOCK_SIZE_N": 128, "BLOCK_SIZE_K": 128, "GROUP_SIZE_M": 8, "A_load_order": 2, "NUM_STAGES": 4, "num_warps": 4, "num_ctas": 1, "num_stages": 4}, "(128, 3072, 1024, 1024, 1, 308)": {"BLOCK_SIZE_M": 64, "BLOCK_SIZE_N": 128, "BLOCK_SIZE_K": 128, "GROUP_SIZE_M": 8, "A_load_order": 2, "NUM_STAGES": 4, "num_warps": 4, "num_ctas": 1, "num_stages": 4}, "(192, 3072, 1024, 1024, 1, 308)": {"BLOCK_SIZE_M": 64, "BLOCK_SIZE_N": 128, "BLOCK_SIZE_K": 256, "GROUP_SIZE_M": 8, "A_load_order": 0, "NUM_STAGES": 2, "num_warps": 4, "num_ctas": 1, "num_stages": 2}, "(256, 3072, 1024, 1024, 1, 308)": {"BLOCK_SIZE_M": 64, "BLOCK_SIZE_N": 128, "BLOCK_SIZE_K": 256, "GROUP_SIZE_M": 8, "A_load_order": 0, "NUM_STAGES": 2, "num_warps": 4, "num_ctas": 1, "num_stages": 2}, "(384, 3072, 1024, 1024, 1, 308)": {"BLOCK_SIZE_M": 64, "BLOCK_SIZE_N": 128, "BLOCK_SIZE_K": 256, "GROUP_SIZE_M": 8, "A_load_order": 0, "NUM_STAGES": 2, "num_warps": 4, "num_ctas": 1, "num_stages": 2}, "(512, 3072, 1024, 1024, 1, 308)": {"BLOCK_SIZE_M": 64, "BLOCK_SIZE_N": 128, "BLOCK_SIZE_K": 256, "GROUP_SIZE_M": 8, "A_load_order": 0, "NUM_STAGES": 2, "num_warps": 4, "num_ctas": 1, "num_stages": 2}, "(768, 3072, 1024, 1024, 1, 308)": {"BLOCK_SIZE_M": 64, "BLOCK_SIZE_N": 128, "BLOCK_SIZE_K": 128, "GROUP_SIZE_M": 8, "A_load_order": 2, "NUM_STAGES": 4, "num_warps": 4, "num_ctas": 1, "num_stages": 4}, "(1024, 3072, 1024, 1024, 1, 308)": {"BLOCK_SIZE_M": 64, "BLOCK_SIZE_N": 128, "BLOCK_SIZE_K": 256, "GROUP_SIZE_M": 8, "A_load_order": 0, "NUM_STAGES": 2, "num_warps": 4, "num_ctas": 1, "num_stages": 2}, "(1536, 3072, 1024, 1024, 1, 308)": {"BLOCK_SIZE_M": 64, "BLOCK_SIZE_N": 128, "BLOCK_SIZE_K": 256, "GROUP_SIZE_M": 8, "A_load_order": 0, "NUM_STAGES": 2, "num_warps": 4, "num_ctas": 1, "num_stages": 2}, "(2048, 3072, 1024, 1024, 1, 308)": {"BLOCK_SIZE_M": 64, "BLOCK_SIZE_N": 128, "BLOCK_SIZE_K": 256, "GROUP_SIZE_M": 8, "A_load_order": 0, "NUM_STAGES": 2, "num_warps": 4, "num_ctas": 1, "num_stages": 2}, "(3072, 3072, 1024, 1024, 1, 308)": {"BLOCK_SIZE_M": 64, "BLOCK_SIZE_N": 128, "BLOCK_SIZE_K": 256, "GROUP_SIZE_M": 8, "A_load_order": 0, "NUM_STAGES": 2, "num_warps": 4, "num_ctas": 1, "num_stages": 2}, "(4096, 3072, 1024, 1024, 1, 308)": {"BLOCK_SIZE_M": 64, "BLOCK_SIZE_N": 128, "BLOCK_SIZE_K": 64, "GROUP_SIZE_M": 8, "A_load_order": 0, "NUM_STAGES": 5, "num_warps": 4, "num_ctas": 1, "num_stages": 5}, "(96, 1024, 1024, 1024, 1, 308)": {"BLOCK_SIZE_M": 64, "BLOCK_SIZE_N": 64, "BLOCK_SIZE_K": 128, "GROUP_SIZE_M": 8, "A_load_order": 0, "NUM_STAGES": 5, "num_warps": 8, "num_ctas": 1, "num_stages": 5}, "(128, 1024, 1024, 1024, 1, 308)": {"BLOCK_SIZE_M": 64, "BLOCK_SIZE_N": 32, "BLOCK_SIZE_K": 128, "GROUP_SIZE_M": 8, "A_load_order": 2, "NUM_STAGES": 4, "num_warps": 8, "num_ctas": 1, "num_stages": 4}, "(192, 1024, 1024, 1024, 1, 308)": {"BLOCK_SIZE_M": 64, "BLOCK_SIZE_N": 64, "BLOCK_SIZE_K": 128, "GROUP_SIZE_M": 8, "A_load_order": 0, "NUM_STAGES": 5, "num_warps": 8, "num_ctas": 1, "num_stages": 5}, "(256, 1024, 1024, 1024, 1, 308)": {"BLOCK_SIZE_M": 64, "BLOCK_SIZE_N": 128, "BLOCK_SIZE_K": 128, "GROUP_SIZE_M": 8, "A_load_order": 2, "NUM_STAGES": 4, "num_warps": 4, "num_ctas": 1, "num_stages": 4}, "(384, 1024, 1024, 1024, 1, 308)": {"BLOCK_SIZE_M": 64, "BLOCK_SIZE_N": 128, "BLOCK_SIZE_K": 128, "GROUP_SIZE_M": 8, "A_load_order": 2, "NUM_STAGES": 4, "num_warps": 4, "num_ctas": 1, "num_stages": 4}, "(512, 1024, 1024, 1024, 1, 308)": {"BLOCK_SIZE_M": 64, "BLOCK_SIZE_N": 128, "BLOCK_SIZE_K": 64, "GROUP_SIZE_M": 8, "A_load_order": 0, "NUM_STAGES": 5, "num_warps": 4, "num_ctas": 1, "num_stages": 5}, "(768, 1024, 1024, 1024, 1, 308)": {"BLOCK_SIZE_M": 64, "BLOCK_SIZE_N": 128, "BLOCK_SIZE_K": 64, "GROUP_SIZE_M": 8, "A_load_order": 0, "NUM_STAGES": 5, "num_warps": 4, "num_ctas": 1, "num_stages": 5}, "(1024, 1024, 1024, 1024, 1, 308)": {"BLOCK_SIZE_M": 64, "BLOCK_SIZE_N": 128, "BLOCK_SIZE_K": 64, "GROUP_SIZE_M": 8, "A_load_order": 0, "NUM_STAGES": 5, "num_warps": 4, "num_ctas": 1, "num_stages": 5}, "(1536, 1024, 1024, 1024, 1, 308)": {"BLOCK_SIZE_M": 64, "BLOCK_SIZE_N": 128, "BLOCK_SIZE_K": 256, "GROUP_SIZE_M": 8, "A_load_order": 0, "NUM_STAGES": 2, "num_warps": 4, "num_ctas": 1, "num_stages": 2}, "(2048, 1024, 1024, 1024, 1, 308)": {"BLOCK_SIZE_M": 64, "BLOCK_SIZE_N": 128, "BLOCK_SIZE_K": 256, "GROUP_SIZE_M": 8, "A_load_order": 0, "NUM_STAGES": 2, "num_warps": 4, "num_ctas": 1, "num_stages": 2}, "(3072, 1024, 1024, 1024, 1, 308)": {"BLOCK_SIZE_M": 64, "BLOCK_SIZE_N": 128, "BLOCK_SIZE_K": 256, "GROUP_SIZE_M": 8, "A_load_order": 0, "NUM_STAGES": 2, "num_warps": 4, "num_ctas": 1, "num_stages": 2}, "(4096, 1024, 1024, 1024, 1, 308)": {"BLOCK_SIZE_M": 64, "BLOCK_SIZE_N": 128, "BLOCK_SIZE_K": 256, "GROUP_SIZE_M": 8, "A_load_order": 0, "NUM_STAGES": 2, "num_warps": 4, "num_ctas": 1, "num_stages": 2}, "(96, 1024, 4096, 4096, 1, 308)": {"BLOCK_SIZE_M": 64, "BLOCK_SIZE_N": 64, "BLOCK_SIZE_K": 256, "GROUP_SIZE_M": 8, "A_load_order": 2, "NUM_STAGES": 3, "num_warps": 8, "num_ctas": 1, "num_stages": 3}, "(128, 1024, 4096, 4096, 1, 308)": {"BLOCK_SIZE_M": 64, "BLOCK_SIZE_N": 64, "BLOCK_SIZE_K": 256, "GROUP_SIZE_M": 8, "A_load_order": 2, "NUM_STAGES": 3, "num_warps": 8, "num_ctas": 1, "num_stages": 3}, "(192, 1024, 4096, 4096, 1, 308)": {"BLOCK_SIZE_M": 64, "BLOCK_SIZE_N": 64, "BLOCK_SIZE_K": 256, "GROUP_SIZE_M": 8, "A_load_order": 2, "NUM_STAGES": 3, "num_warps": 8, "num_ctas": 1, "num_stages": 3}, "(256, 1024, 4096, 4096, 1, 308)": {"BLOCK_SIZE_M": 64, "BLOCK_SIZE_N": 128, "BLOCK_SIZE_K": 128, "GROUP_SIZE_M": 8, "A_load_order": 2, "NUM_STAGES": 4, "num_warps": 4, "num_ctas": 1, "num_stages": 4}, "(384, 1024, 4096, 4096, 1, 308)": {"BLOCK_SIZE_M": 64, "BLOCK_SIZE_N": 128, "BLOCK_SIZE_K": 128, "GROUP_SIZE_M": 8, "A_load_order": 2, "NUM_STAGES": 4, "num_warps": 4, "num_ctas": 1, "num_stages": 4}, "(512, 1024, 4096, 4096, 1, 308)": {"BLOCK_SIZE_M": 64, "BLOCK_SIZE_N": 128, "BLOCK_SIZE_K": 64, "GROUP_SIZE_M": 8, "A_load_order": 0, "NUM_STAGES": 5, "num_warps": 4, "num_ctas": 1, "num_stages": 5}, "(768, 1024, 4096, 4096, 1, 308)": {"BLOCK_SIZE_M": 64, "BLOCK_SIZE_N": 128, "BLOCK_SIZE_K": 256, "GROUP_SIZE_M": 8, "A_load_order": 0, "NUM_STAGES": 2, "num_warps": 4, "num_ctas": 1, "num_stages": 2}, "(1024, 1024, 4096, 4096, 1, 308)": {"BLOCK_SIZE_M": 64, "BLOCK_SIZE_N": 128, "BLOCK_SIZE_K": 256, "GROUP_SIZE_M": 8, "A_load_order": 0, "NUM_STAGES": 2, "num_warps": 4, "num_ctas": 1, "num_stages": 2}, "(1536, 1024, 4096, 4096, 1, 308)": {"BLOCK_SIZE_M": 64, "BLOCK_SIZE_N": 128, "BLOCK_SIZE_K": 256, "GROUP_SIZE_M": 8, "A_load_order": 0, "NUM_STAGES": 2, "num_warps": 4, "num_ctas": 1, "num_stages": 2}, "(2048, 1024, 4096, 4096, 1, 308)": {"BLOCK_SIZE_M": 64, "BLOCK_SIZE_N": 128, "BLOCK_SIZE_K": 64, "GROUP_SIZE_M": 8, "A_load_order": 0, "NUM_STAGES": 5, "num_warps": 4, "num_ctas": 1, "num_stages": 5}, "(3072, 1024, 4096, 4096, 1, 308)": {"BLOCK_SIZE_M": 64, "BLOCK_SIZE_N": 128, "BLOCK_SIZE_K": 64, "GROUP_SIZE_M": 8, "A_load_order": 0, "NUM_STAGES": 5, "num_warps": 4, "num_ctas": 1, "num_stages": 5}, "(4096, 1024, 4096, 4096, 1, 308)": {"BLOCK_SIZE_M": 64, "BLOCK_SIZE_N": 128, "BLOCK_SIZE_K": 64, "GROUP_SIZE_M": 8, "A_load_order": 0, "NUM_STAGES": 5, "num_warps": 4, "num_ctas": 1, "num_stages": 5}, "(96, 2560, 4096, 4096, 1, 308)": {"BLOCK_SIZE_M": 64, "BLOCK_SIZE_N": 128, "BLOCK_SIZE_K": 256, "GROUP_SIZE_M": 8, "A_load_order": 0, "NUM_STAGES": 2, "num_warps": 4, "num_ctas": 1, "num_stages": 2}, "(128, 2560, 4096, 4096, 1, 308)": {"BLOCK_SIZE_M": 64, "BLOCK_SIZE_N": 128, "BLOCK_SIZE_K": 256, "GROUP_SIZE_M": 8, "A_load_order": 0, "NUM_STAGES": 2, "num_warps": 4, "num_ctas": 1, "num_stages": 2}, "(192, 2560, 4096, 4096, 1, 308)": {"BLOCK_SIZE_M": 64, "BLOCK_SIZE_N": 128, "BLOCK_SIZE_K": 256, "GROUP_SIZE_M": 8, "A_load_order": 0, "NUM_STAGES": 2, "num_warps": 4, "num_ctas": 1, "num_stages": 2}, "(256, 2560, 4096, 4096, 1, 308)": {"BLOCK_SIZE_M": 64, "BLOCK_SIZE_N": 128, "BLOCK_SIZE_K": 256, "GROUP_SIZE_M": 8, "A_load_order": 0, "NUM_STAGES": 2, "num_warps": 4, "num_ctas": 1, "num_stages": 2}, "(384, 2560, 4096, 4096, 1, 308)": {"BLOCK_SIZE_M": 64, "BLOCK_SIZE_N": 128, "BLOCK_SIZE_K": 256, "GROUP_SIZE_M": 8, "A_load_order": 0, "NUM_STAGES": 2, "num_warps": 4, "num_ctas": 1, "num_stages": 2}, "(512, 2560, 4096, 4096, 1, 308)": {"BLOCK_SIZE_M": 64, "BLOCK_SIZE_N": 128, "BLOCK_SIZE_K": 128, "GROUP_SIZE_M": 8, "A_load_order": 2, "NUM_STAGES": 4, "num_warps": 4, "num_ctas": 1, "num_stages": 4}, "(768, 2560, 4096, 4096, 1, 308)": {"BLOCK_SIZE_M": 64, "BLOCK_SIZE_N": 128, "BLOCK_SIZE_K": 256, "GROUP_SIZE_M": 8, "A_load_order": 0, "NUM_STAGES": 2, "num_warps": 4, "num_ctas": 1, "num_stages": 2}, "(1024, 2560, 4096, 4096, 1, 308)": {"BLOCK_SIZE_M": 64, "BLOCK_SIZE_N": 128, "BLOCK_SIZE_K": 256, "GROUP_SIZE_M": 8, "A_load_order": 0, "NUM_STAGES": 2, "num_warps": 4, "num_ctas": 1, "num_stages": 2}, "(1536, 2560, 4096, 4096, 1, 308)": {"BLOCK_SIZE_M": 64, "BLOCK_SIZE_N": 128, "BLOCK_SIZE_K": 256, "GROUP_SIZE_M": 8, "A_load_order": 0, "NUM_STAGES": 2, "num_warps": 4, "num_ctas": 1, "num_stages": 2}, "(2048, 2560, 4096, 4096, 1, 308)": {"BLOCK_SIZE_M": 64, "BLOCK_SIZE_N": 128, "BLOCK_SIZE_K": 256, "GROUP_SIZE_M": 8, "A_load_order": 0, "NUM_STAGES": 2, "num_warps": 4, "num_ctas": 1, "num_stages": 2}, "(3072, 2560, 4096, 4096, 1, 308)": {"BLOCK_SIZE_M": 64, "BLOCK_SIZE_N": 128, "BLOCK_SIZE_K": 64, "GROUP_SIZE_M": 8, "A_load_order": 0, "NUM_STAGES": 5, "num_warps": 4, "num_ctas": 1, "num_stages": 5}, "(4096, 2560, 4096, 4096, 1, 308)": {"BLOCK_SIZE_M": 64, "BLOCK_SIZE_N": 128, "BLOCK_SIZE_K": 256, "GROUP_SIZE_M": 8, "A_load_order": 0, "NUM_STAGES": 2, "num_warps": 4, "num_ctas": 1, "num_stages": 2}, "(96, 6144, 2560, 2560, 1, 308)": {"BLOCK_SIZE_M": 64, "BLOCK_SIZE_N": 128, "BLOCK_SIZE_K": 256, "GROUP_SIZE_M": 8, "A_load_order": 0, "NUM_STAGES": 2, "num_warps": 4, "num_ctas": 1, "num_stages": 2}, "(128, 6144, 2560, 2560, 1, 308)": {"BLOCK_SIZE_M": 64, "BLOCK_SIZE_N": 128, "BLOCK_SIZE_K": 256, "GROUP_SIZE_M": 8, "A_load_order": 0, "NUM_STAGES": 2, "num_warps": 4, "num_ctas": 1, "num_stages": 2}, "(192, 6144, 2560, 2560, 1, 308)": {"BLOCK_SIZE_M": 64, "BLOCK_SIZE_N": 64, "BLOCK_SIZE_K": 256, "GROUP_SIZE_M": 8, "A_load_order": 2, "NUM_STAGES": 3, "num_warps": 8, "num_ctas": 1, "num_stages": 3}, "(256, 6144, 2560, 2560, 1, 308)": {"BLOCK_SIZE_M": 64, "BLOCK_SIZE_N": 128, "BLOCK_SIZE_K": 256, "GROUP_SIZE_M": 8, "A_load_order": 0, "NUM_STAGES": 2, "num_warps": 4, "num_ctas": 1, "num_stages": 2}, "(384, 6144, 2560, 2560, 1, 308)": {"BLOCK_SIZE_M": 64, "BLOCK_SIZE_N": 128, "BLOCK_SIZE_K": 256, "GROUP_SIZE_M": 8, "A_load_order": 0, "NUM_STAGES": 2, "num_warps": 4, "num_ctas": 1, "num_stages": 2}, "(512, 6144, 2560, 2560, 1, 308)": {"BLOCK_SIZE_M": 64, "BLOCK_SIZE_N": 128, "BLOCK_SIZE_K": 256, "GROUP_SIZE_M": 8, "A_load_order": 0, "NUM_STAGES": 2, "num_warps": 4, "num_ctas": 1, "num_stages": 2}, "(768, 6144, 2560, 2560, 1, 308)": {"BLOCK_SIZE_M": 64, "BLOCK_SIZE_N": 128, "BLOCK_SIZE_K": 256, "GROUP_SIZE_M": 8, "A_load_order": 0, "NUM_STAGES": 2, "num_warps": 4, "num_ctas": 1, "num_stages": 2}, "(1024, 6144, 2560, 2560, 1, 308)": {"BLOCK_SIZE_M": 64, "BLOCK_SIZE_N": 128, "BLOCK_SIZE_K": 256, "GROUP_SIZE_M": 8, "A_load_order": 0, "NUM_STAGES": 2, "num_warps": 4, "num_ctas": 1, "num_stages": 2}, "(1536, 6144, 2560, 2560, 1, 308)": {"BLOCK_SIZE_M": 64, "BLOCK_SIZE_N": 128, "BLOCK_SIZE_K": 256, "GROUP_SIZE_M": 8, "A_load_order": 0, "NUM_STAGES": 2, "num_warps": 4, "num_ctas": 1, "num_stages": 2}, "(2048, 6144, 2560, 2560, 1, 308)": {"BLOCK_SIZE_M": 64, "BLOCK_SIZE_N": 128, "BLOCK_SIZE_K": 64, "GROUP_SIZE_M": 8, "A_load_order": 0, "NUM_STAGES": 5, "num_warps": 4, "num_ctas": 1, "num_stages": 5}, "(3072, 6144, 2560, 2560, 1, 308)": {"BLOCK_SIZE_M": 64, "BLOCK_SIZE_N": 128, "BLOCK_SIZE_K": 256, "GROUP_SIZE_M": 8, "A_load_order": 0, "NUM_STAGES": 2, "num_warps": 4, "num_ctas": 1, "num_stages": 2}, "(4096, 6144, 2560, 2560, 1, 308)": {"BLOCK_SIZE_M": 64, "BLOCK_SIZE_N": 128, "BLOCK_SIZE_K": 256, "GROUP_SIZE_M": 8, "A_load_order": 0, "NUM_STAGES": 2, "num_warps": 4, "num_ctas": 1, "num_stages": 2}, "(96, 19456, 2560, 2560, 1, 308)": {"BLOCK_SIZE_M": 64, "BLOCK_SIZE_N": 128, "BLOCK_SIZE_K": 256, "GROUP_SIZE_M": 8, "A_load_order": 0, "NUM_STAGES": 2, "num_warps": 4, "num_ctas": 1, "num_stages": 2}, "(128, 19456, 2560, 2560, 1, 308)": {"BLOCK_SIZE_M": 64, "BLOCK_SIZE_N": 128, "BLOCK_SIZE_K": 256, "GROUP_SIZE_M": 8, "A_load_order": 0, "NUM_STAGES": 2, "num_warps": 4, "num_ctas": 1, "num_stages": 2}, "(192, 19456, 2560, 2560, 1, 308)": {"BLOCK_SIZE_M": 64, "BLOCK_SIZE_N": 128, "BLOCK_SIZE_K": 256, "GROUP_SIZE_M": 8, "A_load_order": 0, "NUM_STAGES": 2, "num_warps": 4, "num_ctas": 1, "num_stages": 2}, "(256, 19456, 2560, 2560, 1, 308)": {"BLOCK_SIZE_M": 64, "BLOCK_SIZE_N": 128, "BLOCK_SIZE_K": 256, "GROUP_SIZE_M": 8, "A_load_order": 0, "NUM_STAGES": 2, "num_warps": 4, "num_ctas": 1, "num_stages": 2}, "(384, 19456, 2560, 2560, 1, 308)": {"BLOCK_SIZE_M": 64, "BLOCK_SIZE_N": 128, "BLOCK_SIZE_K": 256, "GROUP_SIZE_M": 8, "A_load_order": 0, "NUM_STAGES": 2, "num_warps": 4, "num_ctas": 1, "num_stages": 2}, "(512, 19456, 2560, 2560, 1, 308)": {"BLOCK_SIZE_M": 64, "BLOCK_SIZE_N": 128, "BLOCK_SIZE_K": 256, "GROUP_SIZE_M": 8, "A_load_order": 0, "NUM_STAGES": 2, "num_warps": 4, "num_ctas": 1, "num_stages": 2}, "(768, 19456, 2560, 2560, 1, 308)": {"BLOCK_SIZE_M": 64, "BLOCK_SIZE_N": 128, "BLOCK_SIZE_K": 256, "GROUP_SIZE_M": 8, "A_load_order": 0, "NUM_STAGES": 2, "num_warps": 4, "num_ctas": 1, "num_stages": 2}, "(1024, 19456, 2560, 2560, 1, 308)": {"BLOCK_SIZE_M": 64, "BLOCK_SIZE_N": 128, "BLOCK_SIZE_K": 256, "GROUP_SIZE_M": 8, "A_load_order": 0, "NUM_STAGES": 2, "num_warps": 4, "num_ctas": 1, "num_stages": 2}, "(1536, 19456, 2560, 2560, 1, 308)": {"BLOCK_SIZE_M": 64, "BLOCK_SIZE_N": 128, "BLOCK_SIZE_K": 256, "GROUP_SIZE_M": 8, "A_load_order": 0, "NUM_STAGES": 2, "num_warps": 4, "num_ctas": 1, "num_stages": 2}, "(2048, 19456, 2560, 2560, 1, 308)": {"BLOCK_SIZE_M": 64, "BLOCK_SIZE_N": 128, "BLOCK_SIZE_K": 256, "GROUP_SIZE_M": 8, "A_load_order": 0, "NUM_STAGES": 2, "num_warps": 4, "num_ctas": 1, "num_stages": 2}, "(3072, 19456, 2560, 2560, 1, 308)": {"BLOCK_SIZE_M": 64, "BLOCK_SIZE_N": 128, "BLOCK_SIZE_K": 256, "GROUP_SIZE_M": 8, "A_load_order": 0, "NUM_STAGES": 2, "num_warps": 4, "num_ctas": 1, "num_stages": 2}, "(4096, 19456, 2560, 2560, 1, 308)": {"BLOCK_SIZE_M": 64, "BLOCK_SIZE_N": 128, "BLOCK_SIZE_K": 256, "GROUP_SIZE_M": 8, "A_load_order": 0, "NUM_STAGES": 2, "num_warps": 4, "num_ctas": 1, "num_stages": 2}, "(96, 2560, 9728, 9728, 1, 308)": {"BLOCK_SIZE_M": 64, "BLOCK_SIZE_N": 32, "BLOCK_SIZE_K": 256, "GROUP_SIZE_M": 8, "A_load_order": 0, "NUM_STAGES": 4, "num_warps": 4, "num_ctas": 1, "num_stages": 4}, "(128, 2560, 9728, 9728, 1, 308)": {"BLOCK_SIZE_M": 64, "BLOCK_SIZE_N": 32, "BLOCK_SIZE_K": 256, "GROUP_SIZE_M": 8, "A_load_order": 0, "NUM_STAGES": 4, "num_warps": 4, "num_ctas": 1, "num_stages": 4}, "(192, 2560, 9728, 9728, 1, 308)": {"BLOCK_SIZE_M": 64, "BLOCK_SIZE_N": 128, "BLOCK_SIZE_K": 256, "GROUP_SIZE_M": 8, "A_load_order": 0, "NUM_STAGES": 2, "num_warps": 4, "num_ctas": 1, "num_stages": 2}, "(256, 2560, 9728, 9728, 1, 308)": {"BLOCK_SIZE_M": 64, "BLOCK_SIZE_N": 128, "BLOCK_SIZE_K": 256, "GROUP_SIZE_M": 8, "A_load_order": 0, "NUM_STAGES": 2, "num_warps": 4, "num_ctas": 1, "num_stages": 2}, "(384, 2560, 9728, 9728, 1, 308)": {"BLOCK_SIZE_M": 64, "BLOCK_SIZE_N": 64, "BLOCK_SIZE_K": 256, "GROUP_SIZE_M": 8, "A_load_order": 2, "NUM_STAGES": 3, "num_warps": 8, "num_ctas": 1, "num_stages": 3}, "(512, 2560, 9728, 9728, 1, 308)": {"BLOCK_SIZE_M": 64, "BLOCK_SIZE_N": 128, "BLOCK_SIZE_K": 128, "GROUP_SIZE_M": 8, "A_load_order": 2, "NUM_STAGES": 4, "num_warps": 4, "num_ctas": 1, "num_stages": 4}, "(768, 2560, 9728, 9728, 1, 308)": {"BLOCK_SIZE_M": 64, "BLOCK_SIZE_N": 128, "BLOCK_SIZE_K": 128, "GROUP_SIZE_M": 8, "A_load_order": 2, "NUM_STAGES": 4, "num_warps": 4, "num_ctas": 1, "num_stages": 4}, "(1024, 2560, 9728, 9728, 1, 308)": {"BLOCK_SIZE_M": 64, "BLOCK_SIZE_N": 128, "BLOCK_SIZE_K": 256, "GROUP_SIZE_M": 8, "A_load_order": 0, "NUM_STAGES": 2, "num_warps": 4, "num_ctas": 1, "num_stages": 2}, "(1536, 2560, 9728, 9728, 1, 308)": {"BLOCK_SIZE_M": 64, "BLOCK_SIZE_N": 128, "BLOCK_SIZE_K": 256, "GROUP_SIZE_M": 8, "A_load_order": 0, "NUM_STAGES": 2, "num_warps": 4, "num_ctas": 1, "num_stages": 2}, "(2048, 2560, 9728, 9728, 1, 308)": {"BLOCK_SIZE_M": 64, "BLOCK_SIZE_N": 128, "BLOCK_SIZE_K": 256, "GROUP_SIZE_M": 8, "A_load_order": 0, "NUM_STAGES": 2, "num_warps": 4, "num_ctas": 1, "num_stages": 2}, "(3072, 2560, 9728, 9728, 1, 308)": {"BLOCK_SIZE_M": 64, "BLOCK_SIZE_N": 128, "BLOCK_SIZE_K": 128, "GROUP_SIZE_M": 8, "A_load_order": 2, "NUM_STAGES": 4, "num_warps": 4, "num_ctas": 1, "num_stages": 4}, "(4096, 2560, 9728, 9728, 1, 308)": {"BLOCK_SIZE_M": 64, "BLOCK_SIZE_N": 128, "BLOCK_SIZE_K": 256, "GROUP_SIZE_M": 8, "A_load_order": 0, "NUM_STAGES": 2, "num_warps": 4, "num_ctas": 1, "num_stages": 2}, "(96, 3072, 1024, 1024, 1, 408)": {"BLOCK_SIZE_M": 64, "BLOCK_SIZE_N": 128, "BLOCK_SIZE_K": 128, "GROUP_SIZE_M": 8, "A_load_order": 2, "NUM_STAGES": 4, "num_warps": 4, "num_ctas": 1, "num_stages": 4}, "(128, 3072, 1024, 1024, 1, 408)": {"BLOCK_SIZE_M": 64, "BLOCK_SIZE_N": 128, "BLOCK_SIZE_K": 128, "GROUP_SIZE_M": 8, "A_load_order": 2, "NUM_STAGES": 4, "num_warps": 4, "num_ctas": 1, "num_stages": 4}, "(192, 3072, 1024, 1024, 1, 408)": {"BLOCK_SIZE_M": 64, "BLOCK_SIZE_N": 128, "BLOCK_SIZE_K": 256, "GROUP_SIZE_M": 8, "A_load_order": 0, "NUM_STAGES": 2, "num_warps": 4, "num_ctas": 1, "num_stages": 2}, "(256, 3072, 1024, 1024, 1, 408)": {"BLOCK_SIZE_M": 64, "BLOCK_SIZE_N": 128, "BLOCK_SIZE_K": 256, "GROUP_SIZE_M": 8, "A_load_order": 0, "NUM_STAGES": 2, "num_warps": 4, "num_ctas": 1, "num_stages": 2}, "(384, 3072, 1024, 1024, 1, 408)": {"BLOCK_SIZE_M": 64, "BLOCK_SIZE_N": 128, "BLOCK_SIZE_K": 256, "GROUP_SIZE_M": 8, "A_load_order": 0, "NUM_STAGES": 2, "num_warps": 4, "num_ctas": 1, "num_stages": 2}, "(512, 3072, 1024, 1024, 1, 408)": {"BLOCK_SIZE_M": 64, "BLOCK_SIZE_N": 128, "BLOCK_SIZE_K": 256, "GROUP_SIZE_M": 8, "A_load_order": 0, "NUM_STAGES": 2, "num_warps": 4, "num_ctas": 1, "num_stages": 2}, "(768, 3072, 1024, 1024, 1, 408)": {"BLOCK_SIZE_M": 64, "BLOCK_SIZE_N": 128, "BLOCK_SIZE_K": 128, "GROUP_SIZE_M": 8, "A_load_order": 2, "NUM_STAGES": 4, "num_warps": 4, "num_ctas": 1, "num_stages": 4}, "(1024, 3072, 1024, 1024, 1, 408)": {"BLOCK_SIZE_M": 64, "BLOCK_SIZE_N": 128, "BLOCK_SIZE_K": 256, "GROUP_SIZE_M": 8, "A_load_order": 0, "NUM_STAGES": 2, "num_warps": 4, "num_ctas": 1, "num_stages": 2}, "(1536, 3072, 1024, 1024, 1, 408)": {"BLOCK_SIZE_M": 64, "BLOCK_SIZE_N": 128, "BLOCK_SIZE_K": 256, "GROUP_SIZE_M": 8, "A_load_order": 0, "NUM_STAGES": 2, "num_warps": 4, "num_ctas": 1, "num_stages": 2}, "(2048, 3072, 1024, 1024, 1, 408)": {"BLOCK_SIZE_M": 64, "BLOCK_SIZE_N": 128, "BLOCK_SIZE_K": 256, "GROUP_SIZE_M": 8, "A_load_order": 0, "NUM_STAGES": 2, "num_warps": 4, "num_ctas": 1, "num_stages": 2}, "(3072, 3072, 1024, 1024, 1, 408)": {"BLOCK_SIZE_M": 64, "BLOCK_SIZE_N": 128, "BLOCK_SIZE_K": 256, "GROUP_SIZE_M": 8, "A_load_order": 0, "NUM_STAGES": 2, "num_warps": 4, "num_ctas": 1, "num_stages": 2}, "(4096, 3072, 1024, 1024, 1, 408)": {"BLOCK_SIZE_M": 64, "BLOCK_SIZE_N": 128, "BLOCK_SIZE_K": 64, "GROUP_SIZE_M": 8, "A_load_order": 0, "NUM_STAGES": 5, "num_warps": 4, "num_ctas": 1, "num_stages": 5}, "(96, 1024, 1024, 1024, 1, 408)": {"BLOCK_SIZE_M": 64, "BLOCK_SIZE_N": 32, "BLOCK_SIZE_K": 128, "GROUP_SIZE_M": 8, "A_load_order": 2, "NUM_STAGES": 4, "num_warps": 8, "num_ctas": 1, "num_stages": 4}, "(128, 1024, 1024, 1024, 1, 408)": {"BLOCK_SIZE_M": 64, "BLOCK_SIZE_N": 32, "BLOCK_SIZE_K": 128, "GROUP_SIZE_M": 8, "A_load_order": 2, "NUM_STAGES": 4, "num_warps": 8, "num_ctas": 1, "num_stages": 4}, "(192, 1024, 1024, 1024, 1, 408)": {"BLOCK_SIZE_M": 64, "BLOCK_SIZE_N": 64, "BLOCK_SIZE_K": 128, "GROUP_SIZE_M": 8, "A_load_order": 0, "NUM_STAGES": 5, "num_warps": 8, "num_ctas": 1, "num_stages": 5}, "(256, 1024, 1024, 1024, 1, 408)": {"BLOCK_SIZE_M": 64, "BLOCK_SIZE_N": 128, "BLOCK_SIZE_K": 128, "GROUP_SIZE_M": 8, "A_load_order": 2, "NUM_STAGES": 4, "num_warps": 4, "num_ctas": 1, "num_stages": 4}, "(384, 1024, 1024, 1024, 1, 408)": {"BLOCK_SIZE_M": 64, "BLOCK_SIZE_N": 128, "BLOCK_SIZE_K": 128, "GROUP_SIZE_M": 8, "A_load_order": 2, "NUM_STAGES": 4, "num_warps": 4, "num_ctas": 1, "num_stages": 4}, "(512, 1024, 1024, 1024, 1, 408)": {"BLOCK_SIZE_M": 64, "BLOCK_SIZE_N": 128, "BLOCK_SIZE_K": 64, "GROUP_SIZE_M": 8, "A_load_order": 0, "NUM_STAGES": 5, "num_warps": 4, "num_ctas": 1, "num_stages": 5}, "(768, 1024, 1024, 1024, 1, 408)": {"BLOCK_SIZE_M": 64, "BLOCK_SIZE_N": 128, "BLOCK_SIZE_K": 64, "GROUP_SIZE_M": 8, "A_load_order": 0, "NUM_STAGES": 5, "num_warps": 4, "num_ctas": 1, "num_stages": 5}, "(1024, 1024, 1024, 1024, 1, 408)": {"BLOCK_SIZE_M": 64, "BLOCK_SIZE_N": 128, "BLOCK_SIZE_K": 64, "GROUP_SIZE_M": 8, "A_load_order": 0, "NUM_STAGES": 5, "num_warps": 4, "num_ctas": 1, "num_stages": 5}, "(1536, 1024, 1024, 1024, 1, 408)": {"BLOCK_SIZE_M": 64, "BLOCK_SIZE_N": 128, "BLOCK_SIZE_K": 256, "GROUP_SIZE_M": 8, "A_load_order": 0, "NUM_STAGES": 2, "num_warps": 4, "num_ctas": 1, "num_stages": 2}, "(2048, 1024, 1024, 1024, 1, 408)": {"BLOCK_SIZE_M": 64, "BLOCK_SIZE_N": 128, "BLOCK_SIZE_K": 64, "GROUP_SIZE_M": 8, "A_load_order": 0, "NUM_STAGES": 5, "num_warps": 4, "num_ctas": 1, "num_stages": 5}, "(3072, 1024, 1024, 1024, 1, 408)": {"BLOCK_SIZE_M": 64, "BLOCK_SIZE_N": 128, "BLOCK_SIZE_K": 256, "GROUP_SIZE_M": 8, "A_load_order": 0, "NUM_STAGES": 2, "num_warps": 4, "num_ctas": 1, "num_stages": 2}, "(4096, 1024, 1024, 1024, 1, 408)": {"BLOCK_SIZE_M": 64, "BLOCK_SIZE_N": 128, "BLOCK_SIZE_K": 256, "GROUP_SIZE_M": 8, "A_load_order": 0, "NUM_STAGES": 2, "num_warps": 4, "num_ctas": 1, "num_stages": 2}, "(96, 1024, 4096, 4096, 1, 408)": {"BLOCK_SIZE_M": 64, "BLOCK_SIZE_N": 64, "BLOCK_SIZE_K": 256, "GROUP_SIZE_M": 8, "A_load_order": 2, "NUM_STAGES": 3, "num_warps": 8, "num_ctas": 1, "num_stages": 3}, "(128, 1024, 4096, 4096, 1, 408)": {"BLOCK_SIZE_M": 64, "BLOCK_SIZE_N": 64, "BLOCK_SIZE_K": 256, "GROUP_SIZE_M": 8, "A_load_order": 2, "NUM_STAGES": 3, "num_warps": 8, "num_ctas": 1, "num_stages": 3}, "(192, 1024, 4096, 4096, 1, 408)": {"BLOCK_SIZE_M": 64, "BLOCK_SIZE_N": 64, "BLOCK_SIZE_K": 256, "GROUP_SIZE_M": 8, "A_load_order": 2, "NUM_STAGES": 3, "num_warps": 8, "num_ctas": 1, "num_stages": 3}, "(256, 1024, 4096, 4096, 1, 408)": {"BLOCK_SIZE_M": 64, "BLOCK_SIZE_N": 128, "BLOCK_SIZE_K": 128, "GROUP_SIZE_M": 8, "A_load_order": 2, "NUM_STAGES": 4, "num_warps": 4, "num_ctas": 1, "num_stages": 4}, "(384, 1024, 4096, 4096, 1, 408)": {"BLOCK_SIZE_M": 64, "BLOCK_SIZE_N": 128, "BLOCK_SIZE_K": 128, "GROUP_SIZE_M": 8, "A_load_order": 2, "NUM_STAGES": 4, "num_warps": 4, "num_ctas": 1, "num_stages": 4}, "(512, 1024, 4096, 4096, 1, 408)": {"BLOCK_SIZE_M": 64, "BLOCK_SIZE_N": 128, "BLOCK_SIZE_K": 64, "GROUP_SIZE_M": 8, "A_load_order": 0, "NUM_STAGES": 5, "num_warps": 4, "num_ctas": 1, "num_stages": 5}, "(768, 1024, 4096, 4096, 1, 408)": {"BLOCK_SIZE_M": 64, "BLOCK_SIZE_N": 128, "BLOCK_SIZE_K": 256, "GROUP_SIZE_M": 8, "A_load_order": 0, "NUM_STAGES": 2, "num_warps": 4, "num_ctas": 1, "num_stages": 2}, "(1024, 1024, 4096, 4096, 1, 408)": {"BLOCK_SIZE_M": 64, "BLOCK_SIZE_N": 128, "BLOCK_SIZE_K": 256, "GROUP_SIZE_M": 8, "A_load_order": 0, "NUM_STAGES": 2, "num_warps": 4, "num_ctas": 1, "num_stages": 2}, "(1536, 1024, 4096, 4096, 1, 408)": {"BLOCK_SIZE_M": 64, "BLOCK_SIZE_N": 128, "BLOCK_SIZE_K": 256, "GROUP_SIZE_M": 8, "A_load_order": 0, "NUM_STAGES": 2, "num_warps": 4, "num_ctas": 1, "num_stages": 2}, "(2048, 1024, 4096, 4096, 1, 408)": {"BLOCK_SIZE_M": 64, "BLOCK_SIZE_N": 128, "BLOCK_SIZE_K": 64, "GROUP_SIZE_M": 8, "A_load_order": 0, "NUM_STAGES": 5, "num_warps": 4, "num_ctas": 1, "num_stages": 5}, "(3072, 1024, 4096, 4096, 1, 408)": {"BLOCK_SIZE_M": 64, "BLOCK_SIZE_N": 128, "BLOCK_SIZE_K": 64, "GROUP_SIZE_M": 8, "A_load_order": 0, "NUM_STAGES": 5, "num_warps": 4, "num_ctas": 1, "num_stages": 5}, "(4096, 1024, 4096, 4096, 1, 408)": {"BLOCK_SIZE_M": 64, "BLOCK_SIZE_N": 128, "BLOCK_SIZE_K": 64, "GROUP_SIZE_M": 8, "A_load_order": 0, "NUM_STAGES": 5, "num_warps": 4, "num_ctas": 1, "num_stages": 5}, "(96, 2560, 4096, 4096, 1, 408)": {"BLOCK_SIZE_M": 64, "BLOCK_SIZE_N": 128, "BLOCK_SIZE_K": 256, "GROUP_SIZE_M": 8, "A_load_order": 0, "NUM_STAGES": 2, "num_warps": 4, "num_ctas": 1, "num_stages": 2}, "(128, 2560, 4096, 4096, 1, 408)": {"BLOCK_SIZE_M": 64, "BLOCK_SIZE_N": 128, "BLOCK_SIZE_K": 256, "GROUP_SIZE_M": 8, "A_load_order": 0, "NUM_STAGES": 2, "num_warps": 4, "num_ctas": 1, "num_stages": 2}, "(192, 2560, 4096, 4096, 1, 408)": {"BLOCK_SIZE_M": 64, "BLOCK_SIZE_N": 128, "BLOCK_SIZE_K": 256, "GROUP_SIZE_M": 8, "A_load_order": 0, "NUM_STAGES": 2, "num_warps": 4, "num_ctas": 1, "num_stages": 2}, "(256, 2560, 4096, 4096, 1, 408)": {"BLOCK_SIZE_M": 64, "BLOCK_SIZE_N": 128, "BLOCK_SIZE_K": 256, "GROUP_SIZE_M": 8, "A_load_order": 0, "NUM_STAGES": 2, "num_warps": 4, "num_ctas": 1, "num_stages": 2}, "(384, 2560, 4096, 4096, 1, 408)": {"BLOCK_SIZE_M": 64, "BLOCK_SIZE_N": 128, "BLOCK_SIZE_K": 256, "GROUP_SIZE_M": 8, "A_load_order": 0, "NUM_STAGES": 2, "num_warps": 4, "num_ctas": 1, "num_stages": 2}, "(512, 2560, 4096, 4096, 1, 408)": {"BLOCK_SIZE_M": 64, "BLOCK_SIZE_N": 128, "BLOCK_SIZE_K": 128, "GROUP_SIZE_M": 8, "A_load_order": 2, "NUM_STAGES": 4, "num_warps": 4, "num_ctas": 1, "num_stages": 4}, "(768, 2560, 4096, 4096, 1, 408)": {"BLOCK_SIZE_M": 64, "BLOCK_SIZE_N": 128, "BLOCK_SIZE_K": 256, "GROUP_SIZE_M": 8, "A_load_order": 0, "NUM_STAGES": 2, "num_warps": 4, "num_ctas": 1, "num_stages": 2}, "(1024, 2560, 4096, 4096, 1, 408)": {"BLOCK_SIZE_M": 64, "BLOCK_SIZE_N": 128, "BLOCK_SIZE_K": 256, "GROUP_SIZE_M": 8, "A_load_order": 0, "NUM_STAGES": 2, "num_warps": 4, "num_ctas": 1, "num_stages": 2}, "(1536, 2560, 4096, 4096, 1, 408)": {"BLOCK_SIZE_M": 64, "BLOCK_SIZE_N": 128, "BLOCK_SIZE_K": 256, "GROUP_SIZE_M": 8, "A_load_order": 0, "NUM_STAGES": 2, "num_warps": 4, "num_ctas": 1, "num_stages": 2}, "(2048, 2560, 4096, 4096, 1, 408)": {"BLOCK_SIZE_M": 64, "BLOCK_SIZE_N": 128, "BLOCK_SIZE_K": 64, "GROUP_SIZE_M": 8, "A_load_order": 0, "NUM_STAGES": 5, "num_warps": 4, "num_ctas": 1, "num_stages": 5}, "(3072, 2560, 4096, 4096, 1, 408)": {"BLOCK_SIZE_M": 64, "BLOCK_SIZE_N": 128, "BLOCK_SIZE_K": 64, "GROUP_SIZE_M": 8, "A_load_order": 0, "NUM_STAGES": 5, "num_warps": 4, "num_ctas": 1, "num_stages": 5}, "(4096, 2560, 4096, 4096, 1, 408)": {"BLOCK_SIZE_M": 64, "BLOCK_SIZE_N": 128, "BLOCK_SIZE_K": 64, "GROUP_SIZE_M": 8, "A_load_order": 0, "NUM_STAGES": 5, "num_warps": 4, "num_ctas": 1, "num_stages": 5}, "(96, 6144, 2560, 2560, 1, 408)": {"BLOCK_SIZE_M": 64, "BLOCK_SIZE_N": 128, "BLOCK_SIZE_K": 256, "GROUP_SIZE_M": 8, "A_load_order": 0, "NUM_STAGES": 2, "num_warps": 4, "num_ctas": 1, "num_stages": 2}, "(128, 6144, 2560, 2560, 1, 408)": {"BLOCK_SIZE_M": 64, "BLOCK_SIZE_N": 128, "BLOCK_SIZE_K": 256, "GROUP_SIZE_M": 8, "A_load_order": 0, "NUM_STAGES": 2, "num_warps": 4, "num_ctas": 1, "num_stages": 2}, "(192, 6144, 2560, 2560, 1, 408)": {"BLOCK_SIZE_M": 64, "BLOCK_SIZE_N": 64, "BLOCK_SIZE_K": 256, "GROUP_SIZE_M": 8, "A_load_order": 2, "NUM_STAGES": 3, "num_warps": 8, "num_ctas": 1, "num_stages": 3}, "(256, 6144, 2560, 2560, 1, 408)": {"BLOCK_SIZE_M": 64, "BLOCK_SIZE_N": 128, "BLOCK_SIZE_K": 256, "GROUP_SIZE_M": 8, "A_load_order": 0, "NUM_STAGES": 2, "num_warps": 4, "num_ctas": 1, "num_stages": 2}, "(384, 6144, 2560, 2560, 1, 408)": {"BLOCK_SIZE_M": 64, "BLOCK_SIZE_N": 128, "BLOCK_SIZE_K": 256, "GROUP_SIZE_M": 8, "A_load_order": 0, "NUM_STAGES": 2, "num_warps": 4, "num_ctas": 1, "num_stages": 2}, "(512, 6144, 2560, 2560, 1, 408)": {"BLOCK_SIZE_M": 64, "BLOCK_SIZE_N": 128, "BLOCK_SIZE_K": 256, "GROUP_SIZE_M": 8, "A_load_order": 0, "NUM_STAGES": 2, "num_warps": 4, "num_ctas": 1, "num_stages": 2}, "(768, 6144, 2560, 2560, 1, 408)": {"BLOCK_SIZE_M": 64, "BLOCK_SIZE_N": 128, "BLOCK_SIZE_K": 256, "GROUP_SIZE_M": 8, "A_load_order": 0, "NUM_STAGES": 2, "num_warps": 4, "num_ctas": 1, "num_stages": 2}, "(1024, 6144, 2560, 2560, 1, 408)": {"BLOCK_SIZE_M": 64, "BLOCK_SIZE_N": 128, "BLOCK_SIZE_K": 256, "GROUP_SIZE_M": 8, "A_load_order": 0, "NUM_STAGES": 2, "num_warps": 4, "num_ctas": 1, "num_stages": 2}, "(1536, 6144, 2560, 2560, 1, 408)": {"BLOCK_SIZE_M": 64, "BLOCK_SIZE_N": 128, "BLOCK_SIZE_K": 64, "GROUP_SIZE_M": 8, "A_load_order": 0, "NUM_STAGES": 5, "num_warps": 4, "num_ctas": 1, "num_stages": 5}, "(2048, 6144, 2560, 2560, 1, 408)": {"BLOCK_SIZE_M": 64, "BLOCK_SIZE_N": 128, "BLOCK_SIZE_K": 64, "GROUP_SIZE_M": 8, "A_load_order": 0, "NUM_STAGES": 5, "num_warps": 4, "num_ctas": 1, "num_stages": 5}, "(3072, 6144, 2560, 2560, 1, 408)": {"BLOCK_SIZE_M": 64, "BLOCK_SIZE_N": 256, "BLOCK_SIZE_K": 64, "GROUP_SIZE_M": 8, "A_load_order": 2, "NUM_STAGES": 4, "num_warps": 8, "num_ctas": 1, "num_stages": 4}, "(4096, 6144, 2560, 2560, 1, 408)": {"BLOCK_SIZE_M": 64, "BLOCK_SIZE_N": 256, "BLOCK_SIZE_K": 64, "GROUP_SIZE_M": 8, "A_load_order": 2, "NUM_STAGES": 4, "num_warps": 8, "num_ctas": 1, "num_stages": 4}, "(96, 19456, 2560, 2560, 1, 408)": {"BLOCK_SIZE_M": 64, "BLOCK_SIZE_N": 128, "BLOCK_SIZE_K": 256, "GROUP_SIZE_M": 8, "A_load_order": 0, "NUM_STAGES": 2, "num_warps": 4, "num_ctas": 1, "num_stages": 2}, "(128, 19456, 2560, 2560, 1, 408)": {"BLOCK_SIZE_M": 64, "BLOCK_SIZE_N": 128, "BLOCK_SIZE_K": 256, "GROUP_SIZE_M": 8, "A_load_order": 0, "NUM_STAGES": 2, "num_warps": 4, "num_ctas": 1, "num_stages": 2}, "(192, 19456, 2560, 2560, 1, 408)": {"BLOCK_SIZE_M": 64, "BLOCK_SIZE_N": 128, "BLOCK_SIZE_K": 256, "GROUP_SIZE_M": 8, "A_load_order": 0, "NUM_STAGES": 2, "num_warps": 4, "num_ctas": 1, "num_stages": 2}, "(256, 19456, 2560, 2560, 1, 408)": {"BLOCK_SIZE_M": 64, "BLOCK_SIZE_N": 128, "BLOCK_SIZE_K": 256, "GROUP_SIZE_M": 8, "A_load_order": 0, "NUM_STAGES": 2, "num_warps": 4, "num_ctas": 1, "num_stages": 2}, "(384, 19456, 2560, 2560, 1, 408)": {"BLOCK_SIZE_M": 64, "BLOCK_SIZE_N": 128, "BLOCK_SIZE_K": 256, "GROUP_SIZE_M": 8, "A_load_order": 0, "NUM_STAGES": 2, "num_warps": 4, "num_ctas": 1, "num_stages": 2}, "(512, 19456, 2560, 2560, 1, 408)": {"BLOCK_SIZE_M": 64, "BLOCK_SIZE_N": 128, "BLOCK_SIZE_K": 256, "GROUP_SIZE_M": 8, "A_load_order": 0, "NUM_STAGES": 2, "num_warps": 4, "num_ctas": 1, "num_stages": 2}, "(768, 19456, 2560, 2560, 1, 408)": {"BLOCK_SIZE_M": 64, "BLOCK_SIZE_N": 128, "BLOCK_SIZE_K": 256, "GROUP_SIZE_M": 8, "A_load_order": 0, "NUM_STAGES": 2, "num_warps": 4, "num_ctas": 1, "num_stages": 2}, "(1024, 19456, 2560, 2560, 1, 408)": {"BLOCK_SIZE_M": 64, "BLOCK_SIZE_N": 256, "BLOCK_SIZE_K": 64, "GROUP_SIZE_M": 8, "A_load_order": 2, "NUM_STAGES": 4, "num_warps": 8, "num_ctas": 1, "num_stages": 4}, "(1536, 19456, 2560, 2560, 1, 408)": {"BLOCK_SIZE_M": 64, "BLOCK_SIZE_N": 128, "BLOCK_SIZE_K": 256, "GROUP_SIZE_M": 8, "A_load_order": 0, "NUM_STAGES": 2, "num_warps": 4, "num_ctas": 1, "num_stages": 2}, "(2048, 19456, 2560, 2560, 1, 408)": {"BLOCK_SIZE_M": 64, "BLOCK_SIZE_N": 128, "BLOCK_SIZE_K": 256, "GROUP_SIZE_M": 8, "A_load_order": 0, "NUM_STAGES": 2, "num_warps": 4, "num_ctas": 1, "num_stages": 2}, "(3072, 19456, 2560, 2560, 1, 408)": {"BLOCK_SIZE_M": 64, "BLOCK_SIZE_N": 128, "BLOCK_SIZE_K": 256, "GROUP_SIZE_M": 8, "A_load_order": 0, "NUM_STAGES": 2, "num_warps": 4, "num_ctas": 1, "num_stages": 2}, "(4096, 19456, 2560, 2560, 1, 408)": {"BLOCK_SIZE_M": 64, "BLOCK_SIZE_N": 128, "BLOCK_SIZE_K": 256, "GROUP_SIZE_M": 8, "A_load_order": 0, "NUM_STAGES": 2, "num_warps": 4, "num_ctas": 1, "num_stages": 2}, "(96, 2560, 9728, 9728, 1, 408)": {"BLOCK_SIZE_M": 64, "BLOCK_SIZE_N": 32, "BLOCK_SIZE_K": 256, "GROUP_SIZE_M": 8, "A_load_order": 0, "NUM_STAGES": 4, "num_warps": 4, "num_ctas": 1, "num_stages": 4}, "(128, 2560, 9728, 9728, 1, 408)": {"BLOCK_SIZE_M": 64, "BLOCK_SIZE_N": 32, "BLOCK_SIZE_K": 256, "GROUP_SIZE_M": 8, "A_load_order": 0, "NUM_STAGES": 4, "num_warps": 4, "num_ctas": 1, "num_stages": 4}, "(192, 2560, 9728, 9728, 1, 408)": {"BLOCK_SIZE_M": 64, "BLOCK_SIZE_N": 128, "BLOCK_SIZE_K": 256, "GROUP_SIZE_M": 8, "A_load_order": 0, "NUM_STAGES": 2, "num_warps": 4, "num_ctas": 1, "num_stages": 2}, "(256, 2560, 9728, 9728, 1, 408)": {"BLOCK_SIZE_M": 64, "BLOCK_SIZE_N": 128, "BLOCK_SIZE_K": 256, "GROUP_SIZE_M": 8, "A_load_order": 0, "NUM_STAGES": 2, "num_warps": 4, "num_ctas": 1, "num_stages": 2}, "(384, 2560, 9728, 9728, 1, 408)": {"BLOCK_SIZE_M": 64, "BLOCK_SIZE_N": 128, "BLOCK_SIZE_K": 128, "GROUP_SIZE_M": 8, "A_load_order": 2, "NUM_STAGES": 4, "num_warps": 4, "num_ctas": 1, "num_stages": 4}, "(512, 2560, 9728, 9728, 1, 408)": {"BLOCK_SIZE_M": 64, "BLOCK_SIZE_N": 128, "BLOCK_SIZE_K": 128, "GROUP_SIZE_M": 8, "A_load_order": 2, "NUM_STAGES": 4, "num_warps": 4, "num_ctas": 1, "num_stages": 4}, "(768, 2560, 9728, 9728, 1, 408)": {"BLOCK_SIZE_M": 64, "BLOCK_SIZE_N": 128, "BLOCK_SIZE_K": 128, "GROUP_SIZE_M": 8, "A_load_order": 2, "NUM_STAGES": 4, "num_warps": 4, "num_ctas": 1, "num_stages": 4}, "(1024, 2560, 9728, 9728, 1, 408)": {"BLOCK_SIZE_M": 64, "BLOCK_SIZE_N": 128, "BLOCK_SIZE_K": 256, "GROUP_SIZE_M": 8, "A_load_order": 0, "NUM_STAGES": 2, "num_warps": 4, "num_ctas": 1, "num_stages": 2}, "(1536, 2560, 9728, 9728, 1, 408)": {"BLOCK_SIZE_M": 64, "BLOCK_SIZE_N": 128, "BLOCK_SIZE_K": 128, "GROUP_SIZE_M": 8, "A_load_order": 2, "NUM_STAGES": 4, "num_warps": 4, "num_ctas": 1, "num_stages": 4}, "(2048, 2560, 9728, 9728, 1, 408)": {"BLOCK_SIZE_M": 64, "BLOCK_SIZE_N": 128, "BLOCK_SIZE_K": 256, "GROUP_SIZE_M": 8, "A_load_order": 0, "NUM_STAGES": 2, "num_warps": 4, "num_ctas": 1, "num_stages": 2}, "(3072, 2560, 9728, 9728, 1, 408)": {"BLOCK_SIZE_M": 64, "BLOCK_SIZE_N": 128, "BLOCK_SIZE_K": 256, "GROUP_SIZE_M": 8, "A_load_order": 0, "NUM_STAGES": 2, "num_warps": 4, "num_ctas": 1, "num_stages": 2}, "(4096, 2560, 9728, 9728, 1, 408)": {"BLOCK_SIZE_M": 64, "BLOCK_SIZE_N": 128, "BLOCK_SIZE_K": 128, "GROUP_SIZE_M": 8, "A_load_order": 2, "NUM_STAGES": 4, "num_warps": 4, "num_ctas": 1, "num_stages": 4}, "(96, 3072, 1024, 64, 8, 104)": {"BLOCK_SIZE_M": 64, "BLOCK_SIZE_N": 128, "BLOCK_SIZE_K": 64, "GROUP_SIZE_M": 8, "A_load_order": 0, "NUM_STAGES": 1, "num_warps": 4, "num_ctas": 1, "num_stages": 1}, "(128, 3072, 1024, 64, 8, 104)": {"BLOCK_SIZE_M": 64, "BLOCK_SIZE_N": 128, "BLOCK_SIZE_K": 64, "GROUP_SIZE_M": 8, "A_load_order": 0, "NUM_STAGES": 1, "num_warps": 4, "num_ctas": 1, "num_stages": 1}, "(192, 3072, 1024, 64, 8, 104)": {"BLOCK_SIZE_M": 64, "BLOCK_SIZE_N": 128, "BLOCK_SIZE_K": 64, "GROUP_SIZE_M": 8, "A_load_order": 0, "NUM_STAGES": 1, "num_warps": 4, "num_ctas": 1, "num_stages": 1}, "(256, 3072, 1024, 64, 8, 104)": {"BLOCK_SIZE_M": 64, "BLOCK_SIZE_N": 128, "BLOCK_SIZE_K": 32, "GROUP_SIZE_M": 8, "A_load_order": 2, "NUM_STAGES": 3, "num_warps": 8, "num_ctas": 1, "num_stages": 3}, "(384, 3072, 1024, 64, 8, 104)": {"BLOCK_SIZE_M": 64, "BLOCK_SIZE_N": 128, "BLOCK_SIZE_K": 64, "GROUP_SIZE_M": 8, "A_load_order": 0, "NUM_STAGES": 1, "num_warps": 4, "num_ctas": 1, "num_stages": 1}, "(512, 3072, 1024, 64, 8, 104)": {"BLOCK_SIZE_M": 64, "BLOCK_SIZE_N": 128, "BLOCK_SIZE_K": 64, "GROUP_SIZE_M": 8, "A_load_order": 0, "NUM_STAGES": 1, "num_warps": 4, "num_ctas": 1, "num_stages": 1}, "(768, 3072, 1024, 64, 8, 104)": {"BLOCK_SIZE_M": 64, "BLOCK_SIZE_N": 128, "BLOCK_SIZE_K": 64, "GROUP_SIZE_M": 8, "A_load_order": 0, "NUM_STAGES": 1, "num_warps": 4, "num_ctas": 1, "num_stages": 1}, "(1024, 3072, 1024, 64, 8, 104)": {"BLOCK_SIZE_M": 64, "BLOCK_SIZE_N": 128, "BLOCK_SIZE_K": 64, "GROUP_SIZE_M": 8, "A_load_order": 0, "NUM_STAGES": 1, "num_warps": 4, "num_ctas": 1, "num_stages": 1}, "(1536, 3072, 1024, 64, 8, 104)": {"BLOCK_SIZE_M": 64, "BLOCK_SIZE_N": 128, "BLOCK_SIZE_K": 64, "GROUP_SIZE_M": 8, "A_load_order": 0, "NUM_STAGES": 1, "num_warps": 4, "num_ctas": 1, "num_stages": 1}, "(2048, 3072, 1024, 64, 8, 104)": {"BLOCK_SIZE_M": 64, "BLOCK_SIZE_N": 128, "BLOCK_SIZE_K": 64, "GROUP_SIZE_M": 8, "A_load_order": 0, "NUM_STAGES": 1, "num_warps": 4, "num_ctas": 1, "num_stages": 1}, "(3072, 3072, 1024, 64, 8, 104)": {"BLOCK_SIZE_M": 64, "BLOCK_SIZE_N": 128, "BLOCK_SIZE_K": 64, "GROUP_SIZE_M": 8, "A_load_order": 0, "NUM_STAGES": 1, "num_warps": 4, "num_ctas": 1, "num_stages": 1}, "(4096, 3072, 1024, 64, 8, 104)": {"BLOCK_SIZE_M": 64, "BLOCK_SIZE_N": 128, "BLOCK_SIZE_K": 64, "GROUP_SIZE_M": 8, "A_load_order": 0, "NUM_STAGES": 1, "num_warps": 4, "num_ctas": 1, "num_stages": 1}, "(96, 1024, 1024, 64, 8, 104)": {"BLOCK_SIZE_M": 64, "BLOCK_SIZE_N": 64, "BLOCK_SIZE_K": 64, "GROUP_SIZE_M": 8, "A_load_order": 0, "NUM_STAGES": 3, "num_warps": 4, "num_ctas": 1, "num_stages": 3}, "(128, 1024, 1024, 64, 8, 104)": {"BLOCK_SIZE_M": 64, "BLOCK_SIZE_N": 64, "BLOCK_SIZE_K": 64, "GROUP_SIZE_M": 8, "A_load_order": 0, "NUM_STAGES": 3, "num_warps": 4, "num_ctas": 1, "num_stages": 3}, "(192, 1024, 1024, 64, 8, 104)": {"BLOCK_SIZE_M": 64, "BLOCK_SIZE_N": 64, "BLOCK_SIZE_K": 64, "GROUP_SIZE_M": 8, "A_load_order": 0, "NUM_STAGES": 3, "num_warps": 4, "num_ctas": 1, "num_stages": 3}, "(256, 1024, 1024, 64, 8, 104)": {"BLOCK_SIZE_M": 64, "BLOCK_SIZE_N": 64, "BLOCK_SIZE_K": 32, "GROUP_SIZE_M": 8, "A_load_order": 0, "NUM_STAGES": 4, "num_warps": 4, "num_ctas": 1, "num_stages": 4}, "(384, 1024, 1024, 64, 8, 104)": {"BLOCK_SIZE_M": 64, "BLOCK_SIZE_N": 64, "BLOCK_SIZE_K": 32, "GROUP_SIZE_M": 8, "A_load_order": 0, "NUM_STAGES": 4, "num_warps": 4, "num_ctas": 1, "num_stages": 4}, "(512, 1024, 1024, 64, 8, 104)": {"BLOCK_SIZE_M": 64, "BLOCK_SIZE_N": 128, "BLOCK_SIZE_K": 32, "GROUP_SIZE_M": 8, "A_load_order": 2, "NUM_STAGES": 3, "num_warps": 8, "num_ctas": 1, "num_stages": 3}, "(768, 1024, 1024, 64, 8, 104)": {"BLOCK_SIZE_M": 64, "BLOCK_SIZE_N": 128, "BLOCK_SIZE_K": 32, "GROUP_SIZE_M": 8, "A_load_order": 2, "NUM_STAGES": 3, "num_warps": 8, "num_ctas": 1, "num_stages": 3}, "(1024, 1024, 1024, 64, 8, 104)": {"BLOCK_SIZE_M": 64, "BLOCK_SIZE_N": 128, "BLOCK_SIZE_K": 64, "GROUP_SIZE_M": 8, "A_load_order": 0, "NUM_STAGES": 1, "num_warps": 4, "num_ctas": 1, "num_stages": 1}, "(1536, 1024, 1024, 64, 8, 104)": {"BLOCK_SIZE_M": 64, "BLOCK_SIZE_N": 128, "BLOCK_SIZE_K": 64, "GROUP_SIZE_M": 8, "A_load_order": 0, "NUM_STAGES": 1, "num_warps": 4, "num_ctas": 1, "num_stages": 1}, "(2048, 1024, 1024, 64, 8, 104)": {"BLOCK_SIZE_M": 64, "BLOCK_SIZE_N": 128, "BLOCK_SIZE_K": 64, "GROUP_SIZE_M": 8, "A_load_order": 0, "NUM_STAGES": 1, "num_warps": 4, "num_ctas": 1, "num_stages": 1}, "(3072, 1024, 1024, 64, 8, 104)": {"BLOCK_SIZE_M": 64, "BLOCK_SIZE_N": 128, "BLOCK_SIZE_K": 64, "GROUP_SIZE_M": 8, "A_load_order": 0, "NUM_STAGES": 1, "num_warps": 4, "num_ctas": 1, "num_stages": 1}, "(4096, 1024, 1024, 64, 8, 104)": {"BLOCK_SIZE_M": 64, "BLOCK_SIZE_N": 128, "BLOCK_SIZE_K": 64, "GROUP_SIZE_M": 8, "A_load_order": 0, "NUM_STAGES": 1, "num_warps": 4, "num_ctas": 1, "num_stages": 1}, "(96, 1024, 4096, 64, 8, 104)": {"BLOCK_SIZE_M": 64, "BLOCK_SIZE_N": 64, "BLOCK_SIZE_K": 64, "GROUP_SIZE_M": 8, "A_load_order": 0, "NUM_STAGES": 3, "num_warps": 4, "num_ctas": 1, "num_stages": 3}, "(128, 1024, 4096, 64, 8, 104)": {"BLOCK_SIZE_M": 64, "BLOCK_SIZE_N": 64, "BLOCK_SIZE_K": 64, "GROUP_SIZE_M": 8, "A_load_order": 0, "NUM_STAGES": 3, "num_warps": 4, "num_ctas": 1, "num_stages": 3}, "(192, 1024, 4096, 64, 8, 104)": {"BLOCK_SIZE_M": 64, "BLOCK_SIZE_N": 64, "BLOCK_SIZE_K": 64, "GROUP_SIZE_M": 8, "A_load_order": 0, "NUM_STAGES": 3, "num_warps": 4, "num_ctas": 1, "num_stages": 3}, "(256, 1024, 4096, 64, 8, 104)": {"BLOCK_SIZE_M": 64, "BLOCK_SIZE_N": 64, "BLOCK_SIZE_K": 32, "GROUP_SIZE_M": 8, "A_load_order": 0, "NUM_STAGES": 4, "num_warps": 4, "num_ctas": 1, "num_stages": 4}, "(384, 1024, 4096, 64, 8, 104)": {"BLOCK_SIZE_M": 64, "BLOCK_SIZE_N": 64, "BLOCK_SIZE_K": 32, "GROUP_SIZE_M": 8, "A_load_order": 0, "NUM_STAGES": 4, "num_warps": 4, "num_ctas": 1, "num_stages": 4}, "(512, 1024, 4096, 64, 8, 104)": {"BLOCK_SIZE_M": 64, "BLOCK_SIZE_N": 128, "BLOCK_SIZE_K": 64, "GROUP_SIZE_M": 8, "A_load_order": 0, "NUM_STAGES": 1, "num_warps": 4, "num_ctas": 1, "num_stages": 1}, "(768, 1024, 4096, 64, 8, 104)": {"BLOCK_SIZE_M": 64, "BLOCK_SIZE_N": 128, "BLOCK_SIZE_K": 64, "GROUP_SIZE_M": 8, "A_load_order": 0, "NUM_STAGES": 1, "num_warps": 4, "num_ctas": 1, "num_stages": 1}, "(1024, 1024, 4096, 64, 8, 104)": {"BLOCK_SIZE_M": 64, "BLOCK_SIZE_N": 128, "BLOCK_SIZE_K": 64, "GROUP_SIZE_M": 8, "A_load_order": 0, "NUM_STAGES": 1, "num_warps": 4, "num_ctas": 1, "num_stages": 1}, "(1536, 1024, 4096, 64, 8, 104)": {"BLOCK_SIZE_M": 64, "BLOCK_SIZE_N": 128, "BLOCK_SIZE_K": 64, "GROUP_SIZE_M": 8, "A_load_order": 0, "NUM_STAGES": 1, "num_warps": 4, "num_ctas": 1, "num_stages": 1}, "(2048, 1024, 4096, 64, 8, 104)": {"BLOCK_SIZE_M": 64, "BLOCK_SIZE_N": 128, "BLOCK_SIZE_K": 64, "GROUP_SIZE_M": 8, "A_load_order": 0, "NUM_STAGES": 1, "num_warps": 4, "num_ctas": 1, "num_stages": 1}, "(3072, 1024, 4096, 64, 8, 104)": {"BLOCK_SIZE_M": 64, "BLOCK_SIZE_N": 128, "BLOCK_SIZE_K": 64, "GROUP_SIZE_M": 8, "A_load_order": 0, "NUM_STAGES": 1, "num_warps": 4, "num_ctas": 1, "num_stages": 1}, "(4096, 1024, 4096, 64, 8, 104)": {"BLOCK_SIZE_M": 64, "BLOCK_SIZE_N": 128, "BLOCK_SIZE_K": 64, "GROUP_SIZE_M": 8, "A_load_order": 0, "NUM_STAGES": 1, "num_warps": 4, "num_ctas": 1, "num_stages": 1}, "(96, 2560, 4096, 64, 8, 104)": {"BLOCK_SIZE_M": 64, "BLOCK_SIZE_N": 64, "BLOCK_SIZE_K": 32, "GROUP_SIZE_M": 8, "A_load_order": 0, "NUM_STAGES": 4, "num_warps": 4, "num_ctas": 1, "num_stages": 4}, "(128, 2560, 4096, 64, 8, 104)": {"BLOCK_SIZE_M": 64, "BLOCK_SIZE_N": 64, "BLOCK_SIZE_K": 32, "GROUP_SIZE_M": 8, "A_load_order": 0, "NUM_STAGES": 4, "num_warps": 4, "num_ctas": 1, "num_stages": 4}, "(192, 2560, 4096, 64, 8, 104)": {"BLOCK_SIZE_M": 64, "BLOCK_SIZE_N": 128, "BLOCK_SIZE_K": 64, "GROUP_SIZE_M": 8, "A_load_order": 0, "NUM_STAGES": 1, "num_warps": 4, "num_ctas": 1, "num_stages": 1}, "(256, 2560, 4096, 64, 8, 104)": {"BLOCK_SIZE_M": 64, "BLOCK_SIZE_N": 128, "BLOCK_SIZE_K": 64, "GROUP_SIZE_M": 8, "A_load_order": 0, "NUM_STAGES": 1, "num_warps": 4, "num_ctas": 1, "num_stages": 1}, "(384, 2560, 4096, 64, 8, 104)": {"BLOCK_SIZE_M": 64, "BLOCK_SIZE_N": 128, "BLOCK_SIZE_K": 64, "GROUP_SIZE_M": 8, "A_load_order": 0, "NUM_STAGES": 1, "num_warps": 4, "num_ctas": 1, "num_stages": 1}, "(512, 2560, 4096, 64, 8, 104)": {"BLOCK_SIZE_M": 64, "BLOCK_SIZE_N": 128, "BLOCK_SIZE_K": 64, "GROUP_SIZE_M": 8, "A_load_order": 0, "NUM_STAGES": 1, "num_warps": 4, "num_ctas": 1, "num_stages": 1}, "(768, 2560, 4096, 64, 8, 104)": {"BLOCK_SIZE_M": 64, "BLOCK_SIZE_N": 128, "BLOCK_SIZE_K": 64, "GROUP_SIZE_M": 8, "A_load_order": 0, "NUM_STAGES": 1, "num_warps": 4, "num_ctas": 1, "num_stages": 1}, "(1024, 2560, 4096, 64, 8, 104)": {"BLOCK_SIZE_M": 64, "BLOCK_SIZE_N": 128, "BLOCK_SIZE_K": 64, "GROUP_SIZE_M": 8, "A_load_order": 0, "NUM_STAGES": 1, "num_warps": 4, "num_ctas": 1, "num_stages": 1}, "(1536, 2560, 4096, 64, 8, 104)": {"BLOCK_SIZE_M": 64, "BLOCK_SIZE_N": 128, "BLOCK_SIZE_K": 64, "GROUP_SIZE_M": 8, "A_load_order": 0, "NUM_STAGES": 1, "num_warps": 4, "num_ctas": 1, "num_stages": 1}, "(2048, 2560, 4096, 64, 8, 104)": {"BLOCK_SIZE_M": 64, "BLOCK_SIZE_N": 128, "BLOCK_SIZE_K": 64, "GROUP_SIZE_M": 8, "A_load_order": 0, "NUM_STAGES": 1, "num_warps": 4, "num_ctas": 1, "num_stages": 1}, "(3072, 2560, 4096, 64, 8, 104)": {"BLOCK_SIZE_M": 64, "BLOCK_SIZE_N": 128, "BLOCK_SIZE_K": 64, "GROUP_SIZE_M": 8, "A_load_order": 0, "NUM_STAGES": 1, "num_warps": 4, "num_ctas": 1, "num_stages": 1}, "(4096, 2560, 4096, 64, 8, 104)": {"BLOCK_SIZE_M": 64, "BLOCK_SIZE_N": 128, "BLOCK_SIZE_K": 64, "GROUP_SIZE_M": 8, "A_load_order": 0, "NUM_STAGES": 1, "num_warps": 4, "num_ctas": 1, "num_stages": 1}, "(96, 6144, 2560, 64, 8, 104)": {"BLOCK_SIZE_M": 64, "BLOCK_SIZE_N": 128, "BLOCK_SIZE_K": 64, "GROUP_SIZE_M": 8, "A_load_order": 0, "NUM_STAGES": 1, "num_warps": 4, "num_ctas": 1, "num_stages": 1}, "(128, 6144, 2560, 64, 8, 104)": {"BLOCK_SIZE_M": 64, "BLOCK_SIZE_N": 128, "BLOCK_SIZE_K": 64, "GROUP_SIZE_M": 8, "A_load_order": 0, "NUM_STAGES": 1, "num_warps": 4, "num_ctas": 1, "num_stages": 1}, "(192, 6144, 2560, 64, 8, 104)": {"BLOCK_SIZE_M": 64, "BLOCK_SIZE_N": 128, "BLOCK_SIZE_K": 64, "GROUP_SIZE_M": 8, "A_load_order": 0, "NUM_STAGES": 1, "num_warps": 4, "num_ctas": 1, "num_stages": 1}, "(256, 6144, 2560, 64, 8, 104)": {"BLOCK_SIZE_M": 64, "BLOCK_SIZE_N": 128, "BLOCK_SIZE_K": 64, "GROUP_SIZE_M": 8, "A_load_order": 0, "NUM_STAGES": 1, "num_warps": 4, "num_ctas": 1, "num_stages": 1}, "(384, 6144, 2560, 64, 8, 104)": {"BLOCK_SIZE_M": 64, "BLOCK_SIZE_N": 128, "BLOCK_SIZE_K": 64, "GROUP_SIZE_M": 8, "A_load_order": 0, "NUM_STAGES": 1, "num_warps": 4, "num_ctas": 1, "num_stages": 1}, "(512, 6144, 2560, 64, 8, 104)": {"BLOCK_SIZE_M": 64, "BLOCK_SIZE_N": 128, "BLOCK_SIZE_K": 64, "GROUP_SIZE_M": 8, "A_load_order": 0, "NUM_STAGES": 1, "num_warps": 4, "num_ctas": 1, "num_stages": 1}, "(768, 6144, 2560, 64, 8, 104)": {"BLOCK_SIZE_M": 64, "BLOCK_SIZE_N": 128, "BLOCK_SIZE_K": 64, "GROUP_SIZE_M": 8, "A_load_order": 0, "NUM_STAGES": 1, "num_warps": 4, "num_ctas": 1, "num_stages": 1}, "(1024, 6144, 2560, 64, 8, 104)": {"BLOCK_SIZE_M": 64, "BLOCK_SIZE_N": 128, "BLOCK_SIZE_K": 64, "GROUP_SIZE_M": 8, "A_load_order": 0, "NUM_STAGES": 1, "num_warps": 4, "num_ctas": 1, "num_stages": 1}, "(1536, 6144, 2560, 64, 8, 104)": {"BLOCK_SIZE_M": 64, "BLOCK_SIZE_N": 128, "BLOCK_SIZE_K": 64, "GROUP_SIZE_M": 8, "A_load_order": 0, "NUM_STAGES": 1, "num_warps": 4, "num_ctas": 1, "num_stages": 1}, "(2048, 6144, 2560, 64, 8, 104)": {"BLOCK_SIZE_M": 64, "BLOCK_SIZE_N": 128, "BLOCK_SIZE_K": 64, "GROUP_SIZE_M": 8, "A_load_order": 0, "NUM_STAGES": 1, "num_warps": 4, "num_ctas": 1, "num_stages": 1}, "(3072, 6144, 2560, 64, 8, 104)": {"BLOCK_SIZE_M": 64, "BLOCK_SIZE_N": 128, "BLOCK_SIZE_K": 64, "GROUP_SIZE_M": 8, "A_load_order": 0, "NUM_STAGES": 1, "num_warps": 4, "num_ctas": 1, "num_stages": 1}, "(4096, 6144, 2560, 64, 8, 104)": {"BLOCK_SIZE_M": 64, "BLOCK_SIZE_N": 128, "BLOCK_SIZE_K": 64, "GROUP_SIZE_M": 8, "A_load_order": 0, "NUM_STAGES": 1, "num_warps": 4, "num_ctas": 1, "num_stages": 1}, "(96, 19456, 2560, 64, 8, 104)": {"BLOCK_SIZE_M": 64, "BLOCK_SIZE_N": 128, "BLOCK_SIZE_K": 64, "GROUP_SIZE_M": 8, "A_load_order": 0, "NUM_STAGES": 1, "num_warps": 4, "num_ctas": 1, "num_stages": 1}, "(128, 19456, 2560, 64, 8, 104)": {"BLOCK_SIZE_M": 64, "BLOCK_SIZE_N": 128, "BLOCK_SIZE_K": 64, "GROUP_SIZE_M": 8, "A_load_order": 0, "NUM_STAGES": 1, "num_warps": 4, "num_ctas": 1, "num_stages": 1}, "(192, 19456, 2560, 64, 8, 104)": {"BLOCK_SIZE_M": 64, "BLOCK_SIZE_N": 128, "BLOCK_SIZE_K": 64, "GROUP_SIZE_M": 8, "A_load_order": 0, "NUM_STAGES": 1, "num_warps": 4, "num_ctas": 1, "num_stages": 1}, "(256, 19456, 2560, 64, 8, 104)": {"BLOCK_SIZE_M": 64, "BLOCK_SIZE_N": 128, "BLOCK_SIZE_K": 64, "GROUP_SIZE_M": 8, "A_load_order": 0, "NUM_STAGES": 1, "num_warps": 4, "num_ctas": 1, "num_stages": 1}, "(384, 19456, 2560, 64, 8, 104)": {"BLOCK_SIZE_M": 64, "BLOCK_SIZE_N": 128, "BLOCK_SIZE_K": 64, "GROUP_SIZE_M": 8, "A_load_order": 0, "NUM_STAGES": 1, "num_warps": 4, "num_ctas": 1, "num_stages": 1}, "(512, 19456, 2560, 64, 8, 104)": {"BLOCK_SIZE_M": 64, "BLOCK_SIZE_N": 128, "BLOCK_SIZE_K": 64, "GROUP_SIZE_M": 8, "A_load_order": 0, "NUM_STAGES": 1, "num_warps": 4, "num_ctas": 1, "num_stages": 1}, "(768, 19456, 2560, 64, 8, 104)": {"BLOCK_SIZE_M": 64, "BLOCK_SIZE_N": 128, "BLOCK_SIZE_K": 64, "GROUP_SIZE_M": 8, "A_load_order": 0, "NUM_STAGES": 1, "num_warps": 4, "num_ctas": 1, "num_stages": 1}, "(1024, 19456, 2560, 64, 8, 104)": {"BLOCK_SIZE_M": 64, "BLOCK_SIZE_N": 128, "BLOCK_SIZE_K": 64, "GROUP_SIZE_M": 8, "A_load_order": 0, "NUM_STAGES": 1, "num_warps": 4, "num_ctas": 1, "num_stages": 1}, "(1536, 19456, 2560, 64, 8, 104)": {"BLOCK_SIZE_M": 64, "BLOCK_SIZE_N": 128, "BLOCK_SIZE_K": 64, "GROUP_SIZE_M": 8, "A_load_order": 0, "NUM_STAGES": 1, "num_warps": 4, "num_ctas": 1, "num_stages": 1}, "(2048, 19456, 2560, 64, 8, 104)": {"BLOCK_SIZE_M": 64, "BLOCK_SIZE_N": 128, "BLOCK_SIZE_K": 64, "GROUP_SIZE_M": 8, "A_load_order": 0, "NUM_STAGES": 1, "num_warps": 4, "num_ctas": 1, "num_stages": 1}, "(3072, 19456, 2560, 64, 8, 104)": {"BLOCK_SIZE_M": 64, "BLOCK_SIZE_N": 128, "BLOCK_SIZE_K": 64, "GROUP_SIZE_M": 8, "A_load_order": 0, "NUM_STAGES": 1, "num_warps": 4, "num_ctas": 1, "num_stages": 1}, "(4096, 19456, 2560, 64, 8, 104)": {"BLOCK_SIZE_M": 64, "BLOCK_SIZE_N": 128, "BLOCK_SIZE_K": 64, "GROUP_SIZE_M": 8, "A_load_order": 2, "NUM_STAGES": 1, "num_warps": 4, "num_ctas": 1, "num_stages": 1}, "(96, 2560, 9728, 64, 8, 104)": {"BLOCK_SIZE_M": 64, "BLOCK_SIZE_N": 64, "BLOCK_SIZE_K": 32, "GROUP_SIZE_M": 8, "A_load_order": 0, "NUM_STAGES": 4, "num_warps": 4, "num_ctas": 1, "num_stages": 4}, "(128, 2560, 9728, 64, 8, 104)": {"BLOCK_SIZE_M": 64, "BLOCK_SIZE_N": 64, "BLOCK_SIZE_K": 32, "GROUP_SIZE_M": 8, "A_load_order": 0, "NUM_STAGES": 4, "num_warps": 4, "num_ctas": 1, "num_stages": 4}, "(192, 2560, 9728, 64, 8, 104)": {"BLOCK_SIZE_M": 64, "BLOCK_SIZE_N": 128, "BLOCK_SIZE_K": 64, "GROUP_SIZE_M": 8, "A_load_order": 0, "NUM_STAGES": 1, "num_warps": 4, "num_ctas": 1, "num_stages": 1}, "(256, 2560, 9728, 64, 8, 104)": {"BLOCK_SIZE_M": 64, "BLOCK_SIZE_N": 128, "BLOCK_SIZE_K": 64, "GROUP_SIZE_M": 8, "A_load_order": 0, "NUM_STAGES": 1, "num_warps": 4, "num_ctas": 1, "num_stages": 1}, "(384, 2560, 9728, 64, 8, 104)": {"BLOCK_SIZE_M": 64, "BLOCK_SIZE_N": 128, "BLOCK_SIZE_K": 64, "GROUP_SIZE_M": 8, "A_load_order": 0, "NUM_STAGES": 1, "num_warps": 4, "num_ctas": 1, "num_stages": 1}, "(512, 2560, 9728, 64, 8, 104)": {"BLOCK_SIZE_M": 64, "BLOCK_SIZE_N": 128, "BLOCK_SIZE_K": 64, "GROUP_SIZE_M": 8, "A_load_order": 0, "NUM_STAGES": 1, "num_warps": 4, "num_ctas": 1, "num_stages": 1}, "(768, 2560, 9728, 64, 8, 104)": {"BLOCK_SIZE_M": 64, "BLOCK_SIZE_N": 128, "BLOCK_SIZE_K": 64, "GROUP_SIZE_M": 8, "A_load_order": 0, "NUM_STAGES": 1, "num_warps": 4, "num_ctas": 1, "num_stages": 1}, "(1024, 2560, 9728, 64, 8, 104)": {"BLOCK_SIZE_M": 64, "BLOCK_SIZE_N": 128, "BLOCK_SIZE_K": 64, "GROUP_SIZE_M": 8, "A_load_order": 0, "NUM_STAGES": 1, "num_warps": 4, "num_ctas": 1, "num_stages": 1}, "(1536, 2560, 9728, 64, 8, 104)": {"BLOCK_SIZE_M": 64, "BLOCK_SIZE_N": 128, "BLOCK_SIZE_K": 64, "GROUP_SIZE_M": 8, "A_load_order": 0, "NUM_STAGES": 1, "num_warps": 4, "num_ctas": 1, "num_stages": 1}, "(2048, 2560, 9728, 64, 8, 104)": {"BLOCK_SIZE_M": 64, "BLOCK_SIZE_N": 128, "BLOCK_SIZE_K": 64, "GROUP_SIZE_M": 8, "A_load_order": 0, "NUM_STAGES": 1, "num_warps": 4, "num_ctas": 1, "num_stages": 1}, "(3072, 2560, 9728, 64, 8, 104)": {"BLOCK_SIZE_M": 64, "BLOCK_SIZE_N": 128, "BLOCK_SIZE_K": 64, "GROUP_SIZE_M": 8, "A_load_order": 2, "NUM_STAGES": 1, "num_warps": 4, "num_ctas": 1, "num_stages": 1}, "(4096, 2560, 9728, 64, 8, 104)": {"BLOCK_SIZE_M": 64, "BLOCK_SIZE_N": 128, "BLOCK_SIZE_K": 64, "GROUP_SIZE_M": 8, "A_load_order": 2, "NUM_STAGES": 1, "num_warps": 4, "num_ctas": 1, "num_stages": 1}, "(96, 3456, 1152, 1152, 1, 108)": {"BLOCK_SIZE_M": 64, "BLOCK_SIZE_N": 64, "BLOCK_SIZE_K": 256, "GROUP_SIZE_M": 8, "A_load_order": 2, "NUM_STAGES": 2, "num_warps": 8, "num_ctas": 1, "num_stages": 2}, "(128, 3456, 1152, 1152, 1, 108)": {"BLOCK_SIZE_M": 64, "BLOCK_SIZE_N": 64, "BLOCK_SIZE_K": 256, "GROUP_SIZE_M": 8, "A_load_order": 2, "NUM_STAGES": 2, "num_warps": 8, "num_ctas": 1, "num_stages": 2}, "(192, 3456, 1152, 1152, 1, 108)": {"BLOCK_SIZE_M": 64, "BLOCK_SIZE_N": 256, "BLOCK_SIZE_K": 64, "GROUP_SIZE_M": 8, "A_load_order": 2, "NUM_STAGES": 4, "num_warps": 8, "num_ctas": 1, "num_stages": 4}, "(256, 3456, 1152, 1152, 1, 108)": {"BLOCK_SIZE_M": 64, "BLOCK_SIZE_N": 256, "BLOCK_SIZE_K": 64, "GROUP_SIZE_M": 8, "A_load_order": 2, "NUM_STAGES": 4, "num_warps": 8, "num_ctas": 1, "num_stages": 4}, "(384, 3456, 1152, 1152, 1, 108)": {"BLOCK_SIZE_M": 64, "BLOCK_SIZE_N": 128, "BLOCK_SIZE_K": 64, "GROUP_SIZE_M": 8, "A_load_order": 0, "NUM_STAGES": 5, "num_warps": 4, "num_ctas": 1, "num_stages": 5}, "(512, 3456, 1152, 1152, 1, 108)": {"BLOCK_SIZE_M": 64, "BLOCK_SIZE_N": 256, "BLOCK_SIZE_K": 64, "GROUP_SIZE_M": 8, "A_load_order": 2, "NUM_STAGES": 4, "num_warps": 8, "num_ctas": 1, "num_stages": 4}, "(768, 3456, 1152, 1152, 1, 108)": {"BLOCK_SIZE_M": 64, "BLOCK_SIZE_N": 256, "BLOCK_SIZE_K": 64, "GROUP_SIZE_M": 8, "A_load_order": 2, "NUM_STAGES": 4, "num_warps": 8, "num_ctas": 1, "num_stages": 4}, "(1024, 3456, 1152, 1152, 1, 108)": {"BLOCK_SIZE_M": 64, "BLOCK_SIZE_N": 256, "BLOCK_SIZE_K": 64, "GROUP_SIZE_M": 8, "A_load_order": 2, "NUM_STAGES": 4, "num_warps": 8, "num_ctas": 1, "num_stages": 4}, "(1536, 3456, 1152, 1152, 1, 108)": {"BLOCK_SIZE_M": 64, "BLOCK_SIZE_N": 256, "BLOCK_SIZE_K": 64, "GROUP_SIZE_M": 8, "A_load_order": 2, "NUM_STAGES": 4, "num_warps": 8, "num_ctas": 1, "num_stages": 4}, "(2048, 3456, 1152, 1152, 1, 108)": {"BLOCK_SIZE_M": 64, "BLOCK_SIZE_N": 256, "BLOCK_SIZE_K": 64, "GROUP_SIZE_M": 8, "A_load_order": 2, "NUM_STAGES": 4, "num_warps": 8, "num_ctas": 1, "num_stages": 4}, "(3072, 3456, 1152, 1152, 1, 108)": {"BLOCK_SIZE_M": 64, "BLOCK_SIZE_N": 256, "BLOCK_SIZE_K": 64, "GROUP_SIZE_M": 8, "A_load_order": 2, "NUM_STAGES": 4, "num_warps": 8, "num_ctas": 1, "num_stages": 4}, "(4096, 3456, 1152, 1152, 1, 108)": {"BLOCK_SIZE_M": 64, "BLOCK_SIZE_N": 128, "BLOCK_SIZE_K": 32, "GROUP_SIZE_M": 8, "A_load_order": 2, "NUM_STAGES": 5, "num_warps": 8, "num_ctas": 1, "num_stages": 5}, "(96, 1152, 1152, 1152, 1, 108)": {"BLOCK_SIZE_M": 64, "BLOCK_SIZE_N": 64, "BLOCK_SIZE_K": 128, "GROUP_SIZE_M": 8, "A_load_order": 0, "NUM_STAGES": 4, "num_warps": 8, "num_ctas": 1, "num_stages": 4}, "(128, 1152, 1152, 1152, 1, 108)": {"BLOCK_SIZE_M": 64, "BLOCK_SIZE_N": 64, "BLOCK_SIZE_K": 128, "GROUP_SIZE_M": 8, "A_load_order": 0, "NUM_STAGES": 4, "num_warps": 8, "num_ctas": 1, "num_stages": 4}, "(192, 1152, 1152, 1152, 1, 108)": {"BLOCK_SIZE_M": 64, "BLOCK_SIZE_N": 64, "BLOCK_SIZE_K": 128, "GROUP_SIZE_M": 8, "A_load_order": 0, "NUM_STAGES": 4, "num_warps": 8, "num_ctas": 1, "num_stages": 4}, "(256, 1152, 1152, 1152, 1, 108)": {"BLOCK_SIZE_M": 64, "BLOCK_SIZE_N": 128, "BLOCK_SIZE_K": 64, "GROUP_SIZE_M": 8, "A_load_order": 0, "NUM_STAGES": 5, "num_warps": 4, "num_ctas": 1, "num_stages": 5}, "(384, 1152, 1152, 1152, 1, 108)": {"BLOCK_SIZE_M": 64, "BLOCK_SIZE_N": 128, "BLOCK_SIZE_K": 64, "GROUP_SIZE_M": 8, "A_load_order": 0, "NUM_STAGES": 5, "num_warps": 4, "num_ctas": 1, "num_stages": 5}, "(512, 1152, 1152, 1152, 1, 108)": {"BLOCK_SIZE_M": 64, "BLOCK_SIZE_N": 256, "BLOCK_SIZE_K": 64, "GROUP_SIZE_M": 8, "A_load_order": 2, "NUM_STAGES": 4, "num_warps": 8, "num_ctas": 1, "num_stages": 4}, "(768, 1152, 1152, 1152, 1, 108)": {"BLOCK_SIZE_M": 64, "BLOCK_SIZE_N": 128, "BLOCK_SIZE_K": 64, "GROUP_SIZE_M": 8, "A_load_order": 0, "NUM_STAGES": 5, "num_warps": 4, "num_ctas": 1, "num_stages": 5}, "(1024, 1152, 1152, 1152, 1, 108)": {"BLOCK_SIZE_M": 64, "BLOCK_SIZE_N": 64, "BLOCK_SIZE_K": 32, "GROUP_SIZE_M": 8, "A_load_order": 0, "NUM_STAGES": 4, "num_warps": 4, "num_ctas": 1, "num_stages": 4}, "(1536, 1152, 1152, 1152, 1, 108)": {"BLOCK_SIZE_M": 64, "BLOCK_SIZE_N": 128, "BLOCK_SIZE_K": 32, "GROUP_SIZE_M": 8, "A_load_order": 2, "NUM_STAGES": 5, "num_warps": 8, "num_ctas": 1, "num_stages": 5}, "(2048, 1152, 1152, 1152, 1, 108)": {"BLOCK_SIZE_M": 64, "BLOCK_SIZE_N": 256, "BLOCK_SIZE_K": 64, "GROUP_SIZE_M": 8, "A_load_order": 2, "NUM_STAGES": 4, "num_warps": 8, "num_ctas": 1, "num_stages": 4}, "(3072, 1152, 1152, 1152, 1, 108)": {"BLOCK_SIZE_M": 64, "BLOCK_SIZE_N": 64, "BLOCK_SIZE_K": 64, "GROUP_SIZE_M": 8, "A_load_order": 0, "NUM_STAGES": 4, "num_warps": 4, "num_ctas": 1, "num_stages": 4}, "(4096, 1152, 1152, 1152, 1, 108)": {"BLOCK_SIZE_M": 64, "BLOCK_SIZE_N": 128, "BLOCK_SIZE_K": 32, "GROUP_SIZE_M": 8, "A_load_order": 2, "NUM_STAGES": 5, "num_warps": 8, "num_ctas": 1, "num_stages": 5}, "(96, 3456, 1152, 1152, 1, 308)": {"BLOCK_SIZE_M": 64, "BLOCK_SIZE_N": 128, "BLOCK_SIZE_K": 128, "GROUP_SIZE_M": 8, "A_load_order": 2, "NUM_STAGES": 4, "num_warps": 4, "num_ctas": 1, "num_stages": 4}, "(128, 3456, 1152, 1152, 1, 308)": {"BLOCK_SIZE_M": 64, "BLOCK_SIZE_N": 128, "BLOCK_SIZE_K": 128, "GROUP_SIZE_M": 8, "A_load_order": 2, "NUM_STAGES": 4, "num_warps": 4, "num_ctas": 1, "num_stages": 4}, "(192, 3456, 1152, 1152, 1, 308)": {"BLOCK_SIZE_M": 64, "BLOCK_SIZE_N": 128, "BLOCK_SIZE_K": 256, "GROUP_SIZE_M": 8, "A_load_order": 0, "NUM_STAGES": 2, "num_warps": 4, "num_ctas": 1, "num_stages": 2}, "(256, 3456, 1152, 1152, 1, 308)": {"BLOCK_SIZE_M": 64, "BLOCK_SIZE_N": 128, "BLOCK_SIZE_K": 256, "GROUP_SIZE_M": 8, "A_load_order": 0, "NUM_STAGES": 2, "num_warps": 4, "num_ctas": 1, "num_stages": 2}, "(384, 3456, 1152, 1152, 1, 308)": {"BLOCK_SIZE_M": 64, "BLOCK_SIZE_N": 128, "BLOCK_SIZE_K": 64, "GROUP_SIZE_M": 8, "A_load_order": 0, "NUM_STAGES": 5, "num_warps": 4, "num_ctas": 1, "num_stages": 5}, "(512, 3456, 1152, 1152, 1, 308)": {"BLOCK_SIZE_M": 64, "BLOCK_SIZE_N": 128, "BLOCK_SIZE_K": 64, "GROUP_SIZE_M": 8, "A_load_order": 0, "NUM_STAGES": 5, "num_warps": 4, "num_ctas": 1, "num_stages": 5}, "(768, 3456, 1152, 1152, 1, 308)": {"BLOCK_SIZE_M": 64, "BLOCK_SIZE_N": 128, "BLOCK_SIZE_K": 64, "GROUP_SIZE_M": 8, "A_load_order": 0, "NUM_STAGES": 5, "num_warps": 4, "num_ctas": 1, "num_stages": 5}, "(1024, 3456, 1152, 1152, 1, 308)": {"BLOCK_SIZE_M": 64, "BLOCK_SIZE_N": 128, "BLOCK_SIZE_K": 256, "GROUP_SIZE_M": 8, "A_load_order": 0, "NUM_STAGES": 2, "num_warps": 4, "num_ctas": 1, "num_stages": 2}, "(1536, 3456, 1152, 1152, 1, 308)": {"BLOCK_SIZE_M": 64, "BLOCK_SIZE_N": 128, "BLOCK_SIZE_K": 64, "GROUP_SIZE_M": 8, "A_load_order": 0, "NUM_STAGES": 5, "num_warps": 4, "num_ctas": 1, "num_stages": 5}, "(2048, 3456, 1152, 1152, 1, 308)": {"BLOCK_SIZE_M": 64, "BLOCK_SIZE_N": 128, "BLOCK_SIZE_K": 64, "GROUP_SIZE_M": 8, "A_load_order": 0, "NUM_STAGES": 5, "num_warps": 4, "num_ctas": 1, "num_stages": 5}, "(3072, 3456, 1152, 1152, 1, 308)": {"BLOCK_SIZE_M": 64, "BLOCK_SIZE_N": 128, "BLOCK_SIZE_K": 64, "GROUP_SIZE_M": 8, "A_load_order": 0, "NUM_STAGES": 5, "num_warps": 4, "num_ctas": 1, "num_stages": 5}, "(4096, 3456, 1152, 1152, 1, 308)": {"BLOCK_SIZE_M": 64, "BLOCK_SIZE_N": 128, "BLOCK_SIZE_K": 64, "GROUP_SIZE_M": 8, "A_load_order": 0, "NUM_STAGES": 5, "num_warps": 4, "num_ctas": 1, "num_stages": 5}, "(96, 1152, 1152, 1152, 1, 308)": {"BLOCK_SIZE_M": 64, "BLOCK_SIZE_N": 32, "BLOCK_SIZE_K": 128, "GROUP_SIZE_M": 8, "A_load_order": 2, "NUM_STAGES": 4, "num_warps": 8, "num_ctas": 1, "num_stages": 4}, "(128, 1152, 1152, 1152, 1, 308)": {"BLOCK_SIZE_M": 64, "BLOCK_SIZE_N": 64, "BLOCK_SIZE_K": 256, "GROUP_SIZE_M": 8, "A_load_order": 2, "NUM_STAGES": 3, "num_warps": 8, "num_ctas": 1, "num_stages": 3}, "(192, 1152, 1152, 1152, 1, 308)": {"BLOCK_SIZE_M": 64, "BLOCK_SIZE_N": 32, "BLOCK_SIZE_K": 128, "GROUP_SIZE_M": 8, "A_load_order": 2, "NUM_STAGES": 4, "num_warps": 8, "num_ctas": 1, "num_stages": 4}, "(256, 1152, 1152, 1152, 1, 308)": {"BLOCK_SIZE_M": 64, "BLOCK_SIZE_N": 128, "BLOCK_SIZE_K": 128, "GROUP_SIZE_M": 8, "A_load_order": 2, "NUM_STAGES": 4, "num_warps": 4, "num_ctas": 1, "num_stages": 4}, "(384, 1152, 1152, 1152, 1, 308)": {"BLOCK_SIZE_M": 64, "BLOCK_SIZE_N": 128, "BLOCK_SIZE_K": 128, "GROUP_SIZE_M": 8, "A_load_order": 2, "NUM_STAGES": 4, "num_warps": 4, "num_ctas": 1, "num_stages": 4}, "(512, 1152, 1152, 1152, 1, 308)": {"BLOCK_SIZE_M": 64, "BLOCK_SIZE_N": 128, "BLOCK_SIZE_K": 64, "GROUP_SIZE_M": 8, "A_load_order": 0, "NUM_STAGES": 5, "num_warps": 4, "num_ctas": 1, "num_stages": 5}, "(768, 1152, 1152, 1152, 1, 308)": {"BLOCK_SIZE_M": 64, "BLOCK_SIZE_N": 128, "BLOCK_SIZE_K": 64, "GROUP_SIZE_M": 8, "A_load_order": 0, "NUM_STAGES": 5, "num_warps": 4, "num_ctas": 1, "num_stages": 5}, "(1024, 1152, 1152, 1152, 1, 308)": {"BLOCK_SIZE_M": 64, "BLOCK_SIZE_N": 128, "BLOCK_SIZE_K": 64, "GROUP_SIZE_M": 8, "A_load_order": 0, "NUM_STAGES": 5, "num_warps": 4, "num_ctas": 1, "num_stages": 5}, "(1536, 1152, 1152, 1152, 1, 308)": {"BLOCK_SIZE_M": 64, "BLOCK_SIZE_N": 128, "BLOCK_SIZE_K": 256, "GROUP_SIZE_M": 8, "A_load_order": 0, "NUM_STAGES": 2, "num_warps": 4, "num_ctas": 1, "num_stages": 2}, "(2048, 1152, 1152, 1152, 1, 308)": {"BLOCK_SIZE_M": 64, "BLOCK_SIZE_N": 128, "BLOCK_SIZE_K": 64, "GROUP_SIZE_M": 8, "A_load_order": 0, "NUM_STAGES": 5, "num_warps": 4, "num_ctas": 1, "num_stages": 5}, "(3072, 1152, 1152, 1152, 1, 308)": {"BLOCK_SIZE_M": 64, "BLOCK_SIZE_N": 128, "BLOCK_SIZE_K": 64, "GROUP_SIZE_M": 8, "A_load_order": 0, "NUM_STAGES": 5, "num_warps": 4, "num_ctas": 1, "num_stages": 5}, "(4096, 1152, 1152, 1152, 1, 308)": {"BLOCK_SIZE_M": 64, "BLOCK_SIZE_N": 128, "BLOCK_SIZE_K": 64, "GROUP_SIZE_M": 8, "A_load_order": 0, "NUM_STAGES": 5, "num_warps": 4, "num_ctas": 1, "num_stages": 5}, "(96, 1152, 4304, 4304, 1, 308)": {"BLOCK_SIZE_M": 64, "BLOCK_SIZE_N": 64, "BLOCK_SIZE_K": 256, "GROUP_SIZE_M": 8, "A_load_order": 2, "NUM_STAGES": 3, "num_warps": 8, "num_ctas": 1, "num_stages": 3}, "(128, 1152, 4304, 4304, 1, 308)": {"BLOCK_SIZE_M": 64, "BLOCK_SIZE_N": 64, "BLOCK_SIZE_K": 128, "GROUP_SIZE_M": 8, "A_load_order": 0, "NUM_STAGES": 5, "num_warps": 8, "num_ctas": 1, "num_stages": 5}, "(192, 1152, 4304, 4304, 1, 308)": {"BLOCK_SIZE_M": 64, "BLOCK_SIZE_N": 64, "BLOCK_SIZE_K": 256, "GROUP_SIZE_M": 8, "A_load_order": 2, "NUM_STAGES": 3, "num_warps": 8, "num_ctas": 1, "num_stages": 3}, "(256, 1152, 4304, 4304, 1, 308)": {"BLOCK_SIZE_M": 64, "BLOCK_SIZE_N": 128, "BLOCK_SIZE_K": 128, "GROUP_SIZE_M": 8, "A_load_order": 2, "NUM_STAGES": 4, "num_warps": 4, "num_ctas": 1, "num_stages": 4}, "(384, 1152, 4304, 4304, 1, 308)": {"BLOCK_SIZE_M": 64, "BLOCK_SIZE_N": 128, "BLOCK_SIZE_K": 128, "GROUP_SIZE_M": 8, "A_load_order": 2, "NUM_STAGES": 4, "num_warps": 4, "num_ctas": 1, "num_stages": 4}, "(512, 1152, 4304, 4304, 1, 308)": {"BLOCK_SIZE_M": 64, "BLOCK_SIZE_N": 128, "BLOCK_SIZE_K": 256, "GROUP_SIZE_M": 8, "A_load_order": 0, "NUM_STAGES": 2, "num_warps": 4, "num_ctas": 1, "num_stages": 2}, "(768, 1152, 4304, 4304, 1, 308)": {"BLOCK_SIZE_M": 64, "BLOCK_SIZE_N": 128, "BLOCK_SIZE_K": 128, "GROUP_SIZE_M": 8, "A_load_order": 2, "NUM_STAGES": 4, "num_warps": 4, "num_ctas": 1, "num_stages": 4}, "(1024, 1152, 4304, 4304, 1, 308)": {"BLOCK_SIZE_M": 64, "BLOCK_SIZE_N": 128, "BLOCK_SIZE_K": 128, "GROUP_SIZE_M": 8, "A_load_order": 2, "NUM_STAGES": 4, "num_warps": 4, "num_ctas": 1, "num_stages": 4}, "(1536, 1152, 4304, 4304, 1, 308)": {"BLOCK_SIZE_M": 64, "BLOCK_SIZE_N": 128, "BLOCK_SIZE_K": 128, "GROUP_SIZE_M": 8, "A_load_order": 2, "NUM_STAGES": 4, "num_warps": 4, "num_ctas": 1, "num_stages": 4}, "(2048, 1152, 4304, 4304, 1, 308)": {"BLOCK_SIZE_M": 64, "BLOCK_SIZE_N": 128, "BLOCK_SIZE_K": 128, "GROUP_SIZE_M": 8, "A_load_order": 2, "NUM_STAGES": 4, "num_warps": 4, "num_ctas": 1, "num_stages": 4}, "(3072, 1152, 4304, 4304, 1, 308)": {"BLOCK_SIZE_M": 64, "BLOCK_SIZE_N": 128, "BLOCK_SIZE_K": 128, "GROUP_SIZE_M": 8, "A_load_order": 2, "NUM_STAGES": 4, "num_warps": 4, "num_ctas": 1, "num_stages": 4}, "(4096, 1152, 4304, 4304, 1, 308)": {"BLOCK_SIZE_M": 64, "BLOCK_SIZE_N": 128, "BLOCK_SIZE_K": 128, "GROUP_SIZE_M": 8, "A_load_order": 2, "NUM_STAGES": 4, "num_warps": 4, "num_ctas": 1, "num_stages": 4}, "(96, 4096, 4608, 4608, 1, 308)": {"BLOCK_SIZE_M": 64, "BLOCK_SIZE_N": 128, "BLOCK_SIZE_K": 256, "GROUP_SIZE_M": 8, "A_load_order": 0, "NUM_STAGES": 2, "num_warps": 4, "num_ctas": 1, "num_stages": 2}, "(128, 4096, 4608, 4608, 1, 308)": {"BLOCK_SIZE_M": 64, "BLOCK_SIZE_N": 128, "BLOCK_SIZE_K": 256, "GROUP_SIZE_M": 8, "A_load_order": 0, "NUM_STAGES": 2, "num_warps": 4, "num_ctas": 1, "num_stages": 2}, "(192, 4096, 4608, 4608, 1, 308)": {"BLOCK_SIZE_M": 64, "BLOCK_SIZE_N": 128, "BLOCK_SIZE_K": 256, "GROUP_SIZE_M": 8, "A_load_order": 0, "NUM_STAGES": 2, "num_warps": 4, "num_ctas": 1, "num_stages": 2}, "(256, 4096, 4608, 4608, 1, 308)": {"BLOCK_SIZE_M": 64, "BLOCK_SIZE_N": 64, "BLOCK_SIZE_K": 256, "GROUP_SIZE_M": 8, "A_load_order": 2, "NUM_STAGES": 3, "num_warps": 8, "num_ctas": 1, "num_stages": 3}, "(384, 4096, 4608, 4608, 1, 308)": {"BLOCK_SIZE_M": 64, "BLOCK_SIZE_N": 128, "BLOCK_SIZE_K": 256, "GROUP_SIZE_M": 8, "A_load_order": 0, "NUM_STAGES": 2, "num_warps": 4, "num_ctas": 1, "num_stages": 2}, "(512, 4096, 4608, 4608, 1, 308)": {"BLOCK_SIZE_M": 64, "BLOCK_SIZE_N": 128, "BLOCK_SIZE_K": 128, "GROUP_SIZE_M": 8, "A_load_order": 2, "NUM_STAGES": 4, "num_warps": 4, "num_ctas": 1, "num_stages": 4}, "(768, 4096, 4608, 4608, 1, 308)": {"BLOCK_SIZE_M": 64, "BLOCK_SIZE_N": 128, "BLOCK_SIZE_K": 256, "GROUP_SIZE_M": 8, "A_load_order": 0, "NUM_STAGES": 2, "num_warps": 4, "num_ctas": 1, "num_stages": 2}, "(1024, 4096, 4608, 4608, 1, 308)": {"BLOCK_SIZE_M": 64, "BLOCK_SIZE_N": 128, "BLOCK_SIZE_K": 256, "GROUP_SIZE_M": 8, "A_load_order": 0, "NUM_STAGES": 2, "num_warps": 4, "num_ctas": 1, "num_stages": 2}, "(1536, 4096, 4608, 4608, 1, 308)": {"BLOCK_SIZE_M": 64, "BLOCK_SIZE_N": 128, "BLOCK_SIZE_K": 256, "GROUP_SIZE_M": 8, "A_load_order": 0, "NUM_STAGES": 2, "num_warps": 4, "num_ctas": 1, "num_stages": 2}, "(2048, 4096, 4608, 4608, 1, 308)": {"BLOCK_SIZE_M": 64, "BLOCK_SIZE_N": 128, "BLOCK_SIZE_K": 256, "GROUP_SIZE_M": 8, "A_load_order": 0, "NUM_STAGES": 2, "num_warps": 4, "num_ctas": 1, "num_stages": 2}, "(3072, 4096, 4608, 4608, 1, 308)": {"BLOCK_SIZE_M": 64, "BLOCK_SIZE_N": 128, "BLOCK_SIZE_K": 256, "GROUP_SIZE_M": 8, "A_load_order": 0, "NUM_STAGES": 2, "num_warps": 4, "num_ctas": 1, "num_stages": 2}, "(4096, 4096, 4608, 4608, 1, 308)": {"BLOCK_SIZE_M": 64, "BLOCK_SIZE_N": 128, "BLOCK_SIZE_K": 256, "GROUP_SIZE_M": 8, "A_load_order": 0, "NUM_STAGES": 2, "num_warps": 4, "num_ctas": 1, "num_stages": 2}, "(96, 6144, 4096, 4096, 1, 308)": {"BLOCK_SIZE_M": 64, "BLOCK_SIZE_N": 128, "BLOCK_SIZE_K": 256, "GROUP_SIZE_M": 8, "A_load_order": 0, "NUM_STAGES": 2, "num_warps": 4, "num_ctas": 1, "num_stages": 2}, "(128, 6144, 4096, 4096, 1, 308)": {"BLOCK_SIZE_M": 64, "BLOCK_SIZE_N": 128, "BLOCK_SIZE_K": 256, "GROUP_SIZE_M": 8, "A_load_order": 0, "NUM_STAGES": 2, "num_warps": 4, "num_ctas": 1, "num_stages": 2}, "(192, 6144, 4096, 4096, 1, 308)": {"BLOCK_SIZE_M": 64, "BLOCK_SIZE_N": 64, "BLOCK_SIZE_K": 256, "GROUP_SIZE_M": 8, "A_load_order": 2, "NUM_STAGES": 3, "num_warps": 8, "num_ctas": 1, "num_stages": 3}, "(256, 6144, 4096, 4096, 1, 308)": {"BLOCK_SIZE_M": 64, "BLOCK_SIZE_N": 128, "BLOCK_SIZE_K": 256, "GROUP_SIZE_M": 8, "A_load_order": 0, "NUM_STAGES": 2, "num_warps": 4, "num_ctas": 1, "num_stages": 2}, "(384, 6144, 4096, 4096, 1, 308)": {"BLOCK_SIZE_M": 64, "BLOCK_SIZE_N": 128, "BLOCK_SIZE_K": 256, "GROUP_SIZE_M": 8, "A_load_order": 0, "NUM_STAGES": 2, "num_warps": 4, "num_ctas": 1, "num_stages": 2}, "(512, 6144, 4096, 4096, 1, 308)": {"BLOCK_SIZE_M": 64, "BLOCK_SIZE_N": 128, "BLOCK_SIZE_K": 256, "GROUP_SIZE_M": 8, "A_load_order": 0, "NUM_STAGES": 2, "num_warps": 4, "num_ctas": 1, "num_stages": 2}, "(768, 6144, 4096, 4096, 1, 308)": {"BLOCK_SIZE_M": 64, "BLOCK_SIZE_N": 128, "BLOCK_SIZE_K": 256, "GROUP_SIZE_M": 8, "A_load_order": 0, "NUM_STAGES": 2, "num_warps": 4, "num_ctas": 1, "num_stages": 2}, "(1024, 6144, 4096, 4096, 1, 308)": {"BLOCK_SIZE_M": 64, "BLOCK_SIZE_N": 128, "BLOCK_SIZE_K": 256, "GROUP_SIZE_M": 8, "A_load_order": 0, "NUM_STAGES": 2, "num_warps": 4, "num_ctas": 1, "num_stages": 2}, "(1536, 6144, 4096, 4096, 1, 308)": {"BLOCK_SIZE_M": 64, "BLOCK_SIZE_N": 128, "BLOCK_SIZE_K": 256, "GROUP_SIZE_M": 8, "A_load_order": 0, "NUM_STAGES": 2, "num_warps": 4, "num_ctas": 1, "num_stages": 2}, "(2048, 6144, 4096, 4096, 1, 308)": {"BLOCK_SIZE_M": 64, "BLOCK_SIZE_N": 128, "BLOCK_SIZE_K": 256, "GROUP_SIZE_M": 8, "A_load_order": 0, "NUM_STAGES": 2, "num_warps": 4, "num_ctas": 1, "num_stages": 2}, "(3072, 6144, 4096, 4096, 1, 308)": {"BLOCK_SIZE_M": 64, "BLOCK_SIZE_N": 128, "BLOCK_SIZE_K": 256, "GROUP_SIZE_M": 8, "A_load_order": 0, "NUM_STAGES": 2, "num_warps": 4, "num_ctas": 1, "num_stages": 2}, "(4096, 6144, 4096, 4096, 1, 308)": {"BLOCK_SIZE_M": 64, "BLOCK_SIZE_N": 128, "BLOCK_SIZE_K": 256, "GROUP_SIZE_M": 8, "A_load_order": 0, "NUM_STAGES": 2, "num_warps": 4, "num_ctas": 1, "num_stages": 2}, "(96, 4096, 4096, 4096, 1, 308)": {"BLOCK_SIZE_M": 64, "BLOCK_SIZE_N": 128, "BLOCK_SIZE_K": 256, "GROUP_SIZE_M": 8, "A_load_order": 0, "NUM_STAGES": 2, "num_warps": 4, "num_ctas": 1, "num_stages": 2}, "(128, 4096, 4096, 4096, 1, 308)": {"BLOCK_SIZE_M": 64, "BLOCK_SIZE_N": 128, "BLOCK_SIZE_K": 256, "GROUP_SIZE_M": 8, "A_load_order": 0, "NUM_STAGES": 2, "num_warps": 4, "num_ctas": 1, "num_stages": 2}, "(192, 4096, 4096, 4096, 1, 308)": {"BLOCK_SIZE_M": 64, "BLOCK_SIZE_N": 128, "BLOCK_SIZE_K": 256, "GROUP_SIZE_M": 8, "A_load_order": 0, "NUM_STAGES": 2, "num_warps": 4, "num_ctas": 1, "num_stages": 2}, "(256, 4096, 4096, 4096, 1, 308)": {"BLOCK_SIZE_M": 64, "BLOCK_SIZE_N": 64, "BLOCK_SIZE_K": 256, "GROUP_SIZE_M": 8, "A_load_order": 2, "NUM_STAGES": 3, "num_warps": 8, "num_ctas": 1, "num_stages": 3}, "(384, 4096, 4096, 4096, 1, 308)": {"BLOCK_SIZE_M": 64, "BLOCK_SIZE_N": 128, "BLOCK_SIZE_K": 256, "GROUP_SIZE_M": 8, "A_load_order": 0, "NUM_STAGES": 2, "num_warps": 4, "num_ctas": 1, "num_stages": 2}, "(512, 4096, 4096, 4096, 1, 308)": {"BLOCK_SIZE_M": 64, "BLOCK_SIZE_N": 128, "BLOCK_SIZE_K": 256, "GROUP_SIZE_M": 8, "A_load_order": 0, "NUM_STAGES": 2, "num_warps": 4, "num_ctas": 1, "num_stages": 2}, "(768, 4096, 4096, 4096, 1, 308)": {"BLOCK_SIZE_M": 64, "BLOCK_SIZE_N": 128, "BLOCK_SIZE_K": 256, "GROUP_SIZE_M": 8, "A_load_order": 0, "NUM_STAGES": 2, "num_warps": 4, "num_ctas": 1, "num_stages": 2}, "(1024, 4096, 4096, 4096, 1, 308)": {"BLOCK_SIZE_M": 64, "BLOCK_SIZE_N": 128, "BLOCK_SIZE_K": 256, "GROUP_SIZE_M": 8, "A_load_order": 0, "NUM_STAGES": 2, "num_warps": 4, "num_ctas": 1, "num_stages": 2}, "(1536, 4096, 4096, 4096, 1, 308)": {"BLOCK_SIZE_M": 64, "BLOCK_SIZE_N": 128, "BLOCK_SIZE_K": 256, "GROUP_SIZE_M": 8, "A_load_order": 0, "NUM_STAGES": 2, "num_warps": 4, "num_ctas": 1, "num_stages": 2}, "(2048, 4096, 4096, 4096, 1, 308)": {"BLOCK_SIZE_M": 64, "BLOCK_SIZE_N": 128, "BLOCK_SIZE_K": 256, "GROUP_SIZE_M": 8, "A_load_order": 0, "NUM_STAGES": 2, "num_warps": 4, "num_ctas": 1, "num_stages": 2}, "(3072, 4096, 4096, 4096, 1, 308)": {"BLOCK_SIZE_M": 64, "BLOCK_SIZE_N": 128, "BLOCK_SIZE_K": 256, "GROUP_SIZE_M": 8, "A_load_order": 0, "NUM_STAGES": 2, "num_warps": 4, "num_ctas": 1, "num_stages": 2}, "(4096, 4096, 4096, 4096, 1, 308)": {"BLOCK_SIZE_M": 64, "BLOCK_SIZE_N": 128, "BLOCK_SIZE_K": 256, "GROUP_SIZE_M": 8, "A_load_order": 0, "NUM_STAGES": 2, "num_warps": 4, "num_ctas": 1, "num_stages": 2}, "(96, 24576, 4096, 4096, 1, 308)": {"BLOCK_SIZE_M": 64, "BLOCK_SIZE_N": 64, "BLOCK_SIZE_K": 256, "GROUP_SIZE_M": 8, "A_load_order": 2, "NUM_STAGES": 3, "num_warps": 8, "num_ctas": 1, "num_stages": 3}, "(128, 24576, 4096, 4096, 1, 308)": {"BLOCK_SIZE_M": 64, "BLOCK_SIZE_N": 64, "BLOCK_SIZE_K": 256, "GROUP_SIZE_M": 8, "A_load_order": 2, "NUM_STAGES": 3, "num_warps": 8, "num_ctas": 1, "num_stages": 3}, "(192, 24576, 4096, 4096, 1, 308)": {"BLOCK_SIZE_M": 64, "BLOCK_SIZE_N": 128, "BLOCK_SIZE_K": 256, "GROUP_SIZE_M": 8, "A_load_order": 0, "NUM_STAGES": 2, "num_warps": 4, "num_ctas": 1, "num_stages": 2}, "(256, 24576, 4096, 4096, 1, 308)": {"BLOCK_SIZE_M": 64, "BLOCK_SIZE_N": 128, "BLOCK_SIZE_K": 256, "GROUP_SIZE_M": 8, "A_load_order": 0, "NUM_STAGES": 2, "num_warps": 4, "num_ctas": 1, "num_stages": 2}, "(384, 24576, 4096, 4096, 1, 308)": {"BLOCK_SIZE_M": 64, "BLOCK_SIZE_N": 128, "BLOCK_SIZE_K": 256, "GROUP_SIZE_M": 8, "A_load_order": 0, "NUM_STAGES": 2, "num_warps": 4, "num_ctas": 1, "num_stages": 2}, "(512, 24576, 4096, 4096, 1, 308)": {"BLOCK_SIZE_M": 64, "BLOCK_SIZE_N": 128, "BLOCK_SIZE_K": 256, "GROUP_SIZE_M": 8, "A_load_order": 0, "NUM_STAGES": 2, "num_warps": 4, "num_ctas": 1, "num_stages": 2}, "(768, 24576, 4096, 4096, 1, 308)": {"BLOCK_SIZE_M": 64, "BLOCK_SIZE_N": 128, "BLOCK_SIZE_K": 256, "GROUP_SIZE_M": 8, "A_load_order": 0, "NUM_STAGES": 2, "num_warps": 4, "num_ctas": 1, "num_stages": 2}, "(1024, 24576, 4096, 4096, 1, 308)": {"BLOCK_SIZE_M": 64, "BLOCK_SIZE_N": 128, "BLOCK_SIZE_K": 256, "GROUP_SIZE_M": 8, "A_load_order": 0, "NUM_STAGES": 2, "num_warps": 4, "num_ctas": 1, "num_stages": 2}, "(1536, 24576, 4096, 4096, 1, 308)": {"BLOCK_SIZE_M": 64, "BLOCK_SIZE_N": 128, "BLOCK_SIZE_K": 256, "GROUP_SIZE_M": 8, "A_load_order": 0, "NUM_STAGES": 2, "num_warps": 4, "num_ctas": 1, "num_stages": 2}, "(2048, 24576, 4096, 4096, 1, 308)": {"BLOCK_SIZE_M": 64, "BLOCK_SIZE_N": 128, "BLOCK_SIZE_K": 256, "GROUP_SIZE_M": 8, "A_load_order": 0, "NUM_STAGES": 2, "num_warps": 4, "num_ctas": 1, "num_stages": 2}, "(3072, 24576, 4096, 4096, 1, 308)": {"BLOCK_SIZE_M": 64, "BLOCK_SIZE_N": 128, "BLOCK_SIZE_K": 128, "GROUP_SIZE_M": 8, "A_load_order": 2, "NUM_STAGES": 4, "num_warps": 4, "num_ctas": 1, "num_stages": 4}, "(4096, 24576, 4096, 4096, 1, 308)": {"BLOCK_SIZE_M": 64, "BLOCK_SIZE_N": 128, "BLOCK_SIZE_K": 256, "GROUP_SIZE_M": 8, "A_load_order": 0, "NUM_STAGES": 2, "num_warps": 4, "num_ctas": 1, "num_stages": 2}, "(96, 4096, 12288, 12288, 1, 308)": {"BLOCK_SIZE_M": 64, "BLOCK_SIZE_N": 32, "BLOCK_SIZE_K": 256, "GROUP_SIZE_M": 8, "A_load_order": 0, "NUM_STAGES": 4, "num_warps": 4, "num_ctas": 1, "num_stages": 4}, "(128, 4096, 12288, 12288, 1, 308)": {"BLOCK_SIZE_M": 64, "BLOCK_SIZE_N": 32, "BLOCK_SIZE_K": 256, "GROUP_SIZE_M": 8, "A_load_order": 0, "NUM_STAGES": 4, "num_warps": 4, "num_ctas": 1, "num_stages": 4}, "(192, 4096, 12288, 12288, 1, 308)": {"BLOCK_SIZE_M": 64, "BLOCK_SIZE_N": 128, "BLOCK_SIZE_K": 256, "GROUP_SIZE_M": 8, "A_load_order": 0, "NUM_STAGES": 2, "num_warps": 4, "num_ctas": 1, "num_stages": 2}, "(256, 4096, 12288, 12288, 1, 308)": {"BLOCK_SIZE_M": 64, "BLOCK_SIZE_N": 64, "BLOCK_SIZE_K": 256, "GROUP_SIZE_M": 8, "A_load_order": 2, "NUM_STAGES": 3, "num_warps": 8, "num_ctas": 1, "num_stages": 3}, "(384, 4096, 12288, 12288, 1, 308)": {"BLOCK_SIZE_M": 64, "BLOCK_SIZE_N": 128, "BLOCK_SIZE_K": 256, "GROUP_SIZE_M": 8, "A_load_order": 0, "NUM_STAGES": 2, "num_warps": 4, "num_ctas": 1, "num_stages": 2}, "(512, 4096, 12288, 12288, 1, 308)": {"BLOCK_SIZE_M": 64, "BLOCK_SIZE_N": 128, "BLOCK_SIZE_K": 256, "GROUP_SIZE_M": 8, "A_load_order": 0, "NUM_STAGES": 2, "num_warps": 4, "num_ctas": 1, "num_stages": 2}, "(768, 4096, 12288, 12288, 1, 308)": {"BLOCK_SIZE_M": 64, "BLOCK_SIZE_N": 128, "BLOCK_SIZE_K": 256, "GROUP_SIZE_M": 8, "A_load_order": 0, "NUM_STAGES": 2, "num_warps": 4, "num_ctas": 1, "num_stages": 2}, "(1024, 4096, 12288, 12288, 1, 308)": {"BLOCK_SIZE_M": 64, "BLOCK_SIZE_N": 128, "BLOCK_SIZE_K": 256, "GROUP_SIZE_M": 8, "A_load_order": 0, "NUM_STAGES": 2, "num_warps": 4, "num_ctas": 1, "num_stages": 2}, "(1536, 4096, 12288, 12288, 1, 308)": {"BLOCK_SIZE_M": 64, "BLOCK_SIZE_N": 128, "BLOCK_SIZE_K": 256, "GROUP_SIZE_M": 8, "A_load_order": 0, "NUM_STAGES": 2, "num_warps": 4, "num_ctas": 1, "num_stages": 2}, "(2048, 4096, 12288, 12288, 1, 308)": {"BLOCK_SIZE_M": 64, "BLOCK_SIZE_N": 128, "BLOCK_SIZE_K": 256, "GROUP_SIZE_M": 8, "A_load_order": 0, "NUM_STAGES": 2, "num_warps": 4, "num_ctas": 1, "num_stages": 2}, "(3072, 4096, 12288, 12288, 1, 308)": {"BLOCK_SIZE_M": 64, "BLOCK_SIZE_N": 128, "BLOCK_SIZE_K": 128, "GROUP_SIZE_M": 8, "A_load_order": 2, "NUM_STAGES": 4, "num_warps": 4, "num_ctas": 1, "num_stages": 4}, "(4096, 4096, 12288, 12288, 1, 308)": {"BLOCK_SIZE_M": 64, "BLOCK_SIZE_N": 128, "BLOCK_SIZE_K": 256, "GROUP_SIZE_M": 8, "A_load_order": 0, "NUM_STAGES": 2, "num_warps": 4, "num_ctas": 1, "num_stages": 2}, "(96, 3456, 1152, 1152, 1, 408)": {"BLOCK_SIZE_M": 64, "BLOCK_SIZE_N": 128, "BLOCK_SIZE_K": 128, "GROUP_SIZE_M": 8, "A_load_order": 2, "NUM_STAGES": 4, "num_warps": 4, "num_ctas": 1, "num_stages": 4}, "(128, 3456, 1152, 1152, 1, 408)": {"BLOCK_SIZE_M": 64, "BLOCK_SIZE_N": 128, "BLOCK_SIZE_K": 128, "GROUP_SIZE_M": 8, "A_load_order": 2, "NUM_STAGES": 4, "num_warps": 4, "num_ctas": 1, "num_stages": 4}, "(192, 3456, 1152, 1152, 1, 408)": {"BLOCK_SIZE_M": 64, "BLOCK_SIZE_N": 128, "BLOCK_SIZE_K": 256, "GROUP_SIZE_M": 8, "A_load_order": 0, "NUM_STAGES": 2, "num_warps": 4, "num_ctas": 1, "num_stages": 2}, "(256, 3456, 1152, 1152, 1, 408)": {"BLOCK_SIZE_M": 64, "BLOCK_SIZE_N": 128, "BLOCK_SIZE_K": 256, "GROUP_SIZE_M": 8, "A_load_order": 0, "NUM_STAGES": 2, "num_warps": 4, "num_ctas": 1, "num_stages": 2}, "(384, 3456, 1152, 1152, 1, 408)": {"BLOCK_SIZE_M": 64, "BLOCK_SIZE_N": 128, "BLOCK_SIZE_K": 64, "GROUP_SIZE_M": 8, "A_load_order": 0, "NUM_STAGES": 5, "num_warps": 4, "num_ctas": 1, "num_stages": 5}, "(512, 3456, 1152, 1152, 1, 408)": {"BLOCK_SIZE_M": 64, "BLOCK_SIZE_N": 128, "BLOCK_SIZE_K": 64, "GROUP_SIZE_M": 8, "A_load_order": 0, "NUM_STAGES": 5, "num_warps": 4, "num_ctas": 1, "num_stages": 5}, "(768, 3456, 1152, 1152, 1, 408)": {"BLOCK_SIZE_M": 64, "BLOCK_SIZE_N": 128, "BLOCK_SIZE_K": 64, "GROUP_SIZE_M": 8, "A_load_order": 0, "NUM_STAGES": 5, "num_warps": 4, "num_ctas": 1, "num_stages": 5}, "(1024, 3456, 1152, 1152, 1, 408)": {"BLOCK_SIZE_M": 64, "BLOCK_SIZE_N": 128, "BLOCK_SIZE_K": 256, "GROUP_SIZE_M": 8, "A_load_order": 0, "NUM_STAGES": 2, "num_warps": 4, "num_ctas": 1, "num_stages": 2}, "(1536, 3456, 1152, 1152, 1, 408)": {"BLOCK_SIZE_M": 64, "BLOCK_SIZE_N": 128, "BLOCK_SIZE_K": 64, "GROUP_SIZE_M": 8, "A_load_order": 0, "NUM_STAGES": 5, "num_warps": 4, "num_ctas": 1, "num_stages": 5}, "(2048, 3456, 1152, 1152, 1, 408)": {"BLOCK_SIZE_M": 64, "BLOCK_SIZE_N": 128, "BLOCK_SIZE_K": 64, "GROUP_SIZE_M": 8, "A_load_order": 0, "NUM_STAGES": 5, "num_warps": 4, "num_ctas": 1, "num_stages": 5}, "(3072, 3456, 1152, 1152, 1, 408)": {"BLOCK_SIZE_M": 64, "BLOCK_SIZE_N": 128, "BLOCK_SIZE_K": 64, "GROUP_SIZE_M": 8, "A_load_order": 0, "NUM_STAGES": 5, "num_warps": 4, "num_ctas": 1, "num_stages": 5}, "(4096, 3456, 1152, 1152, 1, 408)": {"BLOCK_SIZE_M": 64, "BLOCK_SIZE_N": 128, "BLOCK_SIZE_K": 64, "GROUP_SIZE_M": 8, "A_load_order": 0, "NUM_STAGES": 5, "num_warps": 4, "num_ctas": 1, "num_stages": 5}, "(96, 1152, 1152, 1152, 1, 408)": {"BLOCK_SIZE_M": 64, "BLOCK_SIZE_N": 32, "BLOCK_SIZE_K": 128, "GROUP_SIZE_M": 8, "A_load_order": 2, "NUM_STAGES": 4, "num_warps": 8, "num_ctas": 1, "num_stages": 4}, "(128, 1152, 1152, 1152, 1, 408)": {"BLOCK_SIZE_M": 64, "BLOCK_SIZE_N": 64, "BLOCK_SIZE_K": 256, "GROUP_SIZE_M": 8, "A_load_order": 2, "NUM_STAGES": 3, "num_warps": 8, "num_ctas": 1, "num_stages": 3}, "(192, 1152, 1152, 1152, 1, 408)": {"BLOCK_SIZE_M": 64, "BLOCK_SIZE_N": 32, "BLOCK_SIZE_K": 128, "GROUP_SIZE_M": 8, "A_load_order": 2, "NUM_STAGES": 4, "num_warps": 8, "num_ctas": 1, "num_stages": 4}, "(256, 1152, 1152, 1152, 1, 408)": {"BLOCK_SIZE_M": 64, "BLOCK_SIZE_N": 128, "BLOCK_SIZE_K": 128, "GROUP_SIZE_M": 8, "A_load_order": 2, "NUM_STAGES": 4, "num_warps": 4, "num_ctas": 1, "num_stages": 4}, "(384, 1152, 1152, 1152, 1, 408)": {"BLOCK_SIZE_M": 64, "BLOCK_SIZE_N": 128, "BLOCK_SIZE_K": 128, "GROUP_SIZE_M": 8, "A_load_order": 2, "NUM_STAGES": 4, "num_warps": 4, "num_ctas": 1, "num_stages": 4}, "(512, 1152, 1152, 1152, 1, 408)": {"BLOCK_SIZE_M": 64, "BLOCK_SIZE_N": 128, "BLOCK_SIZE_K": 64, "GROUP_SIZE_M": 8, "A_load_order": 0, "NUM_STAGES": 5, "num_warps": 4, "num_ctas": 1, "num_stages": 5}, "(768, 1152, 1152, 1152, 1, 408)": {"BLOCK_SIZE_M": 64, "BLOCK_SIZE_N": 128, "BLOCK_SIZE_K": 256, "GROUP_SIZE_M": 8, "A_load_order": 0, "NUM_STAGES": 2, "num_warps": 4, "num_ctas": 1, "num_stages": 2}, "(1024, 1152, 1152, 1152, 1, 408)": {"BLOCK_SIZE_M": 64, "BLOCK_SIZE_N": 128, "BLOCK_SIZE_K": 64, "GROUP_SIZE_M": 8, "A_load_order": 0, "NUM_STAGES": 5, "num_warps": 4, "num_ctas": 1, "num_stages": 5}, "(1536, 1152, 1152, 1152, 1, 408)": {"BLOCK_SIZE_M": 64, "BLOCK_SIZE_N": 128, "BLOCK_SIZE_K": 64, "GROUP_SIZE_M": 8, "A_load_order": 0, "NUM_STAGES": 5, "num_warps": 4, "num_ctas": 1, "num_stages": 5}, "(2048, 1152, 1152, 1152, 1, 408)": {"BLOCK_SIZE_M": 64, "BLOCK_SIZE_N": 128, "BLOCK_SIZE_K": 64, "GROUP_SIZE_M": 8, "A_load_order": 0, "NUM_STAGES": 5, "num_warps": 4, "num_ctas": 1, "num_stages": 5}, "(3072, 1152, 1152, 1152, 1, 408)": {"BLOCK_SIZE_M": 64, "BLOCK_SIZE_N": 128, "BLOCK_SIZE_K": 64, "GROUP_SIZE_M": 8, "A_load_order": 0, "NUM_STAGES": 5, "num_warps": 4, "num_ctas": 1, "num_stages": 5}, "(4096, 1152, 1152, 1152, 1, 408)": {"BLOCK_SIZE_M": 64, "BLOCK_SIZE_N": 128, "BLOCK_SIZE_K": 64, "GROUP_SIZE_M": 8, "A_load_order": 0, "NUM_STAGES": 5, "num_warps": 4, "num_ctas": 1, "num_stages": 5}, "(96, 1152, 4304, 4304, 1, 408)": {"BLOCK_SIZE_M": 64, "BLOCK_SIZE_N": 64, "BLOCK_SIZE_K": 256, "GROUP_SIZE_M": 8, "A_load_order": 2, "NUM_STAGES": 3, "num_warps": 8, "num_ctas": 1, "num_stages": 3}, "(128, 1152, 4304, 4304, 1, 408)": {"BLOCK_SIZE_M": 64, "BLOCK_SIZE_N": 64, "BLOCK_SIZE_K": 256, "GROUP_SIZE_M": 8, "A_load_order": 2, "NUM_STAGES": 3, "num_warps": 8, "num_ctas": 1, "num_stages": 3}, "(192, 1152, 4304, 4304, 1, 408)": {"BLOCK_SIZE_M": 64, "BLOCK_SIZE_N": 64, "BLOCK_SIZE_K": 256, "GROUP_SIZE_M": 8, "A_load_order": 2, "NUM_STAGES": 3, "num_warps": 8, "num_ctas": 1, "num_stages": 3}, "(256, 1152, 4304, 4304, 1, 408)": {"BLOCK_SIZE_M": 64, "BLOCK_SIZE_N": 128, "BLOCK_SIZE_K": 128, "GROUP_SIZE_M": 8, "A_load_order": 2, "NUM_STAGES": 4, "num_warps": 4, "num_ctas": 1, "num_stages": 4}, "(384, 1152, 4304, 4304, 1, 408)": {"BLOCK_SIZE_M": 64, "BLOCK_SIZE_N": 128, "BLOCK_SIZE_K": 128, "GROUP_SIZE_M": 8, "A_load_order": 2, "NUM_STAGES": 4, "num_warps": 4, "num_ctas": 1, "num_stages": 4}, "(512, 1152, 4304, 4304, 1, 408)": {"BLOCK_SIZE_M": 64, "BLOCK_SIZE_N": 128, "BLOCK_SIZE_K": 256, "GROUP_SIZE_M": 8, "A_load_order": 0, "NUM_STAGES": 2, "num_warps": 4, "num_ctas": 1, "num_stages": 2}, "(768, 1152, 4304, 4304, 1, 408)": {"BLOCK_SIZE_M": 64, "BLOCK_SIZE_N": 128, "BLOCK_SIZE_K": 128, "GROUP_SIZE_M": 8, "A_load_order": 2, "NUM_STAGES": 4, "num_warps": 4, "num_ctas": 1, "num_stages": 4}, "(1024, 1152, 4304, 4304, 1, 408)": {"BLOCK_SIZE_M": 64, "BLOCK_SIZE_N": 128, "BLOCK_SIZE_K": 128, "GROUP_SIZE_M": 8, "A_load_order": 2, "NUM_STAGES": 4, "num_warps": 4, "num_ctas": 1, "num_stages": 4}, "(1536, 1152, 4304, 4304, 1, 408)": {"BLOCK_SIZE_M": 64, "BLOCK_SIZE_N": 128, "BLOCK_SIZE_K": 128, "GROUP_SIZE_M": 8, "A_load_order": 2, "NUM_STAGES": 4, "num_warps": 4, "num_ctas": 1, "num_stages": 4}, "(2048, 1152, 4304, 4304, 1, 408)": {"BLOCK_SIZE_M": 64, "BLOCK_SIZE_N": 128, "BLOCK_SIZE_K": 128, "GROUP_SIZE_M": 8, "A_load_order": 2, "NUM_STAGES": 4, "num_warps": 4, "num_ctas": 1, "num_stages": 4}, "(3072, 1152, 4304, 4304, 1, 408)": {"BLOCK_SIZE_M": 64, "BLOCK_SIZE_N": 128, "BLOCK_SIZE_K": 128, "GROUP_SIZE_M": 8, "A_load_order": 2, "NUM_STAGES": 4, "num_warps": 4, "num_ctas": 1, "num_stages": 4}, "(4096, 1152, 4304, 4304, 1, 408)": {"BLOCK_SIZE_M": 64, "BLOCK_SIZE_N": 128, "BLOCK_SIZE_K": 128, "GROUP_SIZE_M": 8, "A_load_order": 2, "NUM_STAGES": 4, "num_warps": 4, "num_ctas": 1, "num_stages": 4}, "(96, 4096, 4608, 4608, 1, 408)": {"BLOCK_SIZE_M": 64, "BLOCK_SIZE_N": 128, "BLOCK_SIZE_K": 256, "GROUP_SIZE_M": 8, "A_load_order": 0, "NUM_STAGES": 2, "num_warps": 4, "num_ctas": 1, "num_stages": 2}, "(128, 4096, 4608, 4608, 1, 408)": {"BLOCK_SIZE_M": 64, "BLOCK_SIZE_N": 128, "BLOCK_SIZE_K": 256, "GROUP_SIZE_M": 8, "A_load_order": 0, "NUM_STAGES": 2, "num_warps": 4, "num_ctas": 1, "num_stages": 2}, "(192, 4096, 4608, 4608, 1, 408)": {"BLOCK_SIZE_M": 64, "BLOCK_SIZE_N": 128, "BLOCK_SIZE_K": 256, "GROUP_SIZE_M": 8, "A_load_order": 0, "NUM_STAGES": 2, "num_warps": 4, "num_ctas": 1, "num_stages": 2}, "(256, 4096, 4608, 4608, 1, 408)": {"BLOCK_SIZE_M": 64, "BLOCK_SIZE_N": 64, "BLOCK_SIZE_K": 256, "GROUP_SIZE_M": 8, "A_load_order": 2, "NUM_STAGES": 3, "num_warps": 8, "num_ctas": 1, "num_stages": 3}, "(384, 4096, 4608, 4608, 1, 408)": {"BLOCK_SIZE_M": 64, "BLOCK_SIZE_N": 128, "BLOCK_SIZE_K": 256, "GROUP_SIZE_M": 8, "A_load_order": 0, "NUM_STAGES": 2, "num_warps": 4, "num_ctas": 1, "num_stages": 2}, "(512, 4096, 4608, 4608, 1, 408)": {"BLOCK_SIZE_M": 64, "BLOCK_SIZE_N": 128, "BLOCK_SIZE_K": 128, "GROUP_SIZE_M": 8, "A_load_order": 2, "NUM_STAGES": 4, "num_warps": 4, "num_ctas": 1, "num_stages": 4}, "(768, 4096, 4608, 4608, 1, 408)": {"BLOCK_SIZE_M": 64, "BLOCK_SIZE_N": 128, "BLOCK_SIZE_K": 128, "GROUP_SIZE_M": 8, "A_load_order": 2, "NUM_STAGES": 4, "num_warps": 4, "num_ctas": 1, "num_stages": 4}, "(1024, 4096, 4608, 4608, 1, 408)": {"BLOCK_SIZE_M": 64, "BLOCK_SIZE_N": 128, "BLOCK_SIZE_K": 64, "GROUP_SIZE_M": 8, "A_load_order": 0, "NUM_STAGES": 5, "num_warps": 4, "num_ctas": 1, "num_stages": 5}, "(1536, 4096, 4608, 4608, 1, 408)": {"BLOCK_SIZE_M": 64, "BLOCK_SIZE_N": 128, "BLOCK_SIZE_K": 256, "GROUP_SIZE_M": 8, "A_load_order": 0, "NUM_STAGES": 2, "num_warps": 4, "num_ctas": 1, "num_stages": 2}, "(2048, 4096, 4608, 4608, 1, 408)": {"BLOCK_SIZE_M": 64, "BLOCK_SIZE_N": 128, "BLOCK_SIZE_K": 64, "GROUP_SIZE_M": 8, "A_load_order": 0, "NUM_STAGES": 5, "num_warps": 4, "num_ctas": 1, "num_stages": 5}, "(3072, 4096, 4608, 4608, 1, 408)": {"BLOCK_SIZE_M": 64, "BLOCK_SIZE_N": 128, "BLOCK_SIZE_K": 256, "GROUP_SIZE_M": 8, "A_load_order": 0, "NUM_STAGES": 2, "num_warps": 4, "num_ctas": 1, "num_stages": 2}, "(4096, 4096, 4608, 4608, 1, 408)": {"BLOCK_SIZE_M": 64, "BLOCK_SIZE_N": 256, "BLOCK_SIZE_K": 64, "GROUP_SIZE_M": 8, "A_load_order": 2, "NUM_STAGES": 4, "num_warps": 8, "num_ctas": 1, "num_stages": 4}, "(96, 6144, 4096, 4096, 1, 408)": {"BLOCK_SIZE_M": 64, "BLOCK_SIZE_N": 128, "BLOCK_SIZE_K": 256, "GROUP_SIZE_M": 8, "A_load_order": 0, "NUM_STAGES": 2, "num_warps": 4, "num_ctas": 1, "num_stages": 2}, "(128, 6144, 4096, 4096, 1, 408)": {"BLOCK_SIZE_M": 64, "BLOCK_SIZE_N": 128, "BLOCK_SIZE_K": 256, "GROUP_SIZE_M": 8, "A_load_order": 0, "NUM_STAGES": 2, "num_warps": 4, "num_ctas": 1, "num_stages": 2}, "(192, 6144, 4096, 4096, 1, 408)": {"BLOCK_SIZE_M": 64, "BLOCK_SIZE_N": 64, "BLOCK_SIZE_K": 256, "GROUP_SIZE_M": 8, "A_load_order": 2, "NUM_STAGES": 3, "num_warps": 8, "num_ctas": 1, "num_stages": 3}, "(256, 6144, 4096, 4096, 1, 408)": {"BLOCK_SIZE_M": 64, "BLOCK_SIZE_N": 128, "BLOCK_SIZE_K": 256, "GROUP_SIZE_M": 8, "A_load_order": 0, "NUM_STAGES": 2, "num_warps": 4, "num_ctas": 1, "num_stages": 2}, "(384, 6144, 4096, 4096, 1, 408)": {"BLOCK_SIZE_M": 64, "BLOCK_SIZE_N": 128, "BLOCK_SIZE_K": 128, "GROUP_SIZE_M": 8, "A_load_order": 2, "NUM_STAGES": 4, "num_warps": 4, "num_ctas": 1, "num_stages": 4}, "(512, 6144, 4096, 4096, 1, 408)": {"BLOCK_SIZE_M": 64, "BLOCK_SIZE_N": 128, "BLOCK_SIZE_K": 128, "GROUP_SIZE_M": 8, "A_load_order": 2, "NUM_STAGES": 4, "num_warps": 4, "num_ctas": 1, "num_stages": 4}, "(768, 6144, 4096, 4096, 1, 408)": {"BLOCK_SIZE_M": 64, "BLOCK_SIZE_N": 128, "BLOCK_SIZE_K": 256, "GROUP_SIZE_M": 8, "A_load_order": 0, "NUM_STAGES": 2, "num_warps": 4, "num_ctas": 1, "num_stages": 2}, "(1024, 6144, 4096, 4096, 1, 408)": {"BLOCK_SIZE_M": 64, "BLOCK_SIZE_N": 128, "BLOCK_SIZE_K": 64, "GROUP_SIZE_M": 8, "A_load_order": 0, "NUM_STAGES": 5, "num_warps": 4, "num_ctas": 1, "num_stages": 5}, "(1536, 6144, 4096, 4096, 1, 408)": {"BLOCK_SIZE_M": 64, "BLOCK_SIZE_N": 128, "BLOCK_SIZE_K": 256, "GROUP_SIZE_M": 8, "A_load_order": 0, "NUM_STAGES": 2, "num_warps": 4, "num_ctas": 1, "num_stages": 2}, "(2048, 6144, 4096, 4096, 1, 408)": {"BLOCK_SIZE_M": 64, "BLOCK_SIZE_N": 128, "BLOCK_SIZE_K": 256, "GROUP_SIZE_M": 8, "A_load_order": 0, "NUM_STAGES": 2, "num_warps": 4, "num_ctas": 1, "num_stages": 2}, "(3072, 6144, 4096, 4096, 1, 408)": {"BLOCK_SIZE_M": 64, "BLOCK_SIZE_N": 256, "BLOCK_SIZE_K": 64, "GROUP_SIZE_M": 8, "A_load_order": 2, "NUM_STAGES": 4, "num_warps": 8, "num_ctas": 1, "num_stages": 4}, "(4096, 6144, 4096, 4096, 1, 408)": {"BLOCK_SIZE_M": 64, "BLOCK_SIZE_N": 128, "BLOCK_SIZE_K": 256, "GROUP_SIZE_M": 8, "A_load_order": 0, "NUM_STAGES": 2, "num_warps": 4, "num_ctas": 1, "num_stages": 2}, "(96, 4096, 4096, 4096, 1, 408)": {"BLOCK_SIZE_M": 64, "BLOCK_SIZE_N": 128, "BLOCK_SIZE_K": 256, "GROUP_SIZE_M": 8, "A_load_order": 0, "NUM_STAGES": 2, "num_warps": 4, "num_ctas": 1, "num_stages": 2}, "(128, 4096, 4096, 4096, 1, 408)": {"BLOCK_SIZE_M": 64, "BLOCK_SIZE_N": 128, "BLOCK_SIZE_K": 256, "GROUP_SIZE_M": 8, "A_load_order": 0, "NUM_STAGES": 2, "num_warps": 4, "num_ctas": 1, "num_stages": 2}, "(192, 4096, 4096, 4096, 1, 408)": {"BLOCK_SIZE_M": 64, "BLOCK_SIZE_N": 128, "BLOCK_SIZE_K": 256, "GROUP_SIZE_M": 8, "A_load_order": 0, "NUM_STAGES": 2, "num_warps": 4, "num_ctas": 1, "num_stages": 2}, "(256, 4096, 4096, 4096, 1, 408)": {"BLOCK_SIZE_M": 64, "BLOCK_SIZE_N": 64, "BLOCK_SIZE_K": 256, "GROUP_SIZE_M": 8, "A_load_order": 2, "NUM_STAGES": 3, "num_warps": 8, "num_ctas": 1, "num_stages": 3}, "(384, 4096, 4096, 4096, 1, 408)": {"BLOCK_SIZE_M": 64, "BLOCK_SIZE_N": 128, "BLOCK_SIZE_K": 256, "GROUP_SIZE_M": 8, "A_load_order": 0, "NUM_STAGES": 2, "num_warps": 4, "num_ctas": 1, "num_stages": 2}, "(512, 4096, 4096, 4096, 1, 408)": {"BLOCK_SIZE_M": 64, "BLOCK_SIZE_N": 128, "BLOCK_SIZE_K": 128, "GROUP_SIZE_M": 8, "A_load_order": 2, "NUM_STAGES": 4, "num_warps": 4, "num_ctas": 1, "num_stages": 4}, "(768, 4096, 4096, 4096, 1, 408)": {"BLOCK_SIZE_M": 64, "BLOCK_SIZE_N": 128, "BLOCK_SIZE_K": 64, "GROUP_SIZE_M": 8, "A_load_order": 0, "NUM_STAGES": 5, "num_warps": 4, "num_ctas": 1, "num_stages": 5}, "(1024, 4096, 4096, 4096, 1, 408)": {"BLOCK_SIZE_M": 64, "BLOCK_SIZE_N": 128, "BLOCK_SIZE_K": 64, "GROUP_SIZE_M": 8, "A_load_order": 0, "NUM_STAGES": 5, "num_warps": 4, "num_ctas": 1, "num_stages": 5}, "(1536, 4096, 4096, 4096, 1, 408)": {"BLOCK_SIZE_M": 64, "BLOCK_SIZE_N": 128, "BLOCK_SIZE_K": 256, "GROUP_SIZE_M": 8, "A_load_order": 0, "NUM_STAGES": 2, "num_warps": 4, "num_ctas": 1, "num_stages": 2}, "(2048, 4096, 4096, 4096, 1, 408)": {"BLOCK_SIZE_M": 64, "BLOCK_SIZE_N": 128, "BLOCK_SIZE_K": 64, "GROUP_SIZE_M": 8, "A_load_order": 0, "NUM_STAGES": 5, "num_warps": 4, "num_ctas": 1, "num_stages": 5}, "(3072, 4096, 4096, 4096, 1, 408)": {"BLOCK_SIZE_M": 64, "BLOCK_SIZE_N": 128, "BLOCK_SIZE_K": 256, "GROUP_SIZE_M": 8, "A_load_order": 0, "NUM_STAGES": 2, "num_warps": 4, "num_ctas": 1, "num_stages": 2}, "(4096, 4096, 4096, 4096, 1, 408)": {"BLOCK_SIZE_M": 64, "BLOCK_SIZE_N": 128, "BLOCK_SIZE_K": 256, "GROUP_SIZE_M": 8, "A_load_order": 0, "NUM_STAGES": 2, "num_warps": 4, "num_ctas": 1, "num_stages": 2}, "(96, 24576, 4096, 4096, 1, 408)": {"BLOCK_SIZE_M": 64, "BLOCK_SIZE_N": 64, "BLOCK_SIZE_K": 256, "GROUP_SIZE_M": 8, "A_load_order": 2, "NUM_STAGES": 3, "num_warps": 8, "num_ctas": 1, "num_stages": 3}, "(128, 24576, 4096, 4096, 1, 408)": {"BLOCK_SIZE_M": 64, "BLOCK_SIZE_N": 64, "BLOCK_SIZE_K": 256, "GROUP_SIZE_M": 8, "A_load_order": 2, "NUM_STAGES": 3, "num_warps": 8, "num_ctas": 1, "num_stages": 3}, "(192, 24576, 4096, 4096, 1, 408)": {"BLOCK_SIZE_M": 64, "BLOCK_SIZE_N": 128, "BLOCK_SIZE_K": 256, "GROUP_SIZE_M": 8, "A_load_order": 0, "NUM_STAGES": 2, "num_warps": 4, "num_ctas": 1, "num_stages": 2}, "(256, 24576, 4096, 4096, 1, 408)": {"BLOCK_SIZE_M": 64, "BLOCK_SIZE_N": 128, "BLOCK_SIZE_K": 256, "GROUP_SIZE_M": 8, "A_load_order": 0, "NUM_STAGES": 2, "num_warps": 4, "num_ctas": 1, "num_stages": 2}, "(384, 24576, 4096, 4096, 1, 408)": {"BLOCK_SIZE_M": 64, "BLOCK_SIZE_N": 128, "BLOCK_SIZE_K": 256, "GROUP_SIZE_M": 8, "A_load_order": 0, "NUM_STAGES": 2, "num_warps": 4, "num_ctas": 1, "num_stages": 2}, "(512, 24576, 4096, 4096, 1, 408)": {"BLOCK_SIZE_M": 64, "BLOCK_SIZE_N": 128, "BLOCK_SIZE_K": 256, "GROUP_SIZE_M": 8, "A_load_order": 0, "NUM_STAGES": 2, "num_warps": 4, "num_ctas": 1, "num_stages": 2}, "(768, 24576, 4096, 4096, 1, 408)": {"BLOCK_SIZE_M": 64, "BLOCK_SIZE_N": 128, "BLOCK_SIZE_K": 256, "GROUP_SIZE_M": 8, "A_load_order": 0, "NUM_STAGES": 2, "num_warps": 4, "num_ctas": 1, "num_stages": 2}, "(1024, 24576, 4096, 4096, 1, 408)": {"BLOCK_SIZE_M": 64, "BLOCK_SIZE_N": 128, "BLOCK_SIZE_K": 256, "GROUP_SIZE_M": 8, "A_load_order": 0, "NUM_STAGES": 2, "num_warps": 4, "num_ctas": 1, "num_stages": 2}, "(1536, 24576, 4096, 4096, 1, 408)": {"BLOCK_SIZE_M": 64, "BLOCK_SIZE_N": 128, "BLOCK_SIZE_K": 256, "GROUP_SIZE_M": 8, "A_load_order": 0, "NUM_STAGES": 2, "num_warps": 4, "num_ctas": 1, "num_stages": 2}, "(2048, 24576, 4096, 4096, 1, 408)": {"BLOCK_SIZE_M": 64, "BLOCK_SIZE_N": 128, "BLOCK_SIZE_K": 256, "GROUP_SIZE_M": 8, "A_load_order": 0, "NUM_STAGES": 2, "num_warps": 4, "num_ctas": 1, "num_stages": 2}, "(3072, 24576, 4096, 4096, 1, 408)": {"BLOCK_SIZE_M": 64, "BLOCK_SIZE_N": 128, "BLOCK_SIZE_K": 256, "GROUP_SIZE_M": 8, "A_load_order": 0, "NUM_STAGES": 2, "num_warps": 4, "num_ctas": 1, "num_stages": 2}, "(4096, 24576, 4096, 4096, 1, 408)": {"BLOCK_SIZE_M": 64, "BLOCK_SIZE_N": 128, "BLOCK_SIZE_K": 256, "GROUP_SIZE_M": 8, "A_load_order": 0, "NUM_STAGES": 2, "num_warps": 4, "num_ctas": 1, "num_stages": 2}, "(96, 4096, 12288, 12288, 1, 408)": {"BLOCK_SIZE_M": 64, "BLOCK_SIZE_N": 32, "BLOCK_SIZE_K": 256, "GROUP_SIZE_M": 8, "A_load_order": 0, "NUM_STAGES": 4, "num_warps": 4, "num_ctas": 1, "num_stages": 4}, "(128, 4096, 12288, 12288, 1, 408)": {"BLOCK_SIZE_M": 64, "BLOCK_SIZE_N": 32, "BLOCK_SIZE_K": 256, "GROUP_SIZE_M": 8, "A_load_order": 0, "NUM_STAGES": 4, "num_warps": 4, "num_ctas": 1, "num_stages": 4}, "(192, 4096, 12288, 12288, 1, 408)": {"BLOCK_SIZE_M": 64, "BLOCK_SIZE_N": 128, "BLOCK_SIZE_K": 256, "GROUP_SIZE_M": 8, "A_load_order": 0, "NUM_STAGES": 2, "num_warps": 4, "num_ctas": 1, "num_stages": 2}, "(256, 4096, 12288, 12288, 1, 408)": {"BLOCK_SIZE_M": 64, "BLOCK_SIZE_N": 64, "BLOCK_SIZE_K": 256, "GROUP_SIZE_M": 8, "A_load_order": 2, "NUM_STAGES": 3, "num_warps": 8, "num_ctas": 1, "num_stages": 3}, "(384, 4096, 12288, 12288, 1, 408)": {"BLOCK_SIZE_M": 64, "BLOCK_SIZE_N": 128, "BLOCK_SIZE_K": 256, "GROUP_SIZE_M": 8, "A_load_order": 0, "NUM_STAGES": 2, "num_warps": 4, "num_ctas": 1, "num_stages": 2}, "(512, 4096, 12288, 12288, 1, 408)": {"BLOCK_SIZE_M": 64, "BLOCK_SIZE_N": 128, "BLOCK_SIZE_K": 128, "GROUP_SIZE_M": 8, "A_load_order": 2, "NUM_STAGES": 4, "num_warps": 4, "num_ctas": 1, "num_stages": 4}, "(768, 4096, 12288, 12288, 1, 408)": {"BLOCK_SIZE_M": 64, "BLOCK_SIZE_N": 128, "BLOCK_SIZE_K": 256, "GROUP_SIZE_M": 8, "A_load_order": 0, "NUM_STAGES": 2, "num_warps": 4, "num_ctas": 1, "num_stages": 2}, "(1024, 4096, 12288, 12288, 1, 408)": {"BLOCK_SIZE_M": 64, "BLOCK_SIZE_N": 128, "BLOCK_SIZE_K": 256, "GROUP_SIZE_M": 8, "A_load_order": 0, "NUM_STAGES": 2, "num_warps": 4, "num_ctas": 1, "num_stages": 2}, "(1536, 4096, 12288, 12288, 1, 408)": {"BLOCK_SIZE_M": 64, "BLOCK_SIZE_N": 128, "BLOCK_SIZE_K": 256, "GROUP_SIZE_M": 8, "A_load_order": 0, "NUM_STAGES": 2, "num_warps": 4, "num_ctas": 1, "num_stages": 2}, "(2048, 4096, 12288, 12288, 1, 408)": {"BLOCK_SIZE_M": 64, "BLOCK_SIZE_N": 128, "BLOCK_SIZE_K": 256, "GROUP_SIZE_M": 8, "A_load_order": 0, "NUM_STAGES": 2, "num_warps": 4, "num_ctas": 1, "num_stages": 2}, "(3072, 4096, 12288, 12288, 1, 408)": {"BLOCK_SIZE_M": 64, "BLOCK_SIZE_N": 128, "BLOCK_SIZE_K": 256, "GROUP_SIZE_M": 8, "A_load_order": 0, "NUM_STAGES": 2, "num_warps": 4, "num_ctas": 1, "num_stages": 2}, "(4096, 4096, 12288, 12288, 1, 408)": {"BLOCK_SIZE_M": 64, "BLOCK_SIZE_N": 128, "BLOCK_SIZE_K": 256, "GROUP_SIZE_M": 8, "A_load_order": 0, "NUM_STAGES": 2, "num_warps": 4, "num_ctas": 1, "num_stages": 2}, "(96, 3456, 1152, 64, 8, 104)": {"BLOCK_SIZE_M": 64, "BLOCK_SIZE_N": 128, "BLOCK_SIZE_K": 64, "GROUP_SIZE_M": 8, "A_load_order": 0, "NUM_STAGES": 1, "num_warps": 4, "num_ctas": 1, "num_stages": 1}, "(128, 3456, 1152, 64, 8, 104)": {"BLOCK_SIZE_M": 64, "BLOCK_SIZE_N": 128, "BLOCK_SIZE_K": 64, "GROUP_SIZE_M": 8, "A_load_order": 0, "NUM_STAGES": 1, "num_warps": 4, "num_ctas": 1, "num_stages": 1}, "(192, 3456, 1152, 64, 8, 104)": {"BLOCK_SIZE_M": 64, "BLOCK_SIZE_N": 128, "BLOCK_SIZE_K": 64, "GROUP_SIZE_M": 8, "A_load_order": 0, "NUM_STAGES": 1, "num_warps": 4, "num_ctas": 1, "num_stages": 1}, "(256, 3456, 1152, 64, 8, 104)": {"BLOCK_SIZE_M": 64, "BLOCK_SIZE_N": 128, "BLOCK_SIZE_K": 32, "GROUP_SIZE_M": 8, "A_load_order": 2, "NUM_STAGES": 3, "num_warps": 8, "num_ctas": 1, "num_stages": 3}, "(384, 3456, 1152, 64, 8, 104)": {"BLOCK_SIZE_M": 64, "BLOCK_SIZE_N": 128, "BLOCK_SIZE_K": 64, "GROUP_SIZE_M": 8, "A_load_order": 0, "NUM_STAGES": 1, "num_warps": 4, "num_ctas": 1, "num_stages": 1}, "(512, 3456, 1152, 64, 8, 104)": {"BLOCK_SIZE_M": 64, "BLOCK_SIZE_N": 128, "BLOCK_SIZE_K": 64, "GROUP_SIZE_M": 8, "A_load_order": 0, "NUM_STAGES": 1, "num_warps": 4, "num_ctas": 1, "num_stages": 1}, "(768, 3456, 1152, 64, 8, 104)": {"BLOCK_SIZE_M": 64, "BLOCK_SIZE_N": 128, "BLOCK_SIZE_K": 64, "GROUP_SIZE_M": 8, "A_load_order": 0, "NUM_STAGES": 1, "num_warps": 4, "num_ctas": 1, "num_stages": 1}, "(1024, 3456, 1152, 64, 8, 104)": {"BLOCK_SIZE_M": 64, "BLOCK_SIZE_N": 128, "BLOCK_SIZE_K": 64, "GROUP_SIZE_M": 8, "A_load_order": 0, "NUM_STAGES": 1, "num_warps": 4, "num_ctas": 1, "num_stages": 1}, "(1536, 3456, 1152, 64, 8, 104)": {"BLOCK_SIZE_M": 64, "BLOCK_SIZE_N": 128, "BLOCK_SIZE_K": 64, "GROUP_SIZE_M": 8, "A_load_order": 0, "NUM_STAGES": 1, "num_warps": 4, "num_ctas": 1, "num_stages": 1}, "(2048, 3456, 1152, 64, 8, 104)": {"BLOCK_SIZE_M": 64, "BLOCK_SIZE_N": 128, "BLOCK_SIZE_K": 64, "GROUP_SIZE_M": 8, "A_load_order": 0, "NUM_STAGES": 1, "num_warps": 4, "num_ctas": 1, "num_stages": 1}, "(3072, 3456, 1152, 64, 8, 104)": {"BLOCK_SIZE_M": 64, "BLOCK_SIZE_N": 128, "BLOCK_SIZE_K": 64, "GROUP_SIZE_M": 8, "A_load_order": 0, "NUM_STAGES": 1, "num_warps": 4, "num_ctas": 1, "num_stages": 1}, "(4096, 3456, 1152, 64, 8, 104)": {"BLOCK_SIZE_M": 64, "BLOCK_SIZE_N": 128, "BLOCK_SIZE_K": 64, "GROUP_SIZE_M": 8, "A_load_order": 0, "NUM_STAGES": 1, "num_warps": 4, "num_ctas": 1, "num_stages": 1}, "(96, 1152, 1152, 64, 8, 104)": {"BLOCK_SIZE_M": 64, "BLOCK_SIZE_N": 64, "BLOCK_SIZE_K": 64, "GROUP_SIZE_M": 8, "A_load_order": 0, "NUM_STAGES": 3, "num_warps": 4, "num_ctas": 1, "num_stages": 3}, "(128, 1152, 1152, 64, 8, 104)": {"BLOCK_SIZE_M": 64, "BLOCK_SIZE_N": 64, "BLOCK_SIZE_K": 64, "GROUP_SIZE_M": 8, "A_load_order": 0, "NUM_STAGES": 3, "num_warps": 4, "num_ctas": 1, "num_stages": 3}, "(192, 1152, 1152, 64, 8, 104)": {"BLOCK_SIZE_M": 64, "BLOCK_SIZE_N": 64, "BLOCK_SIZE_K": 64, "GROUP_SIZE_M": 8, "A_load_order": 0, "NUM_STAGES": 3, "num_warps": 4, "num_ctas": 1, "num_stages": 3}, "(256, 1152, 1152, 64, 8, 104)": {"BLOCK_SIZE_M": 64, "BLOCK_SIZE_N": 64, "BLOCK_SIZE_K": 32, "GROUP_SIZE_M": 8, "A_load_order": 0, "NUM_STAGES": 4, "num_warps": 4, "num_ctas": 1, "num_stages": 4}, "(384, 1152, 1152, 64, 8, 104)": {"BLOCK_SIZE_M": 64, "BLOCK_SIZE_N": 64, "BLOCK_SIZE_K": 32, "GROUP_SIZE_M": 8, "A_load_order": 0, "NUM_STAGES": 4, "num_warps": 4, "num_ctas": 1, "num_stages": 4}, "(512, 1152, 1152, 64, 8, 104)": {"BLOCK_SIZE_M": 64, "BLOCK_SIZE_N": 128, "BLOCK_SIZE_K": 32, "GROUP_SIZE_M": 8, "A_load_order": 2, "NUM_STAGES": 3, "num_warps": 8, "num_ctas": 1, "num_stages": 3}, "(768, 1152, 1152, 64, 8, 104)": {"BLOCK_SIZE_M": 64, "BLOCK_SIZE_N": 128, "BLOCK_SIZE_K": 32, "GROUP_SIZE_M": 8, "A_load_order": 2, "NUM_STAGES": 3, "num_warps": 8, "num_ctas": 1, "num_stages": 3}, "(1024, 1152, 1152, 64, 8, 104)": {"BLOCK_SIZE_M": 64, "BLOCK_SIZE_N": 128, "BLOCK_SIZE_K": 64, "GROUP_SIZE_M": 8, "A_load_order": 0, "NUM_STAGES": 1, "num_warps": 4, "num_ctas": 1, "num_stages": 1}, "(1536, 1152, 1152, 64, 8, 104)": {"BLOCK_SIZE_M": 64, "BLOCK_SIZE_N": 128, "BLOCK_SIZE_K": 64, "GROUP_SIZE_M": 8, "A_load_order": 2, "NUM_STAGES": 1, "num_warps": 4, "num_ctas": 1, "num_stages": 1}, "(2048, 1152, 1152, 64, 8, 104)": {"BLOCK_SIZE_M": 64, "BLOCK_SIZE_N": 128, "BLOCK_SIZE_K": 64, "GROUP_SIZE_M": 8, "A_load_order": 0, "NUM_STAGES": 1, "num_warps": 4, "num_ctas": 1, "num_stages": 1}, "(3072, 1152, 1152, 64, 8, 104)": {"BLOCK_SIZE_M": 64, "BLOCK_SIZE_N": 128, "BLOCK_SIZE_K": 64, "GROUP_SIZE_M": 8, "A_load_order": 0, "NUM_STAGES": 1, "num_warps": 4, "num_ctas": 1, "num_stages": 1}, "(4096, 1152, 1152, 64, 8, 104)": {"BLOCK_SIZE_M": 64, "BLOCK_SIZE_N": 128, "BLOCK_SIZE_K": 64, "GROUP_SIZE_M": 8, "A_load_order": 0, "NUM_STAGES": 1, "num_warps": 4, "num_ctas": 1, "num_stages": 1}, "(96, 12288, 4096, 4096, 1, 408)": {"BLOCK_SIZE_M": 64, "BLOCK_SIZE_N": 64, "BLOCK_SIZE_K": 256, "GROUP_SIZE_M": 8, "A_load_order": 2, "NUM_STAGES": 3, "num_warps": 8, "num_ctas": 1, "num_stages": 3}, "(128, 12288, 4096, 4096, 1, 408)": {"BLOCK_SIZE_M": 64, "BLOCK_SIZE_N": 64, "BLOCK_SIZE_K": 256, "GROUP_SIZE_M": 8, "A_load_order": 2, "NUM_STAGES": 3, "num_warps": 8, "num_ctas": 1, "num_stages": 3}, "(192, 12288, 4096, 4096, 1, 408)": {"BLOCK_SIZE_M": 64, "BLOCK_SIZE_N": 128, "BLOCK_SIZE_K": 256, "GROUP_SIZE_M": 8, "A_load_order": 0, "NUM_STAGES": 2, "num_warps": 4, "num_ctas": 1, "num_stages": 2}, "(256, 12288, 4096, 4096, 1, 408)": {"BLOCK_SIZE_M": 64, "BLOCK_SIZE_N": 128, "BLOCK_SIZE_K": 128, "GROUP_SIZE_M": 8, "A_load_order": 2, "NUM_STAGES": 4, "num_warps": 4, "num_ctas": 1, "num_stages": 4}, "(384, 12288, 4096, 4096, 1, 408)": {"BLOCK_SIZE_M": 64, "BLOCK_SIZE_N": 128, "BLOCK_SIZE_K": 128, "GROUP_SIZE_M": 8, "A_load_order": 2, "NUM_STAGES": 4, "num_warps": 4, "num_ctas": 1, "num_stages": 4}, "(512, 12288, 4096, 4096, 1, 408)": {"BLOCK_SIZE_M": 64, "BLOCK_SIZE_N": 128, "BLOCK_SIZE_K": 64, "GROUP_SIZE_M": 8, "A_load_order": 0, "NUM_STAGES": 5, "num_warps": 4, "num_ctas": 1, "num_stages": 5}, "(768, 12288, 4096, 4096, 1, 408)": {"BLOCK_SIZE_M": 64, "BLOCK_SIZE_N": 128, "BLOCK_SIZE_K": 128, "GROUP_SIZE_M": 8, "A_load_order": 2, "NUM_STAGES": 4, "num_warps": 4, "num_ctas": 1, "num_stages": 4}, "(1024, 12288, 4096, 4096, 1, 408)": {"BLOCK_SIZE_M": 64, "BLOCK_SIZE_N": 256, "BLOCK_SIZE_K": 64, "GROUP_SIZE_M": 8, "A_load_order": 2, "NUM_STAGES": 4, "num_warps": 8, "num_ctas": 1, "num_stages": 4}, "(1536, 12288, 4096, 4096, 1, 408)": {"BLOCK_SIZE_M": 64, "BLOCK_SIZE_N": 256, "BLOCK_SIZE_K": 64, "GROUP_SIZE_M": 8, "A_load_order": 2, "NUM_STAGES": 4, "num_warps": 8, "num_ctas": 1, "num_stages": 4}, "(2048, 12288, 4096, 4096, 1, 408)": {"BLOCK_SIZE_M": 64, "BLOCK_SIZE_N": 128, "BLOCK_SIZE_K": 128, "GROUP_SIZE_M": 8, "A_load_order": 2, "NUM_STAGES": 4, "num_warps": 4, "num_ctas": 1, "num_stages": 4}, "(3072, 12288, 4096, 4096, 1, 408)": {"BLOCK_SIZE_M": 64, "BLOCK_SIZE_N": 128, "BLOCK_SIZE_K": 128, "GROUP_SIZE_M": 8, "A_load_order": 2, "NUM_STAGES": 4, "num_warps": 4, "num_ctas": 1, "num_stages": 4}, "(4096, 12288, 4096, 4096, 1, 408)": {"BLOCK_SIZE_M": 64, "BLOCK_SIZE_N": 128, "BLOCK_SIZE_K": 128, "GROUP_SIZE_M": 8, "A_load_order": 2, "NUM_STAGES": 4, "num_warps": 4, "num_ctas": 1, "num_stages": 4}, "(96, 12288, 4096, 4096, 1, 308)": {"BLOCK_SIZE_M": 64, "BLOCK_SIZE_N": 64, "BLOCK_SIZE_K": 256, "GROUP_SIZE_M": 8, "A_load_order": 2, "NUM_STAGES": 3, "num_warps": 8, "num_ctas": 1, "num_stages": 3}, "(128, 12288, 4096, 4096, 1, 308)": {"BLOCK_SIZE_M": 64, "BLOCK_SIZE_N": 64, "BLOCK_SIZE_K": 256, "GROUP_SIZE_M": 8, "A_load_order": 2, "NUM_STAGES": 3, "num_warps": 8, "num_ctas": 1, "num_stages": 3}, "(192, 12288, 4096, 4096, 1, 308)": {"BLOCK_SIZE_M": 64, "BLOCK_SIZE_N": 128, "BLOCK_SIZE_K": 256, "GROUP_SIZE_M": 8, "A_load_order": 0, "NUM_STAGES": 2, "num_warps": 4, "num_ctas": 1, "num_stages": 2}, "(256, 12288, 4096, 4096, 1, 308)": {"BLOCK_SIZE_M": 64, "BLOCK_SIZE_N": 128, "BLOCK_SIZE_K": 256, "GROUP_SIZE_M": 8, "A_load_order": 0, "NUM_STAGES": 2, "num_warps": 4, "num_ctas": 1, "num_stages": 2}, "(384, 12288, 4096, 4096, 1, 308)": {"BLOCK_SIZE_M": 64, "BLOCK_SIZE_N": 128, "BLOCK_SIZE_K": 256, "GROUP_SIZE_M": 8, "A_load_order": 0, "NUM_STAGES": 2, "num_warps": 4, "num_ctas": 1, "num_stages": 2}, "(512, 12288, 4096, 4096, 1, 308)": {"BLOCK_SIZE_M": 64, "BLOCK_SIZE_N": 256, "BLOCK_SIZE_K": 128, "GROUP_SIZE_M": 8, "A_load_order": 0, "NUM_STAGES": 2, "num_warps": 8, "num_ctas": 1, "num_stages": 2}, "(768, 12288, 4096, 4096, 1, 308)": {"BLOCK_SIZE_M": 64, "BLOCK_SIZE_N": 256, "BLOCK_SIZE_K": 128, "GROUP_SIZE_M": 8, "A_load_order": 0, "NUM_STAGES": 2, "num_warps": 8, "num_ctas": 1, "num_stages": 2}, "(1024, 12288, 4096, 4096, 1, 308)": {"BLOCK_SIZE_M": 64, "BLOCK_SIZE_N": 128, "BLOCK_SIZE_K": 256, "GROUP_SIZE_M": 8, "A_load_order": 0, "NUM_STAGES": 2, "num_warps": 4, "num_ctas": 1, "num_stages": 2}, "(1536, 12288, 4096, 4096, 1, 308)": {"BLOCK_SIZE_M": 64, "BLOCK_SIZE_N": 128, "BLOCK_SIZE_K": 256, "GROUP_SIZE_M": 8, "A_load_order": 0, "NUM_STAGES": 2, "num_warps": 4, "num_ctas": 1, "num_stages": 2}, "(2048, 12288, 4096, 4096, 1, 308)": {"BLOCK_SIZE_M": 64, "BLOCK_SIZE_N": 128, "BLOCK_SIZE_K": 256, "GROUP_SIZE_M": 8, "A_load_order": 0, "NUM_STAGES": 2, "num_warps": 4, "num_ctas": 1, "num_stages": 2}, "(3072, 12288, 4096, 4096, 1, 308)": {"BLOCK_SIZE_M": 64, "BLOCK_SIZE_N": 128, "BLOCK_SIZE_K": 256, "GROUP_SIZE_M": 8, "A_load_order": 0, "NUM_STAGES": 2, "num_warps": 4, "num_ctas": 1, "num_stages": 2}, "(4096, 12288, 4096, 4096, 1, 308)": {"BLOCK_SIZE_M": 64, "BLOCK_SIZE_N": 256, "BLOCK_SIZE_K": 128, "GROUP_SIZE_M": 8, "A_load_order": 0, "NUM_STAGES": 2, "num_warps": 8, "num_ctas": 1, "num_stages": 2}, "(96, 4096, 4096, 64, 8, 104)": {"BLOCK_SIZE_M": 64, "BLOCK_SIZE_N": 128, "BLOCK_SIZE_K": 64, "GROUP_SIZE_M": 8, "A_load_order": 0, "NUM_STAGES": 1, "num_warps": 4, "num_ctas": 1, "num_stages": 1}, "(96, 12288, 4096, 64, 8, 104)": {"BLOCK_SIZE_M": 64, "BLOCK_SIZE_N": 128, "BLOCK_SIZE_K": 64, "GROUP_SIZE_M": 8, "A_load_order": 0, "NUM_STAGES": 1, "num_warps": 4, "num_ctas": 1, "num_stages": 1}, "(96, 4096, 12288, 64, 8, 104)": {"BLOCK_SIZE_M": 64, "BLOCK_SIZE_N": 128, "BLOCK_SIZE_K": 64, "GROUP_SIZE_M": 8, "A_load_order": 0, "NUM_STAGES": 1, "num_warps": 4, "num_ctas": 1, "num_stages": 1}, "(128, 4096, 4096, 64, 8, 104)": {"BLOCK_SIZE_M": 64, "BLOCK_SIZE_N": 128, "BLOCK_SIZE_K": 64, "GROUP_SIZE_M": 8, "A_load_order": 0, "NUM_STAGES": 1, "num_warps": 4, "num_ctas": 1, "num_stages": 1}, "(128, 12288, 4096, 64, 8, 104)": {"BLOCK_SIZE_M": 64, "BLOCK_SIZE_N": 128, "BLOCK_SIZE_K": 64, "GROUP_SIZE_M": 8, "A_load_order": 0, "NUM_STAGES": 1, "num_warps": 4, "num_ctas": 1, "num_stages": 1}, "(128, 4096, 12288, 64, 8, 104)": {"BLOCK_SIZE_M": 64, "BLOCK_SIZE_N": 128, "BLOCK_SIZE_K": 64, "GROUP_SIZE_M": 8, "A_load_order": 0, "NUM_STAGES": 1, "num_warps": 4, "num_ctas": 1, "num_stages": 1}, "(192, 4096, 4096, 64, 8, 104)": {"BLOCK_SIZE_M": 64, "BLOCK_SIZE_N": 128, "BLOCK_SIZE_K": 64, "GROUP_SIZE_M": 8, "A_load_order": 0, "NUM_STAGES": 1, "num_warps": 4, "num_ctas": 1, "num_stages": 1}, "(192, 12288, 4096, 64, 8, 104)": {"BLOCK_SIZE_M": 64, "BLOCK_SIZE_N": 128, "BLOCK_SIZE_K": 64, "GROUP_SIZE_M": 8, "A_load_order": 0, "NUM_STAGES": 1, "num_warps": 4, "num_ctas": 1, "num_stages": 1}, "(192, 4096, 12288, 64, 8, 104)": {"BLOCK_SIZE_M": 64, "BLOCK_SIZE_N": 128, "BLOCK_SIZE_K": 64, "GROUP_SIZE_M": 8, "A_load_order": 0, "NUM_STAGES": 1, "num_warps": 4, "num_ctas": 1, "num_stages": 1}, "(256, 4096, 4096, 64, 8, 104)": {"BLOCK_SIZE_M": 64, "BLOCK_SIZE_N": 128, "BLOCK_SIZE_K": 64, "GROUP_SIZE_M": 8, "A_load_order": 0, "NUM_STAGES": 1, "num_warps": 4, "num_ctas": 1, "num_stages": 1}, "(256, 12288, 4096, 64, 8, 104)": {"BLOCK_SIZE_M": 64, "BLOCK_SIZE_N": 128, "BLOCK_SIZE_K": 64, "GROUP_SIZE_M": 8, "A_load_order": 0, "NUM_STAGES": 1, "num_warps": 4, "num_ctas": 1, "num_stages": 1}, "(256, 4096, 12288, 64, 8, 104)": {"BLOCK_SIZE_M": 64, "BLOCK_SIZE_N": 128, "BLOCK_SIZE_K": 64, "GROUP_SIZE_M": 8, "A_load_order": 2, "NUM_STAGES": 1, "num_warps": 4, "num_ctas": 1, "num_stages": 1}, "(384, 4096, 4096, 64, 8, 104)": {"BLOCK_SIZE_M": 64, "BLOCK_SIZE_N": 128, "BLOCK_SIZE_K": 64, "GROUP_SIZE_M": 8, "A_load_order": 0, "NUM_STAGES": 1, "num_warps": 4, "num_ctas": 1, "num_stages": 1}, "(384, 12288, 4096, 64, 8, 104)": {"BLOCK_SIZE_M": 64, "BLOCK_SIZE_N": 128, "BLOCK_SIZE_K": 64, "GROUP_SIZE_M": 8, "A_load_order": 0, "NUM_STAGES": 1, "num_warps": 4, "num_ctas": 1, "num_stages": 1}, "(384, 4096, 12288, 64, 8, 104)": {"BLOCK_SIZE_M": 64, "BLOCK_SIZE_N": 128, "BLOCK_SIZE_K": 64, "GROUP_SIZE_M": 8, "A_load_order": 0, "NUM_STAGES": 1, "num_warps": 4, "num_ctas": 1, "num_stages": 1}, "(512, 4096, 4096, 64, 8, 104)": {"BLOCK_SIZE_M": 64, "BLOCK_SIZE_N": 128, "BLOCK_SIZE_K": 64, "GROUP_SIZE_M": 8, "A_load_order": 0, "NUM_STAGES": 1, "num_warps": 4, "num_ctas": 1, "num_stages": 1}, "(512, 12288, 4096, 64, 8, 104)": {"BLOCK_SIZE_M": 64, "BLOCK_SIZE_N": 128, "BLOCK_SIZE_K": 64, "GROUP_SIZE_M": 8, "A_load_order": 0, "NUM_STAGES": 1, "num_warps": 4, "num_ctas": 1, "num_stages": 1}, "(512, 4096, 12288, 64, 8, 104)": {"BLOCK_SIZE_M": 64, "BLOCK_SIZE_N": 128, "BLOCK_SIZE_K": 64, "GROUP_SIZE_M": 8, "A_load_order": 0, "NUM_STAGES": 1, "num_warps": 4, "num_ctas": 1, "num_stages": 1}, "(768, 4096, 4096, 64, 8, 104)": {"BLOCK_SIZE_M": 64, "BLOCK_SIZE_N": 128, "BLOCK_SIZE_K": 64, "GROUP_SIZE_M": 8, "A_load_order": 0, "NUM_STAGES": 1, "num_warps": 4, "num_ctas": 1, "num_stages": 1}, "(768, 12288, 4096, 64, 8, 104)": {"BLOCK_SIZE_M": 64, "BLOCK_SIZE_N": 128, "BLOCK_SIZE_K": 64, "GROUP_SIZE_M": 8, "A_load_order": 0, "NUM_STAGES": 1, "num_warps": 4, "num_ctas": 1, "num_stages": 1}, "(768, 4096, 12288, 64, 8, 104)": {"BLOCK_SIZE_M": 64, "BLOCK_SIZE_N": 128, "BLOCK_SIZE_K": 64, "GROUP_SIZE_M": 8, "A_load_order": 0, "NUM_STAGES": 1, "num_warps": 4, "num_ctas": 1, "num_stages": 1}, "(1024, 4096, 4096, 64, 8, 104)": {"BLOCK_SIZE_M": 64, "BLOCK_SIZE_N": 128, "BLOCK_SIZE_K": 64, "GROUP_SIZE_M": 8, "A_load_order": 0, "NUM_STAGES": 1, "num_warps": 4, "num_ctas": 1, "num_stages": 1}, "(1024, 12288, 4096, 64, 8, 104)": {"BLOCK_SIZE_M": 64, "BLOCK_SIZE_N": 128, "BLOCK_SIZE_K": 64, "GROUP_SIZE_M": 8, "A_load_order": 2, "NUM_STAGES": 1, "num_warps": 4, "num_ctas": 1, "num_stages": 1}, "(1024, 4096, 12288, 64, 8, 104)": {"BLOCK_SIZE_M": 64, "BLOCK_SIZE_N": 128, "BLOCK_SIZE_K": 64, "GROUP_SIZE_M": 8, "A_load_order": 2, "NUM_STAGES": 1, "num_warps": 4, "num_ctas": 1, "num_stages": 1}, "(1536, 4096, 4096, 64, 8, 104)": {"BLOCK_SIZE_M": 64, "BLOCK_SIZE_N": 128, "BLOCK_SIZE_K": 64, "GROUP_SIZE_M": 8, "A_load_order": 0, "NUM_STAGES": 1, "num_warps": 4, "num_ctas": 1, "num_stages": 1}, "(1536, 12288, 4096, 64, 8, 104)": {"BLOCK_SIZE_M": 64, "BLOCK_SIZE_N": 128, "BLOCK_SIZE_K": 64, "GROUP_SIZE_M": 8, "A_load_order": 0, "NUM_STAGES": 1, "num_warps": 4, "num_ctas": 1, "num_stages": 1}, "(1536, 4096, 12288, 64, 8, 104)": {"BLOCK_SIZE_M": 64, "BLOCK_SIZE_N": 128, "BLOCK_SIZE_K": 64, "GROUP_SIZE_M": 8, "A_load_order": 0, "NUM_STAGES": 1, "num_warps": 4, "num_ctas": 1, "num_stages": 1}, "(2048, 4096, 4096, 64, 8, 104)": {"BLOCK_SIZE_M": 64, "BLOCK_SIZE_N": 128, "BLOCK_SIZE_K": 64, "GROUP_SIZE_M": 8, "A_load_order": 0, "NUM_STAGES": 1, "num_warps": 4, "num_ctas": 1, "num_stages": 1}, "(2048, 12288, 4096, 64, 8, 104)": {"BLOCK_SIZE_M": 64, "BLOCK_SIZE_N": 128, "BLOCK_SIZE_K": 64, "GROUP_SIZE_M": 8, "A_load_order": 2, "NUM_STAGES": 1, "num_warps": 4, "num_ctas": 1, "num_stages": 1}, "(2048, 4096, 12288, 64, 8, 104)": {"BLOCK_SIZE_M": 64, "BLOCK_SIZE_N": 128, "BLOCK_SIZE_K": 64, "GROUP_SIZE_M": 8, "A_load_order": 0, "NUM_STAGES": 1, "num_warps": 4, "num_ctas": 1, "num_stages": 1}, "(3072, 4096, 4096, 64, 8, 104)": {"BLOCK_SIZE_M": 64, "BLOCK_SIZE_N": 128, "BLOCK_SIZE_K": 64, "GROUP_SIZE_M": 8, "A_load_order": 0, "NUM_STAGES": 1, "num_warps": 4, "num_ctas": 1, "num_stages": 1}, "(3072, 12288, 4096, 64, 8, 104)": {"BLOCK_SIZE_M": 64, "BLOCK_SIZE_N": 128, "BLOCK_SIZE_K": 64, "GROUP_SIZE_M": 8, "A_load_order": 0, "NUM_STAGES": 1, "num_warps": 4, "num_ctas": 1, "num_stages": 1}, "(3072, 4096, 12288, 64, 8, 104)": {"BLOCK_SIZE_M": 64, "BLOCK_SIZE_N": 128, "BLOCK_SIZE_K": 64, "GROUP_SIZE_M": 8, "A_load_order": 2, "NUM_STAGES": 1, "num_warps": 4, "num_ctas": 1, "num_stages": 1}, "(4096, 4096, 4096, 64, 8, 104)": {"BLOCK_SIZE_M": 64, "BLOCK_SIZE_N": 128, "BLOCK_SIZE_K": 64, "GROUP_SIZE_M": 8, "A_load_order": 0, "NUM_STAGES": 1, "num_warps": 4, "num_ctas": 1, "num_stages": 1}, "(4096, 12288, 4096, 64, 8, 104)": {"BLOCK_SIZE_M": 64, "BLOCK_SIZE_N": 128, "BLOCK_SIZE_K": 64, "GROUP_SIZE_M": 8, "A_load_order": 2, "NUM_STAGES": 1, "num_warps": 4, "num_ctas": 1, "num_stages": 1}, "(4096, 4096, 12288, 64, 8, 104)": {"BLOCK_SIZE_M": 64, "BLOCK_SIZE_N": 128, "BLOCK_SIZE_K": 64, "GROUP_SIZE_M": 8, "A_load_order": 2, "NUM_STAGES": 1, "num_warps": 4, "num_ctas": 1, "num_stages": 1}, "(96, 4096, 2560, 64, 8, 104)": {"BLOCK_SIZE_M": 64, "BLOCK_SIZE_N": 128, "BLOCK_SIZE_K": 64, "GROUP_SIZE_M": 8, "A_load_order": 0, "NUM_STAGES": 1, "num_warps": 4, "num_ctas": 1, "num_stages": 1}, "(96, 1024, 2560, 64, 8, 104)": {"BLOCK_SIZE_M": 64, "BLOCK_SIZE_N": 64, "BLOCK_SIZE_K": 64, "GROUP_SIZE_M": 8, "A_load_order": 0, "NUM_STAGES": 3, "num_warps": 4, "num_ctas": 1, "num_stages": 3}, "(96, 9728, 2560, 64, 8, 104)": {"BLOCK_SIZE_M": 64, "BLOCK_SIZE_N": 128, "BLOCK_SIZE_K": 64, "GROUP_SIZE_M": 8, "A_load_order": 0, "NUM_STAGES": 1, "num_warps": 4, "num_ctas": 1, "num_stages": 1}, "(128, 4096, 2560, 64, 8, 104)": {"BLOCK_SIZE_M": 64, "BLOCK_SIZE_N": 128, "BLOCK_SIZE_K": 64, "GROUP_SIZE_M": 8, "A_load_order": 0, "NUM_STAGES": 1, "num_warps": 4, "num_ctas": 1, "num_stages": 1}, "(128, 1024, 2560, 64, 8, 104)": {"BLOCK_SIZE_M": 64, "BLOCK_SIZE_N": 64, "BLOCK_SIZE_K": 64, "GROUP_SIZE_M": 8, "A_load_order": 0, "NUM_STAGES": 3, "num_warps": 4, "num_ctas": 1, "num_stages": 3}, "(128, 9728, 2560, 64, 8, 104)": {"BLOCK_SIZE_M": 64, "BLOCK_SIZE_N": 128, "BLOCK_SIZE_K": 64, "GROUP_SIZE_M": 8, "A_load_order": 0, "NUM_STAGES": 1, "num_warps": 4, "num_ctas": 1, "num_stages": 1}, "(192, 4096, 2560, 64, 8, 104)": {"BLOCK_SIZE_M": 64, "BLOCK_SIZE_N": 128, "BLOCK_SIZE_K": 64, "GROUP_SIZE_M": 8, "A_load_order": 0, "NUM_STAGES": 1, "num_warps": 4, "num_ctas": 1, "num_stages": 1}, "(192, 1024, 2560, 64, 8, 104)": {"BLOCK_SIZE_M": 64, "BLOCK_SIZE_N": 64, "BLOCK_SIZE_K": 64, "GROUP_SIZE_M": 8, "A_load_order": 0, "NUM_STAGES": 3, "num_warps": 4, "num_ctas": 1, "num_stages": 3}, "(192, 9728, 2560, 64, 8, 104)": {"BLOCK_SIZE_M": 64, "BLOCK_SIZE_N": 128, "BLOCK_SIZE_K": 64, "GROUP_SIZE_M": 8, "A_load_order": 0, "NUM_STAGES": 1, "num_warps": 4, "num_ctas": 1, "num_stages": 1}, "(256, 4096, 2560, 64, 8, 104)": {"BLOCK_SIZE_M": 64, "BLOCK_SIZE_N": 128, "BLOCK_SIZE_K": 64, "GROUP_SIZE_M": 8, "A_load_order": 0, "NUM_STAGES": 1, "num_warps": 4, "num_ctas": 1, "num_stages": 1}, "(256, 1024, 2560, 64, 8, 104)": {"BLOCK_SIZE_M": 64, "BLOCK_SIZE_N": 64, "BLOCK_SIZE_K": 32, "GROUP_SIZE_M": 8, "A_load_order": 0, "NUM_STAGES": 4, "num_warps": 4, "num_ctas": 1, "num_stages": 4}, "(256, 9728, 2560, 64, 8, 104)": {"BLOCK_SIZE_M": 64, "BLOCK_SIZE_N": 128, "BLOCK_SIZE_K": 64, "GROUP_SIZE_M": 8, "A_load_order": 0, "NUM_STAGES": 1, "num_warps": 4, "num_ctas": 1, "num_stages": 1}, "(384, 4096, 2560, 64, 8, 104)": {"BLOCK_SIZE_M": 64, "BLOCK_SIZE_N": 128, "BLOCK_SIZE_K": 64, "GROUP_SIZE_M": 8, "A_load_order": 0, "NUM_STAGES": 1, "num_warps": 4, "num_ctas": 1, "num_stages": 1}, "(384, 1024, 2560, 64, 8, 104)": {"BLOCK_SIZE_M": 64, "BLOCK_SIZE_N": 64, "BLOCK_SIZE_K": 32, "GROUP_SIZE_M": 8, "A_load_order": 0, "NUM_STAGES": 4, "num_warps": 4, "num_ctas": 1, "num_stages": 4}, "(384, 9728, 2560, 64, 8, 104)": {"BLOCK_SIZE_M": 64, "BLOCK_SIZE_N": 128, "BLOCK_SIZE_K": 64, "GROUP_SIZE_M": 8, "A_load_order": 0, "NUM_STAGES": 1, "num_warps": 4, "num_ctas": 1, "num_stages": 1}, "(512, 4096, 2560, 64, 8, 104)": {"BLOCK_SIZE_M": 64, "BLOCK_SIZE_N": 128, "BLOCK_SIZE_K": 64, "GROUP_SIZE_M": 8, "A_load_order": 0, "NUM_STAGES": 1, "num_warps": 4, "num_ctas": 1, "num_stages": 1}, "(512, 1024, 2560, 64, 8, 104)": {"BLOCK_SIZE_M": 64, "BLOCK_SIZE_N": 128, "BLOCK_SIZE_K": 32, "GROUP_SIZE_M": 8, "A_load_order": 2, "NUM_STAGES": 3, "num_warps": 8, "num_ctas": 1, "num_stages": 3}, "(512, 9728, 2560, 64, 8, 104)": {"BLOCK_SIZE_M": 64, "BLOCK_SIZE_N": 128, "BLOCK_SIZE_K": 64, "GROUP_SIZE_M": 8, "A_load_order": 0, "NUM_STAGES": 1, "num_warps": 4, "num_ctas": 1, "num_stages": 1}, "(768, 4096, 2560, 64, 8, 104)": {"BLOCK_SIZE_M": 64, "BLOCK_SIZE_N": 128, "BLOCK_SIZE_K": 64, "GROUP_SIZE_M": 8, "A_load_order": 0, "NUM_STAGES": 1, "num_warps": 4, "num_ctas": 1, "num_stages": 1}, "(768, 1024, 2560, 64, 8, 104)": {"BLOCK_SIZE_M": 64, "BLOCK_SIZE_N": 128, "BLOCK_SIZE_K": 32, "GROUP_SIZE_M": 8, "A_load_order": 2, "NUM_STAGES": 3, "num_warps": 8, "num_ctas": 1, "num_stages": 3}, "(768, 9728, 2560, 64, 8, 104)": {"BLOCK_SIZE_M": 64, "BLOCK_SIZE_N": 128, "BLOCK_SIZE_K": 64, "GROUP_SIZE_M": 8, "A_load_order": 0, "NUM_STAGES": 1, "num_warps": 4, "num_ctas": 1, "num_stages": 1}, "(1024, 4096, 2560, 64, 8, 104)": {"BLOCK_SIZE_M": 64, "BLOCK_SIZE_N": 128, "BLOCK_SIZE_K": 64, "GROUP_SIZE_M": 8, "A_load_order": 0, "NUM_STAGES": 1, "num_warps": 4, "num_ctas": 1, "num_stages": 1}, "(1024, 1024, 2560, 64, 8, 104)": {"BLOCK_SIZE_M": 64, "BLOCK_SIZE_N": 128, "BLOCK_SIZE_K": 64, "GROUP_SIZE_M": 8, "A_load_order": 0, "NUM_STAGES": 1, "num_warps": 4, "num_ctas": 1, "num_stages": 1}, "(1024, 9728, 2560, 64, 8, 104)": {"BLOCK_SIZE_M": 64, "BLOCK_SIZE_N": 128, "BLOCK_SIZE_K": 64, "GROUP_SIZE_M": 8, "A_load_order": 0, "NUM_STAGES": 1, "num_warps": 4, "num_ctas": 1, "num_stages": 1}, "(1536, 4096, 25